headlines,headline_text
"['analyst', 'calls', 'sobha', 'hdfc', 'bank', 'ashok', 'leyland']",analyst calls sobha hdfc bank ashok leyland
"['kamal', 'haasan', 'pens', 'open', 'letter', 'to', 'pm', 'narendra', 'modi', 'criticising', 'implementation', 'of', 'the', 'lockdown']",kamal haasan pens open letter to pm narendra modi criticising implementation of the lockdown
"['gold', 'eases', 'on', 'firmer', 'dollar', 'coronavirus', 'slowdown', 'signs']",gold eases on firmer dollar coronavirus slowdown signs
"['india', 'inc', 'fund', 'raising', 'falls', '78', 'pe', 'investments', 'plunge', '40']",india inc fund raising falls 78 pe investments plunge 40
"['covid', '19', 'throws', 'a', 'wrench', 'into', 'indias', 'disinvestment', 'plans']",covid 19 throws a wrench into indias disinvestment plans
"['sharechat', 'bets', 'big', 'on', 'vernacular', 'audiences', 'with', 'micro', 'influencers', 'user', 'generated', 'content']",sharechat bets big on vernacular audiences with micro influencers user generated content
"['truckers', 'labour', 'get', '30', 'more', 'pay', 'from', 'fmcg', 'companies']",truckers labour get 30 more pay from fmcg companies
"['twitters', 'jack', 'dorsey', 'pledges', '1', 'bn', 'for', 'covid', '19', 'relief', 'effort']",twitters jack dorsey pledges 1 bn for covid 19 relief effort
"['drugs', 'essential', 'ancillaries', 'not', 'so', 'means', 'supplies', 'take', 'a', 'hit']",drugs essential ancillaries not so means supplies take a hit
"['dow', 'jones', 'jumps', '850', 'pts', 'on', 'coronavirus', 'slowdown', 'hopes']",dow jones jumps 850 pts on coronavirus slowdown hopes
"['15th', 'finance', 'commission', 'resumes', 'deliberations', 'via', 'video', 'conferencing']",15th finance commission resumes deliberations via video conferencing
"['covid', '19', 'to', 'hit', 'affordable', 'housing', 'growth', 'over', '6', '1', 'lakh', 'units', 'impacted', 'in', 'top', '7', 'cities']",covid 19 to hit affordable housing growth over 6 1 lakh units impacted in top 7 cities
"['auto', 'parts', 'manufacturers', 'plan', 'diversification', 'of', 'supply', 'chain', 'in', 'the', 'post', 'covid', '19', 'world']",auto parts manufacturers plan diversification of supply chain in the post covid 19 world
"['donald', 'trump', 'removes', 'watchdog', 'tapped', 'for', '2', '2', 'trillion', 'coronavirus', 'rescue', 'oversight']",donald trump removes watchdog tapped for 2 2 trillion coronavirus rescue oversight
"['clerics', 'and', 'leaders', 'appeal', 'to', 'pray', 'at', 'home', 'on', 'shab', 'e', 'baraat']",clerics and leaders appeal to pray at home on shab e baraat
"['irctc', 'stops', 'booking', 'of', '3', 'private', 'trains', 'till', '30th', 'april', 'passengers', 'to', 'get', 'full', 'refund']",irctc stops booking of 3 private trains till 30th april passengers to get full refund
"['pakistan', 'terror', 'factories', 'get', 'active', 'spike', 'in', 'cross', 'border', 'firings']",pakistan terror factories get active spike in cross border firings
"['now', 'coronavirus', 'affected', 'and', 'suspected', 'patients', 'can', 'get', 'virtual', 'healthcare', 'day', 'to', 'day', 'health']",now coronavirus affected and suspected patients can get virtual healthcare day to day health
"['coronavirus', 'impact', 'evidence', 'mounts', 'that', 'the', 'global', 'recession', 'is', 'already', 'here']",coronavirus impact evidence mounts that the global recession is already here
"['share', 'market', 'updatenbsp', 'bandhan', 'bank', 'alkem', 'labsnbsp', 'among', 'top', 'gainers', 'on', 'bsebr']",share market updatenbsp bandhan bank alkem labsnbsp among top gainers on bsebr
"['bank', 'of', 'baroda', 'launches', 'covid', '19', 'loan', 'for', 'retail', 'customers']",bank of baroda launches covid 19 loan for retail customers
"['buy', 'acc', 'target', 'price', 'rs', '1520', 'icici', 'securities']",buy acc target price rs 1520 icici securities
"['donald', 'trump', 'announces', '3', 'million', 'deal', 'for', 'millions', 'of', 'masks']",donald trump announces 3 million deal for millions of masks
"['radhakishan', 'damani', 'the', 'only', 'indian', 'tycoon', 'to', 'get', 'richer', 'under', 'lockdown']",radhakishan damani the only indian tycoon to get richer under lockdown
"['gold', 'prices', 'today', 'hit', 'all', 'time', 'high', 'as', 'investors', 'rush', 'to', 'safety']",gold prices today hit all time high as investors rush to safety
"['realtors', 'in', 'west', 'bengal', 'seek', 'relief', 'from', 'central', 'government']",realtors in west bengal seek relief from central government
"['it', 'sector', 'q4', 'preview', 'virus', 'hits', 'billings', 'shadows', 'fy21', 'spending']",it sector q4 preview virus hits billings shadows fy21 spending
"['buy', 'godrej', 'properties', 'target', 'price', 'rs', '721', 'icici', 'securities']",buy godrej properties target price rs 721 icici securities
"['make', 'a', 'large', 'number', 'of', 'good', 'buys', 'not', 'just', 'a', 'few', 'perfect', 'ones', 'marks']",make a large number of good buys not just a few perfect ones marks
"['share', 'market', 'update17', 'stocks', 'hit', '52', 'week', 'highs', 'on', 'nsebr']",share market update17 stocks hit 52 week highs on nsebr
"['tesco', 'recruits', '45000', 'uk', 'staff', 'over', 'soaring', 'demand', 'amid', 'outbreak']",tesco recruits 45000 uk staff over soaring demand amid outbreak
"['buzzing', 'stocksnbsp', 'vodafone', 'idea', 'nbsp', 'tata', 'motors', 'axis', 'bank', 'rilnbsp']",buzzing stocksnbsp vodafone idea nbsp tata motors axis bank rilnbsp
"['automakers', 'turn', 'to', 'online', 'sales', 'to', 'boost', 'volumes', 'amid', 'covid', '19', 'outbreak']",automakers turn to online sales to boost volumes amid covid 19 outbreak
"['experts', 'list', 'out', 'five', 'ways', 'indian', 'jugaad', 'can', 'maximise', 'resources', 'in', 'the', 'fight', 'against', 'coronavirus', 'pandemic']",experts list out five ways indian jugaad can maximise resources in the fight against coronavirus pandemic
"['trending', 'stocks', 'wipro', 'ltd', 'shares', 'up', '1', '95', 'as', 'nifty', 'gains']",trending stocks wipro ltd shares up 1 95 as nifty gains
"['thousands', 'flock', 'to', 'leave', 'wuhan', 'as', 'outbound', 'travel', 'ban', 'ends']",thousands flock to leave wuhan as outbound travel ban ends
"['share', 'market', 'update', 'future', 'consumernbsp', 'suyog', 'telematicsnbsp', 'nbspamong', 'top', 'losers', 'on', 'bsebr']",share market update future consumernbsp suyog telematicsnbsp nbspamong top losers on bsebr
"['invoke', 'stringent', 'law', 'against', 'those', 'hoarding', 'black', 'marketing', 'essentials', 'mha', 'to', 'states']",invoke stringent law against those hoarding black marketing essentials mha to states
"['european', 'commission', 'to', 'unveil', 'strategy', 'to', 'exit', 'virus', 'lockdown']",european commission to unveil strategy to exit virus lockdown
"['one', 'has', 'to', 'be', 'selective', 'while', 'buying', 'stocks', 'says', 'rajeev', 'thakkar', 'of', 'ppfas', 'mutual', 'fund']",one has to be selective while buying stocks says rajeev thakkar of ppfas mutual fund
"['only', 'a', 'few', 'it', 'cos', 'honour', 'job', 'offers']",only a few it cos honour job offers
"['adani', 'green', 'energy', 'shares', 'jump', '5', 'on', 'total', 'sa', 'deal']",adani green energy shares jump 5 on total sa deal
"['international', 'council', 'of', 'jurists', 'views', 'doesnt', 'reflect', 'indian', 'govt']",international council of jurists views doesnt reflect indian govt
"['will', 'rbi', 'react', 'to', 'mfis', 'distress', 'call']",will rbi react to mfis distress call
"['key', 'us', 'senator', 'calls', 'for', 'independent', 'probe', 'into', 'who', 'handling', 'of', 'covid', '19']",key us senator calls for independent probe into who handling of covid 19
"['govt', 'plans', 'larger', 'force', 'to', 'replace', 'frontline', 'workers', 'engaged', 'in', 'covid', '19', 'management']",govt plans larger force to replace frontline workers engaged in covid 19 management
"['jio', 'airtel', 'may', 'post', 'higher', 'q4', 'revenue', 'on', 'tariff', 'hikes', 'heavy', 'user', 'losses', 'to', 'drag', 'voda', 'idea']",jio airtel may post higher q4 revenue on tariff hikes heavy user losses to drag voda idea
