headlines,headline_text
"['v', 'k', 'sasikala', 'to', 'return', 'on', 'february', '7', 't', 't', 'v', 'dhinakaran', 'sees', 'changes', 'in', 'tamil', 'nadu', 'ahead', 'of', 'arrival']",v k sasikala to return on february 7 t t v dhinakaran sees changes in tamil nadu ahead of arrival
"['after', 'riri', 'greta', 'thunberg', 'others', 'extend', 'support', 'to', 'farmers', 'protest']",after riri greta thunberg others extend support to farmers protest
"['farmers', 'protest', 'rakesh', 'tikait', 'holds', 'show', 'of', 'strength', 'warns', 'govt', 'of', 'gaddi', 'wapsi', 'demand']",farmers protest rakesh tikait holds show of strength warns govt of gaddi wapsi demand
"['golden', 'globes', 'award', 'ceremony', 'to', 'be', 'bicoastal', 'event']",golden globes award ceremony to be bicoastal event
"['ramco', 'cements', 'q3', 'results', 'reports', 'standalone', 'net', 'profit', 'of', 'rs', '201', 'cr']",ramco cements q3 results reports standalone net profit of rs 201 cr
"['stove', 'kraft', 'ipo', 'how', 'to', 'check', 'allotment', 'status']",stove kraft ipo how to check allotment status
"['spot', 'power', 'market', 'grows', '47', 'yoy', 'in', 'jan']",spot power market grows 47 yoy in jan
"['myanmars', 'suu', 'kyi', 'charged', 'can', 'be', 'held', 'until', 'february', '15']",myanmars suu kyi charged can be held until february 15
"['armed', 'forces', 'preparatory', 'institute', 'to', 'come', 'up', 'in', 'hoshiarpur']",armed forces preparatory institute to come up in hoshiarpur
"['budget', 'session', 'of', 'manipur', 'assembly', 'gets', 'underway']",budget session of manipur assembly gets underway
"['flipkart', 'wholesale', 'strengthens', 'commitment', 'to', 'msmes', 'with', 'infrastructure', 'boost']",flipkart wholesale strengthens commitment to msmes with infrastructure boost
"['trade', 'unions', 'burn', 'copies', 'of', 'budget', 'in', 'puducherry']",trade unions burn copies of budget in puducherry
"['road', 'rage', 'behind', 'murder', 'of', 'indigo', 'manager', 'one', 'accused', 'held', 'bihar', 'police']",road rage behind murder of indigo manager one accused held bihar police
"['india', 'warns', 'twitter', 'to', 'comply', 'with', 'orders', 'to', 'block', 'accounts']",india warns twitter to comply with orders to block accounts
"['rupee', 'settles', 'on', 'flat', 'note', 'higher', 'by', '1', 'paisa', 'at', '72', '95', 'against', 'us', 'dollar']",rupee settles on flat note higher by 1 paisa at 72 95 against us dollar
"['lok', 'sabha', 'adjourned', 'twice', 'as', 'opposition', 'continues', 'protest', 'over', '3', 'new', 'farm', 'laws']",lok sabha adjourned twice as opposition continues protest over 3 new farm laws
"['go', 'away', 'reddit', 'rage', 'nomura', 'has', 'the', 'salaryman']",go away reddit rage nomura has the salaryman
"['astrazeneca', 'oxford', 'expect', 'next', 'generation', 'covid', '19', 'vaccine', 'to', 'tackle', 'variants', 'by', 'autumn', 'executive']",astrazeneca oxford expect next generation covid 19 vaccine to tackle variants by autumn executive
"['deepak', 'fertilisers', 'q3', 'results', 'profit', 'surges', 'to', 'rs', '89', 'crore']",deepak fertilisers q3 results profit surges to rs 89 crore
"['indias', 'hero', 'to', 'set', 'up', 'separate', 'harley', 'davidson', 'unit']",indias hero to set up separate harley davidson unit
"['sc', 'refuses', 'to', 'hear', 'plea', 'for', 'probe', 'into', 'chinese', 'surveillance', 'asks', 'petitioner', 'to', 'make', 'representation']",sc refuses to hear plea for probe into chinese surveillance asks petitioner to make representation
"['holding', 'no', 'informal', 'talks', 'with', 'farmers', 'barricading', 'is', 'local', 'admin', 'issue', 'narendra', 'singh', 'tomar']",holding no informal talks with farmers barricading is local admin issue narendra singh tomar
"['nine', 'companies', 'submits', 'rfq', 'to', 'redevelop', 'new', 'delhi', 'railway', 'station']",nine companies submits rfq to redevelop new delhi railway station
"['bring', 'bill', 'for', 'restoring', 'jk', 'statehood', 'ghulam', 'nabi', 'azad', 'to', 'government']",bring bill for restoring jk statehood ghulam nabi azad to government
"['strictly', 'implement', 'regulations', 'to', 'curb', 'unsolicited', 'commercial', 'calls', 'hc', 'tells', 'trai']",strictly implement regulations to curb unsolicited commercial calls hc tells trai
"['indians', 'join', 'the', 'game', 'on', 'gamestop']",indians join the game on gamestop
"['ahead', 'of', '2022', 'mumbai', 'civic', 'polls', 'shiv', 'sena', 'to', 'hold', 'event', 'for', 'gujaratis', 'on', 'february', '7']",ahead of 2022 mumbai civic polls shiv sena to hold event for gujaratis on february 7
"['v', 'mart', 'retail', 'raises', 'rs', '375', 'cr', 'from', 'qibs']",v mart retail raises rs 375 cr from qibs
"['power', 'engineers', 'employees', 'stage', 'nationwide', 'protest', 'against', 'privatisation']",power engineers employees stage nationwide protest against privatisation
"['digital', 'transformation', 'vital', 'to', 'airline', 'recovery', 'and', 'future', 'profitability']",digital transformation vital to airline recovery and future profitability
"['parliamentary', 'panel', 'criticises', 'long', 'delay', 'in', 'implementation', 'of', 'tejas', 'programme']",parliamentary panel criticises long delay in implementation of tejas programme
"['amateurs', 'beat', 'wall', 'street', 'pros', 'at', 'their', 'own', 'game', 'how']",amateurs beat wall street pros at their own game how
"['adani', 'gmr', 'highways', 'anchorage', 'infra', 'among', 'companies', 'looking', 'to', 'redevelop', 'new', 'delhi', 'railway', 'station']",adani gmr highways anchorage infra among companies looking to redevelop new delhi railway station
"['delhi', 'police', 'send', 'notice', 'to', 'activist', 'yogita', 'bhayana', 'over', 'her', 'tweets', 'on', 'january', '26', 'violence']",delhi police send notice to activist yogita bhayana over her tweets on january 26 violence
"['how', 'et', 'ilc', 'organizations', 'are', 'ensuring', 'mental', 'well', 'being', 'of', 'their', 'employees']",how et ilc organizations are ensuring mental well being of their employees
"['considering', 'running', 'trains', 'with', 'reserved', 'coaches', 'southern', 'railway']",considering running trains with reserved coaches southern railway
"['iit', 'delhi', 'and', 'aardo', 'partner', 'for', 'agricultural', 'and', 'rural', 'development']",iit delhi and aardo partner for agricultural and rural development
"['why', 'uipaths', 'automation', 'powered', 'low', 'code', 'applications', 'will', 'boost', 'the', 'adoption', 'of', 'rpa', 'in', 'the', 'future']",why uipaths automation powered low code applications will boost the adoption of rpa in the future
"['bank', 'unions', 'strongly', 'oppose', 'divestment', 'bad', 'bank', 'and', 'fdi', 'in', 'insurance', 'with', 'threats', 'to', 'go', 'on', 'strike']",bank unions strongly oppose divestment bad bank and fdi in insurance with threats to go on strike
"['etilc', 'how', 'leaders', 'from', 'the', 'tech', 'sector', 'look', 'at', 'strategic', 'technological', 'change']",etilc how leaders from the tech sector look at strategic technological change
"['earth', 'energy', 'unveils', '3', 'electric', 'two', 'wheelers', 'starting', 'rs', '92000']",earth energy unveils 3 electric two wheelers starting rs 92000
"['few', 'mid', 'emerging', 'corporates', 'opt', 'for', 'rbis', 'one', 'time', 'restructuring', 'report']",few mid emerging corporates opt for rbis one time restructuring report
"['we', 'are', 'fast', 'achieving', 'pre', 'covid', '19', 'levels', 'in', 'exports', 'commerce', 'secretary']",we are fast achieving pre covid 19 levels in exports commerce secretary
"['over', '300', 'million', 'indians', 'may', 'have', 'covid', '19', 'source', 'citing', 'government', 'study']",over 300 million indians may have covid 19 source citing government study
"['power', 'consumption', 'grows', 'nearly', '6', 'per', 'cent', 'in', 'january']",power consumption grows nearly 6 per cent in january
"['industry', 'hopeful', 'that', 'rodtep', 'will', 'eliminate', 'all', 'undesired', 'tax', 'costs', 'for', 'exporters', 'et', 'ilc', 'members']",industry hopeful that rodtep will eliminate all undesired tax costs for exporters et ilc members
"['jubilant', 'foodworks', 'q3', 'results', 'profit', 'rises', '22', 'to', 'rs', '123', '91', 'crore']",jubilant foodworks q3 results profit rises 22 to rs 123 91 crore
"['market', 'movers', 'rally', 'in', 'banks', 'continues', 'as', 'pharma', 'stocks', 'join', 'party']",market movers rally in banks continues as pharma stocks join party
"['use', 'of', 'ballots', 'will', 'defeat', 'parties', 'supporting', 'evms', 'ncp']",use of ballots will defeat parties supporting evms ncp
"['astrazeneca', 'first', 'jab', 'cuts', 'covid', 'transmission', 'substantially', 'uk', 'study']",astrazeneca first jab cuts covid transmission substantially uk study
"['stage', 'collapses', 'at', 'rakesh', 'tikaits', 'mahapanchayat', 'in', 'haryanas', 'jind']",stage collapses at rakesh tikaits mahapanchayat in haryanas jind
"['bulls', 'back', 'in', 'control', 'of', 'silver', 'gold', 'prices', 'struggle', 'below', 'rs', '48000']",bulls back in control of silver gold prices struggle below rs 48000
"['fo', 'bullish', 'momentum', 'intact', 'but', 'volatility', 'index', 'is', 'rising', 'too']",fo bullish momentum intact but volatility index is rising too
"['analysts', 'maintain', 'bullish', 'view', 'on', 'hdfc', 'see', 'potential', 'upside', 'of', '24']",analysts maintain bullish view on hdfc see potential upside of 24
"['ministerial', 'panel', 'to', 'decide', 'on', 'number', 'of', 'cpses', 'to', 'be', 'retained', 'in', 'each', 'strategic', 'sector', 'dipam', 'secretary']",ministerial panel to decide on number of cpses to be retained in each strategic sector dipam secretary
"['day', 'trading', 'guide', '2', 'stock', 'recommendations', 'for', 'thursday']",day trading guide 2 stock recommendations for thursday
"['sebi', 'comes', 'out', 'with', 'graded', 'entry', 'norms', 'for', 'innovation', 'sandbox']",sebi comes out with graded entry norms for innovation sandbox
"['tech', 'a', 'steady', 'structural', 'return', 'story', 'ipos', 'offer', 'entry', 'opportunity', 'rahul', 'chadha']",tech a steady structural return story ipos offer entry opportunity rahul chadha
"['navys', 'ilyushin', '38sd', 'aircraft', 'fire', 'anti', 'ship', 'missiles', 'during', 'exercise']",navys ilyushin 38sd aircraft fire anti ship missiles during exercise
"['intermiles', 'ceo', 'feels', 'amazon', 'echo', 'with', 'alexa', 'is', 'one', 'of', 'the', 'greatest', 'recent', 'tech', 'innovations', 'for', 'families']",intermiles ceo feels amazon echo with alexa is one of the greatest recent tech innovations for families
"['elior', 'india', 'ceo', 'feels', 'this', 'year', 'will', 'bring', 'opportunity', 'for', 'self', 'reflection', 'and', 'introspection']",elior india ceo feels this year will bring opportunity for self reflection and introspection
"['rbi', 'brings', 'large', 'nbfcs', 'ucbs', 'under', 'risk', 'based', 'audit', 'system']",rbi brings large nbfcs ucbs under risk based audit system
"['et', 'budget', '2021', 'special', 'edition', 'the', 'roaring', '20s']",et budget 2021 special edition the roaring 20s
"['tmc', 'defectors', 'will', 'be', 'defeated', 'in', 'polls', 'anomalies', 'in', 'forest', 'dept', 'recruitment', 'to', 'be', 'probed', 'mamata', 'banerjee']",tmc defectors will be defeated in polls anomalies in forest dept recruitment to be probed mamata banerjee
"['former', 'morgan', 'stanley', 'india', 'heads', 'spac', 'to', 'tap', 'diaspora', 'in', 'us']",former morgan stanley india heads spac to tap diaspora in us
"['iit', 'kharagpur', 'and', 'national', 'institute', 'of', 'urban', 'affairs', 'collaborate', 'to', 'build', 'accessible', 'safe', 'and', 'inclusive', 'indian', 'cities']",iit kharagpur and national institute of urban affairs collaborate to build accessible safe and inclusive indian cities
"['emmy', 'and', 'tony', 'winner', 'hal', 'holbrook', 'who', 'played', 'mark', 'twain', 'passes', 'away', 'at', '95']",emmy and tony winner hal holbrook who played mark twain passes away at 95
"['brookfield', 'reit', 'offers', 'high', 'yield', 'on', 'a', 'stable', 'portfolio']",brookfield reit offers high yield on a stable portfolio
"['coal', 'india', 'signs', 'rs', '2900', 'crore', 'pact', 'for', 'procurement', 'of', 'dumpers']",coal india signs rs 2900 crore pact for procurement of dumpers
"['jetsynthesys', 'announces', 'partnership', 'with', 'square', 'enix', 'launches', 'ludo', 'zenith']",jetsynthesys announces partnership with square enix launches ludo zenith
"['additional', 'director', 'praveen', 'sinha', 'to', 'be', 'acting', 'director', 'cbi']",additional director praveen sinha to be acting director cbi
"['jal', 'shakti', 'ministry', 'launches', 'portal', 'on', 'gobardhan', 'scheme']",jal shakti ministry launches portal on gobardhan scheme
"['satya', 'nadella', 'calls', 'jeff', 'bezoss', 'new', 'role', 'as', 'a', 'well', 'deserved', 'recognition', 'sundar', 'pichai', 'congratulates']",satya nadella calls jeff bezoss new role as a well deserved recognition sundar pichai congratulates
"['indo', 'us', 'joint', 'military', 'exercise', 'yudh', 'abhyas', 'to', 'begin', 'in', 'rajasthan', 'on', 'february', '8']",indo us joint military exercise yudh abhyas to begin in rajasthan on february 8
"['maharashtra', '38', 'workers', 'hurt', 'in', 'uttam', 'galva', 'metallics', 'plant', 'accident']",maharashtra 38 workers hurt in uttam galva metallics plant accident
"['mumbais', 'civic', 'body', 'the', 'brihanmumbai', 'municipal', 'corporation', 'unveils', 'rs', '39038', 'crore', 'budget']",mumbais civic body the brihanmumbai municipal corporation unveils rs 39038 crore budget
"['rihanna', 'creates', 'a', 'stir', 'with', 'farmersprotest', 'tweet', 'greta', 'thunberg', 'joins', 'singer', 'in', 'lending', 'her', 'voice', 'to', 'the', 'movement']",rihanna creates a stir with farmersprotest tweet greta thunberg joins singer in lending her voice to the movement
"['ncpcr', 'qci', 'join', 'hands', 'to', 'ensure', 'industries', 'are', 'free', 'of', 'child', 'labour']",ncpcr qci join hands to ensure industries are free of child labour
"['gamestops', 'giant', 'bubble', 'deflates', 'further', 'after', '27', 'billion', 'rout']",gamestops giant bubble deflates further after 27 billion rout
"['adani', 'enterprises', 'q3', 'results', 'consolidated', 'profit', 'declines', '10', 'to', 'rs', '343', 'crore']",adani enterprises q3 results consolidated profit declines 10 to rs 343 crore
"['fdi', 'hike', 'prudential', 'other', 'global', 'insurers', 'likely', 'to', 'hike', 'stake', 'in', 'indian', 'jvs']",fdi hike prudential other global insurers likely to hike stake in indian jvs
"['hazaras', 'fear', 'for', 'the', 'future', 'as', 'foreign', 'troops', 'exit', 'afghanistan']",hazaras fear for the future as foreign troops exit afghanistan
"['ask', 'ask', 'anb', 'anb']",ask ask anb anb
"['primadollar', 'india', 'appoints', 'swati', 'babel', 'as', 'ceo']",primadollar india appoints swati babel as ceo
"['facts', 'need', 'to', 'be', 'ascertained', 'before', 'rushing', 'to', 'comment', 'on', 'farmers', 'protests', 'says', 'india']",facts need to be ascertained before rushing to comment on farmers protests says india
"['delhi', 'govt', 'to', 'help', 'trace', 'farmers', 'missing', 'from', 'protest', 'sites', 'cm', 'kejriwal']",delhi govt to help trace farmers missing from protest sites cm kejriwal
"['no', 'blanket', 'waiver', 'on', 's', '400', 'urge', 'india', 'to', 'avoid', 'russian', 'deals', 'us']",no blanket waiver on s 400 urge india to avoid russian deals us
"['here', 'are', '4', 'banks', 'that', 'will', 'thrive', 'as', 'private', 'lenders', 'enter', 'golden', 'age']",here are 4 banks that will thrive as private lenders enter golden age
"['zohos', 'sridhar', 'vembu', 'appointed', 'to', 'doval', 'led', 'national', 'security', 'advisory', 'board']",zohos sridhar vembu appointed to doval led national security advisory board
"['labour', 'ministry', 'not', 'agreed', 'to', 'extend', 'the', 'working', 'hours', 'santosh', 'kumar', 'gangwar']",labour ministry not agreed to extend the working hours santosh kumar gangwar
"['morgan', 'stanley', 'says', 'emerging', 'stocks', 'may', 'have', 'peaked', 'for', 'the', 'year']",morgan stanley says emerging stocks may have peaked for the year
"['sc', 'refers', 'to', 'pms', 'statement', 'refuses', 'to', 'entertain', 'pleas', 'on', 'tractor', 'rally', 'violence']",sc refers to pms statement refuses to entertain pleas on tractor rally violence
"['indian', 'documentary', 'writing', 'with', 'fire', 'wins', 'audience', 'award', 'at', 'sundance', 'film', 'festival']",indian documentary writing with fire wins audience award at sundance film festival
"['india', 'invites', 'global', 'defence', 'and', 'aerospace', 'companies', 'to', 'set', 'up', 'manufacturing', 'units']",india invites global defence and aerospace companies to set up manufacturing units
"['copper', 'futures', 'rise', 'marginally', 'on', 'fresh', 'bets']",copper futures rise marginally on fresh bets
"['zinc', 'futures', 'rise', 'on', 'spot', 'demand']",zinc futures rise on spot demand
"['guar', 'seed', 'futures', 'rise', 'on', 'fresh', 'bets']",guar seed futures rise on fresh bets
"['committee', 'formed', 'to', 'suggest', 'reforms', 'in', 'criminal', 'laws', 'govt', 'tells', 'parliament']",committee formed to suggest reforms in criminal laws govt tells parliament
"['bajaj', 'consumer', 'care', 'q3', 'results', 'profit', 'rises', '17', '54', 'to', 'rs', '57', '29', 'crore']",bajaj consumer care q3 results profit rises 17 54 to rs 57 29 crore
"['student', 'youth', 'activists', 'gather', 'at', 'mandi', 'house', 'for', 'march', 'in', 'support', 'of', 'protesting', 'farmers']",student youth activists gather at mandi house for march in support of protesting farmers
"['academicians', 'seek', 'repeal', 'of', 'farm', 'laws', 'say', 'these', 'pose', 'major', 'threat', 'to', 'farming', 'communities']",academicians seek repeal of farm laws say these pose major threat to farming communities
"['centre', 'releases', '14th', 'installment', 'of', 'rs', '6000', 'crore', 'to', 'states', 'to', 'meet', 'gst', 'compensation', 'shortfall']",centre releases 14th installment of rs 6000 crore to states to meet gst compensation shortfall
"['key', 'takeaways', 'from', 'the', 'budget', 'for', 'small', 'businesses']",key takeaways from the budget for small businesses
"['refined', 'soya', 'oil', 'futures', 'fall', 'on', 'low', 'demand']",refined soya oil futures fall on low demand
"['taxes', 'in', 'spain', 'come', 'in', 'the', 'limelight', 'after', 'lionel', 'messis', '671', 'mn', 'contract', 'details', 'were', 'leaked']",taxes in spain come in the limelight after lionel messis 671 mn contract details were leaked
"['russias', 'sputnik', 'v', 'vaccine', 'to', 'seek', 'india', 'approval', 'by', 'march']",russias sputnik v vaccine to seek india approval by march
"['crimes', 'against', 'scs', 'sts', 'increased', 'in', '2019', 'govt', 'tells', 'rajya', 'sabha']",crimes against scs sts increased in 2019 govt tells rajya sabha
"['olx', 'rebrands', 'its', 'aasaanjobs', 'job', 'board', 'to', 'waah', 'jobs']",olx rebrands its aasaanjobs job board to waah jobs
"['covaxin', 'rolled', 'out', 'in', 'west', 'bengal', '60', 'beneficiaries', 'to', 'be', 'inoculated', 'on', 'first', 'day']",covaxin rolled out in west bengal 60 beneficiaries to be inoculated on first day
"['zee', 'media', 'corporation', 'raises', 'rs', '230', 'crore', 'via', 'ncds']",zee media corporation raises rs 230 crore via ncds
"['firs', 'against', 'tharoor', 'journalists', 'figure', 'in', 'rajya', 'sabha']",firs against tharoor journalists figure in rajya sabha
"['will', 'counter', 'chinas', 'aggressive', 'coercive', 'action', 'joe', 'biden', 'administration']",will counter chinas aggressive coercive action joe biden administration
"['stainless', 'steel', 'long', 'products', 'manufacturer', 'viraj', 'profiles', 'ramps', 'up', 'hiring', 'in', '2021']",stainless steel long products manufacturer viraj profiles ramps up hiring in 2021
"['president', 'joe', 'biden', 'bids', 'to', 'undo', 'national', 'shame', 'of', 'donald', 'trump', 'child', 'separations']",president joe biden bids to undo national shame of donald trump child separations
"['nickel', 'futures', 'slide', 'on', 'tepid', 'demand']",nickel futures slide on tepid demand
"['ceat', 'shoppes', 'outlets', 'to', 'act', 'as', 'full', 'fledged', 'customer', 'service', 'centres']",ceat shoppes outlets to act as full fledged customer service centres
"['indian', 'school', 'finance', 'company', 'appoints', 'hari', 'padmanabhan', 'as', 'its', 'independent', 'director']",indian school finance company appoints hari padmanabhan as its independent director
"['sharad', 'yadavs', 'confidant', 'quits', 'loktantrik', 'janata', 'dal']",sharad yadavs confidant quits loktantrik janata dal
"['guar', 'gum', 'futures', 'gain', 'on', 'spot', 'demand']",guar gum futures gain on spot demand
"['cottonseed', 'oil', 'cake', 'futures', 'rise', 'on', 'fresh', 'bets']",cottonseed oil cake futures rise on fresh bets
"['prepared', 'to', 'defeat', 'any', 'misadventures', 'to', 'defend', 'territorial', 'integrity', 'rajnath', 'singh']",prepared to defeat any misadventures to defend territorial integrity rajnath singh
"['department', 'of', 'telecom', 'moves', 'supreme', 'court', 'seeking', 'clarity', 'on', 'agr', 'dues', 'timeline', 'says', 'report']",department of telecom moves supreme court seeking clarity on agr dues timeline says report
"['coriander', 'futures', 'decline', 'on', 'low', 'demand']",coriander futures decline on low demand
"['us', 'based', 'sauce', 'labs', 'to', 'acquire', 'autonomiq']",us based sauce labs to acquire autonomiq
"['west', 'bengal', 'govt', 'allows', 'reopening', 'of', 'sporting', 'complexes', 'stadiums', 'swimming', 'pools']",west bengal govt allows reopening of sporting complexes stadiums swimming pools
"['soybean', 'futures', 'slip', 'on', 'muted', 'demand']",soybean futures slip on muted demand
"['european', 'shares', 'rise', 'on', 'earnings', 'recovery', 'hopes']",european shares rise on earnings recovery hopes
"['gmpf', 'seeks', 'pms', 'intervention', 'for', 'resumption', 'of', 'mining', 'in', 'goa']",gmpf seeks pms intervention for resumption of mining in goa
"['india', 'indonesia', 'south', 'africa', 'join', 'world', 'logistics', 'passport']",india indonesia south africa join world logistics passport
"['suspended', 'ias', 'officer', 'm', 'sivasankar', 'gets', 'bail', 'in', 'dollar', 'smuggling', 'case']",suspended ias officer m sivasankar gets bail in dollar smuggling case
"['carlyle', 'leads', '200', 'million', 'indegene', 'investment']",carlyle leads 200 million indegene investment
"['india', 'foreign', 'ministry', 'calls', 'rihanna', 'greta', 'thunberg', 'tweet', 'sensational', 'and', 'irresponsible']",india foreign ministry calls rihanna greta thunberg tweet sensational and irresponsible
"['arrested', 'pdp', 'youth', 'leader', 'waheed', 'para', 'being', 'kept', 'under', 'inhuman', 'conditions', 'and', 'tortured', 'alleges', 'mehbooba', 'mufti']",arrested pdp youth leader waheed para being kept under inhuman conditions and tortured alleges mehbooba mufti
"['australia', 'shares', 'end', 'higher', 'as', 'rba', 'reaffirms', 'dovish', 'policy', 'stance']",australia shares end higher as rba reaffirms dovish policy stance
"['sensex', 'rallies', 'on', 'to', 'a', 'record', 'high', 'gains', '500', 'points', 'while', 'it', 'topped', '50k']",sensex rallies on to a record high gains 500 points while it topped 50k
"['93000', 'cybercrimes', 'related', 'to', 'sexual', 'exploitation', 'hate', 'in', '3', 'years', 'mha']",93000 cybercrimes related to sexual exploitation hate in 3 years mha
"['difficulty', 'in', 'identification', 'of', 'borrowers', 'and', 'delay', 'by', 'psbs', 'led', 'to', 'poor', 'performance', 'of', 'rural', 'poor', 'to', 'the', 'scheme', 'the', 'rural', 'development', 'ministry', 'said']",difficulty in identification of borrowers and delay by psbs led to poor performance of rural poor to the scheme the rural development ministry said
"['after', 'the', 'white', 'tiger', 'ramin', 'bahrani', 'to', 'reunite', 'with', 'aravind', 'adiga', 'for', 'amnesty', 'adaptation']",after the white tiger ramin bahrani to reunite with aravind adiga for amnesty adaptation
"['rbi', 'seen', 'keeping', 'rates', 'at', 'record', 'lows', 'liquidity', 'stance', 'key']",rbi seen keeping rates at record lows liquidity stance key
"['violence', 'returns', 'to', 'nandigram', 'threatens', 'to', 'break', 'brittle', 'peace']",violence returns to nandigram threatens to break brittle peace
"['morena', '1st', 'mp', 'district', 'with', 'no', 'active', 'covid', '19', 'case', 'official']",morena 1st mp district with no active covid 19 case official
"['supreme', 'court', 'junks', 'pil', 'seeking', 'direction', 'to', 'cbi', 'to', 'submit', 'status', 'report', 'in', 'sushant', 'singh', 'rajput', 'death', 'case']",supreme court junks pil seeking direction to cbi to submit status report in sushant singh rajput death case
"['japanese', 'shares', 'end', 'higher', 'as', 'robust', 'earnings', 'lift', 'sentiment']",japanese shares end higher as robust earnings lift sentiment
"['isro', 'to', 'help', 'skyroot', 'to', 'build', 'its', 'small', 'rocket']",isro to help skyroot to build its small rocket
"['killing', 'of', 'tn', 'fishermen', 'in', 'sri', 'lanka', 'unacceptable', 'jaishankar', 'in', 'rajya', 'sabha']",killing of tn fishermen in sri lanka unacceptable jaishankar in rajya sabha
"['tech', 'mahindra', 'announces', 'partnership', 'with', 'rsa', 'scandinavia']",tech mahindra announces partnership with rsa scandinavia
"['china', 'shares', 'end', 'lower', 'as', 'losses', 'in', 'tech', 'stocks', 'offset', 'auto', 'gains']",china shares end lower as losses in tech stocks offset auto gains
"['dispute', 'resolution', 'committee', 'to', 'have', 'multiple', 'benches', 'cbdt', 'chief']",dispute resolution committee to have multiple benches cbdt chief
