headlines,headline_text
"['gamestop', 'rallies', 'after', 'roaring', 'kitty', 'gives', 'testimony']",gamestop rallies after roaring kitty gives testimony
"['wont', 'accept', 'anything', 'less', 'than', 'reports', 'implementation', 'all', 'assam', 'student', 'union', 'on', 'clause', '6', 'of', 'assam', 'accord']",wont accept anything less than reports implementation all assam student union on clause 6 of assam accord
"['view', 'shouldnt', 'indias', 'news', 'media', 'be', 'self', 'reliant', 'too']",view shouldnt indias news media be self reliant too
"['karnataka', 'govt', 'to', 'table', 'budget', 'on', 'march', '8']",karnataka govt to table budget on march 8
"['brent', 'gives', 'up', 'gains', 'after', 'rising', 'above', '65', 'on', 'texas', 'freeze']",brent gives up gains after rising above 65 on texas freeze
"['flipkart', 'says', 'working', 'on', 'scaling', 'loyalty', 'programme', 'grocery', 'fashion', 'biz']",flipkart says working on scaling loyalty programme grocery fashion biz
"['opec', 'under', 'pressure', 'to', 'boost', 'output', 'as', 'oil', 'climbs', 'towards', 'peak']",opec under pressure to boost output as oil climbs towards peak
"['dollar', 'snaps', 'two', 'day', 'winning', 'streak', 'bitcoin', 'hovers', 'near', 'record', 'highs']",dollar snaps two day winning streak bitcoin hovers near record highs
"['fuel', 'issue', 'nana', 'patole', 'threatens', 'to', 'stall', 'films', 'of', 'big', 'b', 'akshay']",fuel issue nana patole threatens to stall films of big b akshay
"['view', 'the', 'lie', 'of', 'lying', 'women', 'and', 'why', 'there', 'is', 'a', 'long', 'way', 'to', 'go']",view the lie of lying women and why there is a long way to go
"['flipkart', 'to', 'focus', 'on', 'flipkart', 'plus', 'grocery', 'sales', 'in', '2021', 'ceo', 'says']",flipkart to focus on flipkart plus grocery sales in 2021 ceo says
"['walmarts', 'investment', 'year', 'will', 'hold', 'back', 'profit', 'growth', 'shares', 'slide']",walmarts investment year will hold back profit growth shares slide
"['whats', 'in', 'joe', 'bidens', 'sweeping', 'immigration', 'bill', 'being', 'rolled', 'out', 'in', 'congress']",whats in joe bidens sweeping immigration bill being rolled out in congress
"['sebi', 'cancels', 'registration', 'of', 'kolar', 'sharex', 'rajkumar', 'c', 'basantani', 'as', 'stock', 'brokers']",sebi cancels registration of kolar sharex rajkumar c basantani as stock brokers
"['we', 'want', 'to', 'scratch', 'beyond', 'the', 'surface', 'in', 'the', 'consumer', 'home', 'space', 'asian', 'paints', 'amit', 'syngle']",we want to scratch beyond the surface in the consumer home space asian paints amit syngle
"['pfizer', 'plans', 'to', 'test', 'covid', '19', 'vaccine', 'booster', 'engineered', 'for', 'south', 'african', 'variant']",pfizer plans to test covid 19 vaccine booster engineered for south african variant
"['modi', 'suggests', 'regional', 'air', 'ambulance', 'agreement', 'for', 'south', 'asia']",modi suggests regional air ambulance agreement for south asia
"['facebook', 'employee', 'called', 'inflated', 'ad', 'metrics', 'deeply', 'wrong']",facebook employee called inflated ad metrics deeply wrong
"['nse', 'bse', 'bulk', 'deals', 'jp', 'morgans', 'cmdb', 'ii', 'sells', 'stake', 'in', 'matrimony', 'com']",nse bse bulk deals jp morgans cmdb ii sells stake in matrimony com
"['the', 'pandemic', 'has', 'made', 'everything', 'digital', 'first', 'balaji', 'srinivasan', 'says']",the pandemic has made everything digital first balaji srinivasan says
"['meghalaya', 'giving', 'thrust', 'on', 'roof', 'top', 'solar', 'project']",meghalaya giving thrust on roof top solar project
"['canada', 'imposes', 'sanctions', 'myanmar', 'military', 'officials', 'after', 'coup', 'statement']",canada imposes sanctions myanmar military officials after coup statement
"['fpis', 'pump', 'in', '33', '8b', 'this', 'fiscal', 'take', 'total', 'holding', 'to', 'record', '592b', 'check', '10', 'sectors', 'they', 'are', 'most', 'bullish', 'on']",fpis pump in 33 8b this fiscal take total holding to record 592b check 10 sectors they are most bullish on
"['sebi', 'disposes', 'of', 'adjudication', 'proceedings', 'against', '6', 'entities', 'after', 'settlement']",sebi disposes of adjudication proceedings against 6 entities after settlement
"['should', 'the', 'government', 'try', 'to', 'stop', 'more', 'gamestops']",should the government try to stop more gamestops
"['ahead', 'of', 'market', '12', 'things', 'that', 'will', 'decide', 'stock', 'action', 'on', 'friday']",ahead of market 12 things that will decide stock action on friday
"['arjun', 'tendulkar', 'gets', 'maiden', 'ipl', 'deal', 'mumbai', 'indians', 'pick', 'him', 'for', 'base', 'price']",arjun tendulkar gets maiden ipl deal mumbai indians pick him for base price
"['jio', 'puts', 'in', 'emd', 'of', 'rs', '10000', 'cr', 'airtel', 'voda', 'idea', 'put', 'rs', '3000', 'cr', 'rs', '475', 'cr', 'each', 'for', 'spectrum', 'auction']",jio puts in emd of rs 10000 cr airtel voda idea put rs 3000 cr rs 475 cr each for spectrum auction
"['oil', 'india', 'teams', 'up', 'with', 'engineers', 'india', 'to', 'bid', 'for', 'bpcls', '61', '65', 'stake', 'in', 'numaligarh', 'refinery']",oil india teams up with engineers india to bid for bpcls 61 65 stake in numaligarh refinery
"['no', 'link', 'between', 'bjps', 'loss', 'in', 'punjab', 'municipal', 'corporation', 'polls', 'and', 'farmers', 'protest', 'tomar']",no link between bjps loss in punjab municipal corporation polls and farmers protest tomar
"['maldives', 'mauritius', 'indian', 'foreign', 'minister', 'expands', 'outreach', 'in', 'indian', 'ocean', 'region']",maldives mauritius indian foreign minister expands outreach in indian ocean region
"['cait', 'demands', 'ban', 'on', 'amazons', 'e', 'commerce', 'operations', 'in', 'india']",cait demands ban on amazons e commerce operations in india
"['rbi', 'tightens', 'payments', 'security', 'norms', 'for', 'banks', 'digital', 'payment', 'operators']",rbi tightens payments security norms for banks digital payment operators
"['covid', '19', 'maharashtras', 'case', 'count', 'grows', 'by', '10441', 'death', 'toll', 'by', '258']",covid 19 maharashtras case count grows by 10441 death toll by 258
"['it', 'dept', 'detects', 'undisclosed', 'income', 'of', 'over', 'rs', '160', 'cr', 'after', 'raids', 'on', 'andhra', 'firm']",it dept detects undisclosed income of over rs 160 cr after raids on andhra firm
"['india', 'begins', 'anti', 'dumping', 'probe', 'into', 'plastic', 'processing', 'machine', 'imports', 'from', 'china']",india begins anti dumping probe into plastic processing machine imports from china
"['sc', 'panel', 'on', 'farm', 'laws', 'holds', 'consultations', 'with', 'top', 'officials', 'of', 'agriculture', 'related', 'ministries']",sc panel on farm laws holds consultations with top officials of agriculture related ministries
"['power', 'restored', 'to', 'many', 'in', 'texas', 'but', 'freezing', 'temperatures', 'remain']",power restored to many in texas but freezing temperatures remain
"['uk', 'sanctions', 'myanmar', 'generals', 'after', 'military', 'coup']",uk sanctions myanmar generals after military coup
"['esi', 'beneficiaries', 'can', 'get', 'medical', 'services', 'at', 'empaneled', 'hospitals']",esi beneficiaries can get medical services at empaneled hospitals
"['dlfs', 'rental', 'arm', 'completes', 'acquisition', 'of', 'gurgaons', 'one', 'horizon', 'centre']",dlfs rental arm completes acquisition of gurgaons one horizon centre
"['llp', 'compliance', 'set', 'to', 'get', 'stricter', 'as', 'mca', 'applies', 'sections', 'of', 'companies', 'act', 'to', 'llp', 'act']",llp compliance set to get stricter as mca applies sections of companies act to llp act
"['maharashtra', 'congress', 'threatens', 'to', 'disrupt', 'amitabh', 'akshay', 'shoots', 'for', 'silence', 'over', 'centres', 'policies']",maharashtra congress threatens to disrupt amitabh akshay shoots for silence over centres policies
"['sc', 'agrees', 'to', 'hear', 'omar', 'abdullahs', 'plea', 'challenging', 'dhc', 'circular', 'on', 'consent', 'of', 'parties']",sc agrees to hear omar abdullahs plea challenging dhc circular on consent of parties
"['no', 'rise', 'in', 'food', 'grain', 'prices', 'for', 'poor', 'covered', 'under', 'nfsa', 'piyush', 'goyal']",no rise in food grain prices for poor covered under nfsa piyush goyal
"['gjepc', 'welcomes', 'govt', 'move', 'to', 'exempt', 'aidc', 'on', 'gold', 'silver', 'for', 'exporters', 'says', 'to', 'boost', 'exports']",gjepc welcomes govt move to exempt aidc on gold silver for exporters says to boost exports
"['pandemic', 'will', 'drive', 'millions', 'to', 'change', 'occupation', 'says', 'mckinsey', 'report']",pandemic will drive millions to change occupation says mckinsey report
"['england', 'player', 'curran', 'out', 'of', 'frame', 'for', '4th', 'test', 'against', 'india', 'will', 'come', 'with', 'limited', 'overs', 'squad']",england player curran out of frame for 4th test against india will come with limited overs squad
"['outsiders', 'will', 'have', 'to', 'return', 'after', 'bengal', 'assembly', 'polls', 'abhishek', 'banerjee']",outsiders will have to return after bengal assembly polls abhishek banerjee
"['lockdown', 'declared', 'in', 'maharashtras', 'amravati', 'following', 'surge', 'in', 'covid', '19', 'cases']",lockdown declared in maharashtras amravati following surge in covid 19 cases
"['morris', 'gets', 'more', 'than', 'all', 'south', 'african', 'becomes', 'most', 'expensive', 'buy', 'in', 'ipl', 'with', '16', '25', 'crore', 'rr', 'deal']",morris gets more than all south african becomes most expensive buy in ipl with 16 25 crore rr deal
"['pm', 'modi', 'to', 'chair', 'niti', 'aayogs', 'governing', 'council', 'meeting', 'on', 'feb', '20']",pm modi to chair niti aayogs governing council meeting on feb 20
"['lt', 'finances', 'rights', 'issue', 'concludes', 'oversubscribed', 'by', '15']",lt finances rights issue concludes oversubscribed by 15
"['governments', 'initiatives', 'brings', 'back', 'loan', 'growth', 'to', 'pre', 'covid', 'levels']",governments initiatives brings back loan growth to pre covid levels
"['auction', 'action', 'explaining', 'the', 'insane', 'bids', 'of', 'morris', 'maxwell', 'meredith', 'richardson']",auction action explaining the insane bids of morris maxwell meredith richardson
"['amazon', 'india', 'boss', 'claims', 'reuters', 'report', 'is', 'factually', 'incorrect']",amazon india boss claims reuters report is factually incorrect
"['ranbaxy', 'daiichi', 'case', 'sc', 'asks', 'lenders', 'to', 'place', 'loan', 'records', 'of', 'malvinder', 'shivinder']",ranbaxy daiichi case sc asks lenders to place loan records of malvinder shivinder
"['us', 'jobless', 'claims', 'jump', 'to', '861000', 'as', 'layoffs', 'stay', 'high']",us jobless claims jump to 861000 as layoffs stay high
"['trade', 'setup', '15431', 'an', 'intermediate', 'top', 'for', 'nifty', 'volatility', 'may', 'spike']",trade setup 15431 an intermediate top for nifty volatility may spike
"['nasa', 'rover', 'streaks', 'toward', 'a', 'landing', 'on', 'mars']",nasa rover streaks toward a landing on mars
"['faith', 'kicks', 'off', 'india', 'tourism', 'mart', '2021']",faith kicks off india tourism mart 2021
"['test', 'specialist', 'pujara', 'back', 'in', 'ipl', 'fold', 'after', '2014', 'csk', 'buys', 'him', 'at', 'base', 'price']",test specialist pujara back in ipl fold after 2014 csk buys him at base price
"['astrazeneca', 'vaccine', 'faces', 'resistance', 'in', 'europe', 'after', 'health', 'workers', 'suffer', 'side', 'effects']",astrazeneca vaccine faces resistance in europe after health workers suffer side effects
"['puducherry', 'lt', 'governor', 'tamilisai', 'soundararajan', 'asks', 'cm', 'narayansamy', 'to', 'prove', 'majority', 'on', 'feb', '22']",puducherry lt governor tamilisai soundararajan asks cm narayansamy to prove majority on feb 22
"['multiple', 'interests', 'received', 'for', 'pawan', 'hans', 'govt']",multiple interests received for pawan hans govt
"['gujarat', 'rs', 'bypolls', 'two', 'bjp', 'nominees', 'expected', 'to', 'win', 'unopposed']",gujarat rs bypolls two bjp nominees expected to win unopposed
"['gap', 'between', 'growth', 'and', 'valuations', 'is', 'starting', 'to', 'close', 'says', 'ashutosh', 'bishnoi']",gap between growth and valuations is starting to close says ashutosh bishnoi
"['china', 'denies', 'backing', 'coup', 'in', 'myanmar', 'amid', 'protests', 'outside', 'its', 'embassy', 'in', 'yangon']",china denies backing coup in myanmar amid protests outside its embassy in yangon
"['be', 'ready', 'to', 'sacrifice', 'your', 'standing', 'crop', 'rakesh', 'tikait', 'to', 'farmers']",be ready to sacrifice your standing crop rakesh tikait to farmers
"['nclt', 'approves', 'rs', '707', '70', 'cr', 'claim', 'of', 'ilfss', 'fsel', 'from', 'nhai']",nclt approves rs 707 70 cr claim of ilfss fsel from nhai
"['after', 'rajasthan', 'petrol', 'crosses', 'rs', '100', 'mark', 'in', 'madhya', 'pradesh']",after rajasthan petrol crosses rs 100 mark in madhya pradesh
"['negligible', 'impact', 'of', 'rail', 'roko', 'call', 'on', 'train', 'services', 'railways']",negligible impact of rail roko call on train services railways
"['indian', 'startups', 'test', 'a', 'popular', 'us', 'model', 'of', 'fundraising']",indian startups test a popular us model of fundraising
"['small', 'plane', 'crashes', 'into', 'swiss', 'lake', 'pilot', 'is', 'rescued']",small plane crashes into swiss lake pilot is rescued
"['prima', 'facie', 'inclined', 'to', 'strike', 'down', 'centres', 'notification', 'on', 'eia', 'for', 'projects', 'sc']",prima facie inclined to strike down centres notification on eia for projects sc
"['mckinsey', 'says', 'indian', 'it', 'industry', 'to', 'touch', '300', '350', 'billion', 'in', 'five', 'years']",mckinsey says indian it industry to touch 300 350 billion in five years
"['airbus', 'lost', '1', '3', 'billion', 'amid', 'pandemic', 'expects', 'better', '2021']",airbus lost 1 3 billion amid pandemic expects better 2021
"['india', 'can', 'emerge', 'as', 'reskilling', 'hub', 'in', 'post', 'covid', 'world', 'tech', 'leaders', 'say']",india can emerge as reskilling hub in post covid world tech leaders say
"['delhi', 'govt', 'disburses', 'rs', '3', '18', 'cr', 'to', '488', 'construction', 'workers', 'under', 'various', 'welfare', 'schemes']",delhi govt disburses rs 3 18 cr to 488 construction workers under various welfare schemes
"['is', 'bitcoin', 'better', 'than', 'gold', 'the', 'debate', 'is', 'getting', 'louder']",is bitcoin better than gold the debate is getting louder
"['farmers', 'rail', 'roko', 'agitation', 'no', 'trains', 'arrive', 'in', 'narela', 'post', 'noon', 'cops', 'guard', 'station']",farmers rail roko agitation no trains arrive in narela post noon cops guard station
"['day', 'trading', 'guide', 'for', 'friday']",day trading guide for friday
"['steel', 'price', 'hike', 'hurt', 'farm', 'equipment', 'makers', 'rajkumar', 'arumugam', 'amma']",steel price hike hurt farm equipment makers rajkumar arumugam amma
"['wistron', 'to', 'resume', 'production', 'soon', 'karnataka', 'minister']",wistron to resume production soon karnataka minister
"['delhi', 'court', 'seeks', 'filing', 'status', 'of', 'charge', 'sheets', 'forwarded', 'by', 'senior', 'officers', 'in', 'last', '3', 'years']",delhi court seeks filing status of charge sheets forwarded by senior officers in last 3 years
"['maha', 'budget', 'likely', 'to', 'be', 'presented', 'on', 'march', '8']",maha budget likely to be presented on march 8
"['edtech', 'startup', 'leverage', 'edu', 'raises', 'rs', '47', 'crore', 'in', 'series', 'a', 'funding']",edtech startup leverage edu raises rs 47 crore in series a funding
"['collaboration', 'shown', 'in', 'fighting', 'covid', 'valuable', 'takeaway', 'pm', 'modi', 'at', 'workshop', 'with', '10', 'nations']",collaboration shown in fighting covid valuable takeaway pm modi at workshop with 10 nations
"['attack', 'on', 'west', 'bengal', 'minister', 'due', 'to', 'political', 'rivalry', 'concerning', 'tmc', 'railway', 'officials']",attack on west bengal minister due to political rivalry concerning tmc railway officials
"['setting', 'up', 'demo', 'unit', 'for', 'hyperloop', 'would', 'be', 'good', 'achievement', 'for', 'india', 'vk', 'saraswat']",setting up demo unit for hyperloop would be good achievement for india vk saraswat
"['indian', 'oil', 'signs', 'agreement', 'with', 'norways', 'greenstat', 'for', 'centre', 'of', 'excellence', 'on', 'hydrogen']",indian oil signs agreement with norways greenstat for centre of excellence on hydrogen
"['indias', 'inflation', 'target', 'band', 'up', 'for', 'review', 'finance', 'minister']",indias inflation target band up for review finance minister
"['too', 'early', 'to', 'say', 'says', 'donald', 'trump', 'on', 'running', 'for', 'president', 'again', 'in', '2024']",too early to say says donald trump on running for president again in 2024
"['up', 'government', 'crushing', 'honour', 'and', 'human', 'rights', 'of', 'women', 'priyanka', 'gandhi']",up government crushing honour and human rights of women priyanka gandhi
"['flipkart', 'trade', 'body', 'tie', 'up', 'to', 'help', 'small', 'businesses', 'grow']",flipkart trade body tie up to help small businesses grow
"['maruti', 'weighing', 'its', 'options', 'on', 'launching', 'jimny', 'in', 'india']",maruti weighing its options on launching jimny in india
"['russias', 'kalashnikov', 'eyes', 'production', 'in', 'india', 'woos', 'gadget', 'lovers', 'with', 'hi', 'tech', 'shotgun']",russias kalashnikov eyes production in india woos gadget lovers with hi tech shotgun
"['gallantry', 'medals', 'presented', 'to', '127', 'crpf', 'personnel', 'for', 'anti', 'naxal', 'anti', 'terror', 'ops']",gallantry medals presented to 127 crpf personnel for anti naxal anti terror ops
"['pakistan', 'to', 'receive', '2', '8', 'million', 'doses', 'of', 'astrazeneca', 'vaccine', 'under', 'covax', 'scheme', 'on', 'march', '2']",pakistan to receive 2 8 million doses of astrazeneca vaccine under covax scheme on march 2
"['small', 'biz', 'credit', 'demand', 'back', 'to', 'pre', 'covid', 'levels', 'thanks', 'to', 'government', 'scheme', 'and', 'non', 'metros']",small biz credit demand back to pre covid levels thanks to government scheme and non metros
"['up', 'dgp', 'says', 'postmortem', 'inconclusive', 'on', 'cause', 'of', 'death', 'of', 'unnao', 'girls', 'viscera', 'test', 'to', 'be', 'done']",up dgp says postmortem inconclusive on cause of death of unnao girls viscera test to be done
"['proof', 'that', 'protest', 'not', 'limited', 'to', 'punjab', 'and', 'haryana', 'farmers', 'on', 'rail', 'roko']",proof that protest not limited to punjab and haryana farmers on rail roko
"['roughly', '59', 'of', 'indian', 'students', 'depend', 'on', 'edtech', 'apps', 'for', 'exam', 'preparations', 'brainly']",roughly 59 of indian students depend on edtech apps for exam preparations brainly
"['brahmaputra', 'not', 'just', 'a', 'river', 'but', 'manifestation', 'of', 'assams', 'diversity', 'peaceful', 'coexistence', 'modi']",brahmaputra not just a river but manifestation of assams diversity peaceful coexistence modi
"['from', 'stonks', 'to', 'bagholder', 'deciphering', 'reddits', 'trading', 'lingo']",from stonks to bagholder deciphering reddits trading lingo
"['railtel', 'ipo', 'subscribed', 'over', '7', 'times', 'so', 'far', 'on', 'last', 'day']",railtel ipo subscribed over 7 times so far on last day
"['industry', 'seeks', 'participation', 'in', 'covid', '19', 'vaccination', 'programme', 'cii']",industry seeks participation in covid 19 vaccination programme cii
"['commercial', 'markets', 'across', 'india', 'to', 'remain', 'shut', 'on', 'feb', '26', 'traders', 'body', 'cait']",commercial markets across india to remain shut on feb 26 traders body cait
"['education', 'loan', 'demand', 'hits', 'new', 'high', 'despite', 'pandemic']",education loan demand hits new high despite pandemic
"['heightened', 'vigil', 'at', 'loc', 'pushed', 'terror', 'groups', 'to', 'dig', 'tunnels', 'to', 'infiltrate', 'indian', 'army', 'tells', 'envoys']",heightened vigil at loc pushed terror groups to dig tunnels to infiltrate indian army tells envoys
"['china', 'defends', 'use', 'of', 'twitter', 'facebook', 'in', 'virus', 'campaign']",china defends use of twitter facebook in virus campaign
"['56', 'students', 'of', 'sp', 'jain', 'globals', 'class', 'of', '2020', 'get', 'international', 'offers']",56 students of sp jain globals class of 2020 get international offers
"['isma', 'says', 'omcs', 'in', 'some', 'states', 'not', 'lifting', 'ethanol', 'hopes', 'early', 'solution']",isma says omcs in some states not lifting ethanol hopes early solution
"['uk', 'study', 'shows', 'covid', '19', 'infections', 'fallen', 'significantly', 'in', 'england']",uk study shows covid 19 infections fallen significantly in england
"['facebook', 'expands', 'climate', 'change', 'center', 'in', 'push', 'for', 'credible', 'information']",facebook expands climate change center in push for credible information
"['do', 'not', 'sell', 'boya', 'branded', 'electronic', 'items', 'delhi', 'high', 'court', 'tells', 'etailers']",do not sell boya branded electronic items delhi high court tells etailers
"['first', 'fight', 'abhishek', 'then', 'me', 'mamata', 'banerjee', 'challenges', 'amit', 'shah']",first fight abhishek then me mamata banerjee challenges amit shah
"['2', 'more', 'bodies', 'recovered', 'from', 'tapovan', 'tunnel', 'uttarkhand', 'disaster', 'toll', 'crosses', '60']",2 more bodies recovered from tapovan tunnel uttarkhand disaster toll crosses 60
"['india', 'a', 'critical', 'partner', 'says', 'pentagon', 'quad', 'foreign', 'ministers', 'to', 'meet', 'virtually', 'on', 'thursday']",india a critical partner says pentagon quad foreign ministers to meet virtually on thursday
"['no', 'other', 'political', 'party', 'is', 'a', 'match', 'to', 'bjp', 'j', 'p', 'nadda']",no other political party is a match to bjp j p nadda
"['inox', 'group', 'plans', 'rs', '2000', 'crore', 'capex', 'to', 'increase', 'medical', 'industrial', 'gas', 'production']",inox group plans rs 2000 crore capex to increase medical industrial gas production
"['your', 'playstations', 'iphones', 'may', 'get', 'cheaper', 'thanks', 'to', 'the', 'microchip', 'shortage']",your playstations iphones may get cheaper thanks to the microchip shortage
"['mutation', 'in', 'spike', 'protein', 'is', 'dominant', 'form', 'of', 'covid', 'eight', 'times', 'more', 'infectious', 'study', 'finds']",mutation in spike protein is dominant form of covid eight times more infectious study finds
"['martin', 'scorsese', 'feels', 'art', 'of', 'cinema', 'is', 'being', 'devalued', 'by', 'video', 'streamers', 'busy', 'creating', 'ott', 'content']",martin scorsese feels art of cinema is being devalued by video streamers busy creating ott content
"['tech', 'view', 'nifty', 'unlikely', 'to', 'see', 'trend', 'reversal', 'as', 'long', 'as', 'it', 'is', 'above', '15000']",tech view nifty unlikely to see trend reversal as long as it is above 15000
"['vogo', 'lands', '11', '5', 'million', 'from', 'existing', 'investors']",vogo lands 11 5 million from existing investors
"['market', 'movers', 'what', 'lit', 'fire', 'under', 'natural', 'gas', 'stocks', '63', 'stocks', 'give', 'buy', 'signals']",market movers what lit fire under natural gas stocks 63 stocks give buy signals
"['us', 'still', 'unraveling', 'sophisticated', 'hack', 'of', '9', 'govt', 'agencies']",us still unraveling sophisticated hack of 9 govt agencies
"['prime', 'minister', 'narendra', 'modi', 'writes', 'letter', 'to', 'gujarat', 'bjp', 'hails', 'its', 'page', 'committee', 'drive']",prime minister narendra modi writes letter to gujarat bjp hails its page committee drive
"['toolkit', 'case', 'have', 'not', 'leaked', 'anything', 'to', 'media', 'police', 'tells', 'delhi', 'hc']",toolkit case have not leaked anything to media police tells delhi hc
"['toolkit', 'case', 'disha', 'ravi', 'moves', 'delhi', 'hc', 'to', 'restrain', 'police', 'from', 'leaking', 'probe', 'material', 'to', 'media']",toolkit case disha ravi moves delhi hc to restrain police from leaking probe material to media
"['farmers', 'rail', 'roko', 'agitation', '25', 'trains', 'regulated', 'in', 'northern', 'railway', 'zone']",farmers rail roko agitation 25 trains regulated in northern railway zone
"['those', 'who', 'practiced', 'yoga', 'during', 'covid', 'lockdown', 'reported', 'lower', 'stress', 'depression', 'and', 'anxiety', 'study', 'shows']",those who practiced yoga during covid lockdown reported lower stress depression and anxiety study shows
"['5', 'scottish', 'castles', '2', 'prince', 'pads', 'in', 'hollywood', 'or', 'a', 'historic', 'us', 'estate', 'things', '59m', 'can', 'get', 'you']",5 scottish castles 2 prince pads in hollywood or a historic us estate things 59m can get you
"['assiduus', 'global', 'ceo', 'switches', 'off', 'her', 'iphone', 'for', '2', 'hrs', 'in', 'the', 'morning', 'when', 'she', 'exercises']",assiduus global ceo switches off her iphone for 2 hrs in the morning when she exercises
"['india', 'cyclically', 'best', 'positioned', 'in', 'asia', 'says', 'credit', 'suisses', 'dan', 'fineman']",india cyclically best positioned in asia says credit suisses dan fineman
"['pm', 'modi', 'speaks', 'to', 'his', 'australian', 'counterpart', 'scott', 'morrison']",pm modi speaks to his australian counterpart scott morrison
"['foreign', 'secretary', 'harsh', 'shringla', 'calls', 'for', 'greater', 'interaction', 'among', 'strategic', 'affairs', 'analysts', 'of', 'india', 'and', 'russia']",foreign secretary harsh shringla calls for greater interaction among strategic affairs analysts of india and russia
"['employability', 'of', 'women', 'in', 'india', 'higher', 'than', 'men', 'shows', 'wheebox', 'national', 'employability', 'test', 'survey']",employability of women in india higher than men shows wheebox national employability test survey
