headlines,headline_text
"['stock', 'vs', 'mutual', 'funds', 'vs', 'index', 'funds', 'how', 'should', 'a', 'beginner', 'invest', 'in', 'equities']",stock vs mutual funds vs index funds how should a beginner invest in equities
"['darling', 'of', 'ipl', 'auction', 'glenn', 'maxwell', 'fetches', 'rs', '14', '25', 'crore', 'deal']",darling of ipl auction glenn maxwell fetches rs 14 25 crore deal
"['myanmar', 'troops', 'said', 'to', 'be', 'moving', 'to', 'cities']",myanmar troops said to be moving to cities
"['iim', 'indore', 'signs', 'mou', 'with', 'military', 'college', 'of', 'telecommunication', 'engineering', 'mhow']",iim indore signs mou with military college of telecommunication engineering mhow
"['airpower', 'can', 'bring', 'asymmetric', 'results', 'if', 'time', 'place', 'chosen', 'correctly', 'air', 'force', 'chief', 'rks', 'bhadauria']",airpower can bring asymmetric results if time place chosen correctly air force chief rks bhadauria
"['cairn', 'ceo', 'meets', 'finance', 'secretary', 'over', 'arbitration', 'ruling', 'says', 'meeting', 'constructive']",cairn ceo meets finance secretary over arbitration ruling says meeting constructive
"['gold', 'futures', 'gain', 'by', 'over', 'rs', '150', 'on', 'spot', 'demand']",gold futures gain by over rs 150 on spot demand
"['3', 'ways', 'to', 'invest', 'in', 'equity', 'and', 'their', 'tax', 'implications']",3 ways to invest in equity and their tax implications
"['your', 'ride', 'is', 'here', 'waymo', 'brings', 'self', 'driving', 'taxis', 'to', 'san', 'francisco', 'in', 'new', 'test']",your ride is here waymo brings self driving taxis to san francisco in new test
"['pli', 'scheme', 'for', 'high', 'efficiency', 'solar', 'photovoltaic', 'modules', 'to', 'lead', 'to', 'investments', 'of', 'more', 'than', 'rs', '14000', 'crore', 'pm', 'modi']",pli scheme for high efficiency solar photovoltaic modules to lead to investments of more than rs 14000 crore pm modi
"['safir', 'anand', 'on', 'game', 'changers', 'new', 'investment', 'opportunities']",safir anand on game changers new investment opportunities
"['indian', 'army', 'briefs', 'foreign', 'envoys', 'visiting', 'jammu', 'and', 'kashmir', 'on', 'role', 'of', 'pakistan', 'in', 'running', 'terror', 'factories']",indian army briefs foreign envoys visiting jammu and kashmir on role of pakistan in running terror factories
"['big', 'freeze', 'in', 'texas', 'is', 'becoming', 'a', 'global', 'oil', 'market', 'crisis']",big freeze in texas is becoming a global oil market crisis
"['rupee', 'pares', 'initial', 'losses', 'settles', '9', 'paise', 'up', 'at', '72', '65', 'against', 'us', 'dollar']",rupee pares initial losses settles 9 paise up at 72 65 against us dollar
"['reports', 'of', 'indian', 'navy', 'part', 'of', 'iran', 'russia', 'maritime', 'drill', 'false']",reports of indian navy part of iran russia maritime drill false
"['cairn', 'energy', 'ceo', 'meets', 'indian', 'finance', 'secretary', 'as', 'shareholders', 'impatiently', 'wait', 'for', 'action', 'on', 'the', '1', '4', 'billion', 'tax', 'dispute']",cairn energy ceo meets indian finance secretary as shareholders impatiently wait for action on the 1 4 billion tax dispute
"['motilal', 'oswal', 'amc', 'set', 'to', 'launch', 'index', 'fund', 'to', 'capitalise', 'on', 'em', 'rally']",motilal oswal amc set to launch index fund to capitalise on em rally
"['india', 'visa', 'curbs', 'for', 'chinese', 'workers', 'hurting', 'taiwan', 'tech', 'giants']",india visa curbs for chinese workers hurting taiwan tech giants
"['cognizant', 'india', 'says', 'on', 'track', 'to', 'bring', 'in', 'more', 'freshers', 'than', 'ever', 'before']",cognizant india says on track to bring in more freshers than ever before
"['saudi', 'arabias', 'bindawood', 'says', 'subsidiary', 'faces', '33', 'mln', 'coffee', 'maker', 'claim']",saudi arabias bindawood says subsidiary faces 33 mln coffee maker claim
"['huge', 'cache', 'of', 'arms', 'ammunition', 'seized', 'in', 'jammu', 'and', 'kashmirs', 'reasi']",huge cache of arms ammunition seized in jammu and kashmirs reasi
"['us', 'militarys', 'first', 'india', 'born', 'female', 'muslim', 'chaplain', 'graduates', 'from', 'chaplin', 'college']",us militarys first india born female muslim chaplain graduates from chaplin college
"['guar', 'gum', 'futures', 'fall', 'on', 'low', 'demand']",guar gum futures fall on low demand
"['shapoorji', 'pallonji', 'real', 'estate', 'sells', 'over', '600', 'flats', 'worth', 'rs', '400', 'crore', 'in', 'pune']",shapoorji pallonji real estate sells over 600 flats worth rs 400 crore in pune
"['guar', 'seed', 'futures', 'decline', 'on', 'low', 'demand']",guar seed futures decline on low demand
"['why', 'the', 'world', 'is', 'watching', 'australias', 'tussle', 'with', 'big', 'tech']",why the world is watching australias tussle with big tech
"['third', 'quad', 'ministerial', 'meeting', 'to', 'discuss', 'regional', 'global', 'issues']",third quad ministerial meeting to discuss regional global issues
"['why', 'is', 'rbi', 'having', 'a', 'tough', 'ride', 'in', 'keeping', 'bond', 'yields', 'in', 'check']",why is rbi having a tough ride in keeping bond yields in check
"['coriander', 'futures', 'decline', 'on', 'low', 'demand']",coriander futures decline on low demand
"['mixed', 'response', 'to', 'rail', 'roko', 'in', 'karnataka']",mixed response to rail roko in karnataka
"['amit', 'shah', 'promises', 'to', 'put', 'gangasagar', 'on', 'international', 'tourist', 'map']",amit shah promises to put gangasagar on international tourist map
"['foreign', 'envoys', 'visiting', 'j', 'k', 'reach', 'jammu', 'to', 'meet', 'lt', 'guv', 'several', 'delegations']",foreign envoys visiting j k reach jammu to meet lt guv several delegations
"['whitehat', 'jr', 'looks', 'beyond', 'coding', 'classes', 'with', 'create', 'with', 'math', 'course']",whitehat jr looks beyond coding classes with create with math course
"['silver', 'futures', 'decline', 'by', 'over', 'rs', '100', 'on', 'weak', 'spot', 'demand']",silver futures decline by over rs 100 on weak spot demand
"['india', 'russia', 'should', 'diversify', 'trade', 'basket', 'by', 'going', 'beyond', 'traditional', 'sectors', 'shringla']",india russia should diversify trade basket by going beyond traditional sectors shringla
"['bjp', 'will', 'end', 'cut', 'money', 'culture', 'bring', 'development', 'in', 'bengal', 'if', 'voted', 'to', 'power', 'shah']",bjp will end cut money culture bring development in bengal if voted to power shah
"['a', 'year', 'after', 'parasite', 'korean', 'language', 'movie', 'minari', 'is', 'making', 'waves', 'in', 'the', 'awards', 'season']",a year after parasite korean language movie minari is making waves in the awards season
"['soybean', 'futures', 'slip', 'on', 'muted', 'demand']",soybean futures slip on muted demand
"['ai', 'based', 'platform', 'sahi', 'to', 'help', 'industry', 'find', 'skilled', 'gig', 'workers']",ai based platform sahi to help industry find skilled gig workers
"['vistara', 'commences', 'flight', 'operations', 'to', 'germany', 'from', 'india']",vistara commences flight operations to germany from india
"['amazon', 'denies', 'dodging', 'indian', 'regulations', 'but', 'the', 'government', 'is', 'already', 'investigating', 'and', 'rivals', 'want', 'a', 'ban', 'on', 'jeff', 'bezos', 'company']",amazon denies dodging indian regulations but the government is already investigating and rivals want a ban on jeff bezos company
"['nursery', 'admission', 'process', 'begins', 'in', 'delhi']",nursery admission process begins in delhi
"['automakers', 'medical', 'device', 'firms', 'ask', 'joe', 'biden', 'for', 'us', 'chip', 'factory', 'subsidies']",automakers medical device firms ask joe biden for us chip factory subsidies
"['neobank', 'open', 'acquires', 'optobizz', 'in', '5', 'million', 'stock', 'plus', 'cash', 'deal']",neobank open acquires optobizz in 5 million stock plus cash deal
"['shabnam', 'to', 'be', 'first', 'woman', 'on', 'gallows', 'in', 'independent', 'india']",shabnam to be first woman on gallows in independent india
"['path', 'trodden', 'by', 'bharat', 'sevashram', 'sangha', 'will', 'help', 'indias', 'self', 'reliance', 'quest', 'amit', 'shah']",path trodden by bharat sevashram sangha will help indias self reliance quest amit shah
"['cottonseed', 'oil', 'cake', 'futures', 'rise', 'on', 'fresh', 'bets']",cottonseed oil cake futures rise on fresh bets
"['base', 'variants', 'of', 'model', '3', 'model', 'y', 'may', 'get', 'affordable', 'after', 'tesla', 'cuts', 'prices']",base variants of model 3 model y may get affordable after tesla cuts prices
"['covid', '19', 'three', 'maharashtra', 'cities', 'likely', 'to', 'face', 'stricter', 'curbs']",covid 19 three maharashtra cities likely to face stricter curbs
"['ramanis', 'acquittal', 'in', 'defamation', 'case', 'vindication', 'of', 'women', 'journalists', 'iwpc']",ramanis acquittal in defamation case vindication of women journalists iwpc
"['the', 'curious', 'case', 'of', 'petrol', 'prices', 'in', 'india', 'why', 'international', 'factors', 'matter', 'so', 'little', 'now']",the curious case of petrol prices in india why international factors matter so little now
"['coal', 'fired', 'brick', 'kilns', 'cannot', 'be', 'allowed', 'to', 'operate', 'in', 'ncr', 'during', 'severe', 'pollution', 'ngt']",coal fired brick kilns cannot be allowed to operate in ncr during severe pollution ngt
"['delhi', 'metro', 'shuts', 'entry', 'exit', 'at', 'tikri', 'border', '3', 'other', 'stations']",delhi metro shuts entry exit at tikri border 3 other stations
"['its', 'a', 'break', 'up', 'users', 'say', 'as', 'deletefacebook', 'trends', 'on', 'twitter', 'but', 'netizens', 'see', 'irony']",its a break up users say as deletefacebook trends on twitter but netizens see irony
"['pm2', '5', 'air', 'pollution', 'claimed', '54000', 'lives', 'in', 'delhi', 'last', 'year', 'says', 'study']",pm2 5 air pollution claimed 54000 lives in delhi last year says study
"['foreign', 'envoys', 'in', 'jk', 'to', 'take', 'stock', 'of', 'situation']",foreign envoys in jk to take stock of situation
"['iran', 'keen', 'to', 'lift', 'whole', 'leaf', 'teas', 'from', 'india', 'ready', 'to', 'pay', 'good', 'price']",iran keen to lift whole leaf teas from india ready to pay good price
"['west', 'assam', 'milk', 'producers', 'cooperative', 'union', 'ltd', 'made', 'foray', 'in', 'cattle', 'feed', 'supplements', 'segment']",west assam milk producers cooperative union ltd made foray in cattle feed supplements segment
"['sukanya', 'samriddhi', 'yojana', 'important', 'watchouts', 'before', 'you', 'invest']",sukanya samriddhi yojana important watchouts before you invest
"['jesse', 'plemons', 'joins', 'leonardo', 'dicaprio', 'and', 'robert', 'de', 'niro', 'in', 'martin', 'scorseses', 'killers', 'of', 'flower', 'moon']",jesse plemons joins leonardo dicaprio and robert de niro in martin scorseses killers of flower moon
"['employment', 'generation', 'rebounds', 'sharply', 'with', '12', 'million', 'new', 'addition', 'in', 'january']",employment generation rebounds sharply with 12 million new addition in january
"['haldirams', 'partners', 'with', 'futurelife', 'to', 'bring', 'nutritional', 'product', 'range', 'to', 'india']",haldirams partners with futurelife to bring nutritional product range to india
"['funding', 'and', 'msmes', 'can', 'banks', 'fintech', 'together', 'address', 'the', 'credit', 'gap', 'for', 'small', 'businesses']",funding and msmes can banks fintech together address the credit gap for small businesses
"['rail', 'roko', 'call', 'farmers', 'assemble', 'near', 'rail', 'tracks', 'in', 'punjab', 'haryana']",rail roko call farmers assemble near rail tracks in punjab haryana
"['rashmi', 'samant', 'resigns', 'as', 'oxford', 'student', 'union', 'president', 'elect', 'amidst', 'row', 'over', 'her', 'past', 'remarks']",rashmi samant resigns as oxford student union president elect amidst row over her past remarks
"['whats', 'up', 'between', 'google', 'facebook', 'and', 'australia']",whats up between google facebook and australia
"['my', 'clean', 'image', 'will', 'draw', 'people', 'towards', 'bjp', 'e', 'sreedharan', 'ex', 'delhi', 'metro', 'chief']",my clean image will draw people towards bjp e sreedharan ex delhi metro chief
"['apple', 'lobbies', 'for', 'india', 'incentives', 'as', 'it', 'plans', 'ipad', 'assembly', 'sources']",apple lobbies for india incentives as it plans ipad assembly sources
"['goyal', 'invites', 'singapore', 'to', 'invest', 'in', 'semiconductor', 'manufacturing', 'in', 'india']",goyal invites singapore to invest in semiconductor manufacturing in india
"['stock', 'market', 'news', 'vodafone', 'idea', 'shares', 'down', '3', '78']",stock market news vodafone idea shares down 3 78
"['rbi', 'approves', 'dhfl', 'resolution', 'plan']",rbi approves dhfl resolution plan
"['siddaramaiah', 'heads', 'for', 'remote', 'village', 'to', 'fulfill', 'mans', 'final', 'wish']",siddaramaiah heads for remote village to fulfill mans final wish
"['higher', 'wage', 'rule', 'could', 'price', 'out', 'immigrant', 'workers', 'in', 'the', 'us', 'if', 'implemented', 'nfap']",higher wage rule could price out immigrant workers in the us if implemented nfap
"['icc', 'to', 'launch', 'series', 'to', 'celebrate', 'indias', '2011', 'world', 'cup', 'win']",icc to launch series to celebrate indias 2011 world cup win
"['motilal', 'oswal', 'mutual', 'fund', 'launches', 'passive', 'multi', 'asset', 'fofs']",motilal oswal mutual fund launches passive multi asset fofs
"['its', 'naomi', 'moussaka', 'at', 'aus', 'open', 'osaka', 'says', 'eating', 'greek', 'foods', 'an', 'omen']",its naomi moussaka at aus open osaka says eating greek foods an omen
"['seiko', 'hashimoto', 'takes', 'over', 'as', 'tokyo', 'olympic', 'president']",seiko hashimoto takes over as tokyo olympic president
"['india', 'contracts', '41', 'of', 'the', 'sugar', 'export', 'quota', 'for', '2020', '21', 'sugar', 'season', 'says', 'isma']",india contracts 41 of the sugar export quota for 2020 21 sugar season says isma
"['up', 'governor', 'praises', 'adityanath', 'government', 'for', 'steps', 'taken', 'to', 'control', 'coronavirus']",up governor praises adityanath government for steps taken to control coronavirus
"['sri', 'lanka', 'cancels', 'imran', 'khans', 'planned', 'address', 'to', 'its', 'parliament', 'media', 'reports']",sri lanka cancels imran khans planned address to its parliament media reports
"['attack', 'on', 'bengal', 'minister', 'a', 'conspiracy', 'was', 'being', 'pressured', 'to', 'join', 'another', 'party', 'mamata']",attack on bengal minister a conspiracy was being pressured to join another party mamata
"['checkout', 'viral', 'memes', 'and', 'jokes', 'on', 'social', 'media', 'around', 'petrol', 'price', 'in', 'india']",checkout viral memes and jokes on social media around petrol price in india
"['west', 'bengal', 'power', 'minister', 'tests', 'positive', 'for', 'covid', '19']",west bengal power minister tests positive for covid 19
"['labour', 'bureau', 'to', 'conduct', 'five', 'nationwide', 'surveys', 'in', 'five', 'languages', 'to', 'check', 'job', 'data', 'inaccuracies']",labour bureau to conduct five nationwide surveys in five languages to check job data inaccuracies
"['youtube', 'shorts', 'to', 'compete', 'with', 'tiktok', 'in', 'us']",youtube shorts to compete with tiktok in us
"['telangana', 'guv', 'tamilisai', 'soundararajan', 'sworn', 'in', 'as', 'pondy', 'lt', 'governor']",telangana guv tamilisai soundararajan sworn in as pondy lt governor
"['buy', 'ge', 'tampd', 'india', 'target', 'price', 'rs', '146', 'icici', 'securities']",buy ge tampd india target price rs 146 icici securities
"['west', 'bengal', 'minister', 'jakir', 'hossain', 'injured', 'in', 'bomb', 'attack', 'in', 'railway', 'station']",west bengal minister jakir hossain injured in bomb attack in railway station
"['sp', 'legislators', 'stage', 'protest', 'outside', 'up', 'assembly', 'in', 'support', 'of', 'farmers']",sp legislators stage protest outside up assembly in support of farmers
"['un', 'chief', 'extremely', 'grateful', 'for', 'indias', '200000', 'covid', 'vaccines', 'for', 'peacekeepers']",un chief extremely grateful for indias 200000 covid vaccines for peacekeepers
"['britains', 'cairn', 'files', 'case', 'in', 'u', 's', 'to', 'push', 'india', 'to', 'pay', '1', '2', 'billion', 'award']",britains cairn files case in u s to push india to pay 1 2 billion award
"['adar', 'poonawalla', 'group', 'firm', 'makes', 'open', 'offer', 'to', 'buy', 'addl', 'stake', 'in', 'magma', 'fincorp']",adar poonawalla group firm makes open offer to buy addl stake in magma fincorp
"['buy', 'united', 'breweries', 'target', 'price', 'rs', '1510', 'icici', 'securities']",buy united breweries target price rs 1510 icici securities
"['new', 'tests', 'and', 'isolation', 'rules', 'for', 'passengers', 'arriving', 'from', 'the', 'uk', 'brazil', 'south', 'africa']",new tests and isolation rules for passengers arriving from the uk brazil south africa
"['google', 'to', 'give', 'rs', '109', 'crore', 'to', 'support', 'smbs', 'in', 'india']",google to give rs 109 crore to support smbs in india
"['demi', 'lovato', 'opens', 'up', 'about', '2018', 'drug', 'overdose', 'says', 'it', 'led', 'to', 'three', 'strokes']",demi lovato opens up about 2018 drug overdose says it led to three strokes
"['maharashtra', 'minister', 'jayant', 'patil', 'tests', 'positive', 'for', 'coronavirus']",maharashtra minister jayant patil tests positive for coronavirus
"['hold', 'nbcc', 'india', 'target', 'price', 'rs', '35', 'icici', 'securities']",hold nbcc india target price rs 35 icici securities
"['incredible', 'opportunity', 'to', 'reimagine', 'learning', 'for', 'what', 'comes', 'next', 'sundar', 'pichai']",incredible opportunity to reimagine learning for what comes next sundar pichai
"['was', 'there', 'ever', 'life', 'on', 'mars', 'nasas', 'perseverance', 'rover', 'wants', 'to', 'find', 'out']",was there ever life on mars nasas perseverance rover wants to find out
"['bond', 'traders', 'tussle', 'with', 'rbi', 'on', 'modis', 'large', 'borrowing', 'plans']",bond traders tussle with rbi on modis large borrowing plans
"['not', 'just', 'a', 'tiktok', 'clone', 'says', 'chingari', 'app', 'founder', 'with', 'their', 'latest', 'shop', 'within', 'videos', 'feature', 'which', 'he', 'claims', 'is', 'the', 'next', 'big', 'thing', 'in', 'social', 'commerce']",not just a tiktok clone says chingari app founder with their latest shop within videos feature which he claims is the next big thing in social commerce
"['indias', 'usha', 'rao', 'monari', 'appointed', 'as', 'under', 'secretary', 'general', 'and', 'associate', 'administrator', 'of', 'undp']",indias usha rao monari appointed as under secretary general and associate administrator of undp
"['buy', 'bharat', 'electronics', 'target', 'price', 'rs', '143', 'icici', 'direct']",buy bharat electronics target price rs 143 icici direct
"['pm', 'modis', 'pariksha', 'pe', 'charcha', 'to', 'be', 'held', 'online', 'due', 'to', 'covid', '19', 'education', 'minister']",pm modis pariksha pe charcha to be held online due to covid 19 education minister
"['bank', 'accounts', 'ships', 'planes', 'what', 'all', 'india', 'stands', 'to', 'lose', 'if', 'it', 'fails', 'to', 'pay', 'up', 'cairn', 'energy']",bank accounts ships planes what all india stands to lose if it fails to pay up cairn energy
"['lt', 'construction', 'bags', 'contract', 'to', 'build', '2', 'units', 'of', 'kudankulam', 'nuclear', 'power', 'proj']",lt construction bags contract to build 2 units of kudankulam nuclear power proj
"['police', 'file', 'abetment', 'of', 'suicide', 'case', 'against', 'actor', 'sandeep', 'nahars', 'wife', 'mother', 'in', 'law']",police file abetment of suicide case against actor sandeep nahars wife mother in law
"['twitters', 'top', 'lawyer', 'uks', 'fm', 'and', '3', 'other', 'indian', 'origin', 'people', 'feature', 'in', 'times', '100', 'emerging', 'leaders', 'list']",twitters top lawyer uks fm and 3 other indian origin people feature in times 100 emerging leaders list
"['india', 'issues', 'new', 'guidelines', 'for', 'passengers', 'arriving', 'from', 'the', 'uk', 'brazil', 'europe', 'and', 'middle', 'east', 'countries']",india issues new guidelines for passengers arriving from the uk brazil europe and middle east countries
"['founders', 'club', 'to', 'mentor', 'scale', 'six', 'startups']",founders club to mentor scale six startups
"['rbi', 'tightens', 'screws', 'around', 'mauritius', 'based', 'investments', 'into', 'nbfcs']",rbi tightens screws around mauritius based investments into nbfcs
"['sebi', 'clears', 'deck', 'for', 'large', 'ipo', 'issues', 'relaxes', 'minimum', 'public', 'offer', 'requirements']",sebi clears deck for large ipo issues relaxes minimum public offer requirements
"['taking', 'steps', 'to', 'prevent', 'cherry', 'picking', 'states', 'on', 'board', 'for', 'discoms', 'delicensing', 'power', 'secy', 'alok', 'kumar']",taking steps to prevent cherry picking states on board for discoms delicensing power secy alok kumar
"['india', 'startup', 'crushed', 'by', 'whatsapp', 'now', 'aims', 'to', 'rival', 'facebook']",india startup crushed by whatsapp now aims to rival facebook
"['osaka', 'ends', 'williams', 'bid', 'for', 'record', 'equalling', '24th', 'grand', 'slam', 'title']",osaka ends williams bid for record equalling 24th grand slam title
"['buy', 'hcl', 'tech', 'target', 'price', 'rs', '1300', 'motilal', 'oswal']",buy hcl tech target price rs 1300 motilal oswal
"['stock', 'picking', 'guide', 'for', 'a', 'beginner']",stock picking guide for a beginner
"['50', 'indian', 'millennials', 'want', 'to', 'travel', 'with', 'or', 'to', 'see', 'friends', 'family', 'in', '2021', '85', 'travellers', 'will', 'opt', 'for', 'unique', 'accommodations', 'on', 'next', 'holiday']",50 indian millennials want to travel with or to see friends family in 2021 85 travellers will opt for unique accommodations on next holiday
"['should', 'an', 'investor', 'care', 'about', 'the', 'liquidity', 'of', 'his', 'investment', 'portfolio']",should an investor care about the liquidity of his investment portfolio
"['soma', 'groups', 'uttarakhand', 'power', 'assets', 'up', 'for', 'sale']",soma groups uttarakhand power assets up for sale
"['rahul', 'gandhi', 'attacks', 'pm', 'alleges', 'nobody', 'can', 'get', 'justice', 'without', 'fearing', 'consequences']",rahul gandhi attacks pm alleges nobody can get justice without fearing consequences
"['buy', 'va', 'tech', 'wabag', 'target', 'price', 'rs', '288', 'geojit']",buy va tech wabag target price rs 288 geojit
"['buy', 'ultratech', 'cement', 'target', 'price', 'rs', '6650', 'motilal', 'oswal']",buy ultratech cement target price rs 6650 motilal oswal
"['one', 'in', 'four', 'uk', 'firms', 'plan', 'to', 'fire', 'staff', 'if', 'furlough', 'ends', 'soon', 'bcc']",one in four uk firms plan to fire staff if furlough ends soon bcc
"['buy', 'cyient', 'target', 'price', 'rs', '660', 'motilal', 'oswal']",buy cyient target price rs 660 motilal oswal
"['buy', 'infosys', 'target', 'price', 'rs', '1600', 'motilal', 'oswal']",buy infosys target price rs 1600 motilal oswal
"['how', 'money', 'matters', 'and', 'investing', 'changed', 'post', 'covid', '19']",how money matters and investing changed post covid 19
"['rupee', 'opens', 'on', 'flat', 'note', 'against', 'us', 'dollar', 'in', 'early', 'trade']",rupee opens on flat note against us dollar in early trade
"['delhi', 'petrol', 'reaches', 'rs', '89', '88', 'per', 'litre', 'diesel', 'rs', '80', '27', 'per', 'litre']",delhi petrol reaches rs 89 88 per litre diesel rs 80 27 per litre
"['chinas', 'blue', 'chip', 'index', 'falls', 'on', 'policy', 'tightening', 'valuation', 'worries', 'hong', 'kong', 'down']",chinas blue chip index falls on policy tightening valuation worries hong kong down
"['market', 'likely', 'to', 'have', 'a', 'good', 'run', 'for', '2', '3', 'years', 'but', 'with', 'volatility', 'jinesh', 'gopani', 'of', 'axis', 'mutual', 'fund']",market likely to have a good run for 2 3 years but with volatility jinesh gopani of axis mutual fund
"['india', 'offers', 'to', 'vaccinate', 'all', '95000', 'u', 'n', 'peacekeepers']",india offers to vaccinate all 95000 u n peacekeepers
"['investors', 'bet', 'big', 'on', 'edtech', 'startups', 'that', 'bring', 'extracurriculars', 'online']",investors bet big on edtech startups that bring extracurriculars online
"['70', 'yr', 'old', 'driver', 'who', 'allegedly', 'killed', 'nicki', 'minajs', 'father', 'in', 'a', 'hit', 'and', 'run', 'has', 'been', 'arrested']",70 yr old driver who allegedly killed nicki minajs father in a hit and run has been arrested
"['buy', 'uflex', 'target', 'price', 'rs', '387', 'yes', 'securities']",buy uflex target price rs 387 yes securities
"['fintech', 'lobby', 'groups', 'ask', 'govt', 'to', 'allow', 'blockchain', 'ecosystem', 'grow', 'organically']",fintech lobby groups ask govt to allow blockchain ecosystem grow organically
"['buy', 'bharti', 'airtel', 'target', 'price', 'rs', '720', 'motilal', 'oswal']",buy bharti airtel target price rs 720 motilal oswal
"['lot', 'of', 'concerns', 'about', 'behaviour', 'of', 'big', 'tech', 'firms', 'piyush', 'goyal']",lot of concerns about behaviour of big tech firms piyush goyal
"['the', 'key', 'data', 'tesla', 'isnt', 'putting', 'out', 'where', 'elon', 'musk', 'poster', 'boy', 'of', 'clean', 'mobility', 'should', 'come', 'clean']",the key data tesla isnt putting out where elon musk poster boy of clean mobility should come clean
"['privatisation', 'of', 'cpses', 'during', 'recession', 'time', 'a', 'horrible', 'idea', 'sen']",privatisation of cpses during recession time a horrible idea sen
"['australia', 'takes', 'cue', 'from', 'india', 'in', 'pushing', 'back', 'against', 'bri']",australia takes cue from india in pushing back against bri
"['robinhood', 'to', 'allow', 'customers', 'to', 'deposit', 'withdraw', 'cryptocurrencies']",robinhood to allow customers to deposit withdraw cryptocurrencies
