headlines,headline_text
"['buy', 'jk', 'lakshmi', 'cement', 'target', 'price', 'rs', '440', 'motilal', 'oswal']",buy jk lakshmi cement target price rs 440 motilal oswal
"['centre', 'should', 'repeal', 'farm', 'laws', 'work', 'towards', 'normalising', 'situation', 'at', 'delhi', 'borders', 'mayawati']",centre should repeal farm laws work towards normalising situation at delhi borders mayawati
"['goodwill', 'depreciation', 'out', 'cos', 'face', 'higher', 'tax', 'outgo']",goodwill depreciation out cos face higher tax outgo
"['stock', 'market', 'update', '109', 'stocks', 'hit', '52', 'week', 'highs', 'on', 'nse']",stock market update 109 stocks hit 52 week highs on nse
"['stock', 'market', 'update', '2', 'stocks', 'hit', '52', 'week', 'lows', 'on', 'nse']",stock market update 2 stocks hit 52 week lows on nse
"['hc', 'seeks', 'centres', 'stand', 'on', 'pil', 'against', 'new', 'whatsapp', 'privacy', 'policy']",hc seeks centres stand on pil against new whatsapp privacy policy
"['videos', 'show', 'no', 'insult', 'to', 'national', 'flag', 'at', 'red', 'fort', 'shiv', 'sena']",videos show no insult to national flag at red fort shiv sena
"['elon', 'musks', 'banter', 'with', 'robinhood', 'ceo', 'triggers', 'stampede', 'for', 'clubhouse', 'app']",elon musks banter with robinhood ceo triggers stampede for clubhouse app
"['mca', 'amends', 'definition', 'of', 'small', 'companies', 'allows', 'nris', 'to', 'incorporate', 'one', 'person', 'companies']",mca amends definition of small companies allows nris to incorporate one person companies
"['ranveer', 'singh', 'remains', 'advertisers', 'favourite', 'during', 'pandemic', 'signs', '9', 'new', 'brands']",ranveer singh remains advertisers favourite during pandemic signs 9 new brands
"['rihanna', 'tweets', 'about', 'farmers', 'protests', 'in', 'india', 'faces', 'vicious', 'trolling', 'on', 'twitter']",rihanna tweets about farmers protests in india faces vicious trolling on twitter
"['noida', 'introduces', 'fast', 'trains', 'to', 'cut', 'commuting', 'time', 'for', 'aqua', 'line', 'passengers']",noida introduces fast trains to cut commuting time for aqua line passengers
"['how', 'tech', 'companies', 'can', 'combat', 'the', 'implications', 'of', 'covid', '19', 'on', 'the', 'women', 'workforce']",how tech companies can combat the implications of covid 19 on the women workforce
