headlines,headline_text
"['add', 'indian', 'oil', 'corporation', 'target', 'price', 'rs', '105', 'icici', 'securities']",add indian oil corporation target price rs 105 icici securities
"['highways', 'ministry', 'to', 'seek', 'cabinet', 'nod', 'to', 'raise', 'bharatmala', 'outlay']",highways ministry to seek cabinet nod to raise bharatmala outlay
"['raja', 'krishnamoorthi', 'appointed', 'co', 'chair', 'of', 'immigration', 'task', 'force', 'of', 'capac']",raja krishnamoorthi appointed co chair of immigration task force of capac
"['india', 'becomes', 'fastest', 'country', 'to', 'reach', '4', 'million', 'covid', '19', 'vaccination', 'mark']",india becomes fastest country to reach 4 million covid 19 vaccination mark
"['desecration', 'of', 'temples', 'in', 'andhra', 'pradesh', 'raised', 'in', 'rajya', 'sabha']",desecration of temples in andhra pradesh raised in rajya sabha
"['gsk', 'curevac', 'partnership', 'eyes', 'covid', '19', 'vaccine', 'against', 'multiple', 'variants']",gsk curevac partnership eyes covid 19 vaccine against multiple variants
"['republic', 'day', 'violence', 'cash', 'reward', 'announced', 'for', 'information', 'on', 'deep', 'sidhu']",republic day violence cash reward announced for information on deep sidhu
"['who', 'is', 'andy', 'jassy', 'a', 'harvard', 'graduate', 'who', 'joined', 'amazon', 'in', '1997', 'and', 'is', 'now', 'stepping', 'into', 'bezoss', 'shoes']",who is andy jassy a harvard graduate who joined amazon in 1997 and is now stepping into bezoss shoes
"['delhi', 'border', 'blockade', 'by', 'farmers', 'causing', 'inconvenience', 'to', 'people', 'govt', 'tells', 'rajya', 'sabha']",delhi border blockade by farmers causing inconvenience to people govt tells rajya sabha
"['aap', 'mps', 'marshalled', 'out', 'of', 'rajya', 'sabha', 'over', 'unruly', 'behaviour']",aap mps marshalled out of rajya sabha over unruly behaviour
"['govt', 'to', 'delicense', 'power', 'distribution', 'push', 'for', 'gst', 'on', 'electricity', 'r', 'k', 'singh']",govt to delicense power distribution push for gst on electricity r k singh
"['proposed', 'duty', 'levy', 'on', 'components', 'to', 'hit', 'indian', 'handset', 'makers', 'most', 'industry']",proposed duty levy on components to hit indian handset makers most industry
"['republic', 'day', 'violence', 'shashi', 'tharoor', 'rajdeep', 'sardesai', 'move', 'sc', 'against', 'firs']",republic day violence shashi tharoor rajdeep sardesai move sc against firs
"['fomo', 'has', 'taken', 'over', 'from', 'the', 'fear', 'of', 'losing', 'money', 'howard', 'marks']",fomo has taken over from the fear of losing money howard marks
"['neutral', 'on', 'bajaj', 'auto', 'target', 'price', 'rs', '4000', 'motilal', 'oswal']",neutral on bajaj auto target price rs 4000 motilal oswal
"['buy', 'tata', 'consumer', 'products', 'target', 'price', 'rs', '661', 'motilal', 'oswal']",buy tata consumer products target price rs 661 motilal oswal
"['buy', 'when', 'fiis', 'sell', 'to', 'earn', 'big', 'returns', 'on', 'indian', 'stocks', 'says', 'prashant', 'jain']",buy when fiis sell to earn big returns on indian stocks says prashant jain
"['atmanirbhar', 'focus', 'sends', 'lava', 'shares', 'soaring', 'in', 'unlisted', 'market']",atmanirbhar focus sends lava shares soaring in unlisted market
['kg'],kg
"['buy', 'ajanta', 'pharma', 'target', 'price', 'rs', '2030', 'motilal', 'oswal']",buy ajanta pharma target price rs 2030 motilal oswal
"['maharashtras', 'private', 'hospitals', 'offer', 'to', 'vaccinate', 'staff']",maharashtras private hospitals offer to vaccinate staff
"['india', 'has', 'great', 'potential', 'tremendous', 'resources', 'howard', 'marks']",india has great potential tremendous resources howard marks
"['rajya', 'sabha', 'chairman', 'naidu', 'warns', 'mps', 'against', 'recording', 'proceedings', 'on', 'mobile', 'phones']",rajya sabha chairman naidu warns mps against recording proceedings on mobile phones
"['budget', '2021', '22', 'prioritises', 'gaganyaan', 'indias', 'human', 'spaceflight', 'mission', 'over', 'all', 'others', 'heres', 'why']",budget 2021 22 prioritises gaganyaan indias human spaceflight mission over all others heres why
"['buy', 'essel', 'propack', 'target', 'price', 'rs', '333', 'motilal', 'oswal']",buy essel propack target price rs 333 motilal oswal
"['invest', 'and', 'forget', 'can', 'you', 'make', 'high', 'returns', 'over', 'the', 'long', 'run', 'simply', 'by', 'inaction']",invest and forget can you make high returns over the long run simply by inaction
"['stocks', 'in', 'the', 'news', 'bharti', 'airtel', 'ril', 'future', 'retail', 'adani', 'green', 'and', 'jubilant', 'foodworks']",stocks in the news bharti airtel ril future retail adani green and jubilant foodworks
"['agara', 'raises', '4', '3', 'million', 'in', 'pre', 'series', 'a', 'extension', 'round']",agara raises 4 3 million in pre series a extension round
"['after', 'pledging', 'disclosure', 'many', 'uk', 'banks', 'still', 'silent', 'on', 'race', 'diversity', 'data']",after pledging disclosure many uk banks still silent on race diversity data
"['consumer', 'retail', 'cos', 'step', 'on', 'rural', 'path']",consumer retail cos step on rural path
"['mukesh', 'ambani', 'ratan', 'tata', 'and', 'anand', 'mahindra', 'might', 'come', 'together', 'for', 'indias', 'new', 'national', 'hydrogen', 'mission']",mukesh ambani ratan tata and anand mahindra might come together for indias new national hydrogen mission
"['neutral', 'on', 'escorts', 'target', 'price', 'rs', '1470', 'motilal', 'oswal']",neutral on escorts target price rs 1470 motilal oswal
"['five', 'extra', 'hours', 'added', 'to', 'discussion', 'on', 'presidents', 'address', 'to', 'allow', 'raising', 'of', 'farm', 'issues']",five extra hours added to discussion on presidents address to allow raising of farm issues
"['3', 'in', '4', 'indian', 'professionals', 'will', 'actively', 'look', 'for', 'a', 'new', 'job', 'in', '2021', 'linkedin', 'job', 'seeker', 'research']",3 in 4 indian professionals will actively look for a new job in 2021 linkedin job seeker research
"['40', 'percent', 'of', 'staff', 'at', 'toyotas', 'bidadi', 'plant', 'back', 'at', 'work', 'says', 'karnatakas', 'labour', 'minister']",40 percent of staff at toyotas bidadi plant back at work says karnatakas labour minister
"['microsoft', 'offers', 'to', 'step', 'in', 'if', 'rival', 'google', 'quits', 'australia']",microsoft offers to step in if rival google quits australia
"['myanmar', 'burma', 'and', 'why', 'the', 'different', 'names', 'matter']",myanmar burma and why the different names matter
"['rupee', 'opens', 'flat', 'against', 'us', 'dollar', 'in', 'early', 'trade']",rupee opens flat against us dollar in early trade
"['fire', 'breaks', 'out', 'at', 'scindia', 'house', 'in', 'mumbai']",fire breaks out at scindia house in mumbai
"['saudi', 'arabias', 'non', 'oil', 'private', 'sector', 'continues', 'solid', 'growth', 'in', 'january']",saudi arabias non oil private sector continues solid growth in january
"['buy', 'coromandel', 'international', 'target', 'price', 'rs', '1071', 'motilal', 'oswal']",buy coromandel international target price rs 1071 motilal oswal
"['chinas', 'faw', 'considers', 'acquiring', 'bmw', 'partner', 'brilliance', 'in', '7', '2', 'billion', 'deal', 'reuters']",chinas faw considers acquiring bmw partner brilliance in 7 2 billion deal reuters
"['glenmark', 'pharma', 'gets', 'usfda', 'nod', 'for', 'seizure', 'treatment', 'drug']",glenmark pharma gets usfda nod for seizure treatment drug
"['buy', 'mahanagar', 'gas', 'target', 'price', 'rs', '1150', 'edelweiss']",buy mahanagar gas target price rs 1150 edelweiss
"['trade', 'to', 'be', 'part', 'of', 'joe', 'bidens', 'china', 'strategy', 'not', 'driving', 'force', 'ex', 'ustr', 'official']",trade to be part of joe bidens china strategy not driving force ex ustr official
"['govt', 'to', 'explore', 'use', 'of', 'blockchain', 'tech', 'for', 'ushering', 'in', 'digital', 'economy']",govt to explore use of blockchain tech for ushering in digital economy
"['stock', 'market', 'news', 'future', 'retail', 'shares', 'down', '4', '99']",stock market news future retail shares down 4 99
"['home', 'first', 'finance', 'debuts', 'at', '20', 'premium', 'over', 'issue', 'price']",home first finance debuts at 20 premium over issue price
"['uae', 'non', 'oil', 'private', 'sector', 'mild', 'growth', 'unchanged', 'in', 'january', 'pmi']",uae non oil private sector mild growth unchanged in january pmi
"['state', 'run', 'oil', 'companies', 'capex', 'to', 'go', 'up', 'by', '6', '5', 'in', 'fy22']",state run oil companies capex to go up by 6 5 in fy22
"['stock', 'market', 'news', 'ril', 'shares', 'up', '0', '27', 'as', 'nifty', 'gains']",stock market news ril shares up 0 27 as nifty gains
"['why', 'lt', 'could', 'be', 'a', 'major', 'beneficiary', 'of', 'govts', 'infra', 'push']",why lt could be a major beneficiary of govts infra push
"['budget', '2021', 'curing', 'and', 'vaccinating', 'indias', 'international', 'trade']",budget 2021 curing and vaccinating indias international trade
"['india', 'records', '11039', 'new', 'covid', '19', 'cases', '110', 'fresh', 'fatalities']",india records 11039 new covid 19 cases 110 fresh fatalities
"['fitch', 'cuts', 'outlook', 'on', 'kuwaits', 'debt', 'rating', 'to', 'negative', 'on', 'state', 'treasury', 'liquidity', 'risk']",fitch cuts outlook on kuwaits debt rating to negative on state treasury liquidity risk
"['buy', 'dlf', 'target', 'price', 'rs', '320', 'edelweiss']",buy dlf target price rs 320 edelweiss
"['fm', 'batted', 'like', 'pant', 'what', 'was', 'so', 'impressive', 'about', 'this', 'budget']",fm batted like pant what was so impressive about this budget
"['anti', 'dumping', 'duties', 'countervailing', 'duties', 'altered', 'to', 'put', 'brakes', 'on', 'cheap', 'imports']",anti dumping duties countervailing duties altered to put brakes on cheap imports
"['sitharamans', 'bad', 'bank', 'plan', 'sparks', 'concern', 'loan', 'prices', 'could', 'be', 'inflated']",sitharamans bad bank plan sparks concern loan prices could be inflated
"['buy', 'sun', 'pharma', 'target', 'price', 'rs', '650', 'edelweiss']",buy sun pharma target price rs 650 edelweiss
"['buy', 'hdfc', 'target', 'price', 'rs', '3300', 'motilal', 'oswal']",buy hdfc target price rs 3300 motilal oswal
"['stock', 'market', 'news', 'bharti', 'airtel', 'shares', 'climb', '2', '71', 'as', 'nifty', 'gains']",stock market news bharti airtel shares climb 2 71 as nifty gains
"['budget', '2021', 'impact', 'cheaper', 'gold', 'silver', 'jewellery', 'to', 'add', 'glitter', 'to', 'marriage', 'season']",budget 2021 impact cheaper gold silver jewellery to add glitter to marriage season
"['fitch', 'sp', 'flag', 'high', 'fiscal', 'deficit', 'slow', 'consolidation']",fitch sp flag high fiscal deficit slow consolidation
"['home', 'first', 'finance', 'set', 'to', 'ride', 'budget', 'rally', 'eyes', 'strong', 'listing', 'on', 'wednesday']",home first finance set to ride budget rally eyes strong listing on wednesday
"['andy', 'jassy', 'jeff', 'bezos', 'successor', 'ushered', 'in', 'cloud', 'computing', 'boom', 'with', 'aws']",andy jassy jeff bezos successor ushered in cloud computing boom with aws
"['gamestop', 'breaks', 'below', '100', 'as', 'rout', 'erases', '28', 'billion', 'in', 'value']",gamestop breaks below 100 as rout erases 28 billion in value
"['days', 'before', 'coup', 'imf', 'sent', 'myanmar', '350', 'million', 'in', 'emergency', 'aid', 'it', 'cannot', 'get', 'back']",days before coup imf sent myanmar 350 million in emergency aid it cannot get back
"['indian', 'american', 'congressman', 'krishnamoorthi', 'seeks', 'fbi', 'probe', 'into', 'vandalism', 'of', 'gandhi', 'statue', 'in', 'california']",indian american congressman krishnamoorthi seeks fbi probe into vandalism of gandhi statue in california
"['sgx', 'nifty', 'up', '50', 'points', 'heres', 'what', 'changed', 'for', 'market', 'while', 'you', 'were', 'sleeping']",sgx nifty up 50 points heres what changed for market while you were sleeping
"['fbi', 'agents', 'shot', 'serving', 'warrant', 'in', 'florida', 'reports', 'ap']",fbi agents shot serving warrant in florida reports ap
"['indigo', 'paints', 'hits', '20', 'upper', 'circuit', 'up', '110', 'over', 'issue', 'price']",indigo paints hits 20 upper circuit up 110 over issue price
"['bharat', 'biotech', 'ocugen', 'sign', 'pact', 'for', 'supply', 'of', 'covaxin', 'to', 'us', 'market']",bharat biotech ocugen sign pact for supply of covaxin to us market
"['controversy', 'swirls', 'around', 'indias', 'homegrown', 'covid', '19', 'vaccine']",controversy swirls around indias homegrown covid 19 vaccine
"['bharti', 'airtel', 'q3', 'preview', 'telecom', 'operator', 'likely', 'to', 'post', 'profit', 'in', 'q3', 'sales', 'may', 'hit', 'record', 'high']",bharti airtel q3 preview telecom operator likely to post profit in q3 sales may hit record high
"['numbers', 'show', '5g', 'sales', 'unlikely', 'in', 'fy22']",numbers show 5g sales unlikely in fy22
"['bernies', 'famous', 'mittens', 'will', 'be', 'soon', 'available', 'to', 'buy', 'teacher', 'who', 'made', 'them', 'had', 'found', 'a', 'manufacturer']",bernies famous mittens will be soon available to buy teacher who made them had found a manufacturer
"['after', 'budget', 'party', 'sensex', 'bulls', 'flirt', 'with', '50k', 'again']",after budget party sensex bulls flirt with 50k again
"['its', 'equivalent', 'to', 'kapil', 'devs', '4', 'sixes', 'in', 'the', 'lords', 'test']",its equivalent to kapil devs 4 sixes in the lords test
"['sebi', 'issues', 'directions', 'for', 'lpcc', 'by', 'mutual', 'fund', 'houses']",sebi issues directions for lpcc by mutual fund houses
"['dubai', 'closes', 'bars', 'limits', 'activities', 'after', 'virus', 'cases', 'spike']",dubai closes bars limits activities after virus cases spike
"['supreme', 'court', 'asks', 'franklin', 'templeton', 'to', 'disburse', 'rs', '9122', 'crore', 'to', 'investors', 'in', '20', 'days']",supreme court asks franklin templeton to disburse rs 9122 crore to investors in 20 days
"['groww', 'makes', 'senior', 'level', 'appointments', 'as', 'it', 'eyes', 'growth']",groww makes senior level appointments as it eyes growth
"['buy', 'torrent', 'pharma', 'target', 'price', 'rs', '2700', 'edelweiss']",buy torrent pharma target price rs 2700 edelweiss
"['decision', 'to', 'tax', 'pf', 'interest', 'based', 'on', 'principle', 'of', 'equity']",decision to tax pf interest based on principle of equity
"['tata', 'motors', 'shares', 'jump', 'over', '3', 'in', 'early', 'trade']",tata motors shares jump over 3 in early trade
"['frl', 'to', 'explore', 'legal', 'recourse', 'after', 'delhi', 'hc', 'directs', 'status', 'quo', 'in', 'future', 'reliance', 'deal']",frl to explore legal recourse after delhi hc directs status quo in future reliance deal
"['duty', 'on', 'gold', 'slashed', 'in', 'budget', '2021', 'does', 'buying', 'sovereign', 'gold', 'bond', 'make', 'sense', 'now']",duty on gold slashed in budget 2021 does buying sovereign gold bond make sense now
"['empire', 'builder', 'bezos', 'looks', 'beyond', 'amazon']",empire builder bezos looks beyond amazon
"['budget', 'bump', 'top', 'infra', 'stock', 'picks', 'from', 'top', 'brokerages']",budget bump top infra stock picks from top brokerages
"['govt', 'gets', 'in', 'on', 'the', 'act', 'to', 'prepare', 'lic', 'for', 'fy22', 'listing']",govt gets in on the act to prepare lic for fy22 listing
"['pm', 'modi', 'congratulates', 'pm', 'rajapaksa', 'on', 'sri', 'lankas', '73rd', 'independence', 'day']",pm modi congratulates pm rajapaksa on sri lankas 73rd independence day
"['delhi', 'high', 'court', 'gives', 'interim', 'relief', 'to', 'amazon', 'in', 'dispute', 'with', 'future', 'group']",delhi high court gives interim relief to amazon in dispute with future group
"['google', 'cofounder', 'sergey', 'brins', 'family', 'office', 'to', 'open', 'in', 'singapore']",google cofounder sergey brins family office to open in singapore
"['equity', 'flows', 'will', 'continue', 'from', 'foreigners', 'but', 'debt', 'remains', 'a', 'challenge', 'jahangir', 'aziz']",equity flows will continue from foreigners but debt remains a challenge jahangir aziz
"['global', 'bull', 'cycle', 'is', 'going', 'close', 'to', 'euphoria', 'what', 'should', 'you', 'do', 'mark', 'mobius']",global bull cycle is going close to euphoria what should you do mark mobius
"['harvey', 'weinstein', 'accuser', 'demands', 'deposition', 'which', 'will', 'help', 'her', 'make', 'a', 'settlement', 'decision']",harvey weinstein accuser demands deposition which will help her make a settlement decision
"['latest', 'sero', 'survey', 'shows', '56', '13', 'per', 'cent', 'people', 'in', 'delhi', 'have', 'antibodies', 'against', 'covid', '19', 'satyendar', 'jain']",latest sero survey shows 56 13 per cent people in delhi have antibodies against covid 19 satyendar jain
"['view', 'national', 'monetisation', 'pipeline', 'is', 'an', 'idea', 'whose', 'time', 'has', 'come']",view national monetisation pipeline is an idea whose time has come
"['iran', 'deepens', 'breach', 'of', 'nuclear', 'deal', 'at', 'underground', 'enrichment', 'site']",iran deepens breach of nuclear deal at underground enrichment site
"['benefits', 'of', 'an', 'extra', 'limb', 'so', 'that', 'things', 'dont', 'get', 'out', 'of', 'hand']",benefits of an extra limb so that things dont get out of hand
"['reits', 'invits', 'debt', 'access', 'amendment', 'to', 'help', 'attract', 'more', 'investment']",reits invits debt access amendment to help attract more investment
"['asian', 'shares', 'push', 'higher', 'on', 'improving', 'coronavirus', 'outlook']",asian shares push higher on improving coronavirus outlook
"['a', 'bold', 'budget', 'under', 'challenging', 'conditions']",a bold budget under challenging conditions
"['senate', 'confirms', 'mayorkas', 'as', 'bidens', 'homeland', 'security', 'chief']",senate confirms mayorkas as bidens homeland security chief
"['carlyle', 'brighton', 'park', 'invest', '200', 'million', 'in', 'indian', 'healthtech', 'company', 'indegene']",carlyle brighton park invest 200 million in indian healthtech company indegene
"['info', 'based', 'assessments', 'will', 'help', 'reduce', 'harassment', 'of', 'taxpayers', 'pc', 'mody', 'cbdt', 'chairman']",info based assessments will help reduce harassment of taxpayers pc mody cbdt chairman
"['oil', 'rises', 'on', 'falling', 'crude', 'stocks', 'demand', 'hopes', 'on', 'stimulus', 'and', 'vaccine', 'rollouts']",oil rises on falling crude stocks demand hopes on stimulus and vaccine rollouts
"['silver', 'attempts', 'rebound', 'even', 'as', 'retail', 'sweep', 'wanes']",silver attempts rebound even as retail sweep wanes
"['sap', 'indian', 'subcontinent', 'mds', 'daughters', 'taught', 'him', 'to', 'cook', 'and', 'bake', 'during', 'the', 'lockdown']",sap indian subcontinent mds daughters taught him to cook and bake during the lockdown
"['state', 'run', 'oil', 'cos', 'combined', 'capex', 'at', '105k', 'cr', 'in', 'fy22', 'up', '6', '5']",state run oil cos combined capex at 105k cr in fy22 up 6 5
"['fpis', 'salute', 'switch', 'to', 'growth', 'mode', 'all', 'that', 'it', 'brings']",fpis salute switch to growth mode all that it brings
"['will', 'delicense', 'discoms', 'to', 'end', 'monopolies', 'rk', 'singh']",will delicense discoms to end monopolies rk singh
"['dollar', 'near', '2', 'month', 'peak', 'on', 'relative', 'strength', 'of', 'us', 'recovery']",dollar near 2 month peak on relative strength of us recovery
"['silver', 'dulls', 'as', 'investor', 'frenzy', 'cools']",silver dulls as investor frenzy cools
"['gom', 'to', 'decide', 'bare', 'minimum', 'psus', 'in', 'strategic', 'sectors']",gom to decide bare minimum psus in strategic sectors
"['cheaper', 'homes', 'build', 'more']",cheaper homes build more
"['ettech', 'morning', 'dispatch', 'on', 'feb', '3', '2021', 'jeff', 'bezos', 'to', 'step', 'down', 'as', 'amazon', 'ceo', 'expanded', 'google', 'tax', 'in', 'india']",ettech morning dispatch on feb 3 2021 jeff bezos to step down as amazon ceo expanded google tax in india
"['why', 'markets', 'liked', 'the', 'budget', 'heres', 'what', 'top', 'brokerages', 'say']",why markets liked the budget heres what top brokerages say
"['re', 'registration', 'fitness', 'test', 'fees', 'of', 'vehicles', 'may', 'be', 'hiked']",re registration fitness test fees of vehicles may be hiked
"['indigo', 'paints', 'lists', 'at', '75', 'above', 'ipo', 'price']",indigo paints lists at 75 above ipo price
"['ifsc', 'red', 'carpet', 'removes', 'taxation', 'worries', 'for', 'fpis']",ifsc red carpet removes taxation worries for fpis
"['new', 'central', 'schemes', 'added', 'in', 'rejig', 'allocation', 'jumps', '12', '3']",new central schemes added in rejig allocation jumps 12 3
"['hdfc', 'q3', 'profit', 'up', '27', 'after', 'adjusting', 'for', 'one', 'off', 'gains']",hdfc q3 profit up 27 after adjusting for one off gains
"['iifcl', 'may', 'be', 'subsumed', 'into', 'new', 'dfi', 'dfs', 'secretary']",iifcl may be subsumed into new dfi dfs secretary
"['dow', 'jones', 'rallies', 'ahead', 'of', 'amazon', 'alphabet', 'earnings', 'stimulus', 'in', 'focus']",dow jones rallies ahead of amazon alphabet earnings stimulus in focus
"['electronics', 'giants', 'make', 'india', 'hub', 'for', 'exports']",electronics giants make india hub for exports
"['jeff', 'bezos', 'is', 'stepping', 'back', 'with', 'net', 'worth', 'near', 'all', 'time', 'high']",jeff bezos is stepping back with net worth near all time high
"['tech', 'view', 'nifty', 'forms', 'big', 'bullish', 'candle', '14750', 'level', 'crucial', 'now', 'for', 'further', 'gains']",tech view nifty forms big bullish candle 14750 level crucial now for further gains
"['15th', 'fc', 'calls', 'for', 'tech', 'education', 'in', 'regional', 'languages']",15th fc calls for tech education in regional languages
"['quad', 'nations', 'will', 'achieve', 'nothing', 'by', 'giving', 'sermons', 'to', 'myanmar']",quad nations will achieve nothing by giving sermons to myanmar
"['airtel', 'denies', 'claims', 'that', 'data', 'of', '2', '5', 'million', 'users', 'was', 'leaked']",airtel denies claims that data of 2 5 million users was leaked
"['budget', '2021', 'asian', 'development', 'bank', 'in', 'talks', 'to', 'set', 'up', 'fintech', 'hub', 'at', 'gift', 'city']",budget 2021 asian development bank in talks to set up fintech hub at gift city
"['budget', '2021', 'sops', 'may', 'supercharge', 'campus', 'startups', 'say', 'experts']",budget 2021 sops may supercharge campus startups say experts
"['more', 'foreign', 'cos', 'to', 'come', 'under', 'google', 'tax', 'search']",more foreign cos to come under google tax search
"['from', 'iran', 'to', 'ukraine', 'diverse', 'participants', 'at', 'air', 'show', 'as', 'india', 'pitches', 'itself', 'as', 'defence', 'supplier']",from iran to ukraine diverse participants at air show as india pitches itself as defence supplier
"['supreme', 'court', 'should', 'have', 'a', 'twitter', 'handle', 'of', 'its', 'own', 'remarks', 'cji', 'sa', 'bobde']",supreme court should have a twitter handle of its own remarks cji sa bobde
"['jk', 'ladakh', 'fully', 'integrated', 'into', 'mainstream', 'of', 'india', 'govt', 'tells', 'rajya', 'sabha']",jk ladakh fully integrated into mainstream of india govt tells rajya sabha
"['sensex', 'captures', 'and', 'represents', 'the', 'power', 'of', 'equity', '3', 'ways', 'to', 'make', 'the', 'return', 'that', 'is', 'embodied', 'in', 'the', 'index']",sensex captures and represents the power of equity 3 ways to make the return that is embodied in the index
"['who', 'led', 'covid', '19', 'probe', 'team', 'in', 'china', 'visits', 'wuhan', 'virus', 'lab']",who led covid 19 probe team in china visits wuhan virus lab
"['lancet', 'peer', 'reviewed', 'study', 'endorses', 'russias', 'sputnik', 'v', 'covid', '19', 'vaccine']",lancet peer reviewed study endorses russias sputnik v covid 19 vaccine
"['maruti', 'suzuki', 'partners', 'with', 'ald', 'automotive', 'india', 'for', 'subscription', 'program']",maruti suzuki partners with ald automotive india for subscription program
"['udyog', 'manthan', 'to', 'focus', 'on', 'quality', 'productivity', 'commerce', 'ministry']",udyog manthan to focus on quality productivity commerce ministry
"['illegal', 'rohingya', 'immigrants', 'living', 'in', '12', 'states', 'uts', 'govt', 'to', 'rajya', 'sabha']",illegal rohingya immigrants living in 12 states uts govt to rajya sabha
"['why', 'do', 'so', 'many', 'dictators', 'have', 'names', 'that', 'begin', 'with', 'm', 'asks', 'rahul', 'gandhi']",why do so many dictators have names that begin with m asks rahul gandhi
"['all', 'industrial', 'units', 'in', 'delhi', 'operating', 'on', 'cleaner', 'fuels', 'dpcc']",all industrial units in delhi operating on cleaner fuels dpcc
"['zetwerk', 'gets', '120', 'million', 'in', 'series', 'd', 'funding', 'at', '600', 'million', 'valuation']",zetwerk gets 120 million in series d funding at 600 million valuation
"['in', 'the', 'past', 'development', 'was', 'a', 'far', 'cry', 'in', 'hill', 'districts', 'assam', 'chief', 'minister', 'sarbananda', 'sonowal']",in the past development was a far cry in hill districts assam chief minister sarbananda sonowal
"['snowfall', 'disrupts', 'flight', 'operations', 'in', 'kashmir']",snowfall disrupts flight operations in kashmir
"['rs', 'chairman', 'asks', '3', 'aap', 'members', 'to', 'withdraw', 'from', 'house', 'for', 'the', 'day']",rs chairman asks 3 aap members to withdraw from house for the day
"['doors', 'always', 'open', 'for', 'farmers', 'opposition', 'should', 'not', 'make', 'this', 'stir', 'into', 'another', 'shaheen', 'bagh', 'says', 'bjp', 'in', 'rajya', 'sabha']",doors always open for farmers opposition should not make this stir into another shaheen bagh says bjp in rajya sabha
"['myanmars', 'military', 'junta', 'plans', 'probe', 'of', 'last', 'years', 'election']",myanmars military junta plans probe of last years election
"['commodity', 'strategies', 'gold', 'silver', 'crude', 'base', 'metals']",commodity strategies gold silver crude base metals
