headlines,headline_text
"['rupee', 'rises', '10', 'paise', 'to', 'end', 'at', '74', '27', 'against', 'us', 'dollar', 'gilts', 'steady']",rupee rises 10 paise to end at 74 27 against us dollar gilts steady
"['this', 'is', 'why', 'the', 'festive', 'season', 'is', 'the', 'right', 'time', 'to', 'take', 'a', 'closer', 'look', 'at', 'your', 'investments']",this is why the festive season is the right time to take a closer look at your investments
"['nmdc', 'workers', 'hold', 'protest', 'against', 'nagarnar', 'steel', 'plant', 'demerger', 'govt', 'stake', 'sale']",nmdc workers hold protest against nagarnar steel plant demerger govt stake sale
"['ubs', 'revises', 'india', 'gdp', 'forecast', 'to', '9', '5', 'from', '8', '9', 'for', 'fy22']",ubs revises india gdp forecast to 9 5 from 8 9 for fy22
"['revival', 'in', 'growth', 'to', 'boost', 'demand', 'for', 'credit', 'sahil', 'kapoor']",revival in growth to boost demand for credit sahil kapoor
"['hyderpora', 'encounter', 'prohibitory', 'orders', 'imposed', 'in', 'parts', 'of', 'jks', 'ramban']",hyderpora encounter prohibitory orders imposed in parts of jks ramban
"['india', 'cannot', 'depend', 'on', 'imports', 'for', 'essential', 'goods', 'fm', 'sitharaman']",india cannot depend on imports for essential goods fm sitharaman
"['ladki', 'hoon', 'lad', 'sakti', 'hoon', 'priyanka', 'gandhi', 'vadras', '100', 'day', 'action', 'plan', 'to', 'reach', '7', 'crore', 'up', 'women', 'voters']",ladki hoon lad sakti hoon priyanka gandhi vadras 100 day action plan to reach 7 crore up women voters
"['rakesh', 'jhunjhunwalas', 'akasa', 'air', 'signs', '4', '5', 'billion', 'deal', 'with', 'engine', 'maker', 'cfm', 'international']",rakesh jhunjhunwalas akasa air signs 4 5 billion deal with engine maker cfm international
"['amazon', 'to', 'stop', 'accepting', 'visas', 'uk', 'issued', 'credit', 'cards', 'over', 'high', 'fees']",amazon to stop accepting visas uk issued credit cards over high fees
"['the', 'digital', 'crossover']",the digital crossover
"['day', 'trading', 'guide', '2', 'stock', 'recommendations', 'for', 'thursday']",day trading guide 2 stock recommendations for thursday
"['ipos', 'best', 'way', 'to', 'expand', 'capital', 'market', 'nithin', 'kamath']",ipos best way to expand capital market nithin kamath
"['ed', 'conducts', 'raids', 'against', 'supertech', 'group', 'in', 'delhi', 'ncr']",ed conducts raids against supertech group in delhi ncr
"['following', 'bheek', 'remark', 'kangana', 'ranaut', 'brings', 'up', 'gandhi', 'says', 'evidence', 'suggest', 'he', 'wanted', 'bhagat', 'singh', 'hanged']",following bheek remark kangana ranaut brings up gandhi says evidence suggest he wanted bhagat singh hanged
"['gold', 'declines', 'rs', '402', 'silver', 'tumbles', 'rs', '528']",gold declines rs 402 silver tumbles rs 528
"['vice', 'president', 'urges', 'entrepreneurs', 'govts', 'to', 'focus', 'on', 'ways', 'that', 'create', 'happiness']",vice president urges entrepreneurs govts to focus on ways that create happiness
"['disco', 'dancer', 'director', 'b', 'subhashs', 'wife', 'hospitalised', 'film', 'maker', 'seeks', 'financial', 'aid', 'for', 'her', 'treatment']",disco dancer director b subhashs wife hospitalised film maker seeks financial aid for her treatment
"['every', 'smart', 'investor', 'should', 'know', 'about', 'these', '5', 'parallels', 'between', 'cricket', 'investing']",every smart investor should know about these 5 parallels between cricket investing
"['india', 'to', 'pitch', 'for', 'permanent', 'solution', 'for', 'food', 'security', 'in', 'wto', 'meet', 'official']",india to pitch for permanent solution for food security in wto meet official
"['bureaucracy', 'has', 'developed', 'inertia', 'they', 'want', 'court', 'to', 'pass', 'orders', 'sc', 'on', 'delhi', 'pollution']",bureaucracy has developed inertia they want court to pass orders sc on delhi pollution
"['bjp', 'slams', 'kejriwal', 'for', 'advertising', 'more', 'doing', 'little', 'to', 'tackle', 'pollution']",bjp slams kejriwal for advertising more doing little to tackle pollution
"['tech', 'mahindra', 'ranked', 'top', 'it', 'leader', 'in', 'the', 'dow', 'jones', 'sustainability', 'world', 'index', '2021']",tech mahindra ranked top it leader in the dow jones sustainability world index 2021
"['congress', 'didnt', 'empower', 'people', 'in', 'last', '70', 'years', 'alleges', 'bjp', 'chief', 'j', 'p', 'nadda']",congress didnt empower people in last 70 years alleges bjp chief j p nadda
"['chandrayaan', 'performs', 'evasive', 'manoeuvre', 'to', 'avoid', 'collision', 'with', 'nasas', 'orbiter']",chandrayaan performs evasive manoeuvre to avoid collision with nasas orbiter
"['kangana', 'ranaut', 'trains', 'guns', 'at', 'comedian', 'vir', 'das', 'calls', 'his', 'two', 'indias', 'monologue', 'an', 'act', 'of', 'soft', 'terrorism']",kangana ranaut trains guns at comedian vir das calls his two indias monologue an act of soft terrorism
"['rahul', 'drops', 'to', '6th', 'kohli', 'static', 'at', '8th', 'in', 'latest', 'icc', 't20i', 'rankings']",rahul drops to 6th kohli static at 8th in latest icc t20i rankings
"['edelweiss', 'general', 'insurance', 'rolls', 'out', 'initiatives', 'to', 'support', 'flood', 'hit', 'customers']",edelweiss general insurance rolls out initiatives to support flood hit customers
"['india', 'exciting', 'on', 'a', 'multi', 'year', 'horizon', 'despite', 'short', 'term', 'volatility', 'vikas', 'pershad']",india exciting on a multi year horizon despite short term volatility vikas pershad
"['tripura', 'violence', 'sc', 'directs', 'tripura', 'police', 'not', 'to', 'take', 'any', 'coercive', 'steps', 'against', '3', 'civil', 'society', 'members']",tripura violence sc directs tripura police not to take any coercive steps against 3 civil society members
"['roller', 'coaster', 'ride', 'how', 'a', 'token', 'turned', 'rs', '1000', 'into', 'rs', '28', '54', 'crore', 'and', 'then', 'lost', '90']",roller coaster ride how a token turned rs 1000 into rs 28 54 crore and then lost 90
"['bitcoin', 'prices', 'retreat', 'for', '4th', 'day', 'whats', 'cooking']",bitcoin prices retreat for 4th day whats cooking
"['indulge', 'in', 'roman', 'luxury', 'historic', 'villa', 'aurora', 'with', 'the', 'worlds', 'only', 'caravaggio', 'mural', 'may', 'fetch', 'over', '535', 'mn', 'at', 'auction']",indulge in roman luxury historic villa aurora with the worlds only caravaggio mural may fetch over 535 mn at auction
"['commander', 'in', 'thief', 'remark', 'against', 'pm', 'rahul', 'gandhi', 'moves', 'bombay', 'hc', 'for', 'quashing', 'of', 'defamation', 'case']",commander in thief remark against pm rahul gandhi moves bombay hc for quashing of defamation case
"['lakhimpur', 'violence', 'sc', 'appoints', 'ex', 'judge', 'rakesh', 'kumar', 'jain', 'of', 'punjab', 'and', 'haryana', 'hc', 'to', 'monitor', 'sit', 'probe']",lakhimpur violence sc appoints ex judge rakesh kumar jain of punjab and haryana hc to monitor sit probe
"['delhi', 'air', 'pollution', 'schools', 'colleges', 'to', 'remain', 'shut', 'till', 'further', 'orders']",delhi air pollution schools colleges to remain shut till further orders
"['upgrad', 'leases', '1000', 'seats', 'from', 'indiqube', 'in', 'bengaluru', 'hyderabad']",upgrad leases 1000 seats from indiqube in bengaluru hyderabad
"['ubs', 'securities', 'says', 'india', 'to', 'remain', 'one', 'fastest', 'growing', 'economies', 'in', 'fy23']",ubs securities says india to remain one fastest growing economies in fy23
"['cbi', 'apprehends', '2', 'havildars', 'over', 'irregularities', 'in', 'army', 'recruitment']",cbi apprehends 2 havildars over irregularities in army recruitment
"['mahindra', 'finance', 'launches', 'lease', 'based', 'vehicle', 'subscription', 'business', 'for', 'urban', 'centres']",mahindra finance launches lease based vehicle subscription business for urban centres
"['gujarat', 'swac', 'chief', 'visits', 'naliya', 'air', 'force', 'station', 'briefed', 'about', 'security', 'scenario']",gujarat swac chief visits naliya air force station briefed about security scenario
"['post', 'pandemic', 'holistic', 'wellbeing', 'top', 'priority', 'of', 'indians']",post pandemic holistic wellbeing top priority of indians
"['lic', 'ipo', 'expected', 'to', 'hit', 'market', 'by', 'q4', 'dipam', 'secy']",lic ipo expected to hit market by q4 dipam secy
"['mirae', 'asset', 'mutual', 'fund', 'launches', 'hang', 'seng', 'tech', 'etf']",mirae asset mutual fund launches hang seng tech etf
"['money', 'mistakes', '4', 'parental', 'behaviours', 'that', 'can', 'impact', 'childs', 'decision', 'making', 'ability', 'as', 'an', 'adult']",money mistakes 4 parental behaviours that can impact childs decision making ability as an adult
"['putin', 'makes', 'statement', 'by', 'making', 'india', 'his', 'maiden', 'bilateral', 'stop', 'since', 'pandemic']",putin makes statement by making india his maiden bilateral stop since pandemic
"['mp', 'govt', 'slashes', 'vat', 'on', 'aviation', 'turbine', 'fuel', 'to', '4', 'at', 'bhopal', 'indore', 'airports']",mp govt slashes vat on aviation turbine fuel to 4 at bhopal indore airports
"['european', 'stocks', 'extend', 'gains', 'for', 'sixth', 'straight', 'day']",european stocks extend gains for sixth straight day
"['one', 'in', 'three', 'of', 'indian', 'workers', 'has', 'no', 'intention', 'of', 'returning', 'to', 'office', 'post', 'covid', 'pandemic', 'survey']",one in three of indian workers has no intention of returning to office post covid pandemic survey
"['kkr', 'backed', 'vini', 'cosmetics', 'names', 'pepsicos', 'vishal', 'kaul', 'as', 'ceo']",kkr backed vini cosmetics names pepsicos vishal kaul as ceo
"['chaos', 'in', 'bengal', 'assembly', 'over', 'reduction', 'in', 'liquor', 'prices', 'bjp', 'mlas', 'walk', 'out']",chaos in bengal assembly over reduction in liquor prices bjp mlas walk out
"['bullish', 'on', 'banks', 'find', 'out', 'what', 'analysts', 'are', 'saying', 'about', 'nifty', 'bank', 'stocks']",bullish on banks find out what analysts are saying about nifty bank stocks
"['gold', 'demand', 'fizzles', 'out', 'as', 'jewellers', 'put', 'off', 'buying', 'amid', 'rising', 'rising', 'prices']",gold demand fizzles out as jewellers put off buying amid rising rising prices
"['scaler', 'announces', 'paid', 'time', 'off', 'at', 'year', 'end', 'for', 'employees']",scaler announces paid time off at year end for employees
"['to', 'ensure', 'absolute', 'impartiality', 'sc', 'appoints', 'retired', 'hc', 'judge', 'to', 'monitor', 'probe', 'in', 'lakhimpur', 'kheri', 'case']",to ensure absolute impartiality sc appoints retired hc judge to monitor probe in lakhimpur kheri case
"['iim', 'bangalore', 'witnesses', 'record', 'summer', 'placement', 'season']",iim bangalore witnesses record summer placement season
"['satellite', 'attack', 'the', 'mounting', 'arms', 'race', 'in', 'space']",satellite attack the mounting arms race in space
"['jio', 'tops', '4g', 'chart', 'in', 'download', 'speed', 'airtel', 'vi', 'reduce', 'gap', 'in', 'oct', 'trai', 'data']",jio tops 4g chart in download speed airtel vi reduce gap in oct trai data
"['number', 'of', 'people', 'fully', 'vaccinated', 'against', 'covid', '19', 'surpasses', 'those', 'partially', 'vaccinated']",number of people fully vaccinated against covid 19 surpasses those partially vaccinated
"['maximum', 'compounding', 'will', 'still', 'be', 'in', 'private', 'sector', 'banks', 'vishal', 'goyal']",maximum compounding will still be in private sector banks vishal goyal
"['several', 'congress', 'leaders', 'in', 'jk', 'resign', 'attack', 'state', 'unit', 'chief', 'mir']",several congress leaders in jk resign attack state unit chief mir
"['open', 'to', 'investing', 'in', 'fintech', 'post', 'paytms', 'listing', 'missed', 'out', 'on', 'saas', 'deals', 'earlier', 'softbank', 'vision', 'fund']",open to investing in fintech post paytms listing missed out on saas deals earlier softbank vision fund
"['7', 'levels', 'of', 'financial', 'freedom', 'what', 'they', 'mean', 'when', 'to', 'achieve', 'which', 'level']",7 levels of financial freedom what they mean when to achieve which level
"['cbi', 'gets', 'three', 'new', 'joint', 'directors']",cbi gets three new joint directors
"['anand', 'mahindra', 'keeps', 'his', 'promise', 'sponsors', 'education', 'for', 'indias', 'young', 'iron', 'man', 'from', 'imphal']",anand mahindra keeps his promise sponsors education for indias young iron man from imphal
"['yamaha', 'launches', 'yzf', 'r15s', 'v3', 'bike', 'trim', 'at', 'rs', '1', '57', 'lakh']",yamaha launches yzf r15s v3 bike trim at rs 1 57 lakh
"['australia', 'seeks', 'to', 'establish', 'new', 'consulate', 'general', 'in', 'bengaluru', 'scott', 'morrison']",australia seeks to establish new consulate general in bengaluru scott morrison
"['cricket', 'governing', 'body', 'icc', 'forms', 'working', 'group', 'to', 'determine', 'crickets', 'afghan', 'future']",cricket governing body icc forms working group to determine crickets afghan future
"['congress', 'trying', 'to', 'divide', 'society', 'salman', 'khurshids', 'hindutva', 'isis', 'comparison', 'latest', 'example', 'purandeswari']",congress trying to divide society salman khurshids hindutva isis comparison latest example purandeswari
"['japanese', 'shares', 'end', 'lower', 'on', 'weaker', 'yen', 'rising', 'cost', 'worries']",japanese shares end lower on weaker yen rising cost worries
"['china', 'stocks', 'close', 'up', 'as', 'new', 'energy', 'shares', 'boost']",china stocks close up as new energy shares boost
"['australian', 'shares', 'end', 'lower', 'as', 'cba', 'leads', 'banks', 'selloff']",australian shares end lower as cba leads banks selloff
"['tata', 'motors', 'pact', 'with', 'private', 'equity', 'firm', 'tpg', 'credit', 'positive', 'moodys']",tata motors pact with private equity firm tpg credit positive moodys
"['ganguly', 'replaces', 'kumble', 'as', 'icc', 'crickets', 'committee', 'chairman']",ganguly replaces kumble as icc crickets committee chairman
"['salarybox', 'gets', '4', 'million', 'in', 'seed', 'funding', 'from', 'y', 'combinator', 'others']",salarybox gets 4 million in seed funding from y combinator others
"['grants', 'non', 'philanthropic', 'donations', 'received', 'by', 'charitable', 'trusts', 'to', 'attract', '18', 'pc', 'gst', 'aar']",grants non philanthropic donations received by charitable trusts to attract 18 pc gst aar
"['will', 'gasoline', 'prices', 'drop', 'in', '2022', 'it', 'depends', 'on', 'opec', 'and', 'us', 'shale']",will gasoline prices drop in 2022 it depends on opec and us shale
"['guess', 'to', 'open', '50', 'stores', 'touch', 'revenue', 'mark', 'of', 'rs', '300', 'crore', 'in', 'five', 'years']",guess to open 50 stores touch revenue mark of rs 300 crore in five years
"['will', 'paytm', 'defy', 'startup', 'listing', 'trend', 'heres', 'what', 'grey', 'market', 'is', 'signaling']",will paytm defy startup listing trend heres what grey market is signaling
"['elon', 'musk', 'exercises', 'more', 'options', 'sells', 'tesla', 'shares', 'worth', '973', 'million']",elon musk exercises more options sells tesla shares worth 973 million
"['small', 'medium', 'hospitals', 'urge', 'centre', 'to', 'allow', 'booster', 'doses', 'for', 'the', 'eligible']",small medium hospitals urge centre to allow booster doses for the eligible
"['gdp', 'likely', 'to', 'grow', 'at', '10', 'pc', 'in', 'fy22', 'says', 'bibek', 'debroy']",gdp likely to grow at 10 pc in fy22 says bibek debroy
"['uae', 'free', 'trade', 'talks', 'with', 'india', 'and', 'indonesia', 'going', 'well', 'minister', 'says']",uae free trade talks with india and indonesia going well minister says
"['buy', 'nesco', 'target', 'price', 'rs', '770', 'icici', 'direct']",buy nesco target price rs 770 icici direct
"['bjp', 'may', 'retain', 'uttar', 'pradesh', 'with', '240', 'of', '403', 'seats', 'shows', 'survey']",bjp may retain uttar pradesh with 240 of 403 seats shows survey
"['hold', 'ipca', 'laboratories', 'target', 'price', 'rs', '2240', 'emkay', 'global']",hold ipca laboratories target price rs 2240 emkay global
"['how', 'covid', '19', 'became', 'a', 'boon', 'for', 'a', 'battered', 'indian', 'hospital']",how covid 19 became a boon for a battered indian hospital
"['buy', 'bharat', 'forge', 'target', 'price', 'rs', '950', 'emkay', 'global']",buy bharat forge target price rs 950 emkay global
"['state', 'of', 'play', 'of', 'indias', 'healthcare', 'sector', 'exposed', 'by', 'covid']",state of play of indias healthcare sector exposed by covid
"['mensa', 'trying', 'to', 'be', 'a', 'global', 'tech', 'led', 'house', 'of', 'brands', 'says', 'founder', 'of', 'indias', 'fastest', 'unicorn']",mensa trying to be a global tech led house of brands says founder of indias fastest unicorn
"['buy', 'lumax', 'industries', 'target', 'price', 'rs', '1600', 'axis', 'securities']",buy lumax industries target price rs 1600 axis securities
"['rupee', 'falls', '13', 'paise', 'in', 'early', 'trade', 'as', 'us', 'dollar', 'strengths']",rupee falls 13 paise in early trade as us dollar strengths
"['expect', 'upside', 'in', 'maruti', 'motherson', 'sumi', 'zomato', 'nykaa', 'top', 'picks', 'among', 'new', 'age', 'cos', 'hemang', 'jani']",expect upside in maruti motherson sumi zomato nykaa top picks among new age cos hemang jani
"['chuck', 'schumer', 'push', 'to', 'add', 'china', 'tech', 'bill', 'to', 'us', 'defense', 'bill', 'faces', 'hurdles']",chuck schumer push to add china tech bill to us defense bill faces hurdles
"['cred', 'founder', 'promoted', 'firm', 'acquires', 'non', 'bank']",cred founder promoted firm acquires non bank
"['pm', 'modi', 'to', 'inaugurate', 'memorial', 'in', 'birsa', 'mundas', 'honour']",pm modi to inaugurate memorial in birsa mundas honour
"['tv', 'today', 'jumps', '6', 'as', 'sunil', 'singhanias', 'pms', 'abakkus', 'buys', '8', 'lakh', 'shares']",tv today jumps 6 as sunil singhanias pms abakkus buys 8 lakh shares
"['delhi', 'ncr', 'air', 'pollution', 'not', 'in', 'favour', 'of', 'work', 'from', 'home', 'employees', 'advised', 'to', 'carpool', 'centre', 'informs', 'sc']",delhi ncr air pollution not in favour of work from home employees advised to carpool centre informs sc
"['volkswagen', 'powers', 'up', 'the', 'grid', 'to', 'take', 'on', 'tesla']",volkswagen powers up the grid to take on tesla
"['mutual', 'funds', 'for', 'maximum', 'returns']",mutual funds for maximum returns
"['perus', 'central', 'bank', 'joins', 'global', 'push', 'to', 'develop', 'a', 'digital', 'currency']",perus central bank joins global push to develop a digital currency
"['vodafone', 'idea', 'in', 'talks', 'to', 'raise', 'debt', 'equity', 'funds', 'by', 'fy22', 'end']",vodafone idea in talks to raise debt equity funds by fy22 end
"['what', 'are', 'systematic', 'withdrawal', 'plans', 'or', 'swps']",what are systematic withdrawal plans or swps
"['multibagger', 'tracker', 'after', 'an', '8x', 'rally', 'can', 'this', 'smallcap', 'double', 'your', 'money']",multibagger tracker after an 8x rally can this smallcap double your money
"['delhi', 'pollution', 'gopal', 'rai', 'to', 'chair', 'meeting', 'of', 'depts', 'concerned', 'over', 'caqms', 'latest', 'directions']",delhi pollution gopal rai to chair meeting of depts concerned over caqms latest directions
"['will', 'continue', 'to', 'take', 'firm', 'decisive', 'steps', 'against', 'cross', 'border', 'terrorism', 'indias', 'swipe', 'at', 'pakistan', 'during', 'unsc', 'meet']",will continue to take firm decisive steps against cross border terrorism indias swipe at pakistan during unsc meet
"['teslas', 'elon', 'musk', 'exercises', 'more', 'options', 'sells', '973', 'million', 'for', 'taxes']",teslas elon musk exercises more options sells 973 million for taxes
"['buy', 'eih', 'target', 'price', 'rs', '180', 'icici', 'direct']",buy eih target price rs 180 icici direct
"['container', 'shipping', 'rates', 'may', 'take', 'two', 'years', 'to', 'fall', 'to', 'normal']",container shipping rates may take two years to fall to normal
"['largecap', 'stocks', 'that', 'can', 'rally', 'up', 'to', '45', 'in', 'next', '12', 'months']",largecap stocks that can rally up to 45 in next 12 months
"['indigo', 'weighs', 'charging', 'fliers', 'for', 'checked', 'bags', 'as', 'market', 'heats', 'up']",indigo weighs charging fliers for checked bags as market heats up
"['google', 'cloud', 'snap', 'spotify', 'back', 'up', 'after', 'brief', 'outage']",google cloud snap spotify back up after brief outage
"['why', 'investors', 'should', 'invest', 'in', 'equities', 'or', 'mutual', 'funds']",why investors should invest in equities or mutual funds
"['sbi', 'u', 'gro', 'capital', 'to', 'disburse', 'up', 'to', 'rs', '500', 'cr', 'to', 'msmes', 'by', 'march', '22', 'as', 'co', 'lenders']",sbi u gro capital to disburse up to rs 500 cr to msmes by march 22 as co lenders
"['miramax', 'is', 'suing', 'film', 'maker', 'quentin', 'tarantino', 'over', 'planned', 'pulp', 'fiction', 'nfts']",miramax is suing film maker quentin tarantino over planned pulp fiction nfts
"['sensex', 'sheds', '170', 'points', 'as', 'selling', 'continues', 'key', 'factors', 'behind', 'fall']",sensex sheds 170 points as selling continues key factors behind fall
"['buy', 'ador', 'welding', 'target', 'price', 'rs', '945', 'icici', 'direct']",buy ador welding target price rs 945 icici direct
"['spicejet', 'boeing', 'settle', '737', 'max', 'related', 'claims']",spicejet boeing settle 737 max related claims
"['gold', 'rate', 'today', 'yellow', 'metal', 'tops', 'rs', '49000', 'silver', 'gains', 'rs', '180']",gold rate today yellow metal tops rs 49000 silver gains rs 180
"['qualcomm', 'forecasts', 'post', 'apple', 'sales', 'growth', 'shares', 'rise']",qualcomm forecasts post apple sales growth shares rise
"['12', 'new', 'fund', 'offers', 'open', 'for', 'subscription']",12 new fund offers open for subscription
"['honda', 'motorcycle', 'scooter', 'india', 'to', 'take', 'on', 'royal', 'enfield']",honda motorcycle scooter india to take on royal enfield
"['tourism', 'finance', 'corp', 'jumps', '4', 'as', 'firm', 'to', 'consider', 'issuance', 'on', 'ncds']",tourism finance corp jumps 4 as firm to consider issuance on ncds
"['buy', 'ahluwalia', 'contracts', 'india', 'target', 'price', 'rs', '519', 'hdfc', 'securities']",buy ahluwalia contracts india target price rs 519 hdfc securities
"['etf', 'digital', 'gold', 'mutual', 'funds', 'where', 'to', 'invest', 'to', 'save', 'rs', '25', 'lakh', 'for', 'daughters', 'wedding']",etf digital gold mutual funds where to invest to save rs 25 lakh for daughters wedding
"['top', 'cryptocurrency', 'prices', 'today', 'binance', 'coin', 'solana', 'dogecoin', 'shed', 'up', 'to', '6']",top cryptocurrency prices today binance coin solana dogecoin shed up to 6
"['go', 'fashion', 'ipo', 'kicks', 'off', 'today', 'what', 'hats', 'are', 'the', 'brokerages', 'wearing']",go fashion ipo kicks off today what hats are the brokerages wearing
"['no', 'profit', 'pressure', 'says', 'policybazaar', 'founder', 'crypto', 'firms', 'meet', 'govt', 'panel']",no profit pressure says policybazaar founder crypto firms meet govt panel
"['reduce', 'jk', 'cement', 'target', 'price', 'rs', '3210', 'hdfc', 'securities']",reduce jk cement target price rs 3210 hdfc securities
"['bombay', 'hc', 'transfers', 'special', 'judge', 'hearing', 'ed', 'case', 'against', 'anil', 'deshmukh', 'to', 'yavatmal', 'district']",bombay hc transfers special judge hearing ed case against anil deshmukh to yavatmal district
"['home', 'first', 'finance', 'gains', 'nearly', '4', 'on', 'plans', 'to', 'raise', 'rs', '99', 'crore']",home first finance gains nearly 4 on plans to raise rs 99 crore
"['hold', 'berger', 'paints', 'india', 'target', 'price', 'rs', '845', 'icici', 'direct']",hold berger paints india target price rs 845 icici direct
"['india', 'logs', '10197', 'new', 'covid', '19', 'cases', 'recovery', 'rate', 'at', '98', '28', 'pc']",india logs 10197 new covid 19 cases recovery rate at 98 28 pc
"['after', 'doubling', 'over', 'issue', 'price', 'nykaa', 'shares', 'may', 'rally', 'another', '25', 'ubs']",after doubling over issue price nykaa shares may rally another 25 ubs
"['pakistan', 'invites', 'taliban', 'for', 'ministerial', 'meet', 'of', 'afghanistans', 'neighbours']",pakistan invites taliban for ministerial meet of afghanistans neighbours
"['reliance', 'general', 'insurances', 'refusal', 'to', 'pay', 'crop', 'claims', 'can', 'become', 'a', 'law', 'order', 'issue', 'maharashtra', 'tells', 'centre']",reliance general insurances refusal to pay crop claims can become a law order issue maharashtra tells centre
"['puneeth', 'rajkumar', 'to', 'be', 'honoured', 'with', 'karnataka', 'ratna', 'posthumously', 'cm', 'basavaraj', 'bommai', 'announces']",puneeth rajkumar to be honoured with karnataka ratna posthumously cm basavaraj bommai announces
"['unnao', '4th', 'up', 'district', 'to', 'report', 'zika', 'virus', 'case']",unnao 4th up district to report zika virus case
"['schools', 'colleges', 'in', 'ncr', 'to', 'remain', 'closed', 'till', 'further', 'orders', 'caqm']",schools colleges in ncr to remain closed till further orders caqm
"['surprised', 'how', 'well', 'realty', 'is', 'doing', 'play', 'ev', 'theme', 'via', 'ancillaries', 'in', 'auto', 'jinesh', 'gopani']",surprised how well realty is doing play ev theme via ancillaries in auto jinesh gopani
"['buy', 'g', 'r', 'infraprojects', 'target', 'price', 'rs', '2372', 'hdfc', 'securities']",buy g r infraprojects target price rs 2372 hdfc securities
"['axis', 'mutual', 'fund', 'eyes', 'rs', '5000', 'crore', 'from', 'new', 'multi', 'cap', 'fund']",axis mutual fund eyes rs 5000 crore from new multi cap fund
"['sebi', 'extends', 'deadline', 'for', 'comments', 'on', 'disclosure', 'norms', 'for', 'mutual', 'fund', 'schemes', 'with', 'esg', 'theme']",sebi extends deadline for comments on disclosure norms for mutual fund schemes with esg theme
"['covid', 'gains', '3', 'sellers', 'on', 'amazon', 'log', '38', 'increase', 'in', 'fy21', 'sales']",covid gains 3 sellers on amazon log 38 increase in fy21 sales
