headlines,headline_text
"['4', 'reasons', 'why', 'treating', 'real', 'estate', 'as', 'an', 'investment', 'is', 'wrong']",4 reasons why treating real estate as an investment is wrong
"['as', 'port', 'of', 'los', 'angeles', 'import', 'backups', 'ease', 'empty', 'containers', 'pile', 'up']",as port of los angeles import backups ease empty containers pile up
"['dear', 'investors', 'it', 'might', 'be', 'time', 'to', 'curb', 'your', 'enthusiasm']",dear investors it might be time to curb your enthusiasm
"['indias', 'digital', 'transformation', 'in', 'pandemic', 'akin', 'to', 'mobile', 'revolution', 'ibms', 'arvind', 'krishna']",indias digital transformation in pandemic akin to mobile revolution ibms arvind krishna
"['best', 'balanced', 'advantage', 'funds', 'or', 'dynamic', 'asset', 'allocation', 'funds', 'to', 'invest', 'in', '2021']",best balanced advantage funds or dynamic asset allocation funds to invest in 2021
"['objections', 'of', 'naysayers', 'of', 'reform', 'remain', 'frozen', 'in', 'time', 'india', 'at', 'un']",objections of naysayers of reform remain frozen in time india at un
"['motorbike', 'borne', 'men', 'snatch', 'salma', 'aghas', 'handbag', 'veteran', 'actress', 'alleges', 'delay', 'in', 'fir', 'filing']",motorbike borne men snatch salma aghas handbag veteran actress alleges delay in fir filing
"['gtc', 'seeks', 'to', 'intervene', 'in', 'dri', 'case', 'against', 'exporter', 'golden', 'tobie']",gtc seeks to intervene in dri case against exporter golden tobie
"['delhi', 'air', 'quality', 'remains', 'in', 'very', 'poor', 'category', 'aqi', 'at', '379']",delhi air quality remains in very poor category aqi at 379
"['first', 'india', 'russia', '22', 'talks', 'to', 'bolster', 'modi', 'putin', 'summit']",first india russia 22 talks to bolster modi putin summit
"['buy', 'tata', 'motors', 'target', 'price', 'rs', '555', 'edelweiss']",buy tata motors target price rs 555 edelweiss
"['4', 'auto', 'and', 'bank', 'stocks', 'to', 'bet', 'on', 'now', 'sudip', 'bandyopadhyay']",4 auto and bank stocks to bet on now sudip bandyopadhyay
"['buy', 'larsen', 'amp', 'toubro', 'infotech', 'target', 'price', 'rs', '7800', 'edelweiss']",buy larsen amp toubro infotech target price rs 7800 edelweiss
"['use', 'core', 'satellite', 'strategy', 'to', 'invest', 'in', 'global', 'equity', 'mfs']",use core satellite strategy to invest in global equity mfs
"['iits', 'get', 'record', 'pre', 'placement', 'offers', 'for', 'class', 'of', '2022']",iits get record pre placement offers for class of 2022
"['auto', 'stocks', 'may', 'soon', 'stage', 'a', 'turnaround', 'heres', 'why']",auto stocks may soon stage a turnaround heres why
"['premji', 'invest', 'picks', 'up', 'a', 'stake', 'in', 'tanla', 'platforms']",premji invest picks up a stake in tanla platforms
"['twitter', 'redesigns', 'warning', 'labels', 'to', 'identify', 'misinformation', 'fake', 'news', 'easily']",twitter redesigns warning labels to identify misinformation fake news easily
"['watch', 'the', 'ball', 'drop', 'at', 'nys', 'times', 'square', 'on', 'new', 'years', 'eve', 'but', 'dont', 'forget', 'to', 'carry', 'your', 'vax', 'proof']",watch the ball drop at nys times square on new years eve but dont forget to carry your vax proof
"['san', 'diego', 'zoos', 'smiling', 'hippo', 'otis', 'dies', 'at', 'age', '45']",san diego zoos smiling hippo otis dies at age 45
"['cipla', 'launches', 'portable', 'spirometer', 'to', 'diagnose', 'copd', 'diseases']",cipla launches portable spirometer to diagnose copd diseases
"['reduce', 'computer', 'age', 'management', 'services', 'target', 'price', 'rs', '2555', 'hdfc', 'securities']",reduce computer age management services target price rs 2555 hdfc securities
"['buy', 'techno', 'electric', 'amp', 'engineering', 'company', 'target', 'price', 'rs', '332', 'icici', 'securities']",buy techno electric amp engineering company target price rs 332 icici securities
"['xmas', 'orders', 'are', 'pouring', 'in', 'but', 'indian', 'exporters', 'cant', 'find', 'a', 'ship']",xmas orders are pouring in but indian exporters cant find a ship
"['gold', 'prices', 'muted', 'as', 'dollar', 'strength', 'weighs']",gold prices muted as dollar strength weighs
"['sebi', 'proposes', 'cap', 'on', 'startup', 'ipo', 'proceeds', 'for', 'ma']",sebi proposes cap on startup ipo proceeds for ma
"['ongc', 'told', 'to', 'mark', 'areas', 'for', 'privatisation']",ongc told to mark areas for privatisation
"['buy', 'hindustan', 'zinc', 'target', 'price', 'rs', '340', 'yes', 'securities']",buy hindustan zinc target price rs 340 yes securities
"['kartarpur', 'sahib', 'corridor', 'will', 'reopen', 'from', 'today']",kartarpur sahib corridor will reopen from today
"['odisha', 'aims', 'to', 'jab', '90', 'eligible', 'people', 'with', '1st', 'dose', 'by', 'november', '30']",odisha aims to jab 90 eligible people with 1st dose by november 30
"['sgx', 'nifty', 'down', '60', 'points', 'heres', 'what', 'changed', 'for', 'market', 'while', 'you', 'were', 'sleeping']",sgx nifty down 60 points heres what changed for market while you were sleeping
"['naomi', 'osaka', 'shock', 'adds', 'to', 'growing', 'calls', 'over', 'fate', 'of', 'peng', 'shuai', 'who', 'alleged', 'sexual', 'assault', 'by', 'a', 'chinese', 'politician']",naomi osaka shock adds to growing calls over fate of peng shuai who alleged sexual assault by a chinese politician
"['meet', 'selina', 'steinfeld', 'the', '86', 'year', 'old', 'woman', 'named', 'israels', 'miss', 'holocaust', 'survivor']",meet selina steinfeld the 86 year old woman named israels miss holocaust survivor
"['stocks', 'in', 'the', 'news', 'power', 'grid', 'pvr', 'kotak', 'bank', 'coforge', 'and', 'iob']",stocks in the news power grid pvr kotak bank coforge and iob
"['china', 'us', 'to', 'ease', 'restrictions', 'on', 'each', 'others', 'media', 'workers']",china us to ease restrictions on each others media workers
"['rate', 'bets', 'rule', 'currency', 'markets', 'as', 'dollar', 'shines', 'euro', 'aussie', 'sag']",rate bets rule currency markets as dollar shines euro aussie sag
"['us', 'journalist', 'jailed', 'in', 'myanmar', 'for', 'months', 'heads', 'home']",us journalist jailed in myanmar for months heads home
"['dollar', 'stands', 'tall', 'after', 'firm', 'us', 'data', 'asian', 'stocks', 'wobble']",dollar stands tall after firm us data asian stocks wobble
"['nclt', 'mumbai', 'adjourns', 'invesco', 'case', 'against', 'zee', 'till', 'december', '14']",nclt mumbai adjourns invesco case against zee till december 14
"['wall', 'street', 'opens', 'lower', 'as', 'nvidia', 'weighs']",wall street opens lower as nvidia weighs
"['china', 'engaged', 'in', 'border', 'war', 'with', 'india', 'us', 'senator', 'john', 'cornyn']",china engaged in border war with india us senator john cornyn
"['oil', 'falls', 'as', 'us', 'gasoline', 'stock', 'draw', 'raises', 'prospect', 'of', 'spr', 'release']",oil falls as us gasoline stock draw raises prospect of spr release
"['tripura', 'reduces', 'vat', 'on', 'aviation', 'turbine', 'fuel', 'from', '16', 'per', 'cent', 'to', '1', 'per', 'cent']",tripura reduces vat on aviation turbine fuel from 16 per cent to 1 per cent
"['sebi', 'mulls', 'market', 'making', 'mechanism', 'for', 'corporate', 'bonds']",sebi mulls market making mechanism for corporate bonds
"['aggregate', 'npa', 'provisioning', 'by', 'banks', 'falls', 'in', 'q2', 'as', 'collections', 'improve']",aggregate npa provisioning by banks falls in q2 as collections improve
"['customs', 'writes', 'to', 'adani', 'ports', 'sez', 'on', 'banning', 'exim', 'cargo', 'from', 'pakistan', 'iran', 'and', 'afghanistan']",customs writes to adani ports sez on banning exim cargo from pakistan iran and afghanistan
"['air', 'travel', 'may', 'maintain', 'diwali', 'heights', 'indigo', 'ceo']",air travel may maintain diwali heights indigo ceo
"['panacea', 'arm', 'defaults', 'lenders', 'may', 'extend', 'repayment', 'date']",panacea arm defaults lenders may extend repayment date
"['high', 'flying', 'business']",high flying business
"['a', 'protective', 'shield']",a protective shield
"['fpis', 'join', 'ipo', 'rush', 'invest', 'rs', '46000', 'crore', 'in', '2021']",fpis join ipo rush invest rs 46000 crore in 2021
"['crypto', 'may', 'be', 'allowed', 'as', 'asset', 'not', 'as', 'currency', 'legislation', 'being', 'finalised']",crypto may be allowed as asset not as currency legislation being finalised
"['maruti', 'clocks', 'best', 'one', 'day', 'jump', 'in', '19', 'months', 'analysts', 'see', 'more', 'upside']",maruti clocks best one day jump in 19 months analysts see more upside
"['wto', 'may', 'propose', 'new', 'agriculture', 'package']",wto may propose new agriculture package
"['india', 'list', 'its', 'priorities', 'to', 'bidens', 'new', 'afghan', 'envoy']",india list its priorities to bidens new afghan envoy
"['real', 'capex', 'will', 'revive', 'in', '9', '12', 'months', 'says', 'axis', 'bank', 'ceo', 'amitabh', 'chaudhry']",real capex will revive in 9 12 months says axis bank ceo amitabh chaudhry
"['go', 'fashion', 'ipo', 'an', 'expensive', 'bet', 'on', 'the', 'apparel', 'sector']",go fashion ipo an expensive bet on the apparel sector
"['rbi', 'taps', 'sebi', 'to', 'push', 'for', 'open', 'offer', 'exemption', 'for', 'arc', 'deals']",rbi taps sebi to push for open offer exemption for arc deals
"['india', 'swings', 'into', 'action', 'to', 'climb', 'up', 'global', 'hunger', 'index']",india swings into action to climb up global hunger index
"['velocity', 'in', 'bags', '20', 'million', 'in', 'funding', 'led', 'by', 'peter', 'thiels', 'valar', 'ventures']",velocity in bags 20 million in funding led by peter thiels valar ventures
"['price', 'arbitrage', 'a', 'new', 'worry', 'as', 'several', 'crypto', 'platforms', 'crop', 'up']",price arbitrage a new worry as several crypto platforms crop up
"['pmo', 'to', 'step', 'in', 'for', 'consensus', 'on', 'ecommerce', 'rules']",pmo to step in for consensus on ecommerce rules
"['wazirx', 'bitbns', 'hit', 'pause', 'on', 'crypto', 'ads']",wazirx bitbns hit pause on crypto ads
"['sebi', 'proposes', 'new', 'rules', 'for', 'startup', 'ipos', 'softbank', 'eyes', 'indian', 'fintech']",sebi proposes new rules for startup ipos softbank eyes indian fintech
"['air', 'pollution', 'construction', 'workers', 'move', 'sc', 'seeking', 'ex', 'gratia', 'for', 'daily', 'wagers']",air pollution construction workers move sc seeking ex gratia for daily wagers
"['cbi', 'autonomous', 'body', 'centre', 'not', 'filing', 'cases', 'in', 'bengal', 'sc', 'told']",cbi autonomous body centre not filing cases in bengal sc told
"['jk', 'encounter', 'controversy', 'killed', 'businessmen', 'were', 'used', 'as', 'human', 'shields', 'claims', 'family']",jk encounter controversy killed businessmen were used as human shields claims family
"['overall', 'development', 'now', 'not', 'just', 'in', 'pockets', 'pm', 'narendra', 'modi']",overall development now not just in pockets pm narendra modi
"['allahabad', 'hc', 'lack', 'of', 'coordination', 'causing', 'confusion', 'on', 'ganga', 'pollution']",allahabad hc lack of coordination causing confusion on ganga pollution
"['gokwik', 'raises', '15', 'milion', 'series', 'a', 'from', 'sequoia', 'matrix']",gokwik raises 15 milion series a from sequoia matrix
"['indias', 'akasa', 'air', 'orders', '72', 'boeing', '737', 'max', 'jets']",indias akasa air orders 72 boeing 737 max jets
"['bengal', 'assembly', 'votes', 'for', 'withdrawal', 'of', 'bsfs', '50km', 'order', 'by', 'centre']",bengal assembly votes for withdrawal of bsfs 50km order by centre
"['the', 'stakes', 'are', 'high', 'between', 'jeff', 'bezos', 'and', 'mukesh', 'ambani', 'in', 'their', 'fight', 'over', 'a', 'near', 'bankrupt', 'company']",the stakes are high between jeff bezos and mukesh ambani in their fight over a near bankrupt company
"['top', 'aluminium', 'and', 'steelmakers', 'witness', 'a', 'rise', 'in', 'thermal', 'coal', 'stock', 'secondary', 'players', 'still', 'under', 'pressure']",top aluminium and steelmakers witness a rise in thermal coal stock secondary players still under pressure
"['paycraft', 'accelerates', 'growth', 'forays', 'into', 'mena', 'region']",paycraft accelerates growth forays into mena region
"['afghan', 'territory', 'must', 'not', 'become', 'source', 'of', 'terrorism', 'india', 'france']",afghan territory must not become source of terrorism india france
"['accenture', 'and', 'microsoft', 'to', 'support', '10', 'social', 'startups', 'in', 'india']",accenture and microsoft to support 10 social startups in india
"['family', 'of', 'non', 'resident', 'keralites', 'who', 'died', 'abroad', 'due', 'to', 'covid', '19', 'eligible', 'for', 'rs', '50k', 'ex', 'gratia', 'hc', 'asks', 'state', 'govt']",family of non resident keralites who died abroad due to covid 19 eligible for rs 50k ex gratia hc asks state govt
"['intellismart', 'bags', 'rs', '500', 'cr', 'order', 'from', 'assam', 'govt', 'to', 'install', '6', 'lakh', 'smart', 'meters']",intellismart bags rs 500 cr order from assam govt to install 6 lakh smart meters
"['srinagar', 'records', 'coldest', 'night', 'of', 'season', 'at', 'minus', '1', '5', 'degrees', 'celsius']",srinagar records coldest night of season at minus 1 5 degrees celsius
"['delhi', 'to', 'get', 'new', 'swanky', 'private', 'liquor', 'shops', 'from', 'today', 'all', 'the', 'details']",delhi to get new swanky private liquor shops from today all the details
"['stark', 'collaboration', 'between', 'political', 'class', 'bureaucracy', 'and', 'others', 'during', 'riots', 'zakia', 'to', 'sc']",stark collaboration between political class bureaucracy and others during riots zakia to sc
"['ets', 'expands', 'presence', 'in', 'india', 'mohammad', 'kousha', 'avp', 'global', 'growth']",ets expands presence in india mohammad kousha avp global growth
"['binance', 'ceo', 'on', 'bubbles', 'meme', 'coins', 'and', 'cryptos', 'swings']",binance ceo on bubbles meme coins and cryptos swings
"['india', 'resumes', 'covid', '19', 'vaccine', 'exports', 'shortage', 'fears', 'remain']",india resumes covid 19 vaccine exports shortage fears remain
"['amid', 'cryptos', 'wild', 'west', 'binance', 'says', 'a', 'sheriff', 'is', 'needed']",amid cryptos wild west binance says a sheriff is needed
"['which', 'startup', 'could', 'be', 'a', 'wealth', 'creator', 'like', 'hdfc', 'bank', 'or', 'bajaj', 'finance', 'atul', 'suri', 'explains']",which startup could be a wealth creator like hdfc bank or bajaj finance atul suri explains
"['cordelia', 'search', 'was', 'managed', 'to', 'selectively', 'trap', 'people', 'nawab', 'malik']",cordelia search was managed to selectively trap people nawab malik
