headlines,headline_text
"['view', 'budget', 'puts', 'plan', 'afoot', 'but', 'can', 'india', 'deliver', 'gopichand', 'p', 'hinduja', 'weighs', 'in']",view budget puts plan afoot but can india deliver gopichand p hinduja weighs in
"['prudence', 'doesnt', 'mean', 'stinginess', 'or', 'frugality']",prudence doesnt mean stinginess or frugality
"['india', 'becomes', 'largest', 'ipv6', 'subscriber', 'seeks', 'self', 'reliance', 'in', 'internet', 'domain']",india becomes largest ipv6 subscriber seeks self reliance in internet domain
"['india', 'equipped', 'to', 'resolve', 'crisis', 'amicably', 'lata', 'mangeshkar', 'on', 'global', 'support', 'for', 'farmers', 'protests']",india equipped to resolve crisis amicably lata mangeshkar on global support for farmers protests
"['govt', 'may', 'allow', 'private', 'air', 'traffic', 'controllers', 'to', 'manage', 'drones', 'in', 'lower', 'airspace']",govt may allow private air traffic controllers to manage drones in lower airspace
"['indias', 'farmers', 'in', 'global', 'spotlight', 'ministers', 'bollywood', 'biggies', 'vs', 'rihanna', 'thunberg', 'and', 'other', 'celebs']",indias farmers in global spotlight ministers bollywood biggies vs rihanna thunberg and other celebs
"['govt', 'places', 'second', 'purchase', 'order', 'with', 'sii', 'for', '1', 'crore', 'doses', 'of', 'covishield']",govt places second purchase order with sii for 1 crore doses of covishield
"['opposition', 'demands', 'rollback', 'of', 'farm', 'laws', 'during', 'presidents', 'address', 'debate', 'in', 'rs']",opposition demands rollback of farm laws during presidents address debate in rs
"['peace', 'bid', 'fails', 'in', 'lok', 'sabha', 'as', 'opposition', 'hardens', 'debate', 'stand']",peace bid fails in lok sabha as opposition hardens debate stand
"['indian', 'steel', 'mills', 'hike', 'prices', 'despite', 'customs', 'duty', 'cut']",indian steel mills hike prices despite customs duty cut
"['view', 'to', 'manage', 'growth', 'induced', 'friction', 'we', 'need', 'cooperation', 'threatened', 'by', 'anger']",view to manage growth induced friction we need cooperation threatened by anger
"['supreme', 'court', 'refuses', 'to', 'entertain', 'pleas', 'on', 'republic', 'day', 'tractor', 'rally', 'violence']",supreme court refuses to entertain pleas on republic day tractor rally violence
"['reddit', 'trading', 'frenzy', 'fades', 'as', 'yellen', 'summons', 'agencies']",reddit trading frenzy fades as yellen summons agencies
"['quick', 'heal', 'technologies', 'q3', 'results', 'net', 'profit', 'falls', '24', 'to', 'rs', '13', 'cr']",quick heal technologies q3 results net profit falls 24 to rs 13 cr
"['passenger', 'traffic', 'at', 'airports', 'in', 'tier', '2', '3', 'cities', 'higher', 'than', 'pre', 'covid', 'levels', 'iata']",passenger traffic at airports in tier 2 3 cities higher than pre covid levels iata
"['bmc', 'unveils', 'rs', '39038', 'crore', 'budget', 'keeps', 'tax', 'structure', 'unchanged']",bmc unveils rs 39038 crore budget keeps tax structure unchanged
"['rahul', 'gandhi', 'conspires', 'with', 'anti', 'india', 'elements', 'during', 'his', 'visits', 'abroad', 'bjp']",rahul gandhi conspires with anti india elements during his visits abroad bjp
"['15th', 'finance', 'commission', 'has', 'given', 'rs', '14000', 'crore', 'himanta', 'biswa', 'sarma']",15th finance commission has given rs 14000 crore himanta biswa sarma
"['indias', 'reputation', 'has', 'taken', 'massive', 'hit', 'rahul', 'gandhi', 'on', 'farmers', 'protest']",indias reputation has taken massive hit rahul gandhi on farmers protest
"['dot', 'accepts', 'telcos', 'plea', 'to', 'accept', 'bank', 'guarantees', 'valid', 'for', '1', 'year']",dot accepts telcos plea to accept bank guarantees valid for 1 year
"['construction', 'of', 'jorhat', 'majuli', 'would', 'start', 'by', 'february', '20', 'assam', 'cm', 'sarbananda', 'sonowal']",construction of jorhat majuli would start by february 20 assam cm sarbananda sonowal
"['bjp', 'president', 'nadda', 'slams', 'ldf', 'udf', 'says', 'both', 'are', 'two', 'sides', 'of', 'the', 'same', 'coin']",bjp president nadda slams ldf udf says both are two sides of the same coin
"['silver', 'claws', 'back', 'as', 'market', 'looks', 'past', 'retail', 'swings']",silver claws back as market looks past retail swings
"['unsc', 'india', 'harps', 'on', 'constructive', 'approach', 'rather', 'than', 'confrontational', 'on', 'myanmar']",unsc india harps on constructive approach rather than confrontational on myanmar
"['indian', 'railways', 'to', 'complete', '56', 'key', 'railway', 'projects', 'by', 'fy', '22', 'to', 'be', 'future', 'ready']",indian railways to complete 56 key railway projects by fy 22 to be future ready
"['expansion', 'of', 'hdfc', 'margins', 'unlikely', 'in', 'q4', 'keki', 'mistry']",expansion of hdfc margins unlikely in q4 keki mistry
"['flipkart', 'wholesale', 'adds', 'grocery', 'to', 'cart']",flipkart wholesale adds grocery to cart
"['parliamentary', 'panel', 'raises', 'concerns', 'over', 'creating', 'national', 'dna', 'database', 'as', 'proposed', 'under', 'new', 'bill']",parliamentary panel raises concerns over creating national dna database as proposed under new bill
"['treasurys', 'yellen', 'calls', 'top', 'regulator', 'meeting', 'on', 'gamestop', 'volatility', 'consults', 'ethics', 'lawyer']",treasurys yellen calls top regulator meeting on gamestop volatility consults ethics lawyer
"['india', 'tells', 'lanka', 'to', 'honour', 'colombo', 'port', 'deal', 'takes', 'up', 'killing', 'of', 'tamil', 'fishermen']",india tells lanka to honour colombo port deal takes up killing of tamil fishermen
"['hedge', 'funds', 'hunt', 'frothy', 'names', 'to', 'short', 'even', 'after', 'gamestop']",hedge funds hunt frothy names to short even after gamestop
"['rbi', 'imposes', 'rs', '55', 'lakh', 'penalty', 'on', 'pune', 'based', 'seva', 'vikas', 'cooperative', 'bank']",rbi imposes rs 55 lakh penalty on pune based seva vikas cooperative bank
"['u', 's', 'supreme', 'court', 'scraps', 'arguments', 'in', 'trump', 'era', 'immigration', 'and', 'wall', 'cases']",u s supreme court scraps arguments in trump era immigration and wall cases
"['mmtc', 'pamp', 'appoints', 'anika', 'agarwal', 'as', 'president', 'consumer', 'business']",mmtc pamp appoints anika agarwal as president consumer business
"['gsk', 'sees', 'lower', 'profit', 'this', 'year', 'split', 'plans', 'on', 'track']",gsk sees lower profit this year split plans on track
"['nse', 'bse', 'bulk', 'deals', 'societe', 'generale', 'buys', '1', '8', 'stake', 'in', 'pvr', 'and', 'other', 'deals']",nse bse bulk deals societe generale buys 1 8 stake in pvr and other deals
"['home', 'minister', 'amit', 'shah', 'says', 'no', 'propaganda', 'can', 'deter', 'indias', 'unity']",home minister amit shah says no propaganda can deter indias unity
"['shriram', 'city', 'union', 'finance', 'aims', 'over', 'rs', '6000', 'crore', 'disbursement', 'in', 'q4']",shriram city union finance aims over rs 6000 crore disbursement in q4
"['government', 'may', 'delicense', 'power', 'distribution', 'sector', 'to', 'allow', 'competition']",government may delicense power distribution sector to allow competition
"['ahead', 'of', 'market', '12', 'things', 'that', 'will', 'decide', 'stock', 'action', 'on', 'thursday']",ahead of market 12 things that will decide stock action on thursday
"['government', 'has', 'no', 'plan', 'to', 'close', 'down', 'bsnl', 'mtnl', 'dhotre']",government has no plan to close down bsnl mtnl dhotre
"['further', 'opening', 'of', 'domestic', 'flight', 'ops', 'will', 'depend', 'on', 'covid', '19', 'situation', 'passenger', 'demand', 'hardeep', 'puri']",further opening of domestic flight ops will depend on covid 19 situation passenger demand hardeep puri
"['satya', 'microcapital', 'raises', 'rs', '153', 'crore', 'in', 'equity', 'from', 'japans', 'gojo', 'company']",satya microcapital raises rs 153 crore in equity from japans gojo company
"['parliamentary', 'panel', 'submits', 'report', 'on', 'factoring', 'regulation', 'amendment', 'bill']",parliamentary panel submits report on factoring regulation amendment bill
"['lic', 'ipo', 'may', 'hit', 'market', 'in', 'q4', 'of', 'next', 'fiscal', 'dea', 'secretary']",lic ipo may hit market in q4 of next fiscal dea secretary
"['tangible', 'economic', 'gain', 'to', 'aai', 'on', 'leasing', 'out', 'six', 'airports', 'under', 'ppp', 'says', 'government']",tangible economic gain to aai on leasing out six airports under ppp says government
"['karnataka', 'allows', 'cinema', 'halls', 'to', 'operate', 'at', '100', 'per', 'cent', 'capacity', 'for', '4', 'weeks', 'on', 'trial', 'basis']",karnataka allows cinema halls to operate at 100 per cent capacity for 4 weeks on trial basis
"['india', 'can', 'now', 'create', 'aatmanirbhar', 'secured', 'internet']",india can now create aatmanirbhar secured internet
"['cryptocurrency', 'ethereum', 'hits', 'record', 'high', 'ahead', 'of', 'cme', 'futures', 'launch']",cryptocurrency ethereum hits record high ahead of cme futures launch
"['oil', 'prices', 'near', '1', 'year', 'highs', 'after', 'stocks', 'draw', 'supply', 'deficit', 'forecast']",oil prices near 1 year highs after stocks draw supply deficit forecast
"['india', 'to', 'supply', '1', '1', 'billion', 'doses', 'of', 'covid', '19', 'vaccines', 'to', 'unicef']",india to supply 1 1 billion doses of covid 19 vaccines to unicef
"['arvind', 'kejriwal', 'threatens', 'legal', 'action', 'against', 'punjab', 'cm', 'for', 'sharing', 'his', 'doctored', 'video']",arvind kejriwal threatens legal action against punjab cm for sharing his doctored video
"['procter', 'gamble', 'q2', 'results', 'net', 'profit', 'jumps', '84', 'to', 'rs', '251', 'cr']",procter gamble q2 results net profit jumps 84 to rs 251 cr
"['23', 'years', 'after', 'stealing', 'fans', 'from', 'shop', 'man', 'gets', 'one', 'year', 'jail']",23 years after stealing fans from shop man gets one year jail
"['kerala', 'government', 'employees', 'to', 'get', 'pay', 'hike', 'from', 'april', '1', 'but', 'conditions', 'apply']",kerala government employees to get pay hike from april 1 but conditions apply
"['ettech', 'evening', 'briefing', 'on', 'feb', '3', '2021', 'twitters', 'india', 'spat', 'bye', 'bye', 'jeff', 'bezos']",ettech evening briefing on feb 3 2021 twitters india spat bye bye jeff bezos
"['outward', 'remittances', 'slows', 'down', 'during', 'the', 'pandemic']",outward remittances slows down during the pandemic
"['my', 'job', 'is', 'to', 'take', 'back', 'seat', 'and', 'help', 'virat', 'rahane']",my job is to take back seat and help virat rahane
"['no', 'foreign', 'government', 'supported', 'farmers', 'agitation', 'mos', 'muraleedharan']",no foreign government supported farmers agitation mos muraleedharan
"['cet', 'score', 'can', 'be', 'used', 'by', 'state', 'govts', 'for', 'recruitment', 'jitendra', 'singh']",cet score can be used by state govts for recruitment jitendra singh
"['sony', 'raises', 'outlook', 'amid', 'home', 'entertainment', 'boom', 'but', 'struggles', 'to', 'build', 'more', 'ps5s']",sony raises outlook amid home entertainment boom but struggles to build more ps5s
"['ramco', 'cements', 'q3', 'results', 'net', 'profit', 'rises', 'two', 'fold', 'to', 'rs', '207', 'cr']",ramco cements q3 results net profit rises two fold to rs 207 cr
"['chinas', 'lenovo', 'posts', 'record', 'profit', 'in', 'third', 'quarter', 'beating', 'expectations']",chinas lenovo posts record profit in third quarter beating expectations
"['jawahar', 'navodaya', 'vidyalayas', 'can', 'resume', 'for', 'classes', '10', '12', 'in', 'states', 'where', 'schools', 'allowed', 'to', 'reopen', 'education', 'ministry']",jawahar navodaya vidyalayas can resume for classes 10 12 in states where schools allowed to reopen education ministry
"['congress', 'made', 'backdoor', 'deal', 'with', 'bjp', 'to', 'not', 'raise', 'farmers', 'protest', 'issue', 'in', 'parliament', 'aap', 'mp']",congress made backdoor deal with bjp to not raise farmers protest issue in parliament aap mp
"['india', 'launches', 'standardised', 'medical', 'insurance', 'cover', 'for', 'vector', 'borne', 'diseases']",india launches standardised medical insurance cover for vector borne diseases
"['new', 'citizenship', 'law', 'pulls', 'india', 'down', 'in', 'the', 'democracy', 'rankings', 'and', '2021', 'is', 'not', 'looking', 'better']",new citizenship law pulls india down in the democracy rankings and 2021 is not looking better
"['inclusion', 'of', 'indian', 'g', 'secs', 'in', 'global', 'indices', 'likely', 'by', '2nd', 'half', 'of', 'next', 'fiscal', 'dea', 'secretary']",inclusion of indian g secs in global indices likely by 2nd half of next fiscal dea secretary
"['income', 'tax', 'department', 'detects', 'rs', '200', 'crore', 'evasion', 'after', 'raids', 'in', 'assam']",income tax department detects rs 200 crore evasion after raids in assam
"['uipath', 'appoints', 'anil', 'bhasin', 'as', 'md', 'for', 'india', 'and', 'south', 'asia']",uipath appoints anil bhasin as md for india and south asia
"['japanese', 'electronics', 'companies', 'continue', 'to', 'lose', 'ground', 'in', 'india', 'to', 'south', 'korean', 'chinese', 'rivals']",japanese electronics companies continue to lose ground in india to south korean chinese rivals
"['railways', 'revenue', 'declined', 'by', 'rs', '36993', 'crore', 'in', '2020', 'due', 'to', 'pandemic', 'govt']",railways revenue declined by rs 36993 crore in 2020 due to pandemic govt
"['no', 'proposal', 'to', 'launch', 'new', 'pension', 'policy', 'for', 'central', 'civil', 'pensioners', 'jitendra', 'singh']",no proposal to launch new pension policy for central civil pensioners jitendra singh
"['no', 'timeline', 'set', 'for', 'holding', 'simultaneous', 'lok', 'sabha', 'assembly', 'polls', 'govt', 'in', 'parliament']",no timeline set for holding simultaneous lok sabha assembly polls govt in parliament
"['sebi', 'imposes', 'rs', '10', 'lakh', 'fine', 'on', 'individual', 'entity', 'for', 'fraudulent', 'trading', 'activities']",sebi imposes rs 10 lakh fine on individual entity for fraudulent trading activities
"['bjp', 'passes', 'resolution', 'lauding', 'budget', 'govts', 'measures', 'for', 'farmers', 'welfare']",bjp passes resolution lauding budget govts measures for farmers welfare
"['indian', 'diamond', 'retailers', 'say', 'sales', 'are', 'steadily', 'increasing', 'led', 'by', 'millennials']",indian diamond retailers say sales are steadily increasing led by millennials
"['airbus', 'signs', 'mou', 'with', 'flytech', 'to', 'train', 'drone', 'pilots', 'in', 'india']",airbus signs mou with flytech to train drone pilots in india
"['i', 'have', 'been', 'a', 'very', 'strong', 'bear', 'but', 'now', 'i', 'see', 'a', 'mega', 'bull', 'rally', 'starting', 'prasanth', 'prabhakaran']",i have been a very strong bear but now i see a mega bull rally starting prasanth prabhakaran
"['oil', 'painting', 'by', 'erich', 'heckel', 'that', 'was', 'looted', 'by', 'nazis', 'to', 'be', 'returned', 'to', 'its', 'jewish', 'heirs']",oil painting by erich heckel that was looted by nazis to be returned to its jewish heirs
"['kamdhenu', 'q3', 'results', 'posts', 'net', 'profit', 'of', 'rs', '7', 'cr']",kamdhenu q3 results posts net profit of rs 7 cr
"['bharti', 'airtel', 'board', 'okays', 'plan', 'to', 'raise', 'up', 'to', 'rs', '7500', 'crore', 'via', 'bonds']",bharti airtel board okays plan to raise up to rs 7500 crore via bonds
"['practically', 'co', 'founder', 'dives', 'deeper', 'into', 'astronomy', 'during', 'pandemic', 'witnesses', 'great', 'conjunction', 'with', 'family']",practically co founder dives deeper into astronomy during pandemic witnesses great conjunction with family
"['potential', 'antiviral', 'drug', 'against', 'covid', '19', 'identified', 'scientists', 'say', 'its', 'highly', 'effective']",potential antiviral drug against covid 19 identified scientists say its highly effective
"['managing', 'mutual', 'funds', 'is', 'like', 'playing', 'test', 'match', 'with', 't20', 'umpiring', 'kalpen', 'parekh']",managing mutual funds is like playing test match with t20 umpiring kalpen parekh
"['riri', 'storm', 'hits', 'b', 'town', 'akshay', 'kumar', 'ajay', 'devgn', 'k', 'jo', 'tweet', 'about', 'amicable', 'solution', 'fm', 'urges', 'fact', 'check']",riri storm hits b town akshay kumar ajay devgn k jo tweet about amicable solution fm urges fact check
"['it', 'is', 'a', 'mind', 'blowing', 'budget', 'at', 'least', 'for', 'me', 'arvind', 'panagariya']",it is a mind blowing budget at least for me arvind panagariya
"['thermax', 'q3', 'results', 'net', 'profit', 'marginally', 'down', '2', 'at', 'rs', '83', 'cr']",thermax q3 results net profit marginally down 2 at rs 83 cr
"['ihcl', 'q3', 'results', 'reports', 'net', 'loss', 'of', 'rs', '133', 'cr', 'on', 'covid', 'stress']",ihcl q3 results reports net loss of rs 133 cr on covid stress
"['pm', 'modis', 'brother', 'stages', 'dharna', 'at', 'lucknow', 'airport']",pm modis brother stages dharna at lucknow airport
"['gdr', 'manipulation', 'sebi', 'slaps', 'total', 'rs', '11', '8', 'cr', 'fine', 'on', 'beckons', 'industries', '4', 'officials']",gdr manipulation sebi slaps total rs 11 8 cr fine on beckons industries 4 officials
"['india', 'ratings', 'affirms', 'tata', 'housings', 'commercial', 'paper', 'at', 'ind', 'a1']",india ratings affirms tata housings commercial paper at ind a1
"['safety', 'first', 'wear', 'face', 'mask', 'no', 'singing', 'or', 'chanting', 'say', 'olympics', 'organisers']",safety first wear face mask no singing or chanting say olympics organisers
"['reliance', 'gets', 'worlds', 'first', 'carbon', 'neutral', 'oil', 'from', 'us']",reliance gets worlds first carbon neutral oil from us
"['sebi', 'orders', 'attachment', 'of', 'bank', 'demat', 'accounts', 'of', 'individual', 'to', 'recover', 'penalty', 'amount']",sebi orders attachment of bank demat accounts of individual to recover penalty amount
"['mca', 'initiates', 'decriminalisation', 'of', 'llp', 'act']",mca initiates decriminalisation of llp act
"['budget', '2021', 'neerja', 'birla', 'feels', 'mental', 'health', 'deserves', 'a', 'special', 'mention', 'dr', 'prakriti', 'poddar', 'says', 'funds', 'for', 'vaccination', 'drive', 'a', 'positive']",budget 2021 neerja birla feels mental health deserves a special mention dr prakriti poddar says funds for vaccination drive a positive
"['no', 'further', 'internet', 'cut', 'at', 'delhi', 'borders', 'as', 'of', 'now', 'mha', 'official']",no further internet cut at delhi borders as of now mha official
"['ipicol', 'completes', 'submission', 'of', 'evidence', 'of', 'reforms', 'implemented', 'under', 'srap']",ipicol completes submission of evidence of reforms implemented under srap
"['bmc', 'unveils', 'rs', '39038', 'cr', 'budget', 'keeps', 'tax', 'structure', 'unchanged']",bmc unveils rs 39038 cr budget keeps tax structure unchanged
"['square', 'yards', 'q3', 'results', 'revenue', 'rises', '30', 'sequentially', '12', 'on', 'year']",square yards q3 results revenue rises 30 sequentially 12 on year
"['budget', 'was', 'for', '1', 'of', 'population', 'gave', 'wrong', 'message', 'to', 'china', 'rahul', 'gandhi']",budget was for 1 of population gave wrong message to china rahul gandhi
"['from', 'sundar', 'pichai', 'to', 'satya', 'nadella', 'how', 'jeff', 'bezos', 'tech', 'peers', 'reacted', 'to', 'his', 'amazon', 'exit']",from sundar pichai to satya nadella how jeff bezos tech peers reacted to his amazon exit
"['supreme', 'court', 'refuses', 'to', 'entertain', 'plea', 'challenging', 'laws', 'dealing', 'with', 'religious', 'conversion']",supreme court refuses to entertain plea challenging laws dealing with religious conversion
"['edelweiss', 'general', 'insurance', 'partners', 'okinawa', 'autotech', 'for', 'two', 'wheeler', 'policy', 'coverage']",edelweiss general insurance partners okinawa autotech for two wheeler policy coverage
"['mobile', 'premier', 'league', 'raises', 'fresh', 'capital', 'as', 'valuation', 'doubles', 'in', 'four', 'months']",mobile premier league raises fresh capital as valuation doubles in four months
"['tech', 'view', 'nifty', 'forms', 'hanging', 'man', 'looks', 'poised', 'to', 'slow', 'down']",tech view nifty forms hanging man looks poised to slow down
"['arvind', 'fashions', 'q3', 'results', 'net', 'loss', 'widens', 'to', 'rs', '67', 'cr', 'to', 'raise', 'rs', '200', 'cr', 'via', 'rights', 'issue']",arvind fashions q3 results net loss widens to rs 67 cr to raise rs 200 cr via rights issue
"['its', 'bollywood', 'versus', 'rihanna', 'indian', 'government', 'brings', 'its', 'own', 'stars', 'to', 'counter', 'the', 'popstars', 'support', 'to', 'farmers']",its bollywood versus rihanna indian government brings its own stars to counter the popstars support to farmers
"['airbus', 'to', 'partner', 'flytech', 'to', 'train', 'drone', 'pilots', 'in', 'india']",airbus to partner flytech to train drone pilots in india
"['vehicle', 'scrappage', 'policy', 'what', 'it', 'means', 'and', 'how', 'it', 'will', 'impact', 'car', 'buyers']",vehicle scrappage policy what it means and how it will impact car buyers
"['ready', 'to', 'rejoin', 'congress', 'to', 'fight', 'bjp', 'in', 'gujarat', 'shankersinh', 'vaghela']",ready to rejoin congress to fight bjp in gujarat shankersinh vaghela
"['timeline', 'amazons', 'india', 'journey', 'under', 'jeff', 'bezos']",timeline amazons india journey under jeff bezos
"['waiting', 'for', 'sc', 'permission', 'to', 'start', 'fresh', 'nrc', 'updation', 'himanta', 'sharma']",waiting for sc permission to start fresh nrc updation himanta sharma
"['air', 'india', 'employees', 'interest', 'will', 'be', 'protected', 'says', 'hardeep', 'singh', 'puri']",air india employees interest will be protected says hardeep singh puri
"['ex', 'sad', 'leader', 'sends', 'legal', 'notice', 'to', 'twitter', 'to', 'delete', 'kanganas', 'defamatory', 'tweet', 'against', 'farmers']",ex sad leader sends legal notice to twitter to delete kanganas defamatory tweet against farmers
"['cma', 'cgm', 'india', 'introduces', 'python', 'train', 'service', 'on', 'western', 'dedicated', 'freight', 'corridor']",cma cgm india introduces python train service on western dedicated freight corridor
"['farmers', 'protest', 'is', 'experiment', 'will', 'be', 'replicated', 'if', 'successful', 'mp', 'minister']",farmers protest is experiment will be replicated if successful mp minister
"['day', 'trading', 'guide', 'for', 'thursday']",day trading guide for thursday
"['increased', 'capex', 'to', 'push', 'steel', 'demand', 'in', 'india', 'isa']",increased capex to push steel demand in india isa
"['pant', 'is', 'up', 'there', 'with', 'stokes', 'as', 'most', 'enjoyable', 'cricketers', 'to', 'watch', 'vaughan']",pant is up there with stokes as most enjoyable cricketers to watch vaughan
"['india', 'powers', 'spotifys', 'growth', 'as', 'it', 'closes', 'in', 'on', '350', 'million', 'monthly', 'active', 'users']",india powers spotifys growth as it closes in on 350 million monthly active users
"['reduction', 'in', 'import', 'duty', 'on', 'copper', 'scrap', 'to', 'promote', 'recycling', 'in', 'country']",reduction in import duty on copper scrap to promote recycling in country
"['sensex', 'closes', 'above', '50000', 'mark', 'for', 'first', 'time', 'as', 'rally', 'continues', 'for', '3rd', 'day']",sensex closes above 50000 mark for first time as rally continues for 3rd day
"['china', 'steps', 'up', 'vaccine', 'diplomacy', 'as', 'competition', 'with', 'india', 'heats', 'up']",china steps up vaccine diplomacy as competition with india heats up
"['repeal', 'farm', 'laws', 'without', 'making', 'it', 'prestige', 'issue', 'ghulam', 'nabi', 'azad', 'to', 'government']",repeal farm laws without making it prestige issue ghulam nabi azad to government
"['maruti', 'suzuki', 'ties', 'up', 'with', 'ald', 'automotive', 'for', 'subscription', 'programme']",maruti suzuki ties up with ald automotive for subscription programme
"['v', 'guards', 'q3', 'results', 'revenue', 'jumps', '32', 'to', 'rs', '835', 'crore']",v guards q3 results revenue jumps 32 to rs 835 crore
"['astrazeneca', 'says', 'vaccine', '76', 'effective', 'for', '90', 'days', 'after', 'single', 'dose']",astrazeneca says vaccine 76 effective for 90 days after single dose
"['ulips', 'with', 'over', 'rs', '2', '5', 'lakh', 'annual', 'premium', 'to', 'lose', 'their', 'tax', 'edge', 'over', 'equity', 'mfs']",ulips with over rs 2 5 lakh annual premium to lose their tax edge over equity mfs
"['if', 'needed', 'there', 'is', 'provision', 'to', 'revise', 'budget', 'allocation', 'for', 'sports', 'kiren', 'rijiju']",if needed there is provision to revise budget allocation for sports kiren rijiju
"['biden', 'revokes', 'buy', 'american', 'hire', 'american', 'order']",biden revokes buy american hire american order
"['odisha', 'government', 'announces', 'waiver', 'of', 'hostel', 'fees', 'for', 'iti', 'students']",odisha government announces waiver of hostel fees for iti students
"['city', 'union', 'bank', 'q3', 'results', 'net', 'profit', 'declines', '12', 'to', 'rs', '170cr']",city union bank q3 results net profit declines 12 to rs 170cr
"['government', 'introduced', 'multiple', 'reforms', 'policy', 'changes', 'to', 'build', 'indigenous', 'capability', 'air', 'force', 'chief']",government introduced multiple reforms policy changes to build indigenous capability air force chief
"['bengaluru', 'airport', 'ties', 'up', 'with', 'envirotainer', 'for', 'temperature', 'controlled', 'cargo', 'solution']",bengaluru airport ties up with envirotainer for temperature controlled cargo solution
"['dmk', 'mp', 'seeks', 'assurance', 'from', 'prime', 'minister', 'on', 'repeal', 'of', 'farm', 'laws']",dmk mp seeks assurance from prime minister on repeal of farm laws
"['bjp', 'made', 'fake', 'promises', 'to', 'matuas', 'caa', 'implementation', 'wont', 'happen', 'anytime', 'soon', 'tmc']",bjp made fake promises to matuas caa implementation wont happen anytime soon tmc
"['inox', 'leisure', 'q3', 'results', 'reports', 'loss', 'of', 'rs', '102', '50', 'crore']",inox leisure q3 results reports loss of rs 102 50 crore
