headlines,headline_text
"['act', 'east', 'india', 'promotes', 'digital', 'connectivity', 'with', 'asean', 'through', 'mega', 'hackathon']",act east india promotes digital connectivity with asean through mega hackathon
"['delhi', 'court', 'acquits', 'priya', 'ramani', 'in', 'm', 'j', 'akbars', 'criminal', 'defamation', 'case']",delhi court acquits priya ramani in m j akbars criminal defamation case
"['uttar', 'pradesh', 'on', 'alert', 'as', 'protesting', 'farmers', 'call', 'for', 'a', 'four', 'hour', 'rail', 'blockage']",uttar pradesh on alert as protesting farmers call for a four hour rail blockage
"['team', 'prashant', 'jain', 'grabs', 'tamo', 'nifty', 'biggies', 'may', 'have', 'sold', 'sbi', 'at', 'wrong', 'time']",team prashant jain grabs tamo nifty biggies may have sold sbi at wrong time
"['cairn', 'ceo', 'wants', 'to', 'see', 'fm', 'sitharaman', 'on', 'arbitration', 'award', 'next', 'week', 'no', 'time', 'given', 'yet']",cairn ceo wants to see fm sitharaman on arbitration award next week no time given yet
"['cryptocurrency', 'sleuths', 'point', 'to', 'robinhood', 'as', 'dogecoin', 'whale']",cryptocurrency sleuths point to robinhood as dogecoin whale
"['buy', 'kalpataru', 'power', 'target', 'price', 'rs', '400', 'yes', 'securities']",buy kalpataru power target price rs 400 yes securities
"['workers', 'missing', 'after', 'arcelormittal', 's', 'africa', 'site', 'accident']",workers missing after arcelormittal s africa site accident
"['solara', 'promoter', 'tpg', 'plan', 'to', 'sell', 'stake', 'in', 'co']",solara promoter tpg plan to sell stake in co
"['buy', 'repco', 'home', 'finance', 'target', 'price', 'rs', '430', 'motilal', 'oswal']",buy repco home finance target price rs 430 motilal oswal
"['oyos', 'weddingz', 'in', 'ceo', 'became', 'a', 'work', 'from', 'home', 'convert', 'in', '2020']",oyos weddingz in ceo became a work from home convert in 2020
"['gold', 'recovers', 'from', 'over', '2', 'month', 'low', 'as', 'treasury', 'yields', 'retreat']",gold recovers from over 2 month low as treasury yields retreat
"['having', 'kittens', 'about', 'filters']",having kittens about filters
"['tokyo', 'stocks', 'open', 'higher', 'on', 'rallies', 'in', 'us', 'dow']",tokyo stocks open higher on rallies in us dow
"['gold', 'falls', 'to', 'over', '2', 'month', 'low', 'on', 'rising', 'yields', 'dollar']",gold falls to over 2 month low on rising yields dollar
"['congress', 'may', 'contest', '97', 'seats', 'in', 'assam', 'polls']",congress may contest 97 seats in assam polls
"['sgx', 'nifty', 'up', '50', 'points', 'heres', 'what', 'changed', 'for', 'market', 'while', 'you', 'were', 'sleeping']",sgx nifty up 50 points heres what changed for market while you were sleeping
"['fed', 'minutes', 'show', 'willingness', 'to', 'steer', 'past', 'coming', 'jump', 'in', 'inflation']",fed minutes show willingness to steer past coming jump in inflation
"['india', 'urges', 'opec', 'to', 'ease', 'production', 'cuts']",india urges opec to ease production cuts
"['maharashtra', 'ministers', 'statements', 'responsible', 'for', 'low', 'vaccination', 'turnout', 'says', 'bjp']",maharashtra ministers statements responsible for low vaccination turnout says bjp
"['shiprocket', 'raises', '27', 'million', 'as', 'part', 'of', 'series', 'c3', 'funding', 'round']",shiprocket raises 27 million as part of series c3 funding round
"['sbi', 'mf', 'goes', 'all', 'out', 'for', 'psu', 'majors', 'dumps', 'bandhan', 'adani', 'ports', 'sbi', 'itc']",sbi mf goes all out for psu majors dumps bandhan adani ports sbi itc
"['rush', 'limbaugh', 'radio', 'host', 'who', 'was', 'the', 'voice', 'of', 'american', 'conservatism', 'passes', 'away', 'at', '70']",rush limbaugh radio host who was the voice of american conservatism passes away at 70
"['rajya', 'sabha', 'panels', 'improve', 'performance', 'naidu', 'writes', 'to', 'chiefs', 'to', 'enhance', 'attendance']",rajya sabha panels improve performance naidu writes to chiefs to enhance attendance
"['a', 'death', 'cross', 'looms', 'for', 'gold', 'hinting', 'at', 'a', 'deeper', 'correction']",a death cross looms for gold hinting at a deeper correction
"['cairn', 'ceo', 'to', 'meet', 'finance', 'secy', 'today']",cairn ceo to meet finance secy today
"['education', 'ministry', 'revives', 'vedic', 'education', 'proposal']",education ministry revives vedic education proposal
"['india', 'to', 'be', 'among', 'fastest', 'growing', 'emerging', 'economies', 'in', 'fy22', 'rating', 'hinges', 'on', 'deficit', 'debt', 'sp']",india to be among fastest growing emerging economies in fy22 rating hinges on deficit debt sp
"['school', 'packaging', 'demand', 'to', 'boost', 'paper', 'companies']",school packaging demand to boost paper companies
"['foodgrain', 'production', 'to', 'hit', 'record', 'high', 'in', '2020', '21']",foodgrain production to hit record high in 2020 21
"['dot', 'likely', 'to', 'clear', '5g', 'trial', 'applications', 'in', 'two', 'weeks']",dot likely to clear 5g trial applications in two weeks
"['centre', 'considering', 'united', 'india', 'gic', 're', 'for', 'privatisation']",centre considering united india gic re for privatisation
"['dollar', 'buoyed', 'by', 'us', 'recovery', 'hopes', 'bitcoin', 'near', 'record', '52640']",dollar buoyed by us recovery hopes bitcoin near record 52640
"['ad', 'spends', 'on', 'print', 'media', 'may', 'rise', '35', 'to', '16100', 'crore', 'in', '2021', 'report']",ad spends on print media may rise 35 to 16100 crore in 2021 report
"['home', 'appliances', 'clock', 'decade', 'best', 'sales', 'in', 'india', 'in', 'july', 'dec', '2020', 'gfk', 'india']",home appliances clock decade best sales in india in july dec 2020 gfk india
"['dow', 'jones', 'falls', 'at', 'the', 'open', 'with', 'fed', 'minutes', 'in', 'focus']",dow jones falls at the open with fed minutes in focus
"['cowin', '2', '0', 'in', 'the', 'works', 'for', 'covid', 'vaccine', 'self', 'registration']",cowin 2 0 in the works for covid vaccine self registration
"['avataar', 'venture', 'partners', 'raises', '100', 'million', 'as', 'add', 'on', 'capital']",avataar venture partners raises 100 million as add on capital
"['industry', 'cheers', 'pli', 'for', 'telecom', 'sector', 'says', 'new', 'scheme', 'to', 'spur', 'jobs', 'boost', 'innovation']",industry cheers pli for telecom sector says new scheme to spur jobs boost innovation
"['it', 'firms', 'need', 'to', 'focus', 'on', '3', 'ms', 'to', 'harness', 'their', 'potential', 'in', 'india']",it firms need to focus on 3 ms to harness their potential in india
"['facebook', 'blocks', 'news', 'content', 'in', 'australia', 'as', 'it', 'blasts', 'proposed', 'law']",facebook blocks news content in australia as it blasts proposed law
"['with', 'china', 'challenge', 'hanging', 'india', 'bolstering', 'defences', 'in', 'north', 'east', 'with', 'troop', 'reorientation']",with china challenge hanging india bolstering defences in north east with troop reorientation
"['dedicated', 'officials', 'in', 'indian', 'embassies', 'to', 'monitor', 'safety', 'of', 'children', 'adopted', 'abroad']",dedicated officials in indian embassies to monitor safety of children adopted abroad
"['view', 'a', 'new', 'alternate', 'toolkit', 'for', 'patriotism', 'flexing', 'the', 'countrys', 'defence', 'muscles']",view a new alternate toolkit for patriotism flexing the countrys defence muscles
"['india', 'pitches', 'for', 'widening', 'russia', 'ties', 'in', 'three', 'geo', 'political', 'theatres']",india pitches for widening russia ties in three geo political theatres
"['govt', 'gives', 'financial', 'powers', 'to', 'clear', 'projects', 'up', 'to', 'rs', '200', 'crore', 'to', 'deputy', 'chiefs', 'command', 'heads', 'of', 'armed', 'forces']",govt gives financial powers to clear projects up to rs 200 crore to deputy chiefs command heads of armed forces
"['two', 'girls', 'found', 'dead', 'in', 'field', 'third', 'critical', 'in', 'ups', 'unnao']",two girls found dead in field third critical in ups unnao
"['u', 'gro', 'capital', 'launches', 'gro', 'micro', 'for', 'micro', 'enterprises', 'aims', 'to', 'support', '50000', 'small', 'businesses', 'by', 'fy22']",u gro capital launches gro micro for micro enterprises aims to support 50000 small businesses by fy22
"['airbus', 'sees', 'stable', 'aircraft', 'deliveries', 'after', '2020', 'loss']",airbus sees stable aircraft deliveries after 2020 loss
"['unchanged', 'cane', 'prices', 'vs', 'govt', 'claim', 'of', 'clearing', 'higher', 'dues', 'than', 'previous', 'govts']",unchanged cane prices vs govt claim of clearing higher dues than previous govts
"['kkr', 'india', 'nbfc', 'incred', 'set', 'for', 'all', 'stock', 'merger']",kkr india nbfc incred set for all stock merger
"['bank', 'of', 'maharashtra', 'partners', 'with', 'vayana', 'network', 'to', 'offer', 'help', 'msmes']",bank of maharashtra partners with vayana network to offer help msmes
"['1', 'in', '4', 'hires', 'likely', 'to', 'be', 'gig', 'or', 'contractual', 'staff', 'this', 'year']",1 in 4 hires likely to be gig or contractual staff this year
"['up', 'unchanged', 'cane', 'prices', 'vs', 'govt', 'claim', 'of', 'clearing', 'higher', 'dues', 'than', 'previous', 'govts']",up unchanged cane prices vs govt claim of clearing higher dues than previous govts
"['india', 'third', 'on', 'list', 'of', 'countries', 'with', 'highest', 'cumulative', 'vaccination', 'numbers', 'health', 'ministry']",india third on list of countries with highest cumulative vaccination numbers health ministry
"['npci', 'bulks', 'up', 'for', 'one', 'billion', 'transactions', 'per', 'day']",npci bulks up for one billion transactions per day
"['australia', 'shares', 'end', 'flat', 'as', 'energy', 'stocks', 'weigh', 'treasury', 'wine', 'shines']",australia shares end flat as energy stocks weigh treasury wine shines
"['buy', 'apollo', 'tyres', 'target', 'price', 'rs', '247', 'icici', 'direct']",buy apollo tyres target price rs 247 icici direct
"['buy', 'great', 'eastern', 'shipping', 'company', 'target', 'price', 'rs', '290', 'icici', 'direct']",buy great eastern shipping company target price rs 290 icici direct
"['barclays', 'resumes', 'dividend', 'payouts', 'as', 'annual', 'profit', 'halves']",barclays resumes dividend payouts as annual profit halves
"['texas', 'power', 'consumers', 'to', 'pay', 'the', 'price', 'of', 'winter', 'storm']",texas power consumers to pay the price of winter storm
"['jaguar', 'land', 'rover', 'to', 'cut', '2000', 'jobs', 'globally', 'company']",jaguar land rover to cut 2000 jobs globally company
"['rail', 'roko', 'protest', 'delhi', 'police', 'steps', 'up', 'security', 'near', 'tracks']",rail roko protest delhi police steps up security near tracks
"['oppn', 'demands', 'narayanasamy', 'to', 'prove', 'majority', 'in', 'pondy', 'assembly', 'petitions', 'lt', 'guvs', 'office']",oppn demands narayanasamy to prove majority in pondy assembly petitions lt guvs office
"['toolkit', 'case', 'suspect', 'nikita', 'jacob', 'gets', 'transit', 'pre', 'arrest', 'bail']",toolkit case suspect nikita jacob gets transit pre arrest bail
"['dp', 'world', 'records', '36', 'per', 'cent', 'growth', 'in', 'throughput', 'at', 'ictt', 'cochin', 'in', 'january']",dp world records 36 per cent growth in throughput at ictt cochin in january
"['indiamart', 'intermesh', 'surges', '7', 'as', 'qip', 'kicks', 'off']",indiamart intermesh surges 7 as qip kicks off
"['congress', 'wins', '4', 'punjab', 'municipal', 'corporations', 'leading', 'in', 'others']",congress wins 4 punjab municipal corporations leading in others
"['japanese', 'shares', 'slip', 'on', 'market', 'outlook', 'caution', 'fast', 'retailing', 'shines']",japanese shares slip on market outlook caution fast retailing shines
"['uae', 'dismantles', 'eritrea', 'base', 'as', 'it', 'pulls', 'back', 'after', 'yemen', 'war']",uae dismantles eritrea base as it pulls back after yemen war
"['facebook', 'unfriends', 'australia', 'news', 'sites', 'go', 'dark', 'in', 'content', 'row']",facebook unfriends australia news sites go dark in content row
"['cid', 'to', 'probe', 'bomb', 'attack', 'on', 'bengal', 'minister']",cid to probe bomb attack on bengal minister
"['bharat', 'biotech', 'pursues', 'covid', '19', 'vaccine', 'approval', 'in', 'over', '40', 'countries']",bharat biotech pursues covid 19 vaccine approval in over 40 countries
"['singapores', 'singtel', 'says', 'personal', 'information', 'of', '129000', 'users', 'stolen', 'in', 'data', 'breach']",singapores singtel says personal information of 129000 users stolen in data breach
"['bengaluru', 'residential', 'real', 'estate', 'market', 'expected', 'to', 'see', 'measured', 'revival', 'in', 'coming', 'quarters']",bengaluru residential real estate market expected to see measured revival in coming quarters
