headlines,headline_text
"['indias', 'trade', 'deficit', 'more', 'than', 'doubles', 'to', '27', '98', 'billion', 'in', 'august']",indias trade deficit more than doubles to 27 98 billion in august
"['further', 'de', 'escalation', 'on', 'agenda', 'amid', 'talk', 'of', 'modi', 'xi', 'meet', 'at', 'sco']",further de escalation on agenda amid talk of modi xi meet at sco
"['govt', 'to', 'soon', 'invite', 'bids', 'for', 'idbi', 'bank', 'privatisation', 'dipam', 'secy']",govt to soon invite bids for idbi bank privatisation dipam secy
"['chirag', 'paswan', 'cozying', 'up', 'to', 'bjp', 'once', 'again']",chirag paswan cozying up to bjp once again
"['india', 'russia', 'military', 'tech', 'coop', 'progressing', 'based', 'on', 'new', 'requirements', 'envoy']",india russia military tech coop progressing based on new requirements envoy
"['india', 'france', 'work', 'on', 'trilateral', 'projects', 'cooperation', 'in', 'indo', 'pacific']",india france work on trilateral projects cooperation in indo pacific
"['stern', 'action', 'on', 'bjps', 'anti', 'social', 'activities', 'mamata', 'banerjee']",stern action on bjps anti social activities mamata banerjee
"['modi', 'and', 'putin', 'to', 'discuss', 'cooperation', 'at', 'g20', 'sco', 'and', 'un']",modi and putin to discuss cooperation at g20 sco and un
"['rss', 'affiliates', 'to', 'deliberate', 'on', 'the', 'importance', 'of', 'genealogy', 'writing']",rss affiliates to deliberate on the importance of genealogy writing
"['rajnath', 'singh', 'conveys', 'concerns', 'over', 'us', 'f', '16', 'pack', 'for', 'pak']",rajnath singh conveys concerns over us f 16 pack for pak
"['after', 'hiccup', 'army', 'to', 'start', 'agnipath', 'hiring', 'in', 'punjab']",after hiccup army to start agnipath hiring in punjab
"['goa', 'defection', 'mocks', 'crisis', 'management', 'skills', 'of', 'the', 'gandhis']",goa defection mocks crisis management skills of the gandhis
"['commercial', 'mines', 'auction', 'vedanta', 'emerges', 'as', 'highest', 'bidder', 'for', '2', 'coal', 'blocks', 'in', 'odisha']",commercial mines auction vedanta emerges as highest bidder for 2 coal blocks in odisha
"['disneys', 'live', 'action', 'remake', 'of', 'the', 'little', 'mermaid', 'receives', '1', '5', 'million', 'dislikes']",disneys live action remake of the little mermaid receives 1 5 million dislikes
"['the', 'need', 'for', 'central', 'banks', 'to', 'be', 'credible', 'and', 'stay', 'the', 'course', 'come', 'what', 'may']",the need for central banks to be credible and stay the course come what may
"['mcdonalds', 'to', 'shut', 'all', 'outlets', 'across', 'uk', 'heres', 'the', 'reason']",mcdonalds to shut all outlets across uk heres the reason
"['us', 'mulls', 'new', 'restrictions', 'on', 'china', 'details', 'here']",us mulls new restrictions on china details here
"['airlines', 'oppose', 'fee', 'hike', 'by', 'mangaluru', 'airport']",airlines oppose fee hike by mangaluru airport
"['better', 'health', 'with', 'lingering', 'concerns']",better health with lingering concerns
"['stranger', 'things', '5', 'on', 'netflix', 'eddie', 'munson', 'returns', 'for', 'final', 'season']",stranger things 5 on netflix eddie munson returns for final season
"['view', 'understanding', 'competitiveness']",view understanding competitiveness
"['room', 'for', 'smaller', 'interest', 'rate', 'hikes']",room for smaller interest rate hikes
"['sheena', 'bora', 'murder', 'court', 'rejects', 'indranis', 'plea', 'about', 'cd', 'of', 'rahuls', 'conversation', 'with', 'peter', 'and', 'her']",sheena bora murder court rejects indranis plea about cd of rahuls conversation with peter and her
"['brigade', 'appoints', 'mr', 'ravi', 'ahuja', 'as', 'coo', 'commercial']",brigade appoints mr ravi ahuja as coo commercial
"['vinesh', 'phogat', 'wins', 'bronze', 'in', 'world', 'championships']",vinesh phogat wins bronze in world championships
"['facilitated', 'by', 'forum', 'for', 'naga', 'reconciliation', 'leaders', 'of', 'isak', 'muivah', 'and', 'nnpg', 'met', 'on', 'wednesday']",facilitated by forum for naga reconciliation leaders of isak muivah and nnpg met on wednesday
"['up', 'police', 'attach', 'ex', 'mp', 'atiq', 'ahmads', 'properties', 'worth', 'rs', '16', 'crore']",up police attach ex mp atiq ahmads properties worth rs 16 crore
"['achieving', 'target', 'of', '20', 'ethanol', 'blending', 'in', 'petrol', 'by', '2025', 'to', 'save', 'rs', '1', 'lakh', 'crore', 'forex', 'amit', 'shah']",achieving target of 20 ethanol blending in petrol by 2025 to save rs 1 lakh crore forex amit shah
"['what', 'a', 'powerful', 'act', 'by', 'a', 'love', 'struck', 'electrician', 'in', 'a', 'village', 'can', 'teach', 'india']",what a powerful act by a love struck electrician in a village can teach india
"['president', 'draupadi', 'murmu', 'to', 'join', '500', 'world', 'leaders', 'at', 'queens', 'funeral']",president draupadi murmu to join 500 world leaders at queens funeral
"['sop', 'evaluations', 'still', 'on', 'ministry', 'tells', 'semiconductor', 'applicant']",sop evaluations still on ministry tells semiconductor applicant
"['lalu', 'prasad', 'visits', 'rjd', 'office', 'after', 'many', 'years']",lalu prasad visits rjd office after many years
"['i', 'have', 'not', 'returned', 'empty', 'handed', 'from', 'india', 'bangladesh', 'pm', 'sheikh', 'hasina']",i have not returned empty handed from india bangladesh pm sheikh hasina
"['republican', 'lindsey', 'graham', 'seeks', 'ban', 'on', 'abortion', 'after', '15', 'weeks', 'of', 'pregnancy']",republican lindsey graham seeks ban on abortion after 15 weeks of pregnancy
"['did', 'not', 'want', 'my', 'photo', 'on', 'key', 'which', 'i', 'was', 'handing', 'over', 'fm', 'after', 'inaugurating', 'residential', 'complex']",did not want my photo on key which i was handing over fm after inaugurating residential complex
"['43', 'locations', 'over', 'n', 'f', 'railway', 'have', 'been', 'selected', 'for', 'introducing', 'such', 'coach', 'restaurants']",43 locations over n f railway have been selected for introducing such coach restaurants
"['tata', 'steel', 'to', 'raise', 'rs', '2000', 'crore', 'through', 'issuance', 'of', 'ncds']",tata steel to raise rs 2000 crore through issuance of ncds
"['taiban', 'govt', 'says', 'jem', 'chief', 'masood', 'azhar', 'not', 'in', 'afghanistan', 'asserts', 'such', 'terrorist', 'outfits', 'can', 'operate', 'on', 'pakistans', 'soil']",taiban govt says jem chief masood azhar not in afghanistan asserts such terrorist outfits can operate on pakistans soil
"['sad', 'chief', 'sukhbir', 'singh', 'badal', 'quizzed', 'for', '5', 'hours', 'in', '2015', 'kotkapura', 'police', 'firing', 'case']",sad chief sukhbir singh badal quizzed for 5 hours in 2015 kotkapura police firing case
"['assam', 'govt', 'files', 'a', 'petition', 'in', 'gauhati', 'high', 'court', 'after', 'tamil', 'nadu', 'refuses', 'to', 'return', 'the', 'elephant']",assam govt files a petition in gauhati high court after tamil nadu refuses to return the elephant
"['president', 'droupadi', 'murmu', 'to', 'attend', 'queen', 'elizabeths', 'funeral', 'in', 'london']",president droupadi murmu to attend queen elizabeths funeral in london
"['amitabh', 'bachchan', 'recalls', 'father', 'harivansh', 'rai', 'bachchans', 'memory', 'heres', 'how']",amitabh bachchan recalls father harivansh rai bachchans memory heres how
"['child', 'helpline', '1098', 'to', 'remain', 'in', 'operation', 'wcd', 'ministry']",child helpline 1098 to remain in operation wcd ministry
"['will', 'king', 'charles', 'iii', 'wield', 'axe', 'on', 'his', 'own', 'staff', 'find', 'out', 'the', 'truth', 'here']",will king charles iii wield axe on his own staff find out the truth here
"['level', 'of', 'solidarity', 'trust', 'between', 'india', 'france', 'rare', 'in', 'todays', 'world', 'french', 'foreign', 'minister']",level of solidarity trust between india france rare in todays world french foreign minister
"['what', 'is', 'elon', 'musks', 'botometer', 'here', 'are', 'details']",what is elon musks botometer here are details
"['scope', 'for', '5', 'billion', 'more', 'exports', 'to', 'russia', 'rupee', 'trade', 'soon', 'with', 'sbi', 'roped', 'in', 'fieo']",scope for 5 billion more exports to russia rupee trade soon with sbi roped in fieo
"['uk', 'cinema', 'halls', 'to', 'screen', 'queens', 'funeral', 'for', 'free', 'details', 'here']",uk cinema halls to screen queens funeral for free details here
"['uttar', 'pradesh', 'to', 'get', '18', 'new', 'police', 'stations', 'for', 'increased', 'policing']",uttar pradesh to get 18 new police stations for increased policing
"['school', 'jobs', 'scam', 'ex', 'bengal', 'minister', 'partha', 'chatterjees', 'judicial', 'remand', 'extended']",school jobs scam ex bengal minister partha chatterjees judicial remand extended
"['who', 'will', 'attend', 'funeral', 'of', 'queen', 'elizabeth', 'ii', 'here', 'is', 'full', 'list']",who will attend funeral of queen elizabeth ii here is full list
"['russia', 'india', 'trade', 'turnover', 'witnesses', 'unprecedented', 'growth', 'in', 'first', 'half', 'of', '2022', 'russian', 'envoy']",russia india trade turnover witnesses unprecedented growth in first half of 2022 russian envoy
"['gst', 'collection', 'may', 'top', 'rs', '1', '5', 'lakh', 'crore', 'from', 'october', 'revenue', 'secretary', 'tarun', 'bajaj']",gst collection may top rs 1 5 lakh crore from october revenue secretary tarun bajaj
"['dharamshalas', 'of', 'scs', 'backward', 'classes', 'to', 'get', '75', 'pc', 'subsidy', 'on', 'solar', 'energy', 'in', 'haryana']",dharamshalas of scs backward classes to get 75 pc subsidy on solar energy in haryana
"['ayushmann', 'khurrana', 'rakul', 'preet', 'singh', 'starrer', 'doctor', 'g', 'release', 'date', 'revealed', 'here', 'are', 'details']",ayushmann khurrana rakul preet singh starrer doctor g release date revealed here are details
"['development', 'and', 'testing', 'of', 'electric', 'vehicles', 'need', 'to', 'follow', 'strict', 'protocols', 'say', 'industry', 'leaders']",development and testing of electric vehicles need to follow strict protocols say industry leaders
"['no', 'stay', 'on', 'dvac', 'probe', 'against', 'palaniswami', 'madras', 'high', 'court']",no stay on dvac probe against palaniswami madras high court
"['despite', 'strong', 'opposition', 'meghalaya', 'government', 'has', 'issued', 'licences', 'to', 'set', 'up', 'three', 'casinos']",despite strong opposition meghalaya government has issued licences to set up three casinos
"['colorado', 'police', 'kills', 'man', 'who', 'dialed', '911', 'for', 'help']",colorado police kills man who dialed 911 for help
"['melania', 'trump', 'launches', 'christmas', 'ornaments', 'nfts', 'to', 'help', 'foster', 'kids']",melania trump launches christmas ornaments nfts to help foster kids
"['share', 'market', 'update', 'starbucks', 'nucor', 'sofi', 'and', 'more', 'stocks', 'that', 'are', 'moving', 'the', 'market']",share market update starbucks nucor sofi and more stocks that are moving the market
"['government', 'to', 'develop', '3', 'vehicle', 'scrapping', 'facilities', 'in', 'every', 'district']",government to develop 3 vehicle scrapping facilities in every district
"['rashmika', 'mandanna', 'shares', 'adorable', 'photo', 'with', 'thalapathy', 'vijay', 'on', 'sets', 'of', 'varisu']",rashmika mandanna shares adorable photo with thalapathy vijay on sets of varisu
"['hrithik', 'roshan', 'thanks', 'viewers', 'for', 'watching', 'vikram', 'vedha', 'trailer', 'celebrities', 'react']",hrithik roshan thanks viewers for watching vikram vedha trailer celebrities react
"['biswajit', 'daimary', 'suspended', 'mla', 'akhil', 'gogoi', 'for', 'the', 'duration', 'of', 'the', 'question', 'hour', 'for', 'disrupting', 'proceedings']",biswajit daimary suspended mla akhil gogoi for the duration of the question hour for disrupting proceedings
"['tcs', 'pips', 'hdfc', 'bank', 'to', 'be', 'indias', 'most', 'valuable', 'brand', 'kantar', 'brandz', 'report']",tcs pips hdfc bank to be indias most valuable brand kantar brandz report
"['apple', 'watch', 'ultra', 'watch', 'series', '8', 'watch', 'se', '2', 'get', 'more', 'power', 'new', 'report', 'reveals', 'battery', 'capacity']",apple watch ultra watch series 8 watch se 2 get more power new report reveals battery capacity
"['they', 'should', 'do', '100', 'wall', 'street', 'debates', 'the', 'feds', 'next', 'rate', 'move']",they should do 100 wall street debates the feds next rate move
"['indias', 'wpi', 'inflation', 'slows', 'to', '12', '41', 'per', 'cent', 'in', 'august']",indias wpi inflation slows to 12 41 per cent in august
"['us', 'primary', 'results', 'list', 'of', 'winners', 'leading', 'takeaways', 'from', 'new', 'hampshire', 'rhode']",us primary results list of winners leading takeaways from new hampshire rhode
"['karnataka', 'court', 'orders', 'fir', 'probe', 'against', 'yediyurappa', 'and', 'others', 'in', 'corruption', 'case']",karnataka court orders fir probe against yediyurappa and others in corruption case
"['bjp', 'serial', 'killer', 'of', 'democracy', 'trying', 'to', 'topple', 'bhagwant', 'mann', 'led', 'punjab', 'govt', 'aap']",bjp serial killer of democracy trying to topple bhagwant mann led punjab govt aap
"['uk', 'inflation', 'falls', 'to', '9', '9', 'due', 'to', 'this', 'factor']",uk inflation falls to 9 9 due to this factor
"['ahead', 'of', 'market', '10', 'things', 'that', 'will', 'decide', 'd', 'st', 'action', 'on', 'thursday']",ahead of market 10 things that will decide d st action on thursday
"['bjp', 'brought', 'armed', 'goons', 'in', 'trains', 'from', 'outside', 'for', 'rally', 'claims', 'mamata', 'banerjee']",bjp brought armed goons in trains from outside for rally claims mamata banerjee
"['best', 'camera', 'under', '30000', 'in', 'india']",best camera under 30000 in india
"['dhl', 'supply', 'chain', 'to', 'invest', '500', 'mn', 'euro', 'in', 'india', 'over', 'next', '5', 'years', 'to', 'boost', 'capacity']",dhl supply chain to invest 500 mn euro in india over next 5 years to boost capacity
"['every', 'prisoner', 'has', 'a', 'fundamental', 'right', 'to', 'file', 'bail', 'application', 'hc']",every prisoner has a fundamental right to file bail application hc
"['former', 'aide', 'of', 'donald', 'trump', 'karoline', 'leavitt', 'wins', 'new', 'hampshires', '1st', 'congressional', 'district']",former aide of donald trump karoline leavitt wins new hampshires 1st congressional district
"['google', 'suffers', 'setback', 'in', 'court', 'fight', 'against', 'eu', 'fine']",google suffers setback in court fight against eu fine
"['industry', 'body', 'seeks', 'tamil', 'nadu', 'government', 'to', 'roll', 'back', 'power', 'tariff', 'hike']",industry body seeks tamil nadu government to roll back power tariff hike
"['telecom', 'minister', 'vaishnaw', 'calls', 'on', 'telcos', 'tower', 'cos', 'to', 'boost', 'quality', 'of', 'services']",telecom minister vaishnaw calls on telcos tower cos to boost quality of services
"['indias', 'top', '75', 'brands', 'are', 'worth', '393', 'billion', 'thats', '11', 'of', 'indias', 'gdp']",indias top 75 brands are worth 393 billion thats 11 of indias gdp
"['cabinet', 'nod', 'for', 'signing', 'of', 'guarantees', 'for', 'fifa', 'u', '17', 'womens', 'world', 'cup']",cabinet nod for signing of guarantees for fifa u 17 womens world cup
"['nominations', 'for', 'padma', 'awards', '2023', 'to', 'be', 'accepted', 'till', 'thursday', 'mha']",nominations for padma awards 2023 to be accepted till thursday mha
"['the', 'legend', 'of', 'zeldas', 'sequel', 'release', 'date', 'gameplay', 'of', 'video', 'game', 'series', 'announced']",the legend of zeldas sequel release date gameplay of video game series announced
"['hyderabad', 'fire', 'incident', 'hotel', 'owner', 'manager', 'among', '4', 'arrested']",hyderabad fire incident hotel owner manager among 4 arrested
"['cuet', 'nta', 'allows', 'correction', 'in', 'application', 'form', 'till', 'sept', '15']",cuet nta allows correction in application form till sept 15
"['the', 'bill', 'for', 'indias', 'renewable', 'energy', 'goals', 'by', '2030', '560', 'billion']",the bill for indias renewable energy goals by 2030 560 billion
"['karnataka', 'hijab', 'ban', 'sc', 'asks', 'about', 'authentic', 'figure', 'on', 'dropout', 'of', 'students']",karnataka hijab ban sc asks about authentic figure on dropout of students
"['ciel', 'hr', 'services', 'expects', 'to', 'file', 'drhp', 'by', 'q1', 'of', 'next', 'fiscal', 'official']",ciel hr services expects to file drhp by q1 of next fiscal official
"['vedanta', 'foxconn', 'project', 'going', 'to', 'gujarat', 'is', 'part', 'of', 'conspiracy', 'to', 'reduce', 'maharashtras', 'importance', 'ncp', 'mp', 'sule']",vedanta foxconn project going to gujarat is part of conspiracy to reduce maharashtras importance ncp mp sule
"['former', 'chambal', 'dacoit', 'raising', 'awareness', 'about', 'cheetahs', 'being', 'brought', 'to', 'mp']",former chambal dacoit raising awareness about cheetahs being brought to mp
"['smoke', 'on', 'air', 'india', 'plane', 'on', 'runway', 'at', 'muscat', 'passengers', 'and', 'crew', 'evacuated']",smoke on air india plane on runway at muscat passengers and crew evacuated
"['american', 'rb', 'star', 'jesse', 'powell', 'passes', 'away', 'at', '51', 'in', 'los', 'angeles']",american rb star jesse powell passes away at 51 in los angeles
"['why', 'did', 'king', 'charles', 'staff', 'hit', 'with', 'redundancies', 'in', 'wake', 'of', 'accession', 'find', 'out', 'here']",why did king charles staff hit with redundancies in wake of accession find out here
"['mumbai', 'polices', 'brahmastra', 'meme', 'invites', 'reaction', 'from', 'alia', 'bhatt']",mumbai polices brahmastra meme invites reaction from alia bhatt
"['singer', 'murray', 'head', 'suffers', 'accident', 'admitted', 'to', 'hospital', 'in', 'france']",singer murray head suffers accident admitted to hospital in france
"['akshay', 'kumars', 'road', 'safety', 'campaign', 'video', 'lands', 'in', 'trouble', 'netizens', 'slam', 'actor', 'for', 'promoting', 'dowry']",akshay kumars road safety campaign video lands in trouble netizens slam actor for promoting dowry
"['gold', 'prices', 'fall', 'rs', '265', 'silver', 'price', 'slides', 'rs', '786']",gold prices fall rs 265 silver price slides rs 786
"['pvt', 'sector', 'should', 'look', 'at', 'brownfield', 'investment', 'opportunities', 'offered', 'in', 'cpse', 'sale', 'dipam', 'secy']",pvt sector should look at brownfield investment opportunities offered in cpse sale dipam secy
"['delhi', 'rera', 'orders', 'dda', 'to', 'register', 'all', 'ongoing', 'e', 'auction', 'schemes']",delhi rera orders dda to register all ongoing e auction schemes
"['dalai', 'lama', 'to', 'visit', 'sikkim', 'fron', 'oct', '28', 'nov', '1']",dalai lama to visit sikkim fron oct 28 nov 1
"['kyrgyzstan', 'tajikistan', 'border', 'boils', '1', 'killed', '2', 'injured', 'in', 'fresh', 'conflict']",kyrgyzstan tajikistan border boils 1 killed 2 injured in fresh conflict
"['eating', 'non', 'vegetarian', 'food', 'not', 'a', 'taboo', 'but', 'avoid', 'beef', 'rss', 'intellectual', 'wing', 'head']",eating non vegetarian food not a taboo but avoid beef rss intellectual wing head
"['byjus', 'fy21', 'losses', 'balloon', 'to', 'rs', '4588', 'crore', 'ed', 'searches', 'paytm', 'payu', 'offices']",byjus fy21 losses balloon to rs 4588 crore ed searches paytm payu offices
"['qsr', 'leads', 'food', 'service', 'industry', 'with', '19', '95', 'lakh', 'outlets', 'food', 'delivery', 'market', 'expected', 'reach', '18', '1', 'billion', 'by', 'fy25', 'report']",qsr leads food service industry with 19 95 lakh outlets food delivery market expected reach 18 1 billion by fy25 report
"['world', 'looking', 'at', 'india', 'for', 'knowledge', 'rss', 'chief', 'mohan', 'bhagwat']",world looking at india for knowledge rss chief mohan bhagwat
"['best', 'room', 'heaters', 'under', 'rs', '3000', 'in', 'india']",best room heaters under rs 3000 in india
"['farmer', 'owned', 'sahyadri', 'farms', 'has', 'raised', 'rs', '310', 'crore', 'from', 'a', 'group', 'of', 'european', 'investors']",farmer owned sahyadri farms has raised rs 310 crore from a group of european investors
"['a', 'stubborn', 'us', 'inflation', 'a', 'jumbo', 'worry', 'for', 'indian', 'economy']",a stubborn us inflation a jumbo worry for indian economy
"['germany', 'to', 'simplify', 'immigration', 'system', 'for', 'skilled', 'workforce']",germany to simplify immigration system for skilled workforce
"['whatsapp', 'hosts', 'training', 'programme', 'in', 'hyderabad', 'to', 'help', 'restaurateurs']",whatsapp hosts training programme in hyderabad to help restaurateurs
"['what', 'if', 'wb', 'followed', 'ups', 'bulldozer', 'model', 'tmcs', 'mohua', 'moitra', 'on', 'violence', 'in', 'bjp', 'rally']",what if wb followed ups bulldozer model tmcs mohua moitra on violence in bjp rally
"['india', 'top', 'country', 'for', 'sending', 'students', 'to', 'the', 'us', 'for', 'higher', 'education', 'minister', 'counsellor', 'for', 'consular', 'affairs']",india top country for sending students to the us for higher education minister counsellor for consular affairs
"['aap', 'will', 'fully', 'support', 'agnipath', 'scheme', 'arvind', 'kejriwal']",aap will fully support agnipath scheme arvind kejriwal
"['eiffel', 'towers', 'lights', 'to', 'be', 'turned', 'off', 'early', 'heres', 'why']",eiffel towers lights to be turned off early heres why
"['how', 'do', 'ants', 'make', 'climbing', 'walls', 'look', 'so', 'easy', 'this', 'biologist', 'has', 'the', 'answer']",how do ants make climbing walls look so easy this biologist has the answer
"['around', '40', 'indians', 'use', 'digital', 'formats', 'like', 'upi', 'for', 'money', 'transfer', 'nandan', 'nilekani']",around 40 indians use digital formats like upi for money transfer nandan nilekani
"['actor', 'ryan', 'reynolds', 'undergoes', 'life', 'saving', 'colonoscopy', 'on', 'camera', 'to', 'raise', 'awareness', 'details', 'here']",actor ryan reynolds undergoes life saving colonoscopy on camera to raise awareness details here
"['who', 'is', 'ramsey', 'lewis', 'chart', 'topping', 'jazz', 'pianist', 'dies', 'at', '87']",who is ramsey lewis chart topping jazz pianist dies at 87
"['easy', 'to', 'use', 'effective', 'economical', 'nasal', 'covid', 'vaccines', 'to', 'be', 'a', 'game', 'changer', 'say', 'scientists']",easy to use effective economical nasal covid vaccines to be a game changer say scientists
"['how', 'stressed', 'are', 'you', 'yoga', 'therapist', 'explains', 'best', 'ways', 'to', 'control', 'manage', 'overcome', 'it']",how stressed are you yoga therapist explains best ways to control manage overcome it
"['govt', 'reducing', 'compliances', 'in', 'food', 'processing', 'sector', 'union', 'minister', 'prahlad', 'singh', 'patel']",govt reducing compliances in food processing sector union minister prahlad singh patel
"['nifty', 'bank', 'key', 'levels', 'to', 'watch', 'out', 'for', 'on', 'thursday']",nifty bank key levels to watch out for on thursday
"['india', 'a', 'sovereign', 'nation', 'can', 'make', 'its', 'own', 'decisions', 'says', 'pentagon', 'on', 'vostok', 'military', 'exercises']",india a sovereign nation can make its own decisions says pentagon on vostok military exercises
"['cant', 'be', 'locking', 'horns', 'with', 'zomato', 'and', 'swiggy', 'says', 'restaurant', 'body']",cant be locking horns with zomato and swiggy says restaurant body
"['indias', 'food', 'production', 'industry', 'worth', 'over', '400', 'billion', 'but', 'food', 'processing', 'significantly', 'low', 'bcg', 'ficci', 'report']",indias food production industry worth over 400 billion but food processing significantly low bcg ficci report
"['will', 'us', 'president', 'joe', 'biden', 'take', 'the', 'bus', 'for', 'queen', 'elizabeth', 'iis', 'funeral', 'with', 'other', 'world', 'leaders', 'details', 'here']",will us president joe biden take the bus for queen elizabeth iis funeral with other world leaders details here
"['harsha', 'engineers', 'ipo', 'subscribed', '52', 'in', 'first', '90', 'minutes']",harsha engineers ipo subscribed 52 in first 90 minutes
"['agnipath', 'recruitment', 'rallies', 'successfully', 'conducted', 'in', 'punjab', 'no', 'plan', 'to', 'shift', 'sources']",agnipath recruitment rallies successfully conducted in punjab no plan to shift sources
"['karnataka', 'to', 'enact', 'law', 'to', 'make', 'kannada', 'mandatory', 'in', 'state']",karnataka to enact law to make kannada mandatory in state
"['samsung', 'takes', 'dig', 'at', 'apple', 'over', 'iphone', '14', 'on', 'twitter', 'details', 'here']",samsung takes dig at apple over iphone 14 on twitter details here
"['medicines', 'and', 'biryani', 'from', 'the', 'sky', 'made', 'in', 'india', 'drones', 'witness', 'growth', 'post', 'import', 'ban']",medicines and biryani from the sky made in india drones witness growth post import ban
"['us', 'railroad', 'strike', 'date', 'impact', 'key', 'details']",us railroad strike date impact key details
"['crisil', 'report', 'explains', 'why', 'housing', 'finance', 'companies', 'will', 'keep', 'losing', 'market', 'share', 'to', 'banks']",crisil report explains why housing finance companies will keep losing market share to banks
"['explosion', 'at', 'northeastern', 'university', 'in', 'boston', 'probe', 'on']",explosion at northeastern university in boston probe on
"['lancet', 'report', 'on', 'unapproved', 'antibiotic', 'use', 'in', 'india', 'is', 'misleading', 'inappropriate', 'govt', 'official']",lancet report on unapproved antibiotic use in india is misleading inappropriate govt official
"['double', 'whammy', 'appreciating', 'dollar', 'us', 'inflation', 'bad', 'news', 'for', 'indian', 'students']",double whammy appreciating dollar us inflation bad news for indian students
"['donald', 'trump', 'was', 'concerned', 'over', 'likely', 'assassination', 'attempt', 'by', 'iran', 'reveals', 'book']",donald trump was concerned over likely assassination attempt by iran reveals book
