headlines,headline_text
"['buy', 'reliance', 'industries', 'target', 'price', 'rs', '2590', 'edelweissnbsp']",buy reliance industries target price rs 2590 edelweissnbsp
"['bappi', 'lahiris', 'cremation', 'to', 'be', 'conducted', 'on', 'thursday', 'after', 'son', 'bappa', 'arrives', 'from', 'us', 'family', 'releases', 'statement']",bappi lahiris cremation to be conducted on thursday after son bappa arrives from us family releases statement
"['meet', 'the', 'crew', 'spacex', 'engineer', 'anna', 'menon', 'to', 'be', 'on', 'next', 'space', 'mission', 'announced', 'by', 'jared', 'isaacman']",meet the crew spacex engineer anna menon to be on next space mission announced by jared isaacman
"['china', 'may', 'take', 'advantage', 'of', 'ukraine', 'crisis', 'us', 'general']",china may take advantage of ukraine crisis us general
"['litre', 'analysts']",litre analysts
"['indian', 'economy', 'may', 'witness', 'post', 'pandemic', 'economic', 'reset', 'by', 'year', 'end', 'finance', 'ministry']",indian economy may witness post pandemic economic reset by year end finance ministry
"['chaos', 'prevails', 'in', 'govt', 'pu', 'colleges', 'as', 'burqa', 'clad', 'students', 'denied', 'entry', 'citing', 'hc', 'order']",chaos prevails in govt pu colleges as burqa clad students denied entry citing hc order
"['hospital', 'chains', 'witness', 'a', 'revival', 'in', 'medical', 'tourism']",hospital chains witness a revival in medical tourism
"['food', 'safety', 'authority', 'comes', 'out', 'with', 'new', 'regulations', 'for', 'beer', 'and', 'bread']",food safety authority comes out with new regulations for beer and bread
"['du', 'opening', 'calls', 'for', 'online', 'classes', 'among', 'final', 'year', 'ug', 'pg', 'students', 'grow', 'louder']",du opening calls for online classes among final year ug pg students grow louder
"['karnataka', 'hijab', 'innocent', 'display', 'of', 'faith', 'not', 'jingoism', 'says', 'petitioners', 'counsel', 'devadatt', 'kamat']",karnataka hijab innocent display of faith not jingoism says petitioners counsel devadatt kamat
"['vistara', 'gradually', 'restoring', 'certain', 'services', 'to', 'pre', 'covid', 'levels']",vistara gradually restoring certain services to pre covid levels
"['this', 'jhunjhunwala', 'stock', 'rallies', '15', 'as', 'nomura', 'raises', 'target', 'price']",this jhunjhunwala stock rallies 15 as nomura raises target price
"['lassa', 'fever', 'symptoms', 'treatment', 'more', 'about', 'the', 'pandemic', 'wary', 'worlds', 'new', 'fear', 'factor']",lassa fever symptoms treatment more about the pandemic wary worlds new fear factor
"['omicron', 'most', 'dominant', 'strain', 'of', 'covid', '19', 'in', 'india']",omicron most dominant strain of covid 19 in india
"['salaries', 'in', 'india', 'expected', 'to', 'increase', '9', '9', 'in', '2022', 'highest', 'in', 'five', 'years', 'aon', 'survey']",salaries in india expected to increase 9 9 in 2022 highest in five years aon survey
"['srei', 'promoters', 'move', 'nclt', 'contesting', 'kpmg', 'forensic', 'audit']",srei promoters move nclt contesting kpmg forensic audit
"['elon', 'musks', 'neuralink', 'brain', 'chip', 'tests', 'kills', '15', 'monkeys', 'out', 'of', '23', 'company', 'accused', 'of', 'causing', 'extreme', 'suffering', 'says', 'report']",elon musks neuralink brain chip tests kills 15 monkeys out of 23 company accused of causing extreme suffering says report
"['actor', 'activist', 'deep', 'sidhu', 'accused', 'in', 'last', 'years', 'red', 'fort', 'violence', 'case', 'dies', 'in', 'road', 'accident']",actor activist deep sidhu accused in last years red fort violence case dies in road accident
"['virgin', 'galactic', 'opens', 'ticket', 'sales', 'for', 'space', 'tourism', 'flights']",virgin galactic opens ticket sales for space tourism flights
"['delhi', 'ncr', 'to', 'witness', 'over', '8', 'million', 'sq', 'ft', 'office', 'leasing', 'in', '2022', 'report']",delhi ncr to witness over 8 million sq ft office leasing in 2022 report
