headlines,headline_text
"['bob', 'evans', 'farms', 'foods', 'recalls', 'italian', 'pork', 'sausage', 'after', 'consumer', 'complaints', 'read', 'details']",bob evans farms foods recalls italian pork sausage after consumer complaints read details
"['delhi', 'airport', 'emerges', 'as', 'worlds', '10th', 'busiest', 'airport', 'report']",delhi airport emerges as worlds 10th busiest airport report
"['darrell', 'brooks', 'found', 'guilty', 'on', 'all', '76', 'counts', 'for', 'killing', 'six', 'by', 'driving', 'car', 'into', 'crowd', 'during', 'waukesha', 'christmas', 'parade', 'in', 'wisconsin']",darrell brooks found guilty on all 76 counts for killing six by driving car into crowd during waukesha christmas parade in wisconsin
"['air', 'india', 'express', 'to', 'lease', '2', 'b737', 'jets', 'from', 'vistara', 'as', 'it', 'readies', 'for', 'winter', 'rush']",air india express to lease 2 b737 jets from vistara as it readies for winter rush
"['telangana', 'police', 'stop', 'bid', 'to', 'coax', 'trs', 'mlas', 'into', 'defecting', 'party']",telangana police stop bid to coax trs mlas into defecting party
"['bjp', 'moves', 'ec', 'alleging', 'irregularities', 'in', 'odisha', 'and', 'telangana', 'bypolls']",bjp moves ec alleging irregularities in odisha and telangana bypolls
"['jiomart', 'on', 'whatsapp', 'is', 'a', 'big', 'opportunity', 'for', 'paid', 'messaging', 'market', 'zuckerberg']",jiomart on whatsapp is a big opportunity for paid messaging market zuckerberg
"['best', 'dehumidifier', 'for', 'rooms', 'in', 'india']",best dehumidifier for rooms in india
"['apple', 'iphone', '13', 'price', 'reduced', 'amazon', 'flipkart', 'and', 'apple', 'store', 'know', 'where', 'you', 'can', 'buy', 'cheap']",apple iphone 13 price reduced amazon flipkart and apple store know where you can buy cheap
"['russian', 'petrochem', 'co', 'sibur', 'eyes', 'india', 'to', 'boost', 'exports']",russian petrochem co sibur eyes india to boost exports
"['discussed', '14', 'pro', 'shortage', 'with', 'apple', 'mos', 'it']",discussed 14 pro shortage with apple mos it
"['aramco', 'unveils', '1', '5', 'billion', 'sustainability', 'fund']",aramco unveils 1 5 billion sustainability fund
"['jeevan', 'pramaan', 'how', 'pensioner', 'can', 'submit', 'annual', 'life', 'certificate', 'using', 'doorstep', 'banking']",jeevan pramaan how pensioner can submit annual life certificate using doorstep banking
"['realty', 'sector', 'sentiment', 'dips', 'marginally', 'but', 'remains', 'optimistic', 'with', 'indian', 'economys', 'resilience']",realty sector sentiment dips marginally but remains optimistic with indian economys resilience
"['world', 'champion', 'arm', 'wrestler', 'margaret', 'pathaw', 'gets', 'rs', '5', 'lakh', 'award', 'from', 'meghalaya', 'govt']",world champion arm wrestler margaret pathaw gets rs 5 lakh award from meghalaya govt
"['how', 'to', 'merge', 'two', 'or', 'more', 'epf', 'accounts']",how to merge two or more epf accounts
"['arvind', 'kejriwal', 'wants', 'lakshmi', 'and', 'ganesh', 'images', 'too', 'on', 'currency', 'notes']",arvind kejriwal wants lakshmi and ganesh images too on currency notes
"['sbi', 'indian', 'banks', 'special', 'fd', 'schemes', 'with', 'higher', 'interest', 'rates', 'to', 'end', 'soon']",sbi indian banks special fd schemes with higher interest rates to end soon
"['crypto', 'prices', 'today', 'live', 'news', 'bitcoin', 'dogecoin', 'ethereum', 'shibha', 'inu', 'cryptocurrency', 'latest', 'updates', '27', '0ctober', '2022']",crypto prices today live news bitcoin dogecoin ethereum shibha inu cryptocurrency latest updates 27 0ctober 2022
"['omega', 'x', 'verbally', 'abused', 'by', 'spire', 'entertainments', 'ceo', 'video', 'sparks', 'fan', 'outrage']",omega x verbally abused by spire entertainments ceo video sparks fan outrage
