headlines,headline_text
"['bogtui', 'is', 'no', 'west', 'bengal', 'production', 'of', 'west', 'side', 'story']",bogtui is no west bengal production of west side story
"['key', 'triggers', 'that', 'can', 'bring', '20', 'upside', 'to', 'this', 'jhunjhunwala', 'stock']",key triggers that can bring 20 upside to this jhunjhunwala stock
"['icai', 'working', 'on', 'paper', 'on', 'cryptocurrency', 'assets']",icai working on paper on cryptocurrency assets
"['view', 'the', 'concept', 'of', 'an', 'integrated', 'indirect', 'tax', 'regime', 'under', 'gst', 'has', 'evidently', 'hit', 'a', 'critical', 'roadblock']",view the concept of an integrated indirect tax regime under gst has evidently hit a critical roadblock
"['sonia', 'holds', 'more', 'meetings', 'with', 'congress', 'change', 'seekers']",sonia holds more meetings with congress change seekers
"['mandhana', 'bhatia', 'rise', 'in', 'women', 'odi', 'rankings', 'mithali', 'slips']",mandhana bhatia rise in women odi rankings mithali slips
"['nbfcs', 'seek', 'extension', 'of', 'subsidy', 'under', 'pm', 'housing', 'for', 'two', 'years']",nbfcs seek extension of subsidy under pm housing for two years
"['elss', 'vs', 'the', 'rest', 'how', 'to', 'decide', 'on', 'where', 'to', 'invest', 'to', 'save', 'taxes']",elss vs the rest how to decide on where to invest to save taxes
"['ofbusiness', 'joins', 'ola', 'and', 'inmobi', 'in', 'a', 'special', 'club', 'of', 'unicorns']",ofbusiness joins ola and inmobi in a special club of unicorns
"['sensex', 'up', 'over', '200', 'points', 'nifty', 'trends', 'at', '17377', 'points', 'dr', 'reddys', 'divis', 'labs', 'hindalco', 'itc', 'and', 'bajaj', 'finance', 'top', 'gainers']",sensex up over 200 points nifty trends at 17377 points dr reddys divis labs hindalco itc and bajaj finance top gainers
"['will', 'ensure', 'no', 'toll', 'plazas', 'within', '60', 'km', 'on', 'highways', 'says', 'gadkari']",will ensure no toll plazas within 60 km on highways says gadkari
"['bookmyshow', 'bags', 'exclusive', 'ticketing', 'rights', 'for', 'ipl', '2022']",bookmyshow bags exclusive ticketing rights for ipl 2022
"['income', 'tax', 'department', 'raids', 'hero', 'motorcorp', 'premises']",income tax department raids hero motorcorp premises
"['vahdam', 'india', 'appoints', 'kalpesh', 'tiwari', 'as', 'chief', 'hro']",vahdam india appoints kalpesh tiwari as chief hro
"['virat', 'kohli', 'invests', 'in', 'rage', 'coffee']",virat kohli invests in rage coffee
