headlines,headline_text
"['us', 'president', 'joe', 'biden', 'to', 'announce', '900', 'million', 'ev', 'plan', 'at', 'detroit', 'auto', 'show', 'details', 'here']",us president joe biden to announce 900 million ev plan at detroit auto show details here
"['sc', 'allows', 'bcci', 'to', 'amend', 'constitution', 'concerning', 'tenure', 'of', 'its', 'office', 'bearers']",sc allows bcci to amend constitution concerning tenure of its office bearers
"['agnipath', 'scheme', 'punjab', 'cm', 'bhagwant', 'mann', 'assures', 'support', 'to', 'army', 'recruitment', 'drives']",agnipath scheme punjab cm bhagwant mann assures support to army recruitment drives
"['heavy', 'rain', 'likely', 'in', 'parts', 'of', 'rajasthan', 'during', 'next', '48', 'hours']",heavy rain likely in parts of rajasthan during next 48 hours
"['realme', 'c30s', 'launched', 'in', 'india', 'check', 'price', 'specifications', 'and', 'where', 'to', 'buy']",realme c30s launched in india check price specifications and where to buy
"['police', 'officer', 'in', 'mumbai', 'held', 'for', 'stalking', 'assaulting', 'sending', 'lewd', 'messages', 'to', 'his', 'woman', 'colleague']",police officer in mumbai held for stalking assaulting sending lewd messages to his woman colleague
"['airtel', 'ibm', 'team', 'up', 'to', 'bring', 'secure', 'edge', 'cloud', 'services', 'to', 'local', 'enterprises']",airtel ibm team up to bring secure edge cloud services to local enterprises
"['operation', 'kichad', 'congress', 'slams', 'bjp', 'says', 'goa', 'mlas', 'crossover', 'fast', 'tracked', 'due', 'to', 'yatra', 'success']",operation kichad congress slams bjp says goa mlas crossover fast tracked due to yatra success
"['indian', 'navy', 'revives', 'training', 'centre', 'at', 'j', 'ks', 'manasbal', 'lake', 'after', '33', 'years']",indian navy revives training centre at j ks manasbal lake after 33 years
"['chiles', 'queulat', 'national', 'park', 'mountain', 'glacier', 'collapses', 'amid', 'soaring', 'temperatures', 'see', 'details']",chiles queulat national park mountain glacier collapses amid soaring temperatures see details
"['want', 'to', 'study', 'at', 'the', 'top', '5', 'universities', 'in', 'the', 'us']",want to study at the top 5 universities in the us
"['new', 'iqoo', 'z6', 'lite', 'is', 'here', 'price', 'specifications', 'and', 'more']",new iqoo z6 lite is here price specifications and more
"['delhi', 'consumers', 'to', 'get', 'power', 'subsidy', 'only', 'if', 'its', 'opted', 'heres', 'how', 'you', 'can', 'apply', 'for', 'subsidy']",delhi consumers to get power subsidy only if its opted heres how you can apply for subsidy
"['trailingspouse', 'this', 'start', 'up', 'boss', 'didnt', 'think', 'twice', 'moved', 'to', 'manila', 'to', 'support', 'his', 'wifes', 'career']",trailingspouse this start up boss didnt think twice moved to manila to support his wifes career
"['karnataka', 'aims', 'to', 'convert', '35000', 'buses', 'into', 'electric', 'by', '2030']",karnataka aims to convert 35000 buses into electric by 2030
"['queen', 'elizabeth', 'iis', 'coffin', 'arrives', 'at', 'buckingham', 'palace', 'read', 'details']",queen elizabeth iis coffin arrives at buckingham palace read details
"['tech', 'view', 'nifty50', 'recoups', 'losses', 'forms', 'bullish', 'candle', 'to', 'reclaim', '18k', 'what', 'should', 'investors', 'do', 'on', 'thursday']",tech view nifty50 recoups losses forms bullish candle to reclaim 18k what should investors do on thursday
"['nokia', '5710', 'xpressaudio', 'launches', 'in', 'india', 'here', 'are', 'the', 'details']",nokia 5710 xpressaudio launches in india here are the details
"['this', 'tyre', 'stock', 'hovering', 'at', '52', 'week', 'high', 'still', 'has', 'more', 'room', 'to', 'run']",this tyre stock hovering at 52 week high still has more room to run
"['speakers', 'word', 'of', 'caution', 'to', 'cong', 'mla', 'irks', 'assam', 'opp', 'party']",speakers word of caution to cong mla irks assam opp party
"['want', 'number', 'of', 'indian', 'students', 'in', 'france', 'to', 'climb', 'to', '20000', 'by', '2025', 'french', 'minister']",want number of indian students in france to climb to 20000 by 2025 french minister
"['deshbhakti', 'curriculum', 'helping', 'students', 'understand', 'various', 'aspects', 'of', 'patriotism', 'delhi', 'dy', 'cm', 'sisodia']",deshbhakti curriculum helping students understand various aspects of patriotism delhi dy cm sisodia
"['pm', 'narendra', 'modi', 'is', 'quicker', 'than', 'cheetah', 'when', 'evading', 'issues', 'aimim', 'chief', 'asaduddin', 'owaisi']",pm narendra modi is quicker than cheetah when evading issues aimim chief asaduddin owaisi
"['sensex', 'nifty', 'end', 'lower', 'as', 'd', 'street', 'bulls', 'take', 'a', 'breather', 'after', '4', 'days']",sensex nifty end lower as d street bulls take a breather after 4 days
"['modi', 'xi', 'putin', 'among', 'top', 'leaders', 'to', 'attend', 'first', 'in', 'person', 'sco', 'summit', 'after', 'covid']",modi xi putin among top leaders to attend first in person sco summit after covid
"['when', 'will', 'govt', 'restore', 'status', 'quo', 'ante', 'congress', 'on', 'ladakh', 'border', 'row', 'with', 'china']",when will govt restore status quo ante congress on ladakh border row with china
"['this', 'fund', 'manager', 'is', 'ready', 'to', 'deploy', 'fresh', 'funds', 'in', 'financials', 'it', 'heres', 'why']",this fund manager is ready to deploy fresh funds in financials it heres why
"['looming', 'food', 'crisis', 'worries', 'red', 'cross', 'other', 'agencies', 'in', 'flood', 'hit', 'pakistan']",looming food crisis worries red cross other agencies in flood hit pakistan
"['queen', 'elizabeths', 'final', 'journey', 'sets', 'record', 'for', 'most', 'tracked', 'flight', 'in', 'history', 'details', 'here']",queen elizabeths final journey sets record for most tracked flight in history details here
"['india', 'france', 'to', 'work', 'towards', 'setting', 'up', 'indo', 'pacific', 'trilateral', 'development', 'cooperation', 'eam']",india france to work towards setting up indo pacific trilateral development cooperation eam
"['the', 'bachelorette', 'finale', 'part', '1', 'rachel', 'gabby', 'introduce', 'remaining', 'suitors', 'to', 'families', 'check', 'out', 'what', 'happened']",the bachelorette finale part 1 rachel gabby introduce remaining suitors to families check out what happened
"['goa', 'eight', 'congress', 'mlas', 'to', 'join', 'bjp', 'confirms', 'state', 'party', 'chief', 'sadanand', 'shet', 'tanavade']",goa eight congress mlas to join bjp confirms state party chief sadanand shet tanavade
"['india', 'aims', 'to', 'leapfrog', 'in', 'quantum', 'technology', 'with', 'industrys', 'help', 'mos', 'it']",india aims to leapfrog in quantum technology with industrys help mos it
"['mumbai', 'residents', 'to', 'get', 'free', 'healthcare', 'facilities', 'from', 'next', 'month', 'announces', 'cm', 'eknath', 'shinde']",mumbai residents to get free healthcare facilities from next month announces cm eknath shinde
"['sikkim', 'govt', 'hikes', 'minimum', 'wage', 'by', '67']",sikkim govt hikes minimum wage by 67
"['apple', 'is', 'giving', 'free', 'airpods', 'with', 'ipads', 'macs', 'under', 'this', 'special', 'offer', 'check', 'if', 'youre', 'eligible']",apple is giving free airpods with ipads macs under this special offer check if youre eligible
"['blake', 'shelton', 'gwen', 'stefanis', 'marriage', 'see', 'how', 'singer', 'has', 'saved', 'wifes', 'number', 'on', 'his', 'phone']",blake shelton gwen stefanis marriage see how singer has saved wifes number on his phone
"['video', 'ai', 'startup', 'awiros', 'raises', '7', 'million', 'in', 'series', 'a', 'funding']",video ai startup awiros raises 7 million in series a funding
"['tata', 'power', 'to', 'develop', '4', 'mwp', 'solar', 'project', 'at', 'pune', 'plant']",tata power to develop 4 mwp solar project at pune plant
"['why', 'insurance', 'stocks', 'could', 'be', 'the', 'next', 'multibaggers', 'which', 'are', 'the', 'best', 'bets']",why insurance stocks could be the next multibaggers which are the best bets
"['flood', 'like', 'a', 'situation', 'highlights', 'how', 'cities', 'must', 'adapt', 'to', 'climate', 'change']",flood like a situation highlights how cities must adapt to climate change
"['looking', 'for', 'a', 'job', 'in', 'uae', 'here', 'are', 'the', '15', 'most', 'sought', 'after', 'roles', 'in', 'uae']",looking for a job in uae here are the 15 most sought after roles in uae
"['fire', 'emblem', 'engage', 'see', 'the', 'story', 'gameplay', 'launch', 'date']",fire emblem engage see the story gameplay launch date
"['former', 'us', 'president', 'bill', 'clintons', 'impeachment', 'investigator', 'ken', 'starr', 'dies', 'at', 'age', 'of', '76']",former us president bill clintons impeachment investigator ken starr dies at age of 76
"['with', 'the', 'merge', 'underway', 'whats', 'in', 'store', 'for', 'ethereum']",with the merge underway whats in store for ethereum
"['canara', 'bank', 'hikes', 'loan', 'interest', 'rates', 'check', 'late', 'rates', 'here']",canara bank hikes loan interest rates check late rates here
"['ambuja', 'cement', 'shares', 'climb', 'over', '7', 'hit', '52', 'week', 'high']",ambuja cement shares climb over 7 hit 52 week high
"['pvr', 'inox', 'leisure', 'rally', 'up', 'to', '7', 'as', 'cci', 'rejects', 'complaint', 'against', 'proposed', 'merger']",pvr inox leisure rally up to 7 as cci rejects complaint against proposed merger
"['jacob', 'lofland', 'joins', 'the', 'cast', 'of', 'joaquin', 'phoenix', 'starrer', 'joker', 'folie', 'a', 'deux']",jacob lofland joins the cast of joaquin phoenix starrer joker folie a deux
"['10', 'best', 'travel', 'credit', 'cards']",10 best travel credit cards
"['bill', 'gates', 'lauds', 'womens', 'empowerment', 'digital', 'bank', 'accounts', 'in', 'india']",bill gates lauds womens empowerment digital bank accounts in india
"['total', 'wage', 'rate', 'for', 'tea', 'estate', 'workers', 'in', 'assam', 'to', 'increase', 'by', '9']",total wage rate for tea estate workers in assam to increase by 9
"['700', 'acres', 'land', 'worth', 'usd', '1', '1', 'billion', 'acquired', 'in', 'h1', '2022', 'report']",700 acres land worth usd 1 1 billion acquired in h1 2022 report
"['breath', 'analyser', 'tests', 'for', 'aviation', 'personnel', 'to', 'continue', 'as', 'per', 'dgca', 'guidelines', 'delhi', 'hc']",breath analyser tests for aviation personnel to continue as per dgca guidelines delhi hc
"['indian', 'origin', 'artists', 'are', 'working', 'on', 'a', 'giant', 'mural', 'in', 'london', 'to', 'honour', 'the', 'queen']",indian origin artists are working on a giant mural in london to honour the queen
"['why', 'financial', 'literacy', 'is', 'important', 'for', 'everyone']",why financial literacy is important for everyone
"['cfo', 'explains', 'why', 'raymond', 'is', 'extremely', 'bullish', 'on', 'textile', 'realty', 'other', 'business', 'segments']",cfo explains why raymond is extremely bullish on textile realty other business segments
"['towards', 'a', 'safer', 'crypto', 'world', 'helios', 'group', 'to', 'list', 'pnp', 'coin', 'on', 'its', 'new', 'regulated', 'heliosdax', 'exchange']",towards a safer crypto world helios group to list pnp coin on its new regulated heliosdax exchange
"['six', 'pak', 'nationals', 'held', 'with', 'drugs', 'worth', 'rs', '200', 'cr', 'off', 'gujarat', 'coast']",six pak nationals held with drugs worth rs 200 cr off gujarat coast
"['indian', 'railways', 'launches', 'navratri', 'special', 'bharat', 'gaurav', 'train', 'on', 'delhi', 'katra', 'route']",indian railways launches navratri special bharat gaurav train on delhi katra route
"['bts', 'star', 'kim', 'tae', 'hyung', 'gets', 'featured', 'on', 'koreas', 'vogue', 'magazine', 'cover', 'check', 'out', 'the', 'details']",bts star kim tae hyung gets featured on koreas vogue magazine cover check out the details
"['want', 'to', 'apply', 'for', 'business', 'loan', 'here', 'is', 'a', 'checklist', 'of', 'documents', 'you', 'will', 'need']",want to apply for business loan here is a checklist of documents you will need
"['rbi', 'could', 'raise', 'rates', 'by', '35', '50', 'basis', 'points', 'on', 'september', '30', 'analysts']",rbi could raise rates by 35 50 basis points on september 30 analysts
"['global', 'economy', 'may', 'avoid', 'recession', 'as', 'inflation', 'risks', 'ease', 'jp', 'morgan']",global economy may avoid recession as inflation risks ease jp morgan
"['flush', 'nasal', 'cavity', 'with', 'mild', 'saline', 'solution', 'twice', 'a', 'day', 'to', 'reduce', 'covid', 'severity']",flush nasal cavity with mild saline solution twice a day to reduce covid severity
"['coffee', 'day', 'shares', 'rally', '11', 'on', 'huge', 'volumes']",coffee day shares rally 11 on huge volumes
"['vedanta', 'foxconn', 'project', 'wont', 'be', 'surprised', 'if', 'mumbai', 'goes', 'to', 'gujarat', 'says', 'maha', 'congress', 'chief']",vedanta foxconn project wont be surprised if mumbai goes to gujarat says maha congress chief
"['hc', 'directs', 'swamy', 'to', 'handover', 'government', 'bungalows', 'possession', 'to', 'estate', 'officer', 'in', 'six', 'weeks']",hc directs swamy to handover government bungalows possession to estate officer in six weeks
"['top', '5', 'reasons', 'for', 'accidents', 'in', 'indian', 'cities', 'like', 'delhi', 'mumbai', 'bengaluru', 'chennai', 'and', 'hyderabad']",top 5 reasons for accidents in indian cities like delhi mumbai bengaluru chennai and hyderabad
"['why', 'icici', 'securities', 'is', 'bullish', 'on', 'power', 'and', 'capital', 'goods', 'stocks']",why icici securities is bullish on power and capital goods stocks
"['dgca', 'set', 'to', 'restore', 'breath', 'analyser', 'test', 'for', 'aircraft', 'personnel', 'from', 'oct', '15']",dgca set to restore breath analyser test for aircraft personnel from oct 15
"['how', 'to', 'revive', 'your', 'struggling', 'cloud', 'kitchen', 'business']",how to revive your struggling cloud kitchen business
"['bank', 'of', 'baroda', 'hikes', 'fd', 'interest', 'rate', 'by', 'up', 'to', '20', 'bps']",bank of baroda hikes fd interest rate by up to 20 bps
"['after', 'short', 'term', 'strength', 'see', 'downside', 'risk', 'in', 'nifty', 'rohit', 'srivastava']",after short term strength see downside risk in nifty rohit srivastava
"['bank', 'fraud', 'ed', 'seizes', 'over', '430', 'kgs', 'gold', 'silver', 'after', 'searches', 'at', 'private', 'lockers']",bank fraud ed seizes over 430 kgs gold silver after searches at private lockers
"['fast', 'transition', 'to', 'clean', 'energy', 'cheaper', 'than', 'slow', 'or', 'no', 'transition', 'claims', 'oxford', 'study']",fast transition to clean energy cheaper than slow or no transition claims oxford study
"['bjp', 'tried', 'to', 'buy', '10', 'punjab', 'aap', 'mlas', 'for', 'rs', '25', 'crore', 'each', 'says', 'arvind', 'kejriwal']",bjp tried to buy 10 punjab aap mlas for rs 25 crore each says arvind kejriwal
"['no', 'disruption', 'in', 'singapores', 'rice', 'supply', 'from', 'india', 'report']",no disruption in singapores rice supply from india report
"['early', 'trends', 'suggest', 'harsha', 'engineers', 'may', 'see', 'gravity', 'defying', 'listing']",early trends suggest harsha engineers may see gravity defying listing
"['alphaville', 'my', 'life', 'to', 'live', 'a', 'woman', 'is', 'a', 'woman', '5', 'films', 'from', 'cinematic', 'genius', 'jean', 'luc', 'godard']",alphaville my life to live a woman is a woman 5 films from cinematic genius jean luc godard
"['land', 'deals', 'worth', '1', '1', 'bn', 'closed', 'in', 'jan', 'jun', 'across', 'top', '8', 'cities', 'cii', 'cbre']",land deals worth 1 1 bn closed in jan jun across top 8 cities cii cbre
"['wealthtech', 'startup', 'centricity', 'raises', '4', 'million', 'in', 'funding', 'led', 'by', 'burman', 'family', 'office']",wealthtech startup centricity raises 4 million in funding led by burman family office
"['railway', 'warehouse', 'workers', 'union', 'working', 'on', 'plan', 'to', 'ensure', 'govt', 'benefits', 'for', 'members']",railway warehouse workers union working on plan to ensure govt benefits for members
"['idol', 'makers', 'mandap', 'decorators', 'back', 'in', 'vogue', 'after', 'muted', 'demand', 'during', 'covid', 'years']",idol makers mandap decorators back in vogue after muted demand during covid years
"['financial', 'infrastructure', 'startup', 'm2p', 'bets', 'big', 'on', 'lending', 'launches', 'core', 'lending', 'stack']",financial infrastructure startup m2p bets big on lending launches core lending stack
"['google', 'announces', 'ios', '16', 'lock', 'screen', 'widgets', 'for', 'chrome', 'drive', 'gmail']",google announces ios 16 lock screen widgets for chrome drive gmail
"['ted', 'lasso', 'star', 'jason', 'sudeikis', 'gets', 'best', 'actor', 'emmy', 'award', 'says', 'im', 'truly', 'surprised', 'and', 'flattered']",ted lasso star jason sudeikis gets best actor emmy award says im truly surprised and flattered
"['electric', '2ws', '3ws', 'may', 'lap', 'up', 'major', 'chunk', 'of', 'total', 'sales', 'pie', 'by', '2030', 'report']",electric 2ws 3ws may lap up major chunk of total sales pie by 2030 report
"['why', 'are', 'you', 'hesitating', 'to', 'get', 'into', 'manufacturing', 'fm', 'nirmala', 'sitharaman', 'asks', 'india', 'inc']",why are you hesitating to get into manufacturing fm nirmala sitharaman asks india inc
"['bengal', 'lawless', 'under', 'mamata', 'banerjee', 'led', 'government', 'curbing', 'democratic', 'rights', 'bjp']",bengal lawless under mamata banerjee led government curbing democratic rights bjp
"['jimmy', 'kimmel', 'faces', 'flak', 'for', 'stealing', 'quinta', 'brunsons', 'glorious', 'moment', 'see', 'what', 'happened']",jimmy kimmel faces flak for stealing quinta brunsons glorious moment see what happened
"['happy', 'birthday', 'suryakumar', 'yadav', 'some', 'lesser', 'known', 'important', 'facts', 'about', 'the', 'indian', 'cricketer']",happy birthday suryakumar yadav some lesser known important facts about the indian cricketer
"['happy', 'birthday', 'ayushmann', 'khurrana', 'all', 'about', 'actors', 'life', 'upcoming', 'projects']",happy birthday ayushmann khurrana all about actors life upcoming projects
"['vedanta', 'surges', 'over', '13', 'as', 'company', 'to', 'set', 'up', 'iphone', 'manufacturing', 'hub', 'in', 'maharashtra']",vedanta surges over 13 as company to set up iphone manufacturing hub in maharashtra
"['auto', 'sector', 'should', 'target', '100', 'electrification', 'in', '2', '3', 'wheeler', 'segments', 'in', 'next', 'four', 'years', 'amitabh', 'kant']",auto sector should target 100 electrification in 2 3 wheeler segments in next four years amitabh kant
"['countdown', 'begins', 'flipkart', 'amazon', 'gear', 'up', 'for', 'festive', 'battle']",countdown begins flipkart amazon gear up for festive battle
"['snake', 'catcher', 'in', 'rajasthan', 'dies', 'within', 'minutes', 'after', 'being', 'bitten', 'by', 'a', 'cobra']",snake catcher in rajasthan dies within minutes after being bitten by a cobra
"['gavaskar', 'comes', 'to', 'harshal', 'patels', 'defence', 'after', 'fan', 'says', 'bowler', 'will', 'give', 'away', 'runs', 'in', 't20', 'world', 'cup']",gavaskar comes to harshal patels defence after fan says bowler will give away runs in t20 world cup
"['urvashi', 'rautela', 'seemingly', 'apologises', 'to', 'rishabh', 'pant', 'twitter', 'has', 'a', 'field', 'day']",urvashi rautela seemingly apologises to rishabh pant twitter has a field day
"['better', 'call', 'saul', 'star', 'bob', 'odenkirk', 'says', 'thank', 'you', 'generously', 'after', 'getting', 'snubbed', 'at', 'emmy', 'awards', 'see', 'details']",better call saul star bob odenkirk says thank you generously after getting snubbed at emmy awards see details
"['green', 'mobility', 'to', 'play', 'key', 'role', 'in', 'indias', 'decarbonisation', 'niti', 'ceo', 'iyer']",green mobility to play key role in indias decarbonisation niti ceo iyer
"['suprsend', 'raises', '1', '0', 'million', 'to', 'help', 'developers', 'build', 'product', 'notifications', 'centrally']",suprsend raises 1 0 million to help developers build product notifications centrally
"['realty', 'developers', 'continue', 'to', 'expand', 'malls', 'portfolio', 'on', 'robust', 'demand']",realty developers continue to expand malls portfolio on robust demand
"['ithink', 'logistics', 'launches', 'cross', 'border', 'services', 'for', 'indian', 'e', 'commerce', 'sellers']",ithink logistics launches cross border services for indian e commerce sellers
"['harsha', 'engineers', 'ipo', 'opens', 'today', 'grey', 'market', 'premium', 'is', 'at', '210']",harsha engineers ipo opens today grey market premium is at 210
"['board', 'of', 'directors', 'appoints', 'sanjay', 'gupta', 'as', 'ceo', 'of', 'ncml']",board of directors appoints sanjay gupta as ceo of ncml
"['vedanta', 'foxconn', 'to', 'set', 'up', 'fab', 'chip', 'facility', 'in', 'gujarat']",vedanta foxconn to set up fab chip facility in gujarat
"['russia', 'to', 'soon', 'begin', 'e', 'visas', 'for', 'indians', 'mulls', 'visa', 'free', 'regime']",russia to soon begin e visas for indians mulls visa free regime
"['maruti', 'suzuki', 'executive', 'chairman', 'wants', 'auto', 'components', 'industry', 'to', 'focus', 'on', 'enhancing', 'localisation']",maruti suzuki executive chairman wants auto components industry to focus on enhancing localisation
"['buy', 'tata', 'motors', 'target', 'price', 'rs', '510', 'prabhudas', 'lilladher']",buy tata motors target price rs 510 prabhudas lilladher
"['sea', 'of', 'red', 'it', 'index', 'crashes', 'another', '3', 'time', 'to', 'buy', 'the', 'dip']",sea of red it index crashes another 3 time to buy the dip
"['apple', 'ios', '16', 'release', 'date', 'of', 'new', 'operating', 'system', 'and', 'more', 'all', 'you', 'need', 'to', 'know']",apple ios 16 release date of new operating system and more all you need to know
"['byjus', 'final', 'audited', 'accounts', 'may', 'lower', 'revenue', 'numbers']",byjus final audited accounts may lower revenue numbers
"['day', 'during', 'april', 'august', 'morth']",day during april august morth
"['goldman', 'sachs', 'likely', 'to', 'start', 'cutting', 'hundreds', 'of', 'jobs', 'this', 'month', 'heres', 'why']",goldman sachs likely to start cutting hundreds of jobs this month heres why
"['consumers', 'in', 'delhi', 'can', 'give', 'missed', 'call', 'to', 'opt', 'for', 'power', 'subsidy', 'from', 'today', 'says', 'arvind', 'kejriwal']",consumers in delhi can give missed call to opt for power subsidy from today says arvind kejriwal
"['gujarat', 'apollo', 'extends', 'gains', 'zooms', '18', 'on', 'forming', 'jv', 'with', 'keestrack']",gujarat apollo extends gains zooms 18 on forming jv with keestrack
"['ayesha', 'jhulka', 'was', 'reluctant', 'to', 'make', 'a', 'comeback', 'but', 'hush', 'hush', 'director', 'tanuja', 'chandra', 'persuaded', 'her']",ayesha jhulka was reluctant to make a comeback but hush hush director tanuja chandra persuaded her
"['buy', 'angel', 'one', 'target', 'price', 'rs', '1865', 'hdfc', 'securities']",buy angel one target price rs 1865 hdfc securities
"['get', 'your', 'hawkins', 'fix', 'from', 'this', 'stranger', 'things', 'themed', 'caf', 'in', 'japan']",get your hawkins fix from this stranger things themed caf in japan
"['rick', 'and', 'morty', 'season', '6', 'know', 'release', 'date', 'and', 'where', 'to', 'watch']",rick and morty season 6 know release date and where to watch
"['7', 'realty', 'and', 'auto', 'stocks', 'to', 'bet', 'on', 'now', 'hemang', 'jani']",7 realty and auto stocks to bet on now hemang jani
"['sbi', 'm', 'cap', 'hits', 'rs', '5', 'lakh', 'crore', 'mark', 'as', 'shares', 'scale', 'fresh', 'record', 'high']",sbi m cap hits rs 5 lakh crore mark as shares scale fresh record high
"['buy', 'sbi', 'cards', 'and', 'payment', 'services', 'target', 'price', 'rs', '1265', 'hdfc', 'securities']",buy sbi cards and payment services target price rs 1265 hdfc securities
"['maharashtras', 'hirpodi', 'village', 'turns', 'a', 'barren', 'hill', 'into', 'a', 'forest', 'with', 'the', 'help', 'of', 'contour', 'trenches', 'and', 'drought', 'tolerant', 'trees']",maharashtras hirpodi village turns a barren hill into a forest with the help of contour trenches and drought tolerant trees
"['rachel', 'bloom', 'joins', 'the', 'cast', 'of', 'hbo', 'maxs', 'julia', 'season', 'two']",rachel bloom joins the cast of hbo maxs julia season two
"['buy', 'brigade', 'enterprises', 'target', 'price', 'rs', '619', 'hdfc', 'securities']",buy brigade enterprises target price rs 619 hdfc securities
"['india', 'is', 'anti', 'fragile', 'if', 'the', 'world', 'markets', 'go', 'up', '1x', 'after', 'fall', 'we', 'will', 'go', 'up', '1', '5x', 'ravi', 'dharamshi']",india is anti fragile if the world markets go up 1x after fall we will go up 1 5x ravi dharamshi
"['50', 'year', 'old', 'woman', 'arrested', 'in', 'mumbai', 'for', 'abusive', 'facebook', 'comments', 'on', 'devendra', 'fadnavis', 'wife']",50 year old woman arrested in mumbai for abusive facebook comments on devendra fadnavis wife
"['chhatrapati', 'shivajiraje', 'bhosale', 'a', '12th', 'generation', 'descendant', 'of', 'chhatrapati', 'shivaji', 'maharaj', 'passes', 'away', 'in', 'pune']",chhatrapati shivajiraje bhosale a 12th generation descendant of chhatrapati shivaji maharaj passes away in pune
"['redbus', 'karix', 'partner', 'to', 'launch', 'lts', 'service', 'on', 'whatsapp']",redbus karix partner to launch lts service on whatsapp
"['buy', 'sun', 'pharmaceutical', 'industries', 'target', 'price', 'rs', '1050', 'centrum', 'broking']",buy sun pharmaceutical industries target price rs 1050 centrum broking
"['this', 'london', 'bank', 'had', 'a', 'book', 'full', 'of', 'sexual', 'jokes', 'about', 'women', 'which', 'was', 'read', 'christmas', 'office', 'party', 'every', 'year']",this london bank had a book full of sexual jokes about women which was read christmas office party every year
