headlines,headline_text
"['pm', 'modi', 'declares', 'modhera', 'indias', '1st', '24x7', 'solar', 'powered', 'village']",pm modi declares modhera indias 1st 24x7 solar powered village
"['this', 'world', 'mental', 'health', 'day', 'lets', 'unlock', 'the', 'behavioural', 'effects', 'of', 'lockdown']",this world mental health day lets unlock the behavioural effects of lockdown
"['amit', 'shah', 'northeast', 'culture', 'is', 'indias', 'heritage']",amit shah northeast culture is indias heritage
"['nia', 'search', 'in', 'tamil', 'nadu', 'over', 'suspected', 'ltte', 'links']",nia search in tamil nadu over suspected ltte links
"['time', 'to', 'wean', 'india', 'off', 'imported', 'energy']",time to wean india off imported energy
"['binance', 'crypto', 'exchange', 'attacked', 'by', 'hacker', 'loses', 'over', '100', 'million']",binance crypto exchange attacked by hacker loses over 100 million
"['india', 'beat', 'south', 'africa', 'to', 'win', 'dicc', 't20', 'champions', 'trophy', '2022']",india beat south africa to win dicc t20 champions trophy 2022
"['mental', 'health', 'day', 'need', 'more', 'psychiatrists', 'and', 'support', 'system', 'say', 'experts']",mental health day need more psychiatrists and support system say experts
"['ukraine', 'conflict', 'does', 'not', 'serve', 'interests', 'of', 'anybody', 'eam', 'jaishankar']",ukraine conflict does not serve interests of anybody eam jaishankar
"['easy', 'trip', 'planners', 'rises', 'over', '6', 'as', 'firm', 'announces', 'stock', 'split', 'bonus', 'issue']",easy trip planners rises over 6 as firm announces stock split bonus issue
"['eknath', 'shinde', 'camp', 'working', 'at', 'bjps', 'behest', 'uddhav', 'thackeray']",eknath shinde camp working at bjps behest uddhav thackeray
