headlines,headline_text
"['little', 'ranbir', 'kapoor', 'boys', 'uncanny', 'resemblance', 'to', 'actor', 'surprises', 'netizens']",little ranbir kapoor boys uncanny resemblance to actor surprises netizens
"['doc', 'martin', 'when', 'is', 'the', 'final', 'episode', 'going', 'to', 'be', 'aired', 'on', 'tv']",doc martin when is the final episode going to be aired on tv
"['india', 'can', 'accelerate', 'green', 'investments', 'to', 'usd', '12', '1', 'trillion', 'by', '2050']",india can accelerate green investments to usd 12 1 trillion by 2050
"['whats', 'not', 'on', 'rishi', 'sunaks', 'to', 'do', 'list', 'ending', 'racism']",whats not on rishi sunaks to do list ending racism
"['were', 'confident', 'he', 'will', 'do', 'his', 'best', 'for', 'the', 'people', 'of', 'the', 'uk', 'says', 'infosys', 'founder', 'narayana', 'murthy']",were confident he will do his best for the people of the uk says infosys founder narayana murthy
"['president', 'xi', 'jinping', 'visits', 'maos', 'revolutionary', 'base', 'as', 'he', 'vows', 'to', 'make', 'china', 'a', 'modern', 'socialist', 'country']",president xi jinping visits maos revolutionary base as he vows to make china a modern socialist country
"['american', 'singer', 'pianist', 'jerry', 'lee', 'lewis', 'alive', 'after', 'being', 'falsely', 'reported', 'to', 'be', 'dead']",american singer pianist jerry lee lewis alive after being falsely reported to be dead
"['cbdt', 'extends', 'deadline', 'for', 'filing', 'tds', 'for', 'non', 'salary', 'transactions', 'till', 'november', '30']",cbdt extends deadline for filing tds for non salary transactions till november 30
"['dr', 'reddys', 'q2', 'preview', 'high', 'base', 'to', 'play', 'spoilsport', 'outlook', 'for', 'us', 'russia', 'in', 'focus']",dr reddys q2 preview high base to play spoilsport outlook for us russia in focus
"['historic', 'decision', 'red', 'letter', 'day', 'bccis', 'pay', 'equity', 'decision', 'wins', 'hearts', 'of', 'smriti', 'irani', 'sachin', 'tendulkar', 'mithali', 'raj', 'and', 'more']",historic decision red letter day bccis pay equity decision wins hearts of smriti irani sachin tendulkar mithali raj and more
"['jsw', 'steels', 'us', 'unit', 'raises', '182', 'million', 'debt', 'to', 'upgrade', 'texas', 'plant', 'stock', 'climbs', '5', '44']",jsw steels us unit raises 182 million debt to upgrade texas plant stock climbs 5 44
"['bse', 'technologies', 'announces', 'launch', 'of', 'kyc', 'registration', 'agency']",bse technologies announces launch of kyc registration agency
"['why', 'are', 'fans', 'teasing', 'rishabh', 'pant', 'with', 'urvashi', 'rautelas', 'name']",why are fans teasing rishabh pant with urvashi rautelas name
"['zombie', 'angelina', 'jolies', 'shocking', 'revelation', 'iranian', 'girl', 'says', 'she', 'used', 'make', 'up', 'and', 'editing', 'to', 'look', 'like', 'hollywood', 'actress']",zombie angelina jolies shocking revelation iranian girl says she used make up and editing to look like hollywood actress
"['quordle', 'for', 'october', '27', 'hints', 'clues', 'and', 'answers', 'for', 'todays', 'wordy', 'puzzle']",quordle for october 27 hints clues and answers for todays wordy puzzle
"['whatsapp', 'to', 'get', 'more', 'updates', 'may', 'let', 'you', 'forward', 'images', 'and', 'videos', 'with', 'captions']",whatsapp to get more updates may let you forward images and videos with captions
"['coimbatore', 'blast', 'probe', 'handed', 'over', 'to', 'nia']",coimbatore blast probe handed over to nia
"['liger', 'director', 'puri', 'jagannadhs', 'whatsapp', 'audio', 'clip', 'goes', 'viral', 'after', 'distributors', 'threaten', 'to', 'protest', 'outside', 'his', 'house']",liger director puri jagannadhs whatsapp audio clip goes viral after distributors threaten to protest outside his house
"['tata', 'chemicals', 'logs', '3', 'fold', 'jump', 'in', 'q2', 'profit', 'at', 'rs', '628', 'cr']",tata chemicals logs 3 fold jump in q2 profit at rs 628 cr
"['oppo', 'reno', '8', '5g', 'gets', 'a', 'deep', 'price', 'cut', 'check', 'out', 'the', 'latest', 'price', 'and', 'deals', 'here']",oppo reno 8 5g gets a deep price cut check out the latest price and deals here
"['video', 'man', 'proposes', 'to', 'girlfriend', 'in', 'stands', 'during', 'indias', 'match', 'against', 'netherlands']",video man proposes to girlfriend in stands during indias match against netherlands
"['un', 'should', 'take', 'up', 'issue', 'of', 'detentions', 'in', 'kashmir', 'with', 'goi', 'hurriyat']",un should take up issue of detentions in kashmir with goi hurriyat
"['india', 'to', 'see', 'biggest', 'jump', 'in', 'energy', 'demand', 'globally', 'iea']",india to see biggest jump in energy demand globally iea
"['abbott', 'elementary', 'how', 'to', 'watch', 'episode', '6', 'of', 'sitcom', 'tv', 'series', 'free']",abbott elementary how to watch episode 6 of sitcom tv series free
"['woman', 'found', 'in', 'pythons', 'stomach', 'shocker', 'from', 'indonesias', 'jambi', 'province']",woman found in pythons stomach shocker from indonesias jambi province
"['amitabh', 'chaudhry', 'on', 'citi', 'and', 'max', 'life', 'acquisition', 'axis', 'bank', 'building', 'a', 'granular', 'franchise']",amitabh chaudhry on citi and max life acquisition axis bank building a granular franchise
"['samajwadi', 'party', 'leader', 'azam', 'khan', 'sentenced', 'to', 'three', 'years', 'jail', 'in', '2019', 'hate', 'speech', 'case']",samajwadi party leader azam khan sentenced to three years jail in 2019 hate speech case
"['indias', 'per', 'capita', 'ghg', 'emissions', 'far', 'below', 'world', 'average', 'unep', 'report']",indias per capita ghg emissions far below world average unep report
"['railways', 'does', 'not', 'earn', 'profit', 'through', 'passenger', 'trains', 'these', 'services', 'are', 'run', 'for', 'convenience', 'of', 'people', 'raosaheb', 'danve']",railways does not earn profit through passenger trains these services are run for convenience of people raosaheb danve
"['v', 'guard', 'q2', 'net', 'profit', 'dips', '26', '5', 'pc', 'to', 'rs', '43', '6', 'cr', 'revenue', 'up', '8', '7', 'pc', 'to', 'rs', '986', 'cr']",v guard q2 net profit dips 26 5 pc to rs 43 6 cr revenue up 8 7 pc to rs 986 cr
"['wordle', '495', 'october', '27', 'check', 'out', 'the', 'hints', 'and', 'answer', 'for', 'today']",wordle 495 october 27 check out the hints and answer for today
"['renowned', 'producer', 'cum', 'director', 'jules', 'bass', 'dies', 'at', 'age', 'of', '87']",renowned producer cum director jules bass dies at age of 87
"['how', 'hugh', 'jackman', 'decided', 'to', 'return', 'as', 'wolverine', 'for', 'deadpool', '3', 'know', 'here']",how hugh jackman decided to return as wolverine for deadpool 3 know here
"['first', 'test', 'flight', 'of', 'gaganyaan', 'mission', 'in', 'february', 'next', 'year', 'isro', 'official']",first test flight of gaganyaan mission in february next year isro official
"['former', 'tory', 'chairman', 'sir', 'jake', 'berry', 'accuses', 'suella', 'braverman', 'of', 'violating', 'ministerial', 'code', 'multiple', 'times']",former tory chairman sir jake berry accuses suella braverman of violating ministerial code multiple times
"['amid', 'startup', 'funding', 'crunch', 'udaan', 'raises', '120', 'million', 'and', 'plans', 'ipo', 'after', 'a', 'year']",amid startup funding crunch udaan raises 120 million and plans ipo after a year
"['century', 'real', 'estate', 'in', 'talks', 'with', 'global', 'domestic', 'funds', 'to', 'raise', 'over', 'rs', '1000', 'crore']",century real estate in talks with global domestic funds to raise over rs 1000 crore
"['nottingham', 'east', 'mp', 'nadia', 'whittome', 'ordered', 'to', 'delete', 'rishi', 'sunak', 'tweet', 'after', 'social', 'media', 'backlash']",nottingham east mp nadia whittome ordered to delete rishi sunak tweet after social media backlash
"['major', 'items', 'imported', 'from', 'china', 'used', 'for', 'meeting', 'demand', 'of', 'fast', 'growing', 'sectors', 'official']",major items imported from china used for meeting demand of fast growing sectors official
"['sensex', 'climbs', '212', 'points', 'nifty', 'up', '80', 'points', 'as', 'metal', 'stocks', 'sparkle']",sensex climbs 212 points nifty up 80 points as metal stocks sparkle
"['indias', 'textiles', 'sector', 'eyeing', '100', 'billion', 'exports', 'in', '5', '6', 'years', 'piyush', 'goyal']",indias textiles sector eyeing 100 billion exports in 5 6 years piyush goyal
"['iea', 'sees', 'global', 'energy', 'emissions', 'peaking', 'in', '2025']",iea sees global energy emissions peaking in 2025
"['microsoft', 'co', 'founder', 'bill', 'gates', 'visits', 'luxembourg', 'steers', 'clean', 'energy', 'talks', 'with', 'pm', 'xavier', 'bettel', 'and', 'european', 'investment', 'bank']",microsoft co founder bill gates visits luxembourg steers clean energy talks with pm xavier bettel and european investment bank
"['two', 'real', 'estate', 'and', 'others', 'mid', 'cap', 'stocks', 'with', 'upside', 'potential', 'of', 'more', 'than', '25']",two real estate and others mid cap stocks with upside potential of more than 25
"['tamilnad', 'mercantile', 'bank', 'q2', 'results', 'profit', 'jumps', '37', 'yoy', 'to', 'rs', '262', 'crore']",tamilnad mercantile bank q2 results profit jumps 37 yoy to rs 262 crore
"['fpis', 'have', 'sold', 'equities', 'worth', 'over', '13000', 'crore', 'since', 'september', 'with', 'flows', 'reversing', 'after', 'the', 'last', 'us', 'fed', 'rate', 'hike']",fpis have sold equities worth over 13000 crore since september with flows reversing after the last us fed rate hike
"['rishi', 'sunak', 'know', 'uk', 'pms', 'birth', 'age', 'parents', 'education', 'political', 'career', 'net', 'worth']",rishi sunak know uk pms birth age parents education political career net worth
"['india', 'to', 'soon', 'upgrade', 'nyoma', 'airfield', 'near', 'lac', 'with', 'china', 'for', 'fighter', 'ops', 'bro', 'to', 'build', 'new', 'runway']",india to soon upgrade nyoma airfield near lac with china for fighter ops bro to build new runway
"['what', 'is', 'the', 'real', 'risk', 'factor', 'for', 'the', 'reliance', 'stock', 'dipan', 'mehta', 'answers']",what is the real risk factor for the reliance stock dipan mehta answers
"['is', 'this', 'it', 'multibagger', 'running', 'out', 'of', 'steam', 'icici', 'securities', 'answers']",is this it multibagger running out of steam icici securities answers
"['credit', 'suisse', 'shares', 'sink', '14', 'after', 'massive', 'third', 'quarter', 'loss', 'read', 'details', 'here']",credit suisse shares sink 14 after massive third quarter loss read details here
"['lloyds', 'bank', 'sets', 'aside', '668', 'million', 'to', 'cover', 'loan', 'losses', 'hails', 'resilient', 'mortgage', 'customers']",lloyds bank sets aside 668 million to cover loan losses hails resilient mortgage customers
"['did', 'katy', 'perry', 'use', 'her', 'robot', 'clone', 'for', 'las', 'vegas', 'concert', 'details', 'inside']",did katy perry use her robot clone for las vegas concert details inside
"['har', 'har', 'mahadev', 'box', 'office', 'subodh', 'bhave', 'and', 'sharad', 'kelkar', 'starrer', 'collects', '2', '25', 'crores', 'on', 'day', '1']",har har mahadev box office subodh bhave and sharad kelkar starrer collects 2 25 crores on day 1
"['kartik', 'aaryans', 'latest', 'freddy', 'to', 'release', 'on', 'disney', 'hotstar', 'check', 'release', 'date', 'and', 'how', 'to', 'watch']",kartik aaryans latest freddy to release on disney hotstar check release date and how to watch
"['heardle', 'today', 'october', '27', 'clues', 'answer', 'to', 'todays', 'music', 'puzzle']",heardle today october 27 clues answer to todays music puzzle
"['realme', '10', 'series', 'design', 'teased', 'set', 'for', 'november', 'launch']",realme 10 series design teased set for november launch
"['this', 'pms', 'wont', 'invest', 'in', 'private', 'banks', 'or', 'it', 'services', 'stocks', 'heres', 'why']",this pms wont invest in private banks or it services stocks heres why
"['jsw', 'steel', 'acquires', '30', '5', 'acre', 'land', 'parcel', 'in', 'pen', 'near', 'mumbai']",jsw steel acquires 30 5 acre land parcel in pen near mumbai
"['sensex', 'ends', 'volatile', 'session', '213', 'pts', 'higher', 'nifty', 'holds', '17700']",sensex ends volatile session 213 pts higher nifty holds 17700
"['goa', 'preferred', 'destination', 'for', 'second', 'home', 'buyers', 'due', 'to', 'high', 'rental', 'yields', 'reports']",goa preferred destination for second home buyers due to high rental yields reports
"['kerala', 'governor', 'arif', 'mohammed', 'khan', 'is', 'a', 'disgrace', 'to', 'the', 'constitutional', 'position', 'he', 'holds', 'congress']",kerala governor arif mohammed khan is a disgrace to the constitutional position he holds congress
"['share', 'interim', 'dividend', 'fixes', 'record', 'date']",share interim dividend fixes record date
"['bts', 'jin', 'releases', 'teases', 'of', 'his', 'new', 'solo', 'music', 'video', 'fans', 'go', 'crazy', 'watch', 'video', 'here']",bts jin releases teases of his new solo music video fans go crazy watch video here
"['delhi', 'govt', 'spraying', 'poisonous', 'chemical', 'in', 'yamuna', 'to', 'remove', 'froth', 'ahead', 'of', 'chhath', 'puja', 'bjp', 'mp']",delhi govt spraying poisonous chemical in yamuna to remove froth ahead of chhath puja bjp mp
"['most', 'non', 'bjp', 'cms', 'holding', 'home', 'portfolios', 'skip', 'mha', 'meet']",most non bjp cms holding home portfolios skip mha meet
"['delhi', 'airport', 'operator', 'dial', 'to', 'deploy', 'more', 'electric', 'vehicles', 'to', 'reduce', 'emissions']",delhi airport operator dial to deploy more electric vehicles to reduce emissions
"['whatsapp', 'chatbot', 'startup', 'wati', 'raises', '23', 'million', 'in', 'funding', 'led', 'by', 'tiger', 'global']",whatsapp chatbot startup wati raises 23 million in funding led by tiger global
"['cyber', 'security', 'platform', 'blusapphire', 'raises', '9', '2mn', 'in', 'series', 'a', 'funding', 'from', 'barings', 'pe', 'india', 'dallas', 'venture', 'capital', 'others']",cyber security platform blusapphire raises 9 2mn in series a funding from barings pe india dallas venture capital others
"['2', 'against', 'netherlands', 'in', 't20', 'world', 'cup']",2 against netherlands in t20 world cup
"['assamese', 'actor', 'nipon', 'goswami', 'passes', 'away']",assamese actor nipon goswami passes away
"['q2', 'corporate', 'earnings', 'report', 'banks', 'perform', 'well', 'moderate', 'growth', 'in', 'fmcg', 'auto']",q2 corporate earnings report banks perform well moderate growth in fmcg auto
"['kkr', 'to', 'acquire', 'digital', 'services', 'transformation', 'company', 'ness', 'digital', 'engineering']",kkr to acquire digital services transformation company ness digital engineering
"['rajasthan', 'cm', 'gehlot', 'seeks', 'better', 'facilities', 'in', 'govt', 'hospitals']",rajasthan cm gehlot seeks better facilities in govt hospitals
"['this', 'multibagger', 'stock', 'slumps', 'over', '4', 'after', 'q2', 'results']",this multibagger stock slumps over 4 after q2 results
"['fire', 'haircut', 'goes', 'horribly', 'wrong', 'gujarat', 'teen', 'suffers', 'severe', 'burns']",fire haircut goes horribly wrong gujarat teen suffers severe burns
"['tata', 'airbus', 'to', 'manufacture', 'c', '295', 'transport', 'aircraft', 'in', 'gujarat']",tata airbus to manufacture c 295 transport aircraft in gujarat
"['chhath', 'puja', '2022', 'railways', 'announces', 'over', '250', 'special', 'trains']",chhath puja 2022 railways announces over 250 special trains
"['gender', 'no', 'bar', 'bccis', 'big', 'boost', 'for', 'equal', 'pay', 'now', 'women', 'cricketers', 'to', 'be', 'paid', 'same', 'as', 'men']",gender no bar bccis big boost for equal pay now women cricketers to be paid same as men
"['gold', 'falls', 'rs', '101', 'silver', 'declines', 'rs', '334']",gold falls rs 101 silver declines rs 334
"['cybersecurity', 'platform', 'blusapphire', 'raises', '9', '2', 'million', 'in', 'barings', 'pe', 'led', 'funding', 'round']",cybersecurity platform blusapphire raises 9 2 million in barings pe led funding round
"['all', 'you', 'need', 'to', 'know', 'about', 'sip', 'and', 'starting', 'a', 'sip', 'investment']",all you need to know about sip and starting a sip investment
"['twitter', 'deal', 'pushes', 'dogecoin', 'up', '22', 'is', 'it', 'a', 'dead', 'cat', 'bounce', 'in', 'the', 'dog', 'themed', 'token']",twitter deal pushes dogecoin up 22 is it a dead cat bounce in the dog themed token
"['7th', 'pay', 'commission', 'these', 'central', 'govt', 'pensioners', 'dont', 'need', 'to', 'apply', 'for', 'additional', 'payment', 'after', 'commutation']",7th pay commission these central govt pensioners dont need to apply for additional payment after commutation
"['environmentalists', 'pin', 'blame', 'on', 'delhi', 'govt', 'as', 'toxic', 'foam', 'covers', 'sections', 'of', 'yamuna']",environmentalists pin blame on delhi govt as toxic foam covers sections of yamuna
"['sp', 'leader', 'azam', 'khan', 'convicted', 'for', 'hate', 'speech', 'against', 'up', 'cm', 'adityanath']",sp leader azam khan convicted for hate speech against up cm adityanath
"['maisie', 'williams', 'admits', 'final', 'season', 'of', 'game', 'of', 'thrones', 'fell', 'off', 'at', 'the', 'end', 'despite', 'a', 'strong', 'start']",maisie williams admits final season of game of thrones fell off at the end despite a strong start
"['devops', 'startup', 'devtron', 'raises', '12', 'million', 'in', 'funding', 'led', 'by', 'insight', 'partners']",devops startup devtron raises 12 million in funding led by insight partners
"['not', 'planning', 'to', 'cut', '75', 'of', 'jobs', 'elon', 'musk', 'tells', 'twitter', 'employees']",not planning to cut 75 of jobs elon musk tells twitter employees
"['what', 'a', 'beach', 'lakshadweeps', 'minicoy', 'thundi', 'and', 'kadmat', 'beaches', 'awarded', 'prestigious', 'blue', 'flag', 'eco', 'label', 'for', 'coastal', 'cleanliness']",what a beach lakshadweeps minicoy thundi and kadmat beaches awarded prestigious blue flag eco label for coastal cleanliness
"['peter', 'mcguire', 'on', 'dollar', 'index', 'ukraine', 'war', 'commodity', 'prices']",peter mcguire on dollar index ukraine war commodity prices
"['global', 'crises', 'can', 'speed', 'up', 'move', 'to', 'clean', 'energy', 'report']",global crises can speed up move to clean energy report
"['2', 'ways', 'canara', 'bank', 'customers', 'can', 'do', 're', 'kyc']",2 ways canara bank customers can do re kyc
"['18000', '18200', 'could', 'be', 'a', 'little', 'tough', 'to', 'breach', 'have', '3', 'picks', 'this', 'samvat', 'deepak', 'jasani']",18000 18200 could be a little tough to breach have 3 picks this samvat deepak jasani
"['trais', 'concerns', 'over', 'dilution', 'of', 'power', 'under', 'draft', 'telecom', 'bill', 'provisions', 'duly', 'addressed', 'dot', 'sources']",trais concerns over dilution of power under draft telecom bill provisions duly addressed dot sources
"['halloween', '2022', 'theres', 'more', 'to', 'halloween', 'beyond', 'trick', 'or', 'treat', 'and', 'monster', 'balls']",halloween 2022 theres more to halloween beyond trick or treat and monster balls
"['nayanthara', 'vignesh', 'surrogacy', 'row', 'tamil', 'nadu', 'govt', 'gives', 'clean', 'chit', 'says', 'they', 'didnt', 'break', 'any', 'law']",nayanthara vignesh surrogacy row tamil nadu govt gives clean chit says they didnt break any law
"['t20', 'world', 'cup', '2022', 'meet', 'vikramjit', 'singh', '19', 'year', 'old', 'who', 'opens', 'for', 'netherlands']",t20 world cup 2022 meet vikramjit singh 19 year old who opens for netherlands
"['bcci', 'bats', 'for', 'gender', 'equity', 'announces', 'equal', 'pay', 'for', 'men', 'and', 'women']",bcci bats for gender equity announces equal pay for men and women
"['lightspeed', 'backed', 'udaan', 'raises', '120', 'million']",lightspeed backed udaan raises 120 million
"['australian', 'wicketkeeper', 'matthew', 'wade', 'tests', 'positive', 'for', 'covid', '19', 'but', 'will', 'play', 'against', 'england']",australian wicketkeeper matthew wade tests positive for covid 19 but will play against england
"['happy', 'birthday', 'david', 'warner', 'heres', 'an', 'unknown', 'side', 'of', 'the', 'australian', 'cricketer']",happy birthday david warner heres an unknown side of the australian cricketer
"['kaveri', 'seed', 'approves', 'rs', '125', 'crore', 'share', 'buyback', 'at', 'a', 'premium', 'of', '45']",kaveri seed approves rs 125 crore share buyback at a premium of 45
"['lakshmi', 'ganesh', 'images', 'on', 'currency', 'dont', 'misuse', 'religion', 'for', 'political', 'purposes', 'like', 'bjp', 'says', 'brinda', 'karat']",lakshmi ganesh images on currency dont misuse religion for political purposes like bjp says brinda karat
"['tn', 'government', 'report', 'absolves', 'nayanathara', 'and', 'her', 'husband', 'from', 'surrogacy', 'violation', 'allegations', 'blames', 'negligence', 'of', 'hospital', 'staff', 'for', 'controversy']",tn government report absolves nayanathara and her husband from surrogacy violation allegations blames negligence of hospital staff for controversy
"['world', 'to', 'blaze', 'by', '1', '5', 'degree', 'goal', 'global', 'temperatures', 'to', 'rise', 'by', 'at', 'least', '2', '5', 'degrees', 'by', 'end', 'of', 'this', 'century', 'new', 'un', 'report']",world to blaze by 1 5 degree goal global temperatures to rise by at least 2 5 degrees by end of this century new un report
"['dgca', 'allows', 'indigo', 'to', 'wet', 'lease', 'turkish', 'airlines', 'boeing', 'planes', 'for', 'six', 'months', 'heres', 'what', 'it', 'means']",dgca allows indigo to wet lease turkish airlines boeing planes for six months heres what it means
"['veteran', 'assamese', 'actor', 'nipon', 'goswami', 'passes', 'away', 'at', '80', 'after', 'prolonged', 'illness']",veteran assamese actor nipon goswami passes away at 80 after prolonged illness
"['bcci', 'announces', 'equal', 'pay', 'for', 'mens', 'and', 'womens', 'cricketers', 'know', 'how', 'much', 'players', 'will', 'get', 'now']",bcci announces equal pay for mens and womens cricketers know how much players will get now
"['teach', 'a', 'man', 'to', 'sustainably', 'fish', 'goa', 'to', 'install', 'cctv', 'cameras', 'in', 'jetties', 'to', 'curb', 'unsustainable', 'led', 'fishing', 'practices']",teach a man to sustainably fish goa to install cctv cameras in jetties to curb unsustainable led fishing practices
"['elon', 'musk', 'visits', 'twitter', 'office', 'says', 'let', 'that', 'sink', 'in']",elon musk visits twitter office says let that sink in
"['glittering', 'track', 'record', 'long', 'runway', 'for', 'growth', 'titan', 'can', 'rally', 'over', '16', 'motilal', 'oswal']",glittering track record long runway for growth titan can rally over 16 motilal oswal
"['airtel', 'africa', 'fy2q', 'net', 'profit', 'falls', '21', 'on', 'year', 'amid', 'forex', 'losses']",airtel africa fy2q net profit falls 21 on year amid forex losses
"['over', 'next', '12', 'to', '18', 'months', 'normalisation', 'of', 'margins', 'likely', 'for', 'banking', 'sector', 'milind', 'agrawal']",over next 12 to 18 months normalisation of margins likely for banking sector milind agrawal
"['metas', 'instagram', 'users', 'reach', '2', 'billion', 'closing', 'in', 'on', 'facebook']",metas instagram users reach 2 billion closing in on facebook
"['a', 'bitter', 'pill', 'gland', 'pharma', 'records', 'biggest', 'fall', 'since', 'listing', 'hits', '52', 'week', 'low']",a bitter pill gland pharma records biggest fall since listing hits 52 week low
"['iraq', 'emerges', 'as', 'a', 'key', 'pillar', 'in', 'chinas', 'bri', 'strategy']",iraq emerges as a key pillar in chinas bri strategy
"['halloween', '2022', 'is', 'around', 'the', 'corner', 'know', 'the', 'date', 'importance', 'and', 'history']",halloween 2022 is around the corner know the date importance and history
"['dgca', 'issues', 'aerodrome', 'licence', 'for', 'mopa', 'airport', 'in', 'goa']",dgca issues aerodrome licence for mopa airport in goa
"['unilever', 'recalls', 'dove', 'other', 'aerosol', 'dry', 'shampoo', 'brands', 'over', 'cancer', 'risk']",unilever recalls dove other aerosol dry shampoo brands over cancer risk
"['rec', 'q2', 'results', 'net', 'profit', 'up', '1', '5', 'at', 'rs', '2732', 'crore']",rec q2 results net profit up 1 5 at rs 2732 crore
"['rossouw', 'rilee', 'rossouw', 'creates', 'history', 'becomes', 'first', 'south', 'africa', 'batter', 'to', 'score', 'century', 'in', 't20', 'world', 'cup']",rossouw rilee rossouw creates history becomes first south africa batter to score century in t20 world cup
"['ram', 'setu', 'box', 'office', 'collection', 'day', '2', 'akshay', 'kumars', 'movie', 'doing', 'well']",ram setu box office collection day 2 akshay kumars movie doing well
"['chhath', 'puja', 'time', 'date', 'and', 'rituals']",chhath puja time date and rituals
"['ss', 'rajamoulis', 'rrr', 'wins', 'best', 'international', 'film', 'at', 'saturn', 'awards', '2022']",ss rajamoulis rrr wins best international film at saturn awards 2022
"['iifl', 'finance', 'rises', 'over', '6', 'as', 'q2', 'pat', 'surges', '36', 'yoy']",iifl finance rises over 6 as q2 pat surges 36 yoy
"['mamata', 'banerjee', 'may', 'attend', 'bengal', 'governor', 'la', 'ganeshans', 'family', 'event', 'in', 'chennai']",mamata banerjee may attend bengal governor la ganeshans family event in chennai
"['indian', 'army', 'celebrating', '75th', 'national', 'infantry', 'day', 'highlights', 'and', 'history', 'of', 'the', 'day']",indian army celebrating 75th national infantry day highlights and history of the day
"['ugc', 'net', '2022', 'results', 'are', 'likely', 'to', 'be', 'released', 'soon']",ugc net 2022 results are likely to be released soon
"['nmdc', 'to', 'separately', 'list', 'steel', 'biz', 'last', 'day', 'to', 'buy', 'stock', 'to', 'qualify', 'for', 'emerged', 'shares']",nmdc to separately list steel biz last day to buy stock to qualify for emerged shares
"['rajnath', 'singh', 'says', 'pak', 'will', 'have', 'to', 'bear', 'consequences', 'for', 'committing', 'atrocities', 'against', 'people', 'in', 'pok']",rajnath singh says pak will have to bear consequences for committing atrocities against people in pok
