headlines,headline_text
"['how', 'hyderabad', 'based', 'midhani', 'supplied', 'special', 'steel', 'to', 'chandrayaans', 'bahubali', 'when', 'world', 'denied', 'it']",how hyderabad based midhani supplied special steel to chandrayaans bahubali when world denied it
"['sensex', 'nifty', 'log', 'best', 'week', 'in', 'over', '2', 'months', 'led', 'by', 'energy', 'banking', 'stocks']",sensex nifty log best week in over 2 months led by energy banking stocks
"['august', 'demat', 'account', 'additions', 'top', '3', 'million', 'for', 'the', 'first', 'time', 'in', '19', 'months']",august demat account additions top 3 million for the first time in 19 months
"['anand', 'mahindra', 'joins', 'jawan', 'fan', 'club', 'calls', 'shah', 'rukh', 'khan', 'an', 'important', 'natural', 'resource']",anand mahindra joins jawan fan club calls shah rukh khan an important natural resource
"['what', 'are', 'high', 'yielding', 'bonds', 'and', 'what', 'to', 'look', 'for', 'before', 'investing', 'in', 'them']",what are high yielding bonds and what to look for before investing in them
"['rajeev', 'thakkars', 'tips', 'for', 'smallcap', 'investors', 'elections', 'diversification', 'strategy']",rajeev thakkars tips for smallcap investors elections diversification strategy
"['dubai', 'jobs', 'over', '3000', 'openings', 'to', 'come', 'up', 'at', 'newly', 'launched', 'ai', 'and', 'web', '3', '0', 'campus']",dubai jobs over 3000 openings to come up at newly launched ai and web 3 0 campus
"['hul', 'itc', 'among', '10', 'nifty', 'stocks', 'with', 'golden', 'crossover', 'pattern']",hul itc among 10 nifty stocks with golden crossover pattern
"['technical', 'breakout', 'mm', 'finance', 'indraprastha', 'gas', '2', 'other', 'stocks', 'surpass', '100', 'day', 'sma']",technical breakout mm finance indraprastha gas 2 other stocks surpass 100 day sma
"['indias', 'move', 'to', 'mainstream', 'millets', 'will', 'go', 'a', 'long', 'way', 'in', 'ensuring', 'global', 'food', 'security', 'un']",indias move to mainstream millets will go a long way in ensuring global food security un
"['hayao', 'miyazakis', 'last', 'film', 'the', 'boy', 'and', 'the', 'heron', 'makes', 'its', 'first', 'international', 'debut', 'at', 'tiff']",hayao miyazakis last film the boy and the heron makes its first international debut at tiff
"['wear', 'masks', 'avoid', 'crowded', 'places', 'say', 'doctors', 'as', 'viral', 'cases', 'rise', 'across', 'india']",wear masks avoid crowded places say doctors as viral cases rise across india
"['garbage', 'collector', 'accused', 'for', 'murdering', 'mumbai', 'flight', 'attendant', 'commits', 'suicide', 'in', 'police', 'lock', 'up', 'toilet']",garbage collector accused for murdering mumbai flight attendant commits suicide in police lock up toilet
"['lt', 'hal', '4', 'other', 'large', 'cap', 'stocks', 'hit', 'all', 'time', 'highs', 'on', 'friday']",lt hal 4 other large cap stocks hit all time highs on friday
"['do', 'co', 'branded', 'credit', 'cards', 'actually', 'help', 'you', 'save', 'money']",do co branded credit cards actually help you save money
"['how', 'lic', 'pension', 'policyholders', 'can', 'submit', 'digital', 'life', 'certificate']",how lic pension policyholders can submit digital life certificate
"['india', 'vs', 'bharat', 'rahul', 'gandhi', 'says', 'govt', 'is', 'attempting', 'to', 'change', 'countrys', 'nature']",india vs bharat rahul gandhi says govt is attempting to change countrys nature
"['any', 'exporter', 'who', 'is', 'not', 'hedging', 'should', 'keep', 'a', 'stop', 'loss', 'policy', 'or', 'hedge', 'via', 'option', 'amit', 'pabari', 'cr', 'forex']",any exporter who is not hedging should keep a stop loss policy or hedge via option amit pabari cr forex
"['bharat', 'dynamics', 'aditya', 'birla', 'capital', '2', 'more', 'midcap', 'stocks', 'cross', '50', 'day', 'sma']",bharat dynamics aditya birla capital 2 more midcap stocks cross 50 day sma
"['i', 'am', 'not', 'bothered', 'says', 'siddaramaiah', 'on', 'bjp', 'jds', 'poll', 'pact', 'for', 'lok', 'sabha', 'polls']",i am not bothered says siddaramaiah on bjp jds poll pact for lok sabha polls
"['scientists', 'grow', 'whole', 'model', 'of', 'human', 'embryo', 'without', 'sperm', 'or', 'egg']",scientists grow whole model of human embryo without sperm or egg
"['g20', 'summit', 'quick', 'commerce', 'companies', 'staff', 'up', 'to', 'meet', 'demand', 'spike']",g20 summit quick commerce companies staff up to meet demand spike
"['digital', 'india', 'aadhaar', 'e', 'sanjeevani', 'bhashini', 'showcased', 'at', 'g20', 'summit', 'venue']",digital india aadhaar e sanjeevani bhashini showcased at g20 summit venue
"['home', 'guard', 'who', 'set', 'himself', 'on', 'fire', 'in', 'hyderabad', 'dies', 'opposition', 'dubs', 'it', 'murder', 'by', 'brs', 'govt']",home guard who set himself on fire in hyderabad dies opposition dubs it murder by brs govt
"['et', 'startup', 'awards', '2023', 'a', 'growth', 'mindset', 'will', 'set', 'the', 'winner', 'apart']",et startup awards 2023 a growth mindset will set the winner apart
"['its', 'special', 'as', 'son', 'in', 'law', 'of', 'india', 'rishi', 'sunak', 'on', 'visit', 'to', 'delhi', 'for', 'g20']",its special as son in law of india rishi sunak on visit to delhi for g20
"['cea', 'rejects', 'statistical', 'discrepancy', 'criticism', 'on', 'q1', 'growth', 'numbers']",cea rejects statistical discrepancy criticism on q1 growth numbers
"['rbi', 'to', 'discontinue', 'incremental', 'cash', 'reserve', 'ratio', 'in', 'a', 'phased', 'manner']",rbi to discontinue incremental cash reserve ratio in a phased manner
"['indias', 'time', 'to', 'shine', 'how', 'g20', 'summit', 'can', 'be', 'a', 'pivotal', 'moment', 'for', 'indias', 'global', 'aspirations']",indias time to shine how g20 summit can be a pivotal moment for indias global aspirations
"['when', 'dhoni', 'met', 'donald', 'captain', 'cool', 'chills', 'in', 'us', 'plays', 'golf', 'with', 'former', 'president', 'trump', 'fans', 'go', 'wild']",when dhoni met donald captain cool chills in us plays golf with former president trump fans go wild
"['mount', 'fuji', 'faces', 'overcrowding', 'and', 'ecological', 'concerns', 'as', 'visitor', 'numbers', 'soar']",mount fuji faces overcrowding and ecological concerns as visitor numbers soar
"['telangana', 'man', 'who', 'could', 'barely', 'move', 'after', 'coma', 'completes', 'difficult', 'amarnath', 'track']",telangana man who could barely move after coma completes difficult amarnath track
"['irfc', 'vodafone', 'idea', 'among', '10', 'midcap', 'stocks', 'which', 'hit', '52', 'week', 'highs', 'on', 'friday']",irfc vodafone idea among 10 midcap stocks which hit 52 week highs on friday
"['how', 'to', 'get', 'better', 'sleep', 'on', 'long', 'haul', 'flights', 'here', 'are', 'some', 'tips']",how to get better sleep on long haul flights here are some tips
"['au', 'small', 'finance', 'partners', 'bank', 'bajaj', 'allianz', 'life', 'insurance', 'to', 'offer', 'insurance', 'products']",au small finance partners bank bajaj allianz life insurance to offer insurance products
"['british', 'pm', 'rishi', 'sunak', 'arrives', 'for', 'g20', 'summit']",british pm rishi sunak arrives for g20 summit
"['deputy', 'chief', 'of', 'air', 'staff', 'flies', 'indigenously', 'developed', 'trainer', 'aircraft', 'htt', '40']",deputy chief of air staff flies indigenously developed trainer aircraft htt 40
"['air', 'pollution', 'can', 'hurt', 'unborn', 'babies', 'study', 'says', 'even', 'low', 'levels', 'of', 'exposure', 'may', 'lead', 'to', 'risk', 'of', 'asthma', 'copd', 'in', 'adulthood']",air pollution can hurt unborn babies study says even low levels of exposure may lead to risk of asthma copd in adulthood
"['schneider', 'electric', 'invests', 'undisclosed', 'amount', 'in', 'biofuels', 'junction']",schneider electric invests undisclosed amount in biofuels junction
"['its', 'special', 'as', 'son', 'in', 'law', 'of', 'india', 'rishi', 'sunak', 'on', 'visit', 'to', 'delhi', 'for', 'g20']",its special as son in law of india rishi sunak on visit to delhi for g20
"['upi', 'atm', 'launched', 'forget', 'debit', 'card', 'you', 'can', 'withdraw', 'money', 'from', 'atm', 'using', 'upi', 'how', 'to', 'use', 'it']",upi atm launched forget debit card you can withdraw money from atm using upi how to use it
"['himachal', 'pradesh', 'kinnaur', 'district', 'cut', 'off', 'from', 'shimla', 'following', 'major', 'landslide']",himachal pradesh kinnaur district cut off from shimla following major landslide
"['natco', 'pharma', 'others', 'sued', 'in', 'us', 'for', 'generic', 'cancer', 'drug']",natco pharma others sued in us for generic cancer drug
"['venture', 'catalysts', 'makes', 'partial', 'exit', 'in', 'metaverse', 'skill', 'tech', 'cusmat', 'with', 'over', '4', '2', 'times', 'returns']",venture catalysts makes partial exit in metaverse skill tech cusmat with over 4 2 times returns
"['fii', 'favourites', 'capital', 'goods', 'beat', 'bank', 'stocks', 'as', 'top', 'beneficiary', 'in', '2023']",fii favourites capital goods beat bank stocks as top beneficiary in 2023
"['dont', 'be', 'overtly', 'bullish', 'now', 'its', 'time', 'to', 'tone', 'down', 'expectations', 'sahil', 'kapoor']",dont be overtly bullish now its time to tone down expectations sahil kapoor
"['indias', 'military', 'studying', 'options', 'for', 'any', 'china', 'war', 'on', 'taiwan']",indias military studying options for any china war on taiwan
"['omar', 'abdullah', 'on', 'india', 'bharat', 'debate', 'let', 'centre', 'bring', 'issue', 'to', 'parliament', 'if', 'it', 'has', 'the', 'courage']",omar abdullah on india bharat debate let centre bring issue to parliament if it has the courage
"['study', 'shows', 'potential', 'of', 'online', 'gaming', 'sector', 'despite', 'high', 'tax', 'rate']",study shows potential of online gaming sector despite high tax rate
"['world', 'physiotherapy', 'day', 'celebrating', 'the', 'vital', 'role', 'of', 'physiotherapy', 'in', 'healthcare']",world physiotherapy day celebrating the vital role of physiotherapy in healthcare
"['bank', 'of', 'baroda', 'launches', 'upi', 'atm', 'facility', 'who', 'can', 'use', 'upi', 'atm', 'how', 'to', 'withdraw', 'cash', 'without', 'using', 'debit', 'or', 'credit', 'card']",bank of baroda launches upi atm facility who can use upi atm how to withdraw cash without using debit or credit card
"['end', 'of', 'road', 'for', 'communists', 'in', 'tripura', 'bjp', 'after', 'bypoll', 'victories']",end of road for communists in tripura bjp after bypoll victories
"['director', 'atlee', 'music', 'composer', 'anirudh', 'catch', 'jawan', 'first', 'show', 'in', 'chennai', 'witness', 'shah', 'rukh', 'khan', 'frenzy']",director atlee music composer anirudh catch jawan first show in chennai witness shah rukh khan frenzy
"['trent', 'idfc', 'first', 'bank', 'among', '11', 'stocks', 'that', 'could', 'double', 'in', '3', 'years', 'dam', 'capital', 'advisors']",trent idfc first bank among 11 stocks that could double in 3 years dam capital advisors
"['ambanis', 'reliance', 'explores', 'chipmaking', 'foray', 'talking', 'with', 'potential', 'partners']",ambanis reliance explores chipmaking foray talking with potential partners
"['non', 'disclosure', 'of', 'cases', 'in', 'poll', 'affidavit', 'nagpur', 'court', 'acquits', 'devendra', 'fadnavis']",non disclosure of cases in poll affidavit nagpur court acquits devendra fadnavis
"['g20', 'summit', 'roads', 'wear', 'deserted', 'look', 'as', 'traffic', 'curbs', 'come', 'into', 'force', 'in', 'new', 'delhi']",g20 summit roads wear deserted look as traffic curbs come into force in new delhi
"['unprecedented', 'failure', 'of', 'modi', 'govt', 'not', 'to', 'come', 'out', 'with', 'census', 'denying', '14', 'cr', 'indians', 'from', 'food', 'entitlement', 'congress']",unprecedented failure of modi govt not to come out with census denying 14 cr indians from food entitlement congress
"['asia', 'cup', '2023', 'acc', 'adds', 'reserve', 'day', 'exclusively', 'for', 'india', 'pakistan', 'super', 'four', 'clash', 'on', 'sep', '10']",asia cup 2023 acc adds reserve day exclusively for india pakistan super four clash on sep 10
"['2', 'top', 'stock', 'recommendations', 'from', 'gaurav', 'bissa']",2 top stock recommendations from gaurav bissa
"['former', 'swiggy', 'cto', 'dale', 'vaz', 'secures', 'seed', 'funding', 'for', 'new', 'venture', 'aaritya', 'technologies']",former swiggy cto dale vaz secures seed funding for new venture aaritya technologies
"['bangladeshi', 'passenger', 'arrested', 'for', 'in', 'flight', 'sexual', 'misconduct', 'on', 'a', 'muscat', 'mumbai', 'bound', 'flight']",bangladeshi passenger arrested for in flight sexual misconduct on a muscat mumbai bound flight
"['plugging', 'gaps', 'for', 'creator', 'economy', 'will', 'boost', 'entrepreneurship', 'in', 'influencer', 'marketing', 'sector']",plugging gaps for creator economy will boost entrepreneurship in influencer marketing sector
"['like', 'a', 'big', 'fat', 'indian', 'wedding', 'how', 'india', 'has', 'prepared', 'for', 'g20', 'mega', 'meet']",like a big fat indian wedding how india has prepared for g20 mega meet
"['digital', 'public', 'infras', 'transformative', 'impact', 'goes', 'beyond', 'inclusive', 'finance', 'in', 'india', 'world', 'bank']",digital public infras transformative impact goes beyond inclusive finance in india world bank
"['looking', 'out', 'of', 'car', 'sunroof', 'illegal', 'and', 'unsafe', 'can', 'attract', 'penalty', 'warn', 'police']",looking out of car sunroof illegal and unsafe can attract penalty warn police
"['srk', 'is', 'the', 'cinema', 'god', 'kangana', 'ranaut', 'bows', 'down', 'to', 'shah', 'rukh', 'khans', 'hard', 'work', 'humility', 'amid', 'jawan', 'success']",srk is the cinema god kangana ranaut bows down to shah rukh khans hard work humility amid jawan success
"['nifty', 'financial', 'services', 'index', 'private', 'banks', 'hold', 'more', 'upside', 'potential', 'than', 'service', 'providers']",nifty financial services index private banks hold more upside potential than service providers
"['g20', 'delegates', 'to', 'experience', 'indias', 'technological', 'prowess', 'artistic', 'riches', 'at', 'various', 'exhibitions']",g20 delegates to experience indias technological prowess artistic riches at various exhibitions
"['tragic', 'lightning', 'strike', 'claims', 'life', 'of', '20', 'year', 'old', 'in', 'assams', 'chirang', 'district']",tragic lightning strike claims life of 20 year old in assams chirang district
"['chennai', 'based', 'firm', 'commercial', 'law', 'advisors', 'set', 'to', 'merge', 'with', 'law', 'firm', 'jsa']",chennai based firm commercial law advisors set to merge with law firm jsa
"['australia', 'cuts', 'down', 'student', 'visa', 'processing', 'time', 'to', '16', 'days']",australia cuts down student visa processing time to 16 days
"['odisha', 'makes', 'tracking', 'devices', 'with', 'panic', 'buttons', 'mandatory', 'for', 'commercial', 'vehicles']",odisha makes tracking devices with panic buttons mandatory for commercial vehicles
"['indias', 'g20', 'presidency', 'moment', 'of', 'reflection', 'reveals', 'nda', 'govts', 'failure', 'to', 'conduct', 'census', 'congress']",indias g20 presidency moment of reflection reveals nda govts failure to conduct census congress
"['kangana', 'ranaut', 'hails', 'shah', 'rukh', 'khan', 'for', 'reinventing', 'himself', 'calls', 'him', 'the', 'cinema', 'god', 'that', 'india', 'needs']",kangana ranaut hails shah rukh khan for reinventing himself calls him the cinema god that india needs
"['after', 'g20', 'get', 'ready', 'for', 'high', 'speed', 'return', 'of', 'motogp', 'bharat']",after g20 get ready for high speed return of motogp bharat
"['cricket', 'legend', 'glenn', 'mcgrath', 'fearlessly', 'evicts', 'three', 'intruding', 'pythons', 'from', 'his', 'home']",cricket legend glenn mcgrath fearlessly evicts three intruding pythons from his home
"['mas', 'financial', 'will', 'touch', 'rs', '1000', 'crore', 'aum', 'by', '2025', 'and', 'grow', 'at', '30', 'plus', 'in', 'hfc', 'kamlesh', 'gandhi']",mas financial will touch rs 1000 crore aum by 2025 and grow at 30 plus in hfc kamlesh gandhi
"['navi', 'amc', 'to', 'launch', 'navi', 'nifty', '50', 'etf']",navi amc to launch navi nifty 50 etf
"['indian', 'economy', 'on', 'a', 'promising', 'growth', 'trajectory', 'says', 'adb', 'president']",indian economy on a promising growth trajectory says adb president
"['shipping', 'stocks', 'gain', 'up', 'to', '13', 'mazagon', 'dock', 'cochin', 'shipyard', 'lead', 'the', 'pack']",shipping stocks gain up to 13 mazagon dock cochin shipyard lead the pack
"['g20', 'summit', 'china', 'seeks', 'to', 'tie', 'advanced', 'semiconductor', 'access', 'to', 'climate', 'action']",g20 summit china seeks to tie advanced semiconductor access to climate action
"['shubman', 'gill', 'turns', '24', 'a', 'look', 'at', 'career', 'accomplishments', 'of', 'indias', 'rising', 'batting', 'sensation']",shubman gill turns 24 a look at career accomplishments of indias rising batting sensation
"['g20', 'here', 'are', 'routes', 'you', 'can', 'follow', 'to', 'reach', 'igi', 'airport', 'and', 'railway', 'stations', 'during', 'g20', 'summit', 'days']",g20 here are routes you can follow to reach igi airport and railway stations during g20 summit days
"['scientists', 'unearth', 'gigantic', 'bubble', 'of', 'galaxies', 'in', 'earths', 'cosmic', 'backyard']",scientists unearth gigantic bubble of galaxies in earths cosmic backyard
"['asean', 'india', 'summit', 'pm', 'modi', 'bats', 'for', 'open', 'and', 'free', 'indo', 'pacific', 'at', 'east', 'asia', 'meet']",asean india summit pm modi bats for open and free indo pacific at east asia meet
"['ratnaveer', 'precision', 'ipo', 'how', 'to', 'check', 'allotment', 'status']",ratnaveer precision ipo how to check allotment status
"['india', 'needs', 'to', 'grow', 'at', '8', '9', 'for', '20', 'years', 'to', 'become', 'developed', 'country', 'by', '2047', 'deloitte']",india needs to grow at 8 9 for 20 years to become developed country by 2047 deloitte
"['how', 'to', 'add', 'a', 'nominee', 'to', 'your', 'sbi', 'savings', 'account', 'fixed', 'deposit', 'fd']",how to add a nominee to your sbi savings account fixed deposit fd
"['postal', 'life', 'insurance', 'policy', 'when', 'can', 'you', 'surrender', 'pli', 'policy', 'how', 'to', 'surrender', 'and', 'more']",postal life insurance policy when can you surrender pli policy how to surrender and more
"['former', 'pm', 'deve', 'gowda', 'not', 'to', 'attend', 'g20', 'dinner', 'due', 'to', 'health', 'reasons']",former pm deve gowda not to attend g20 dinner due to health reasons
"['no', 'business', 'leaders', 'invited', 'for', 'g20', 'dinner', 'pib', 'rubbishes', 'reports']",no business leaders invited for g20 dinner pib rubbishes reports
"['shemaroo', 'entertainment', 'hits', '5', 'lower', 'circuit', 'after', '3', 'officials', 'held', 'for', 'gst', 'fraud']",shemaroo entertainment hits 5 lower circuit after 3 officials held for gst fraud
"['how', 'to', 'transfer', 'property', 'to', 'legal', 'heir', 'after', 'owners', 'death']",how to transfer property to legal heir after owners death
"['buy', 'titan', 'company', 'target', 'price', 'rs', '3570', 'motilal', 'oswal', 'financial', 'services']",buy titan company target price rs 3570 motilal oswal financial services
"['us', 'vice', 'president', 'kamala', 'harris', 'dismisses', 'biden', 'age', 'concerns', 'but', 'ready', 'to', 'be', 'president']",us vice president kamala harris dismisses biden age concerns but ready to be president
"['g20', 'summit', 'traffic', 'curbs', 'come', 'into', 'force', 'in', 'new', 'delhi', 'police', 'urge', 'people', 'to', 'use', 'metro']",g20 summit traffic curbs come into force in new delhi police urge people to use metro
"['we', 'can', 'expect', 'power', 'tariffs', 'to', 'go', 'up', 'over', 'next', 'couple', 'of', 'years', 'sabyasachi', 'majumdar', 'icra']",we can expect power tariffs to go up over next couple of years sabyasachi majumdar icra
"['tight', 'security', 'in', 'new', 'delhi', 'for', 'g20', 'summit', 'traffic', 'restrictions', 'in', 'place']",tight security in new delhi for g20 summit traffic restrictions in place
"['shivajis', 'historic', 'wagh', 'nakh', 'tiger', 'claws', 'used', 'for', 'killing', 'afzal', 'khan', 'coming', 'back', 'to', 'india', 'from', 'uk']",shivajis historic wagh nakh tiger claws used for killing afzal khan coming back to india from uk
"['india', 'inc', 'looks', 'to', 'build', 'pipeline', 'of', 'women', 'leaders']",india inc looks to build pipeline of women leaders
"['5', 'agro', 'chemical', 'stocks', 'including', 'two', 'mncs', 'with', 'buy', 'reco', 'upside', 'potential', 'of', 'up', 'to', '37']",5 agro chemical stocks including two mncs with buy reco upside potential of up to 37
"['buy', 'larsen', 'amp', 'toubro', 'target', 'price', 'rs', '3141', 'icici', 'securities']",buy larsen amp toubro target price rs 3141 icici securities
"['building', 'blocks', 'in', 'place', 'viacom18', 'will', 'hope', 'to', 'build', 'profitable', 'sports', 'business', 'anil', 'jayaraj', 'ceo']",building blocks in place viacom18 will hope to build profitable sports business anil jayaraj ceo
"['g20', 'summit', 'several', 'opposition', 'cms', 'not', 'to', 'attend', 'official', 'dinner', 'congs', 'sukhvinder', 'sukhu', 'likely', 'to', 'be', 'present']",g20 summit several opposition cms not to attend official dinner congs sukhvinder sukhu likely to be present
"['g20', 'sherpas', 'focus', 'on', 'building', 'consensus', 'to', 'finalise', 'draft', 'leaders', 'declaration']",g20 sherpas focus on building consensus to finalise draft leaders declaration
"['g20', 'india', 'to', 'provide', 'hands', 'on', 'upi', 'experience', 'to', 'visiting', 'delegates']",g20 india to provide hands on upi experience to visiting delegates
"['confident', 'that', 'india', 'will', 'do', 'everything', 'possible', 'to', 'ensure', 'existing', 'geopolitical', 'divides', 'are', 'overcome', 'un', 'chief', 'says', 'ahead', 'of', 'g20', 'summit']",confident that india will do everything possible to ensure existing geopolitical divides are overcome un chief says ahead of g20 summit
"['tpg', 'backed', 'rr', 'kabels', 'ipo', 'share', 'price', 'band', 'announced', 'at', 'rs', '983', '1035']",tpg backed rr kabels ipo share price band announced at rs 983 1035
"['i', 'hope', 'his', 'victims', 'have', 'some', 'closure', 'netizens', 'hail', '30', 'year', 'prison', 'sentence', 'for', 'that', '70s', 'show', 'star', 'danny', 'masterson', 'in', 'rape', 'case']",i hope his victims have some closure netizens hail 30 year prison sentence for that 70s show star danny masterson in rape case
"['police', 'to', 'keep', 'close', 'watch', 'on', 'delhi', 'during', 'g20', 'summit', 'through', '5000', 'cctv', 'cameras']",police to keep close watch on delhi during g20 summit through 5000 cctv cameras
"['mapmyindia', 'collaborates', 'with', 'delhi', 'police', 'for', 'real', 'time', 'traffic', 'updates', 'during', 'g20', 'summit']",mapmyindia collaborates with delhi police for real time traffic updates during g20 summit
"['meet', 'delhis', 'extraordinary', 'uber', 'driver', 'abdul', 'qadeer', 'who', 'offers', 'more', 'than', 'just', 'a', 'ride']",meet delhis extraordinary uber driver abdul qadeer who offers more than just a ride
"['landmark', 'cars', 'shares', 'jump', '8', 'on', 'dealership', 'agreement', 'with', 'mm']",landmark cars shares jump 8 on dealership agreement with mm
"['q3', 'most', 'important', 'for', 'hotel', 'industry', 'average', 'rates', 'may', 'keep', 'increasing', 'puneet', 'chhatwal', 'indian', 'hotels']",q3 most important for hotel industry average rates may keep increasing puneet chhatwal indian hotels
"['top', '5', 'investment', 'options', 'that', 'can', 'help', 'senior', 'citizens', 'earn', 'monthly', 'income', 'during', 'retirement']",top 5 investment options that can help senior citizens earn monthly income during retirement
"['as', 'india', 'hosts', 'its', 'first', 'g20', 'summit', 'vedanta', 'boss', 'anil', 'agarwal', 'proud', 'to', 'see', 'tricolour', 'fly', 'high', 'with', 'other', 'world', 'flags']",as india hosts its first g20 summit vedanta boss anil agarwal proud to see tricolour fly high with other world flags
"['buy', 'hdfc', 'life', 'insurance', 'company', 'target', 'price', 'rs', '675', 'kotak', 'securities', 'br']",buy hdfc life insurance company target price rs 675 kotak securities br
"['world', 'facing', 'polycrisis', 'g20', 'must', 'show', 'the', 'way', 'korean', 'president', 'yoon', 'suk', 'yeol']",world facing polycrisis g20 must show the way korean president yoon suk yeol
"['dont', 'have', 'a', 'weekend', 'booking', 'yet', 'youre', 'probably', 'too', 'late']",dont have a weekend booking yet youre probably too late
"['switch', 'mobility', 'rolls', 'out', 'electric', 'lcvs', 'with', 'car', 'like', 'features']",switch mobility rolls out electric lcvs with car like features
"['zepto', 'appoints', 'ankit', 'agarwal', 'as', 'chief', 'product', 'officer', 'to', 'drive', 'innovation', 'in', 'fulfillment']",zepto appoints ankit agarwal as chief product officer to drive innovation in fulfillment
"['shah', 'rukh', 'khans', 'jawan', 'roars', 'to', 'a', 'jubilant', 'start', 'with', '100', 'theater', 'occupancy', 'in', 'west', 'bengal']",shah rukh khans jawan roars to a jubilant start with 100 theater occupancy in west bengal
"['sensex', 'jumps', '150', 'points', 'led', 'by', 'gains', 'in', 'banks', 'nifty', 'above', '19750']",sensex jumps 150 points led by gains in banks nifty above 19750
"['fundamental', 'radar', 'lic', 'housing', 'poised', 'to', 'test', 'rs', '580', 'in', '12', 'months', 'says', 'shrikant', 'chouhan']",fundamental radar lic housing poised to test rs 580 in 12 months says shrikant chouhan
"['oshi', 'no', 'ko', 'chapter', '126', 'release', 'date', 'time', 'and', 'everything', 'you', 'may', 'want', 'to', 'know']",oshi no ko chapter 126 release date time and everything you may want to know
