headlines,headline_text
"['shah', 'rukh', 'khans', 'jawan', 'surpasses', 'pathaan', 'with', 'record', 'breaking', 'opening', 'day', 'collection']",shah rukh khans jawan surpasses pathaan with record breaking opening day collection
"['100', 'vvpat', 'count', 'idea', 'regressive', 'like', 'adopting', 'paper', 'ballot', 'election', 'commission', 'to', 'sc']",100 vvpat count idea regressive like adopting paper ballot election commission to sc
"['top', 'congress', 'leadership', 'maintaining', 'silence', 'over', 'denigration', 'of', 'hindu', 'faith', 'ravi', 'shankar', 'prasad']",top congress leadership maintaining silence over denigration of hindu faith ravi shankar prasad
"['world', 'bank', 'lauds', 'indias', 'digital', 'public', 'infrastructure', 'in', 'g20', 'document']",world bank lauds indias digital public infrastructure in g20 document
"['vedanta', 'foxconn', 'submit', 'separate', 'proposals', 'for', 'chipset', 'fabrication', 'units']",vedanta foxconn submit separate proposals for chipset fabrication units
"['going', 'to', 'the', 'bank', 'to', 'exchange', 'rs', '2000', 'currency', 'notes', 'keep', 'these', '4', 'things', 'in', 'mind']",going to the bank to exchange rs 2000 currency notes keep these 4 things in mind
"['food', 'for', 'the', 'soul']",food for the soul
"['dont', 'fetishise', 'never', 'taking', 'leave']",dont fetishise never taking leave
"['ecommerce', 'rules', 'shouldnt', 'stunt', 'sectors', 'growth', 'iacc']",ecommerce rules shouldnt stunt sectors growth iacc
"['century', 'plyboards', 'expanding', 'across', 'every', 'single', 'segment', 'we', 'are', 'present', 'in', 'keshav', 'bhajanka']",century plyboards expanding across every single segment we are present in keshav bhajanka
"['g20', 'summit', 'check', 'the', 'list', 'of', 'ministers', 'assigned', 'to', 'welcome', 'dignitaries']",g20 summit check the list of ministers assigned to welcome dignitaries
"['bankruptcy', 'court', 'admits', 'insolvency', 'resolution', 'plea', 'against', 'goli', 'vada', 'pav']",bankruptcy court admits insolvency resolution plea against goli vada pav
