headlines,headline_text
"['google', 'celebrates', 'indias', 'first', 'woman', 'biochemist', 'dr', 'kamala', 'sohonies', '112th', 'birth', 'anniversary', 'with', 'a', 'colourful', 'doodle']",google celebrates indias first woman biochemist dr kamala sohonies 112th birth anniversary with a colourful doodle
"['gold', 'prices', 'are', 'expected', 'to', 'be', 'range', 'bound', 'next', 'week', 'support', 'zone', 'seen', 'at', '1920', '1930']",gold prices are expected to be range bound next week support zone seen at 1920 1930
"['ott', 'has', 'bridged', 'geographical', 'barriers', 'anurag', 'thakur']",ott has bridged geographical barriers anurag thakur
"['our', 'obsession', 'with', 'the', 'perfect', 'mango', 'is', 'resulting', 'in', 'local', 'varieties', 'being', 'ignored']",our obsession with the perfect mango is resulting in local varieties being ignored
"['realty', 'stocks', 'may', 'be', 'losing', 'momentum', 'warns', 'anand', 'james', 'of', 'geojit']",realty stocks may be losing momentum warns anand james of geojit
"['uranium', 'rich', 'kazakhstan', 'mulls', 'building', 'nuclear', 'power', 'plant']",uranium rich kazakhstan mulls building nuclear power plant
"['jee', 'advanced', 'result', '2023', 'exam', 'results', 'declared', 'heres', 'how', 'you', 'can', 'download', 'it']",jee advanced result 2023 exam results declared heres how you can download it
"['us', 'energy', 'department', 'gets', 'two', 'ransom', 'notices', 'as', 'moveit', 'hack', 'claims', 'more', 'victims']",us energy department gets two ransom notices as moveit hack claims more victims
"['studying', 'abroad', 'is', 'not', 'translating', 'to', 'jobs', 'abroad', 'amid', 'global', 'economic', 'slowdown']",studying abroad is not translating to jobs abroad amid global economic slowdown
"['sovereign', 'gold', 'bond', 'scheme', '2023', '24', '1st', 'tranche', 'opens', 'for', 'subscription', 'from', 'monday', '8', 'reasons', 'to', 'buy']",sovereign gold bond scheme 2023 24 1st tranche opens for subscription from monday 8 reasons to buy
"['india', 'moves', 'ahead', 'with', 'creation', 'of', 'theatre', 'commands', 'for', 'integrated', 'war', 'fighting']",india moves ahead with creation of theatre commands for integrated war fighting
"['how', 'the', 'right', 'policy', 'mix', 'economic', 'transformation', 'can', 'create', 'market', 'winners', 'in', 'india']",how the right policy mix economic transformation can create market winners in india
"['icai', 'to', 'establish', 'centre', 'for', 'excellence', 'in', 'kashmir']",icai to establish centre for excellence in kashmir
"['surat', 'man', 'latest', 'to', 'defy', 'surrogacy', 'laws', 'embrace', 'parenthood']",surat man latest to defy surrogacy laws embrace parenthood
"['clinical', 'rotations', 'in', 'the', 'us', 'put', 'indian', 'medical', 'students', 'on', 'the', 'path', 'to', 'becoming', 'practicing', 'doctors']",clinical rotations in the us put indian medical students on the path to becoming practicing doctors
"['almost', '40', 'of', 'surrendered', 'rs', '2000', 'return', 'back', 'in', 'other', 'denominations']",almost 40 of surrendered rs 2000 return back in other denominations
"['modi', 'writes', 'to', 'g20', 'leaders', 'on', 'full', 'membership', 'for', 'african', 'union', 'at', 'new', 'delhi', 'summit']",modi writes to g20 leaders on full membership for african union at new delhi summit
"['privacy', 'concerns', 'fuel', 'a', 'fall', 'in', 'social', 'media', 'geotagging']",privacy concerns fuel a fall in social media geotagging
"['pakistans', 'new', 'budget', 'fail', 'to', 'meet', 'expectations', 'to', 'boost', 'economy']",pakistans new budget fail to meet expectations to boost economy
"['nsa', 'pitches', 'for', 'critical', 'tech', 'for', 'india', 'through', 'initiatives', 'like', 'icet']",nsa pitches for critical tech for india through initiatives like icet
"['small', 'size', 'sugar', 'rush', 'carries', 'revenue', 'to', 'record', 'in', 'fy23']",small size sugar rush carries revenue to record in fy23
"['oil', 'rich', 'sakhalin', 'calls', 'for', 'more', 'investment', 'from', 'india']",oil rich sakhalin calls for more investment from india
"['in', 'charts', 'number', 'nuggets', 'from', 'the', 'filings', 'of', 'the', 'it', 'firms']",in charts number nuggets from the filings of the it firms
"['move', 'over', 'celebs', 'cannes', 'lays', 'the', 'red', 'carpet', 'for', 'influencers']",move over celebs cannes lays the red carpet for influencers
"['mls', '2023', 'live', 'streaming', 'where', 'to', 'watch', 'major', 'league', 'soccer']",mls 2023 live streaming where to watch major league soccer
"['spain', 'vs', 'croatia', 'uefa', 'nations', 'league', 'final', 'where', 'to', 'watch', 'live', 'streaming']",spain vs croatia uefa nations league final where to watch live streaming
"['dallas', 'wings', 'vs', 'seattle', 'storm', 'live', 'streaming', 'where', 'to', 'watch', 'wnba', '2023']",dallas wings vs seattle storm live streaming where to watch wnba 2023
"['bob', 'huggins', 'of', 'west', 'virginia', 'arrested', 'heres', 'why']",bob huggins of west virginia arrested heres why
"['wnba', '2023', 'tv', 'schedule', 'live', 'streaming', 'matches']",wnba 2023 tv schedule live streaming matches
"['india', 'uk', 'seeking', 'equal', 'treatment', 'for', 'services', 'sector', 'companies', 'under', 'proposed', 'free', 'trade', 'agreement', 'official']",india uk seeking equal treatment for services sector companies under proposed free trade agreement official
"['corporate', 'actions', 'this', 'week', 'hul', 'tata', 'steel', 'to', 'go', 'ex', 'dividend', 'indiamart', 'intermesh', 'ex', 'bonus', 'and', 'more']",corporate actions this week hul tata steel to go ex dividend indiamart intermesh ex bonus and more
"['planning', 'of', 'revolt', 'against', 'uddhav', 'thackeray', 'started', '6', '7', 'months', 'after', 'he', 'became', 'maharashtra', 'cm', 'shiv', 'sena', 'ubt', 'mla', 'nitin', 'deshmukh']",planning of revolt against uddhav thackeray started 6 7 months after he became maharashtra cm shiv sena ubt mla nitin deshmukh
"['juneteenth', 'day', 'in', 'us', 'list', 'of', 'popular', 'celebrations']",juneteenth day in us list of popular celebrations
"['buzz', 'and', 'smiles', 'growing', 'after', 'mercedes', 'tops', 'canada', 'practice']",buzz and smiles growing after mercedes tops canada practice
"['a', 'chatbot', 'that', 'wont', 'take', 'bribes', 'for', 'giving', 'advice', 'is', 'a', 'hit', 'in', 'india']",a chatbot that wont take bribes for giving advice is a hit in india
"['local', 'device', 'manufacturing', 'no', 'longer', 'confined', 'to', 'assembling', 'in', 'india', 'now']",local device manufacturing no longer confined to assembling in india now
"['want', 'to', 'deactivate', 'instagram', 'heres', 'a', 'step', 'by', 'step', 'guide']",want to deactivate instagram heres a step by step guide
"['netflix', 'releases', 'new', 'archies', 'trailer', 'at', 'tudum', 'event', 'in', 'brazil', 'heres', 'a', 'first', 'look']",netflix releases new archies trailer at tudum event in brazil heres a first look
"['govt', 'likely', 'to', 'invite', 'financial', 'bids', 'for', 'privatising', 'nmdc', 'steel', 'after', 'commissioning', 'blast', 'furnace', 'this', 'month']",govt likely to invite financial bids for privatising nmdc steel after commissioning blast furnace this month
"['4', 'large', 'cap', 'stocks', 'with', 'right', 'mix', 'of', 'roe', 'roce', 'for', 'wealth', 'creation']",4 large cap stocks with right mix of roe roce for wealth creation
"['banks', 'need', 'to', 'collaborate', 'and', 'create', 'policies', 'for', 'mobilizing', 'capital', 'towards', 'green', 'finance', 'joshi']",banks need to collaborate and create policies for mobilizing capital towards green finance joshi
"['view', 'ravi', 'shastri', 'co', 'passed', 'on', 'a', 'team', 'that', 'beat', 'the', 'world', 'at', 'their', 'home', 'but', 'rahul', 'dravid', 'co', 'couldnt', 'build', 'on', 'that']",view ravi shastri co passed on a team that beat the world at their home but rahul dravid co couldnt build on that
"['jharkhand', 'first', 'batch', 'of', '382', 'agniveers', 'completes', '24', 'week', 'military', 'training', 'inducted', 'in', '2', 'regiments']",jharkhand first batch of 382 agniveers completes 24 week military training inducted in 2 regiments
"['odisha', 'confirms', 'first', 'heat', 'wave', 'related', 'death']",odisha confirms first heat wave related death
"['5', 'stocks', 'from', 'sugar', 'industry', 'with', 'upside', 'potential', 'of', 'up', 'to', '40']",5 stocks from sugar industry with upside potential of up to 40
"['make', 'yoga', 'part', 'of', 'daily', 'routine', 'for', 'healthy', 'life', 'pm', 'modi', 'to', 'people']",make yoga part of daily routine for healthy life pm modi to people
"['rbi', 'denies', 'reports', 'of', 'missing', 'banknotes', 'assures', 'proper', 'accounting', 'and', 'systems', 'in', 'place']",rbi denies reports of missing banknotes assures proper accounting and systems in place
