headlines,headline_text
"['yuan', 'drops', 'toward', 'record', 'low', 'as', 'china', 'budges', 'in', 'fight', 'with', 'bears']",yuan drops toward record low as china budges in fight with bears
"['prince', 'harry', 'visits', 'queen', 'elizabeth', 'iis', 'burial', 'site', 'on', 'first', 'anniversary', 'of', 'her', 'death', 'details', 'here']",prince harry visits queen elizabeth iis burial site on first anniversary of her death details here
"['how', 'india', 'is', 'fixing', 'legacy', 'issues', 'to', 'force', 'a', 'fundamental', 'reset', 'of', 'economy']",how india is fixing legacy issues to force a fundamental reset of economy
"['us', 'retail', 'staff', 'are', 'fed', 'up', 'quitting', 'at', 'record', 'rates']",us retail staff are fed up quitting at record rates
"['channel', '4', 'discontinues', 'hollyoaks', 'programme', 'shifted', 'to', 'e4', 'episodes', 'available', 'on', 'youtube']",channel 4 discontinues hollyoaks programme shifted to e4 episodes available on youtube
"['supreme', 'court', 'releases', 'man', 'after', 'finding', 'he', 'was', 'juvenile', 'at', 'time', 'of', 'offence']",supreme court releases man after finding he was juvenile at time of offence
"['monarch', 'legacy', 'of', 'monsters', 'see', 'cast', 'release', 'schedule', 'streaming', 'platform', 'storyline', 'and', 'more']",monarch legacy of monsters see cast release schedule streaming platform storyline and more
"['seek', 'another', 'term', 'for', 'global', 'south']",seek another term for global south
"['varanasi', 'court', 'grants', '8', 'more', 'weeks', 'to', 'asi', 'to', 'complete', 'scientific', 'survey', 'of', 'gyanvapi', 'mosque', 'complex']",varanasi court grants 8 more weeks to asi to complete scientific survey of gyanvapi mosque complex
"['poll', 'overseers', 'get', 'your', 'ai', 'act', 'together']",poll overseers get your ai act together
"['ajit', 'ninan', '1955', '2023', 'his', 'clean', 'lines', 'dealt', 'with', 'a', 'messy', 'world']",ajit ninan 1955 2023 his clean lines dealt with a messy world
"['manipur', 'two', 'killed', 'in', 'firing', 'between', 'security', 'forces', 'and', 'armed', 'men']",manipur two killed in firing between security forces and armed men
"['bridging', 'the', 'stem', 'liberal', 'arts', 'divide']",bridging the stem liberal arts divide
"['audit', 'reveals', 'lack', 'of', 'uniformity', 'in', 'cctv', 'installation', 'need', 'of', 'ai']",audit reveals lack of uniformity in cctv installation need of ai
"['vikings', 'valhalla', 'video', 'game', 'on', 'netflix', 'popular', 'series', 'released', 'details', 'here']",vikings valhalla video game on netflix popular series released details here
"['adani', 'enterprises', 'to', 'supply', 'ammonia', 'green', 'hydrogen', 'to', 'kowa', 'holdings', 'asia']",adani enterprises to supply ammonia green hydrogen to kowa holdings asia
"['idbi', 'trusteeship', 'files', 'insolvency', 'resolution', 'application', 'against', 'coffee', 'day', 'enterprises']",idbi trusteeship files insolvency resolution application against coffee day enterprises
"['top', '8', 'folding', 'dining', 'tables', 'to', 'upgrade', 'your', 'dining', 'areas']",top 8 folding dining tables to upgrade your dining areas
"['us', 'government', 'terminates', 'deep', 'vzn', 'program', 'to', 'research', 'exotic', 'virus', 'pathogens', 'apprehending', 'accidental', 'outbreak']",us government terminates deep vzn program to research exotic virus pathogens apprehending accidental outbreak
"['karnataka', 'hc', 'stays', 'proceedings', 'in', 'case', 'against', 'cm', 'siddaramaiah']",karnataka hc stays proceedings in case against cm siddaramaiah
"['12', 'modern', 'dining', 'tables', 'to', 'elevate', 'your', 'dining', 'space', 'starting', 'at', 'just', 'rs', '15000']",12 modern dining tables to elevate your dining space starting at just rs 15000
"['dinner', 'sets', 'under', '30000', '6', 'dinnerware', 'options', 'to', 'enhance', 'the', 'way', 'you', 'dine']",dinner sets under 30000 6 dinnerware options to enhance the way you dine
"['icici', 'bank', 'gets', 'rbi', 'nod', 'to', 'make', 'i', 'process', 'services', 'as', 'wholly', 'owned', 'subsidiary']",icici bank gets rbi nod to make i process services as wholly owned subsidiary
"['aap', 'releases', 'first', 'list', 'of', '10', 'candidates', 'for', 'mp', 'assembly', 'polls', 'becomes', 'third', 'party', 'to', 'do', 'so']",aap releases first list of 10 candidates for mp assembly polls becomes third party to do so
"['world', 'way', 'off', 'track', 'to', 'meet', 'paris', 'goals', 'says', 'un', 'report']",world way off track to meet paris goals says un report
"['inter', 'miami', 'vs', 'sporting', 'kc', 'live', 'streaming', 'where', 'to', 'watch', 'lionel', 'messis', 'club', 'and', 'sporting', 'kansas', 'citys', 'next', 'mls', 'match']",inter miami vs sporting kc live streaming where to watch lionel messis club and sporting kansas citys next mls match
"['russian', 'air', 'superiority', 'stopping', 'counteroffensive', 'zelensky']",russian air superiority stopping counteroffensive zelensky
"['elden', 'ring', 'see', 'how', 'to', 'obtain', 'meteorite', 'staff', 'in', 'game']",elden ring see how to obtain meteorite staff in game
"['what', 'is', 'a', 'comet', 'where', 'does', 'it', 'come', 'from', 'why', 'does', 'it', 'have', 'long', 'streaming', 'tail']",what is a comet where does it come from why does it have long streaming tail
"['india', 'will', 'be', 'largest', 'exporter', 'of', 'ai', 'in', 'future', 'nvidia', 'founder', 'jensen', 'huang']",india will be largest exporter of ai in future nvidia founder jensen huang
"['tatas', 'partnership', 'with', 'nvidia', 'to', 'upskill', '6', 'lakh', 'tcs', 'employees']",tatas partnership with nvidia to upskill 6 lakh tcs employees
"['panasonic', 'to', 'invest', 'another', 'rs', '300', 'cr', 'in', 'andhra', 'facility', 'by', '2026', 'aims', 'higher', 'exports', 'from', 'india']",panasonic to invest another rs 300 cr in andhra facility by 2026 aims higher exports from india
"['dunzo', 'delays', 'paying', 'salaries', 'further', 'as', 'company', 'faces', 'severe', 'cash', 'crunch']",dunzo delays paying salaries further as company faces severe cash crunch
"['nse', 'gets', 'sebi', 'nod', 'to', 'launch', 'options', 'on', 'wti', 'crude', 'and', 'natural', 'gas', 'futures', 'contracts']",nse gets sebi nod to launch options on wti crude and natural gas futures contracts
"['india', 'committed', 'to', 'furthering', 'voice', 'of', 'global', 'south', 'pm', 'modi', 'after', 'talks', 'with', 'mauritian', 'leader']",india committed to furthering voice of global south pm modi after talks with mauritian leader
"['sovereign', 'gold', 'bond', 'issue', 'price', 'fixed', 'at', 'rs', '5923', 'per', 'gram', 'subscription', 'to', 'open', 'on', 'sep', '11']",sovereign gold bond issue price fixed at rs 5923 per gram subscription to open on sep 11
"['amit', 'shah', 'hails', 'world', 'bank', 'report', 'that', 'india', 'achieved', '80', 'per', 'cent', 'financial', 'inclusion', 'in', 'just', '6', 'years', 'under', 'pm', 'narendra', 'modi']",amit shah hails world bank report that india achieved 80 per cent financial inclusion in just 6 years under pm narendra modi
"['us', 'open', '2023', 'final', 'live', 'streaming', 'tv', 'channel', 'start', 'time', 'when', 'and', 'where', 'to', 'watch', 'aryna', 'sabalenka', 'vs', 'coco', 'gauff', 'tennis', 'match']",us open 2023 final live streaming tv channel start time when and where to watch aryna sabalenka vs coco gauff tennis match
"['willkomen', 'swagatam', 'g20', 'delegates', 'to', 'be', 'greeted', 'in', 'multiple', 'languages']",willkomen swagatam g20 delegates to be greeted in multiple languages
"['india', 'is', 'facing', 'threat', 'to', 'secularism', 'pm', 'modi', 'going', 'against', 'the', 'constitution', 'says', 'tn', 'cm', 'stalin']",india is facing threat to secularism pm modi going against the constitution says tn cm stalin
"['assam', 'launches', 'a', 'series', 'of', 'initiatives', 'on', 'skill', 'development']",assam launches a series of initiatives on skill development
"['reliance', 'nvidia', 'to', 'develop', 'ai', 'infra', 'in', 'india', 'freshworks', 'draws', 'more', 'large', 'customers']",reliance nvidia to develop ai infra in india freshworks draws more large customers
"['adani', 'group', 'stocks', 'market', 'cap', 'crosses', 'rs', '11', 'lakh', 'crore']",adani group stocks market cap crosses rs 11 lakh crore
"['adani', 'group', 'stocks', 'recover', 'after', 'occrp', 'reports', 'mcap', 'hits', 'rs', '11', 'trillion']",adani group stocks recover after occrp reports mcap hits rs 11 trillion
"['nfl', 'who', 'sang', 'national', 'anthem', 'ahead', 'of', 'kansas', 'city', 'chiefs', 'vs', 'detroit', 'lions', 'game']",nfl who sang national anthem ahead of kansas city chiefs vs detroit lions game
"['sjvn', 'inks', 'ppa', 'with', 'bbmb', 'to', 'set', 'up', '18', 'mw', 'solar', 'project']",sjvn inks ppa with bbmb to set up 18 mw solar project
"['bank', 'of', 'baroda', 'enables', 'upi', 'atm', 'facility', 'at', 'over', '6000', 'atms', 'across', 'country']",bank of baroda enables upi atm facility at over 6000 atms across country
"['directors', 'have', 'a', 'natural', 'flair', 'for', 'acting', 'feels', 'anurag', 'kashyap']",directors have a natural flair for acting feels anurag kashyap
"['shah', 'rukh', 'khans', 'jawan', 'records', 'bollywood', 'box', 'office', 'history', 'with', 'biggest', 'opening', 'of', 'rs', '75', 'cr', 'rajamouli', 'raves', 'about', 'baadshah']",shah rukh khans jawan records bollywood box office history with biggest opening of rs 75 cr rajamouli raves about baadshah
"['banks', 'cant', 'use', 'loc', 'as', 'measure', 'to', 'recover', 'money', 'delhi', 'hc']",banks cant use loc as measure to recover money delhi hc
"['ratnaveer', 'precision', 'engineering', 'shares', 'to', 'list', 'on', 'september', '11', 'marking', 'the', 'first', 't3', 'debut']",ratnaveer precision engineering shares to list on september 11 marking the first t3 debut
"['freshworks', 'betting', 'on', 'larger', 'customers', 'becoming', 'bigger', 'part', 'of', 'its', 'business']",freshworks betting on larger customers becoming bigger part of its business
"['hurricane', 'lee', 'intensifies', 'to', 'category', '5', 'sweeps', 'atlantic', 'ocean', 'check', 'forecast', 'projected', 'path']",hurricane lee intensifies to category 5 sweeps atlantic ocean check forecast projected path
"['india', 'crush', 'maldives', '8', '0', 'to', 'make', 'saff', 'u', '16', 'championship', 'final']",india crush maldives 8 0 to make saff u 16 championship final
"['brookfield', 'to', 'invest', 'rs', '1500', 'crore', 'more', 'in', 'leela']",brookfield to invest rs 1500 crore more in leela
"['us', 'president', 'joe', 'biden', 'arrives', 'in', 'new', 'delhi', 'to', 'attend', 'g20', 'summit']",us president joe biden arrives in new delhi to attend g20 summit
"['income', 'tax', 'dept', 'seeking', 'shareholders', 'details', 'from', 'some', 'startups', 'ashneer', 'grover']",income tax dept seeking shareholders details from some startups ashneer grover
"['need', 'to', 're', 'evaluate', 'pearl', 'millet', 'cultivation', 'in', 'india', 'amid', 'climate', 'change', 'study']",need to re evaluate pearl millet cultivation in india amid climate change study
"['wipro', 'founder', 'azim', 'premji', 'meets', 'karnataka', 'cm', 'siddaramaiah', 'his', 'deputy', 'dk', 'shivakumar', 'over', 'brand', 'bengaluru']",wipro founder azim premji meets karnataka cm siddaramaiah his deputy dk shivakumar over brand bengaluru
"['joe', 'burrow', 'salary', 'cincinnati', 'bengals', 'quarterback', 'creates', 'history', 'becomes', 'highest', 'paid', 'nfl', 'player']",joe burrow salary cincinnati bengals quarterback creates history becomes highest paid nfl player
"['pm', 'modis', 'degrees', 'court', 'reserves', 'order', 'on', 'kejriwals', 'plea', 'against', 'summons', 'in', 'defamation', 'case']",pm modis degrees court reserves order on kejriwals plea against summons in defamation case
"['tired', 'of', 'living', 'with', 'polycystic', 'ovaries', 'losing', 'weight', 'can', 'be', 'antidote', 'for', 'pcos', 'claim', 'researchers']",tired of living with polycystic ovaries losing weight can be antidote for pcos claim researchers
"['in', 'a', 'first', 'florida', 'city', 'becomes', 'sanctuary', 'for', 'lgbtq', 'people', 'all', 'you', 'may', 'want', 'to', 'know']",in a first florida city becomes sanctuary for lgbtq people all you may want to know
"['lawmakers', 'raise', 'concern', 'over', 'chinese', 'envoys', 'comments', 'on', 'indo', 'nepal', 'ties', 'warned', 'to', 'be', 'more', 'careful']",lawmakers raise concern over chinese envoys comments on indo nepal ties warned to be more careful
"['sat', 'defers', 'hearing', 'on', 'sebis', 'confirmatory', 'order', 'to', 'sept', '13']",sat defers hearing on sebis confirmatory order to sept 13
"['celebrating', 'excellence', 'in', 'project', 'management', 'highlights', 'from', 'pmi', 'south', 'asia', 'awards', '2023']",celebrating excellence in project management highlights from pmi south asia awards 2023
"['fm', 'holds', 'bilateral', 'meeting', 'with', 'us', 'treasury', 'secretary', 'discusses', 'g20', 'priorities']",fm holds bilateral meeting with us treasury secretary discusses g20 priorities
"['mega', 'millions', 'lottery', 'drawing', 'tonight', 'jackpot', 'soars', 'to', '101', 'million', 'when', 'to', 'check', 'friday', 'result', 'winner', 'number']",mega millions lottery drawing tonight jackpot soars to 101 million when to check friday result winner number
"['assam', 'solar', 'operated', 'mobile', 'lift', 'irrigation', 'scheme', 'demonstrates', 'remarkable', 'success', 'in', 'boko', 'region']",assam solar operated mobile lift irrigation scheme demonstrates remarkable success in boko region
"['religion', 'and', 'politics', 'different', 'no', 'need', 'to', 'mix', 'them', 'cong', 'chief', 'kharge', 'on', 'udhyanidhis', 'sanatan', 'dharma', 'remarks']",religion and politics different no need to mix them cong chief kharge on udhyanidhis sanatan dharma remarks
"['time100', 'ai', 'list', 'these', 'indians', 'made', 'a', 'difference', 'in', 'the', 'ai', 'space']",time100 ai list these indians made a difference in the ai space
"['world', 'banks', 'g20', 'document', 'on', 'indias', 'dpi', 'testament', 'to', 'rapid', 'progress', 'and', 'innovation', 'pm', 'modi']",world banks g20 document on indias dpi testament to rapid progress and innovation pm modi
"['in', 'uae', 'hundreds', 'of', 'mammoottys', 'fans', 'queue', 'up', 'to', 'donate', 'blood', 'to', 'celebrate', 'his', 'birthday']",in uae hundreds of mammoottys fans queue up to donate blood to celebrate his birthday
"['ratnaveer', 'precision', 'engineering', 'ipo', 'share', 'allotment', 'expected', 'today', 'heres', 'how', 'you', 'can', 'check', 'status']",ratnaveer precision engineering ipo share allotment expected today heres how you can check status
"['ntpc', 'green', 'energy', 'v', 'o', 'chidambaranar', 'port', 'authority', 'to', 'develop', 'green', 'hydrogen', 'hub', 'in', 'tamil', 'nadu']",ntpc green energy v o chidambaranar port authority to develop green hydrogen hub in tamil nadu
"['jupiter', 'life', 'line', 'hospitals', 'ipo', 'racing', 'ahead', 'on', 'last', 'day', 'led', 'by', 'strong', 'institutional', 'interest']",jupiter life line hospitals ipo racing ahead on last day led by strong institutional interest
"['weekend', 'watchlist', 'from', 'jawan', 'to', 'the', 'little', 'mermaid', 'list', 'of', 'must', 'watch', 'theatrical', 'ott', 'releases']",weekend watchlist from jawan to the little mermaid list of must watch theatrical ott releases
"['tenet', 'diagnostics', 'chain', 'to', 'invest', 'rs', '100', 'crore', 'in', 'karnataka', 'to', 'open', 'new', 'centres', 'as', 'sector', 'records', 'healthy', 'growth']",tenet diagnostics chain to invest rs 100 crore in karnataka to open new centres as sector records healthy growth
"['gold', 'rises', 'rs', '100', 'silver', 'remains', 'flat']",gold rises rs 100 silver remains flat
"['usa', 'vs', 'uzbekistan', 'live', 'streaming', 'kick', 'off', 'time', 'where', 'to', 'watch', 'usmnt', 'soccer', 'match']",usa vs uzbekistan live streaming kick off time where to watch usmnt soccer match
"['srk', 'starrer', 'jawans', 'brea', 'king', 'business', 'hopes', 'spread', 'movie', 'industrys', 'arms', 'wider', 'to', 'capture', 'more', 'revenues']",srk starrer jawans brea king business hopes spread movie industrys arms wider to capture more revenues
"['rajasthan', 'govt', 'approves', 'rs', '256', '46', 'cr', 'for', 'construction', 'of', 'bridge', 'on', 'chambal', 'river', 'in', 'kota']",rajasthan govt approves rs 256 46 cr for construction of bridge on chambal river in kota
"['jupiter', 'life', 'line', 'hospitals', 'ipo', 'subscription', 'status']",jupiter life line hospitals ipo subscription status
"['ems', 'ipo', 'fully', 'subscribed', 'within', 'hours', 'of', 'opening', 'check', 'gmp', 'and', 'other', 'details']",ems ipo fully subscribed within hours of opening check gmp and other details
"['carrot', 'and', 'stick', 'how', 'haryana', 'plans', 'to', 'curb', 'stubble', 'burning', 'reduce', 'pollution']",carrot and stick how haryana plans to curb stubble burning reduce pollution
"['dubais', 'evolving', 'startup', 'ecosystem', 'paves', 'the', 'way', 'for', 'a', 'bright', 'tomorrow']",dubais evolving startup ecosystem paves the way for a bright tomorrow
"['us', 'europe', 'and', 'india', 'need', 'to', 'create', 'competitive', 'alternative', 'model', 'to', 'chinas', 'coercive', 'production', 'model', 'rahul', 'gandhi']",us europe and india need to create competitive alternative model to chinas coercive production model rahul gandhi
"['inclusive', 'growth', 'climate', 'finance', 'among', 'g20', 'priorities', 'under', 'indias', 'presidency', 'amitabh', 'kant']",inclusive growth climate finance among g20 priorities under indias presidency amitabh kant
"['india', 'to', 'focus', 'on', 'sustainable', 'inclusive', 'growth', 'during', 'its', 'presidency', 'g20', 'sherpa', 'amitabh', 'kant']",india to focus on sustainable inclusive growth during its presidency g20 sherpa amitabh kant
"['tech', 'view', 'nifty', 'momentum', 'indicators', 'blinking', 'buy', 'what', 'traders', 'should', 'do', 'on', 'monday']",tech view nifty momentum indicators blinking buy what traders should do on monday
"['mumbai', 'police', 'announce', 'eight', 'alternative', 'routes', 'in', 'mumbai', 'during', 'ganesh', 'festival', 'here', 'are', 'details']",mumbai police announce eight alternative routes in mumbai during ganesh festival here are details
"['ettech', 'deals', 'digest', 'late', 'stage', 'investment', 'in', 'e', 'scooter', 'makers', 'boosts', 'funding', 'activity', 'for', 'startups']",ettech deals digest late stage investment in e scooter makers boosts funding activity for startups
"['earnings', 'growth', 'in', 'some', 'mid', 'and', 'smallcaps', 'will', 'be', 'far', 'superior', 'to', 'largecaps', 'tough', 'to', 'say', 'when', 'pe', 'valuations', 'will', 'contract', 'vinod', 'karki']",earnings growth in some mid and smallcaps will be far superior to largecaps tough to say when pe valuations will contract vinod karki
"['2006', 'mumbai', 'train', 'blasts', 'after', 'hc', 'rap', 'maharashtra', 'government', 'appoints', 'special', 'prosecutor', 'for', 'appeal', 'hearing']",2006 mumbai train blasts after hc rap maharashtra government appoints special prosecutor for appeal hearing
"['foreign', 'exchange', 'reserves', 'are', 'up', 'by', '4', '039', 'bln', 'to', '598', '897', 'bln', 'for', 'the', 'week', 'ending', 'sept', '1']",foreign exchange reserves are up by 4 039 bln to 598 897 bln for the week ending sept 1
"['air', 'india', 'working', 'towards', 'getting', 'overseas', 'competition', 'regulators', 'nod', 'for', 'vistara', 'merger', 'campbell', 'wilson']",air india working towards getting overseas competition regulators nod for vistara merger campbell wilson
"['2023', 'tata', 'nexon', 'ev', 'bookings', 'to', 'start', 'on', 'september', '9', 'heres', 'all', 'you', 'need', 'to', 'know']",2023 tata nexon ev bookings to start on september 9 heres all you need to know
"['congress', 'is', 'engaged', 'in', 'uniting', 'bharat', 'bjp', 'trying', 'to', 'break', 'it', 'mallikarjun', 'kharge']",congress is engaged in uniting bharat bjp trying to break it mallikarjun kharge
"['beml', 'rain', 'industries', 'among', '10', 'stocks', 'with', 'bearish', 'rsi', 'trends']",beml rain industries among 10 stocks with bearish rsi trends
"['firm', 'belief', 'that', 'g20', 'summit', 'will', 'chart', 'new', 'path', 'in', 'human', 'centric', 'inclusive', 'development', 'pm', 'modi']",firm belief that g20 summit will chart new path in human centric inclusive development pm modi
"['the', '1975', 'pop', 'rock', 'bands', '2024', 'tour', 'dates', 'cities', 'and', 'ticket', 'sale', 'details']",the 1975 pop rock bands 2024 tour dates cities and ticket sale details
"['starworth', 'infrastructure', 'and', 'construction', 'target', '4x', 'growth', 'in', 'revenue', 'by', '2027']",starworth infrastructure and construction target 4x growth in revenue by 2027
"['mallikarjun', 'kharge', 'not', 'invited', 'to', 'presidents', 'g20', 'dinner', 'party', 'leaders', 'say', 'its', 'unfortunate', 'shows', 'govts', 'thinking']",mallikarjun kharge not invited to presidents g20 dinner party leaders say its unfortunate shows govts thinking
"['jason', 'statham', 'sylvester', 'stallone', 'starrer', 'expend4bles', 'sets', 'september', '22', 'as', 'release', 'date', 'for', 'indian', 'theatres']",jason statham sylvester stallone starrer expend4bles sets september 22 as release date for indian theatres
"['new', 'delhi', 'leaders', 'declaration', 'almost', 'ready', 'india']",new delhi leaders declaration almost ready india
"['reliance', 'partners', 'with', 'nvidia', 'for', 'developing', 'ai', 'infra', 'in', 'india']",reliance partners with nvidia for developing ai infra in india
"['high', 'income', 'countries', 'of', 'g20', 'fall', 'drastically', 'short', 'on', 'climate', 'action', 'says', 'oxfam', 'paper']",high income countries of g20 fall drastically short on climate action says oxfam paper
"['mankind', 'pharma', 'radico', 'khaitan', 'among', '10', 'stocks', 'with', 'rsi', 'trending', 'down']",mankind pharma radico khaitan among 10 stocks with rsi trending down
"['find', 'bullion', 'attractive', 'gold', 'doesnt', 'charm', 'vani', 'kola', 'kalaari', 'md', 'reveals', 'she', 'doesnt', 'own', 'or', 'buy', 'jewellery']",find bullion attractive gold doesnt charm vani kola kalaari md reveals she doesnt own or buy jewellery
"['issue', 'show', 'cause', 'for', 'suspending', 'business', 'with', 'company', 'over', 'agustawestland', 'probe', 'hc', 'to', 'centre']",issue show cause for suspending business with company over agustawestland probe hc to centre
"['lifestyle', 'retailer', 'goodgudi', 'raises', 'funding']",lifestyle retailer goodgudi raises funding
"['pvr', 'inox', 'coal', 'india', 'among', '10', 'overbought', 'stocks', 'with', 'rsi', 'above', '70']",pvr inox coal india among 10 overbought stocks with rsi above 70
"['gccs', 'expanding', 'out', 'of', 'bengaluru', 'with', '55', 'pc', 'set', 'up', 'in', 'other', 'indian', 'locations', 'report']",gccs expanding out of bengaluru with 55 pc set up in other indian locations report
"['states', 'uts', 'collected', 'rs', '2', 'lakh', 'cr', 'in', 'fy23', 'from', 'real', 'estate', 'sector', 'report']",states uts collected rs 2 lakh cr in fy23 from real estate sector report
"['what', 'are', 'the', 'different', 'types', 'of', 'cxo', 'courses', 'available']",what are the different types of cxo courses available
"['balaji', 'amines', 'arm', 'balaji', 'speciality', 'chemicals', 'withdraws', 'ipo', 'papers']",balaji amines arm balaji speciality chemicals withdraws ipo papers
"['imd', 'issues', 'orange', 'rain', 'alert', 'for', 'mp', 'intermittent', 'showers', 'continue', 'in', 'state']",imd issues orange rain alert for mp intermittent showers continue in state
"['rec', 'au', 'sfb', '5', 'other', 'midcap', 'stocks', 'surpass', '20', 'day', 'sma']",rec au sfb 5 other midcap stocks surpass 20 day sma
"['get', 'ready', 'for', 'apples', 'wonderlust', 'event', 'tech', 'giant', 'sets', 'youtube', 'live', 'stream', 'placeholder', 'ahead', 'of', 'iphone', '15', 'launch']",get ready for apples wonderlust event tech giant sets youtube live stream placeholder ahead of iphone 15 launch
"['economists', 'welcome', 'rbi', 'move', 'to', 'withdraw', 'icrr', 'in', 'a', 'phased', 'manner']",economists welcome rbi move to withdraw icrr in a phased manner
"['how', '250', 'gm', 'seeds', 'created', 'a', 'millet', 'movement', 'in', 'india', 'odishas', 'millet', 'didi', 'to', 'tell', 'g20']",how 250 gm seeds created a millet movement in india odishas millet didi to tell g20
"['renewable', 'energy', 'a', 'beacon', 'of', 'hope', 'at', 'the', 'g', '20', 'summit']",renewable energy a beacon of hope at the g 20 summit
"['bata', 'india', 'dabur', 'india', 'among', '10', 'stocks', 'with', 'rsi', 'trending', 'up']",bata india dabur india among 10 stocks with rsi trending up
"['brazil', 'vs', 'bolivia', 'live', 'streaming', 'where', 'to', 'watch', 'world', 'cup', '2026', 'qualifiers', 'south', 'america', 'conmebol', 'soccer', 'match']",brazil vs bolivia live streaming where to watch world cup 2026 qualifiers south america conmebol soccer match
"['bengaluru', 'develops', 'revolutionary', 'tech', 'that', 'can', 'predict', 'disease', 'outbreak', 'one', 'month', 'in', 'advance']",bengaluru develops revolutionary tech that can predict disease outbreak one month in advance
"['petition', 'filed', 'in', 'bihar', 'court', 'against', 'a', 'raja', 'priyank', 'kharge']",petition filed in bihar court against a raja priyank kharge
"['akasa', 'air', 'celebrates', 'milestone', 'as', 'first', 'batch', 'of', 'pilots', 'graduate']",akasa air celebrates milestone as first batch of pilots graduate
"['relief', 'for', 'devendra', 'fadnavis', 'as', 'nagpur', 'court', 'acquits', 'him', 'in', '2014', 'poll', 'affidavit', 'matter']",relief for devendra fadnavis as nagpur court acquits him in 2014 poll affidavit matter
