headlines,headline_text
"['sc', 'questions', 'tearing', 'hurry', 'shown', 'by', 'delhi', 'lg', 'in', 'mcd', 'elections', 'amidst', 'legislative', 'concerns']",sc questions tearing hurry shown by delhi lg in mcd elections amidst legislative concerns
"['the', 'boys', 'prequel', 'release', 'window', 'of', 'the', 'vought', 'rising', 'revealed', 'what', 'to', 'expect']",the boys prequel release window of the vought rising revealed what to expect
"['marital', 'rape', 'is', 'rape', 'not', 'another', 'crime']",marital rape is rape not another crime
"['from', 'mutton', 'biryani', 'to', 'chicken', 'curry', 'west', 'bengal', 'jails', 'to', 'serve', 'prisoners', 'special', 'meals', 'for', 'durga', 'puja', 'check', 'menu']",from mutton biryani to chicken curry west bengal jails to serve prisoners special meals for durga puja check menu
"['the', 'new', 'disposables', 'sustainability', 'burden']",the new disposables sustainability burden
"['it', 'is', 'a', 'personal', 'decision', 'babita', 'phogat', 'on', 'sister', 'vinesh', 'phogat', 'contesting', 'on', 'congress', 'ticket']",it is a personal decision babita phogat on sister vinesh phogat contesting on congress ticket
"['govt', 'may', 'mandate', 'qr', 'codes', 'to', 'check', 'fake', 'cancer', 'drugs']",govt may mandate qr codes to check fake cancer drugs
"['cement', 'prices', 'will', 'be', 'hiked', 'and', 'demand', 'will', 'grow', 'in', 'h2fy25', 'centrum', 'report']",cement prices will be hiked and demand will grow in h2fy25 centrum report
"['is', 'angelina', 'jolie', 'dating', 'corbynista', 'rapper', 'akala', 'rumours', 'fly', 'after', 'both', 'seen', 'together', 'in', 'the', 'film', 'premiere']",is angelina jolie dating corbynista rapper akala rumours fly after both seen together in the film premiere
"['et', 'graphics', 'with', 'more', 'youths', 'in', 'the', 'workforce', 'skilling', 'remains', 'a', 'challenge']",et graphics with more youths in the workforce skilling remains a challenge
