headlines,headline_text
"['sri', 'lanka', 'unaware', 'of', 'ship', 'carrying', 'toxic', 'wastes', 'from', 'the', 'us', 'officials']",sri lanka unaware of ship carrying toxic wastes from the us officials
"['jobs', 'generated', 'under', 'mgnregs', 'up', '4', '8']",jobs generated under mgnregs up 4 8
"['my', 'hero', 'academia', 'season', '7', 'release', 'date', 'animes', 'season', '6', 'special', 'episodes', 'to', 'premier', 'in', 'april']",my hero academia season 7 release date animes season 6 special episodes to premier in april
"['trying', 'to', 'bring', 'in', 'fresh', 'blood', 'and', 'fresh', 'thinking', 'in', 'vip', 'looking', 'at', '14', 'growth', 'says', 'md']",trying to bring in fresh blood and fresh thinking in vip looking at 14 growth says md
"['today', 'people', 'scared', 'matter', 'of', 'grave', 'concern', 'saurabh', 'bhardwaj']",today people scared matter of grave concern saurabh bhardwaj
"['hoard', 'this', 'is', 'what', 'we', 'know', 'so', 'far', 'about', 'release', 'date', 'plot', 'cast', 'and', 'trailer']",hoard this is what we know so far about release date plot cast and trailer
