headlines,headline_text
"['jharkhand', 'elections', 'on', 'lines', 'of', 'haryana', 'bjp', 'sets', 'up', 'ranchi', 'war', 'room']",jharkhand elections on lines of haryana bjp sets up ranchi war room
"['indian', 'telcos', 'get', 'huge', 'discounts', 'on', 'gear', 'as', 'vendors', 'target', 'growth', 'markets']",indian telcos get huge discounts on gear as vendors target growth markets
"['from', 'kazan', 'to', 'the', 'world', 'brics', 'expansion', 'could', 'reshape', 'global', 'governance']",from kazan to the world brics expansion could reshape global governance
"['sanctioned', 'indian', 'companies', 'procured', 'items', 'made', 'in', 'west', 'open', 'markets']",sanctioned indian companies procured items made in west open markets
"['one', 'railway', 'app', 'for', 'ticketing', 'tracking', 'trains', 'expected', 'to', 'make', 'its', 'debut', 'in', 'december']",one railway app for ticketing tracking trains expected to make its debut in december
"['regular', 'ibc', 'tweaks', 'needed', 'to', 'address', 'bankruptcy', 'challenges', 'says', 'corporate', 'affairs', 'ministry']",regular ibc tweaks needed to address bankruptcy challenges says corporate affairs ministry
"['will', 'deport', 'illegal', 'immigrants', 'return', 'land', 'to', 'tribals', 'amit', 'shah']",will deport illegal immigrants return land to tribals amit shah
"['dth', 'players', 'fy24', 'revenue', 'down', 'amid', 'major', 'subscriber', 'loss']",dth players fy24 revenue down amid major subscriber loss
"['world', 'trade', 'disorder', 'agents', 'the', 'plan', 'india', 'has', 'to', 'follow', 'regardless', 'of', 'who', 'wins', 'us', 'elections']",world trade disorder agents the plan india has to follow regardless of who wins us elections
"['us', 'elections', 'kamala', 'harris', 'woos', 'michigan', 'as', 'donald', 'trump', 'hits', 'eastern', 'states']",us elections kamala harris woos michigan as donald trump hits eastern states
"['at', 'least', '12', 'civilians', 'injured', 'in', 'srinagar', 'grenade', 'attack']",at least 12 civilians injured in srinagar grenade attack
"['not', 'all', 'dolphins', 'are', 'the', 'same', 'goa']",not all dolphins are the same goa
"['maharashtra', 'elections', 'want', 'to', 'bring', 'back', 'holistic', 'work', 'done', 'by', 'pawar', 'says', 'yugendra']",maharashtra elections want to bring back holistic work done by pawar says yugendra
"['india', 'rises', 'as', 'global', 'player', 'in', 'petroleum', 'gemstone', 'sugar', 'exports', 'with', 'surging', 'market', 'share', 'in', '5', 'yrs']",india rises as global player in petroleum gemstone sugar exports with surging market share in 5 yrs
"['youtube', 'dont', 'play', 'moscow', 'rules']",youtube dont play moscow rules
"['centre', 'rejects', 'punjab', 'govts', 'stubble', 'funding', 'demand']",centre rejects punjab govts stubble funding demand
"['indias', 'green', 'revolution', 'leading', 'the', 'way', 'in', 'durable', 'carbon', 'removal', 'to', 'combat', 'climate', 'change']",indias green revolution leading the way in durable carbon removal to combat climate change
"['samajwadi', 'partys', 'real', 'agenda', 'is', 'muslim', 'appeasement', 'supporting', 'jihadis', 'for', 'vote', 'bank', 'up', 'deputy', 'cm', 'keshav', 'prasad', 'maurya']",samajwadi partys real agenda is muslim appeasement supporting jihadis for vote bank up deputy cm keshav prasad maurya
"['jammu', 'kashmir', 'uts', 'first', 'assembly', 'session', 'begins', 'today']",jammu kashmir uts first assembly session begins today
"['dlf', 'aims', 'to', 'double', 'rental', 'income', 'in', 'fy26']",dlf aims to double rental income in fy26
"['lost', 'cause', 'by', 'beck']",lost cause by beck
"['parliaments', 'winter', 'session', 'likely', 'to', 'start', 'from', 'november', '25']",parliaments winter session likely to start from november 25
"['biodiversity', 'is', 'the', 'new', 'oil', 'protect', 'it']",biodiversity is the new oil protect it
"['john', 'wick', 'chapter', '5', 'is', 'happening', 'what', 'do', 'we', 'know', 'so', 'far', 'about', 'keanu', 'reeves', 'john', 'wick', '5']",john wick chapter 5 is happening what do we know so far about keanu reeves john wick 5
"['the', 'right', 'to', 'exist']",the right to exist
"['australia', 'plans', '10', '5', 'billion', 'in', 'student', 'debt', 'cuts']",australia plans 10 5 billion in student debt cuts
"['adani', 'may', 'pull', 'the', 'power', 'plug', 'on', 'bangladesh', 'if', 'dues', 'not', 'settled', 'by', 'november', '7']",adani may pull the power plug on bangladesh if dues not settled by november 7
"['israeli', 'attacks', 'across', 'gaza', 'kill', 'three', 'northern', 'areas', 'besieged']",israeli attacks across gaza kill three northern areas besieged
"['peacock', 'november', '2024', 'lineup', 'check', 'out', 'complete', 'list']",peacock november 2024 lineup check out complete list
"['why', 'community', 'building', 'is', 'key', 'to', 'creator', 'success', 'today']",why community building is key to creator success today
"['days', 'of', 'our', 'lives', 'season', '61', 'what', 'we', 'know', 'about', 'renewal']",days of our lives season 61 what we know about renewal
"['banks', 'seek', 'integration', 'with', 'rbi', 'platform', 'to', 'monitor', 'lrs', 'limits']",banks seek integration with rbi platform to monitor lrs limits
"['jamiat', 'cautions', 'tdp', 'jdu', 'says', 'even', 'crutches', 'will', 'not', 'escape', 'responsibility', 'if', 'waqf', 'bill', 'passed']",jamiat cautions tdp jdu says even crutches will not escape responsibility if waqf bill passed
"['us', 'election', 'results', 'verdict', 'is', 'out', 'donald', 'trump', 'is', 'winning', 'landslides', 'in', 'polls', 'claim', 'supporters']",us election results verdict is out donald trump is winning landslides in polls claim supporters
"['best', 'dinner', 'sets', 'under', '15000', 'in', 'india']",best dinner sets under 15000 in india
"['outer', 'banks', 'season', '4', 'part', '2', 'heres', 'trailer', 'cast', 'release', 'date', 'and', 'where', 'to', 'watch']",outer banks season 4 part 2 heres trailer cast release date and where to watch
"['cracks', 'appear', 'in', 'boundary', 'wall', 'of', 'puri', 'jagannath', 'temple', 'odisha', 'government', 'seeks', 'asi', 'help', 'for', 'repairs']",cracks appear in boundary wall of puri jagannath temple odisha government seeks asi help for repairs
"['fortnite', 'reload', 'everything', 'we', 'know', 'about', 'how', 'to', 'play']",fortnite reload everything we know about how to play
"['rahul', 'gandhi', 'promises', 'to', 'set', 'up', 'medical', 'college', 'in', 'wayanad']",rahul gandhi promises to set up medical college in wayanad
"['ujjivan', 'small', 'finance', 'bank', 'to', 'apply', 'for', 'universal', 'licence', 'this', 'fiscal', 'md', 'sanjeev', 'nautiyal']",ujjivan small finance bank to apply for universal licence this fiscal md sanjeev nautiyal
"['committed', 'to', 'making', 'mumbai', 'slum', 'free', 'says', 'eknath', 'shinde', 'takes', 'swipe', 'at', 'uddhav', 'ladki', 'bahin', 'opposers']",committed to making mumbai slum free says eknath shinde takes swipe at uddhav ladki bahin opposers
"['coal', 'india', 'hopes', 'to', 'rejoin', 'dividend', 'list', 'as', 'ecl', 'improves', 'performance']",coal india hopes to rejoin dividend list as ecl improves performance
"['delhi', 'hit', 'and', 'run', 'case', 'accused', 'drags', 'two', 'traffic', 'cops', 'on', 'cars', 'bonnet', 'for', '20', 'metres', 'check', 'video', 'here']",delhi hit and run case accused drags two traffic cops on cars bonnet for 20 metres check video here
"['in', 'last', '10', 'years', 'we', 'have', 'made', 'very', 'significant', 'progress', 'eam', 's', 'jaishankar', 'on', 'indias', 'growth']",in last 10 years we have made very significant progress eam s jaishankar on indias growth
"['fortnite', 'remix', 'chapter', '2', 'map', 'all', 'you', 'may', 'want', 'to', 'know']",fortnite remix chapter 2 map all you may want to know
"['telangana', 'govt', 'to', 'come', 'up', 'with', 'new', 'energy', 'policy', 'soon', 'says', 'deputy', 'chief', 'minister']",telangana govt to come up with new energy policy soon says deputy chief minister
"['fpis', 'raise', 'tempo', 'in', 'primary', 'market', 'despite', 'sustained', 'selling', 'in', 'the', 'secondary', 'market']",fpis raise tempo in primary market despite sustained selling in the secondary market
"['parties', 'engage', 'in', 'slogan', 'war', 'ahead', 'of', 'up', 'bypolls']",parties engage in slogan war ahead of up bypolls
"['data', 'protection', 'rules', 'coming', 'soon', 'swiggys', 'bigger', 'ipo', 'raise']",data protection rules coming soon swiggys bigger ipo raise
"['us', 'economy', 'to', 'fall', 'into', 'recession', 'after', 'november', '5', 'election', 'results']",us economy to fall into recession after november 5 election results
"['you', 'dont', 'know', 'not', 'one', 'thing', 'about', 'american', 'struggle', 'rapper', 'cardi', 'b', 'hits', 'back', 'at', 'elon', 'musk']",you dont know not one thing about american struggle rapper cardi b hits back at elon musk
"['quad', 'right', 'up', 'there', 'eam', 'jaishankar', 'on', 'australias', 'foundational', 'role', 'in', 'partnership']",quad right up there eam jaishankar on australias foundational role in partnership
"['do', 'what', 'it', 'takes', 'to', 'punish', 'terrorists', 'jammu', 'kashmir', 'lg', 'manoj', 'sinha', 'to', 'security', 'officials']",do what it takes to punish terrorists jammu kashmir lg manoj sinha to security officials
"['ai', 'driven', 'cyber', 'attacks', 'top', 'risk', 'for', 'enterprises', 'says', 'report']",ai driven cyber attacks top risk for enterprises says report
"['if', 'it', 'turns', 'out', 'that', 'this', 'is', 'the', 'end', 'jos', 'buttler', 'pens', 'emotional', 'message', 'after', 'rajasthan', 'royals', 'releases', 'englands', 'white', 'ball', 'captain']",if it turns out that this is the end jos buttler pens emotional message after rajasthan royals releases englands white ball captain
"['need', 'peoples', 'support', 'to', 'defeat', 'bjp', 'ensure', 'good', 'work', 'continues', 'in', 'delhi', 'says', 'kejriwal']",need peoples support to defeat bjp ensure good work continues in delhi says kejriwal
"['branding', 'in', 'kannada', 'cms', 'plans', 'on', 'new', 'regulations', 'leaves', 'manufactures', 'in', 'spot', 'of', 'bother']",branding in kannada cms plans on new regulations leaves manufactures in spot of bother
"['bcci', 'to', 'discuss', 'new', 'zealand', 'whitewash', 'some', 'star', 'seniors', 'could', 'be', 'phased', 'out', 'post', 'australia', 'series']",bcci to discuss new zealand whitewash some star seniors could be phased out post australia series
"['kamala', 'harris', 'vs', 'donald', 'trump', 'a', 'comparative', 'analysis', 'of', 'immigration', 'policies', 'their', 'effects', 'on', 'indians', 'in', 'the', 'us']",kamala harris vs donald trump a comparative analysis of immigration policies their effects on indians in the us
"['dont', 'forget', 'to', 'fall', 'back', 'an', 'hour', 'daylight', 'saving', 'time', 'ends', 'this', 'sunday']",dont forget to fall back an hour daylight saving time ends this sunday
"['ghaziabad', 'courtroom', 'clash', 'delhi', 'lawyers', 'to', 'strike', 'on', 'november', '4']",ghaziabad courtroom clash delhi lawyers to strike on november 4
"['pakistans', 'punjab', 'govt', 'shows', 'bidding', 'interest', 'in', 'pia', 'considers', 'launching', 'air', 'punjab']",pakistans punjab govt shows bidding interest in pia considers launching air punjab
"['why', 'instagram', 'famous', 'peanut', 'the', 'squirrel', 'was', 'euthanised', 'by', 'ny', 'officials', 'the', 'controversy', 'that', 'caught', 'us', 'elections', 'by', 'storm']",why instagram famous peanut the squirrel was euthanised by ny officials the controversy that caught us elections by storm
"['will', 'bring', 'stringent', 'law', 'to', 'prevent', 'transfer', 'of', 'tribal', 'land', 'to', 'infiltrators', 'in', 'jharkhand', 'amit', 'shah']",will bring stringent law to prevent transfer of tribal land to infiltrators in jharkhand amit shah
"['us', 'election', 'results', 'is', 'elon', 'musk', 'winning', 'polls', 'for', 'donald', 'trump']",us election results is elon musk winning polls for donald trump
"['best', 'dog', 'collars', 'in', 'india']",best dog collars in india
"['bjp', 'to', 'lose', 'support', 'of', 'nitish', 'kumar', 'chandrababu', 'naidu', 'at', 'centre', 'if', 'mva', 'wins', 'in', 'maharashtra', 'jitendra', 'awhad']",bjp to lose support of nitish kumar chandrababu naidu at centre if mva wins in maharashtra jitendra awhad
"['maruti', 'suzuki', 'looks', 'to', 'cash', 'in', 'on', 'few', 'lakh', 'marriages', 'in', 'november', 'to', 'carry', 'festive', 'sales', 'momentum']",maruti suzuki looks to cash in on few lakh marriages in november to carry festive sales momentum
"['what', 'can', 'indian', 'bosses', 'learn', 'from', 'mogambo', 'comedian', 'shares', '5', 'key', 'management', 'lessons', 'in', 'viral', 'video']",what can indian bosses learn from mogambo comedian shares 5 key management lessons in viral video
"['bored', 'of', 'modi', 'why', 'mention', 'him', 'twice', 'rahul', 'gandhi']",bored of modi why mention him twice rahul gandhi
"['us', 'stock', 'market', 'forecast', 'november', '5', 'election', 'results', 'recession', 'fears', 'to', 'drive', 'sp', '500', 'dow', 'jones', 'nasdaq']",us stock market forecast november 5 election results recession fears to drive sp 500 dow jones nasdaq
"['naxalism', 'will', 'be', 'wiped', 'out', 'from', 'country', 'by', 'march', '2026', 'home', 'minister', 'amit', 'shah']",naxalism will be wiped out from country by march 2026 home minister amit shah
"['raise', 'the', 'space', 'bar', 'as', 'spacex', 'provides', 'some', 'of', 'cheapest', 'satellite', 'launches', 'what', 'can', 'isro', 'do', 'to', 'reclaim', 'cost', 'advantage']",raise the space bar as spacex provides some of cheapest satellite launches what can isro do to reclaim cost advantage
"['portals', 'of', 'kedarnath', 'closed']",portals of kedarnath closed
"['satellite', 'mission', 'discovers', 'how', '650', 'foot', 'mega', 'tsunami', 'in', '2023', 'left', 'earth', 'shaking', 'for', '9', 'days']",satellite mission discovers how 650 foot mega tsunami in 2023 left earth shaking for 9 days
"['not', 'seeing', 'slowdown', 'in', 'tech', 'spends', 'rather', 'lot', 'of', 'momentum', 'around', 'ai', 'copilot', 'microsoft', 'india', 'president']",not seeing slowdown in tech spends rather lot of momentum around ai copilot microsoft india president
"['update', 'the', 'cv', 'what', 'commercial', 'vehicle', 'makers', 'are', 'doing', 'to', 'attract', 'the', 'reluctant', 'millennial', 'driver']",update the cv what commercial vehicle makers are doing to attract the reluctant millennial driver
"['applications', 'for', 'business', 'school', 'graduate', 'courses', 'skyrocket', 'despite', 'economic', 'uncertainty', 'report']",applications for business school graduate courses skyrocket despite economic uncertainty report
"['ajit', 'pawar', 'to', 'emerge', 'as', 'key', 'player', 'after', 'maharashtra', 'polls', 'nawab', 'malik']",ajit pawar to emerge as key player after maharashtra polls nawab malik
"['security', 'apparatus', 'must', 'do', 'everything', 'to', 'check', 'spurt', 'in', 'terror', 'attacks', 'says', 'jammu', 'and', 'kashmir', 'cm', 'abdullah']",security apparatus must do everything to check spurt in terror attacks says jammu and kashmir cm abdullah
"['marketed', 'as', 'a', 'powerful', 'stimulant', 'kamini', 'tablets', 'cause', 'lead', 'poisoning', 'in', 'individual', 'australia', 'issues', 'urgent', 'health', 'warning']",marketed as a powerful stimulant kamini tablets cause lead poisoning in individual australia issues urgent health warning
"['india', 'wants', 'to', 'grow', 'with', 'world', 'external', 'affairs', 'minister', 's', 'jaishankar']",india wants to grow with world external affairs minister s jaishankar
"['ind', 'vs', 'nz', 'test', 'new', 'zealand', 'create', 'history', 'as', 'india', 'suffers', 'first', 'ever', 'test', 'series', 'whitewash', 'at', 'home']",ind vs nz test new zealand create history as india suffers first ever test series whitewash at home
"['you', 'made', 'saheb', 'happy', 'in', 'ls', 'elections', 'make', 'me', 'happy', 'in', 'assembly', 'polls', 'ajit', 'pawar', 'to', 'voters']",you made saheb happy in ls elections make me happy in assembly polls ajit pawar to voters
"['donald', 'trumps', 'execution', 'fantasy', 'could', 'trigger', 'a', 'setback', 'for', 'republicans', 'amid', 'tight', 'race', 'with', 'kamala', 'harris', 'heres', 'why']",donald trumps execution fantasy could trigger a setback for republicans amid tight race with kamala harris heres why
"['koderma', 'stone', 'industry', 'to', 'be', 'revived', 'with', 'rs', '500', 'cr', 'special', 'package', 'amit', 'shah']",koderma stone industry to be revived with rs 500 cr special package amit shah
"['bjp', 'to', 'implement', 'uniform', 'civil', 'code', 'in', 'jharkhand', 'tribals', 'to', 'be', 'out', 'of', 'its', 'ambit', 'amit', 'shah']",bjp to implement uniform civil code in jharkhand tribals to be out of its ambit amit shah
"['kannada', 'film', 'maker', 'guruprasad', 'found', 'hanging', 'in', 'bengaluru', 'flat']",kannada film maker guruprasad found hanging in bengaluru flat
"['salman', 'khans', 'favourite', 'suv', 'will', 'be', 'launched', 'in', 'india']",salman khans favourite suv will be launched in india
"['jammu', 'and', 'kashmir', 'five', 'injured', 'in', 'grenade', 'attack', 'in', 'srinagar']",jammu and kashmir five injured in grenade attack in srinagar
"['no', 'provision', 'for', 'digital', 'arrest', 'worldwide', 'report', 'cybercrimes', 'at', 'earliest', 'experts']",no provision for digital arrest worldwide report cybercrimes at earliest experts
"['k', 'rail', 'can', 'be', 'implemented', 'if', 'technical', 'issues', 'in', 'design', 'addressed', 'says', 'centre']",k rail can be implemented if technical issues in design addressed says centre
"['karnataka', 'cm', 'trying', 'to', 'distract', 'farmers', 'during', 'by', 'elections', 'bjps', 'bommai', 'on', 'retraction', 'of', 'notices', 'related', 'to', 'waqf', 'land']",karnataka cm trying to distract farmers during by elections bjps bommai on retraction of notices related to waqf land
"['a', 'complete', 'guide', 'to', 'uks', 'high', 'potential', 'individual', 'hpi', 'visa']",a complete guide to uks high potential individual hpi visa
"['sebi', 'slaps', 'rs', '50', 'lakh', 'fine', 'on', 'sunil', 'lulla', 'for', 'violating', 'market', 'norms', 'in', 'eros', 'international', 'matter']",sebi slaps rs 50 lakh fine on sunil lulla for violating market norms in eros international matter
"['5', 'career', 'paths', 'to', 'pursue', 'after', 'a', 'degree', 'in', 'geography']",5 career paths to pursue after a degree in geography
"['bjp', 'releases', 'sankalp', 'patra', 'for', 'jharkhand', 'assembly', 'elections']",bjp releases sankalp patra for jharkhand assembly elections
"['bjp', 'stands', 'out', 'from', 'other', 'parties', 'polls', 'will', 'ensure', 'jharkhands', 'future', 'amit', 'shah', 'after', 'releasing', 'bjps', 'sankalp', 'patra']",bjp stands out from other parties polls will ensure jharkhands future amit shah after releasing bjps sankalp patra
"['rajpal', 'yadav', 'viral', 'video', 'bhool', 'bhulaiyaa', '3', 'actor', 'reacts', 'angrily', 'to', 'diwali', 'question', 'grabs', 'reporters', 'phone', 'watch']",rajpal yadav viral video bhool bhulaiyaa 3 actor reacts angrily to diwali question grabs reporters phone watch
"['magicpin', 'slashes', 'platform', 'fee', 'to', 'rs', '5', 'per', 'delivery']",magicpin slashes platform fee to rs 5 per delivery
"['reclaiming', 'upma', 'from', 'culinary', 'afterthought', 'to', 'celebrated', 'dish']",reclaiming upma from culinary afterthought to celebrated dish
"['ncs', 'abdul', 'rahim', 'rather', 'likely', 'to', 'become', 'jk', 'assembly', 'speaker']",ncs abdul rahim rather likely to become jk assembly speaker
"['nagina', 'mp', 'chandra', 'shekhar', 'azad', 'claims', 'stones', 'thrown', 'at', 'vande', 'bharat', 'coach', 'in', 'which', 'he', 'was', 'travelling']",nagina mp chandra shekhar azad claims stones thrown at vande bharat coach in which he was travelling
"['after', 'diwali', 'and', 'festivities', 'traders', 'focus', 'shifts', 'to', 'wedding', 'season']",after diwali and festivities traders focus shifts to wedding season
"['journalists', 'facing', 'atrocities', 'under', 'bjp', 'regime', 'sp', 'chief', 'akhilesh', 'yadav']",journalists facing atrocities under bjp regime sp chief akhilesh yadav
"['i', 'congratulate', 'kharge', 'sahab', 'on', 'accepting', 'that', 'congress', 'failed', 'to', 'fulfil', 'poll', 'promises', 'amit', 'shah']",i congratulate kharge sahab on accepting that congress failed to fulfil poll promises amit shah
"['uttar', 'pradesh', 'bhagpat', 'district', 'congress', 'president', 'yunus', 'chaudhary', 'removed', 'from', 'his', 'post']",uttar pradesh bhagpat district congress president yunus chaudhary removed from his post
"['ratan', 'tata', 'noel', 'related', 'to', 'tata', 'group', 'founder', 'says', 'new', 'book']",ratan tata noel related to tata group founder says new book
"['biscuits', 'play', 'key', 'role', 'in', 'srinagar', 'anti', 'terror', 'operation']",biscuits play key role in srinagar anti terror operation
"['wtc', 'points', 'table', 'can', 'india', 'still', 'play', 'the', 'world', 'test', 'championship', 'final', 'after', 'suffering', 'whitewash', 'against', 'new', 'zealand']",wtc points table can india still play the world test championship final after suffering whitewash against new zealand
"['myth', 'debunking', '101', 'long', 'tenure', 'means', 'more', 'job', 'security']",myth debunking 101 long tenure means more job security
"['ncp', 'sana', 'malik', 'expresses', 'confidence', 'in', 'winning', 'the', 'election', 'despite', 'allegations', 'against', 'her', 'father']",ncp sana malik expresses confidence in winning the election despite allegations against her father
"['ngt', 'flags', 'solid', 'sewage', 'waste', 'management', 'issues', 'in', 'gujarat', 'odisha']",ngt flags solid sewage waste management issues in gujarat odisha
"['himalayan', 'glacial', 'lakes', 'saw', '10', '81', 'per', 'cent', 'area', 'expansion', 'from', '2011', 'to', '2024', 'report']",himalayan glacial lakes saw 10 81 per cent area expansion from 2011 to 2024 report
"['us', 'elections', 'womens', 'march', 'protesters', 'gather', 'to', 'support', 'vice', 'president', 'kamala', 'harris']",us elections womens march protesters gather to support vice president kamala harris
"['ahead', 'of', 'market', '10', 'things', 'that', 'will', 'decide', 'stock', 'action', 'on', 'monday']",ahead of market 10 things that will decide stock action on monday
"['no', 'law', 'and', 'order', 'in', 'maharashtra', 'shiv', 'sena', 'ubt', 'leader', 'priyanka', 'chaturvedi']",no law and order in maharashtra shiv sena ubt leader priyanka chaturvedi
"['ngt', 'orders', 'action', 'against', 'illegal', 'breeding', 'farming', 'of', 'african', 'catfish', 'in', 'up']",ngt orders action against illegal breeding farming of african catfish in up
"['rahul', 'gandhi', 'campaigns', 'for', 'priyanka', 'in', 'wayanad', 'says', 'confident', 'you', 'now', 'have', 'the', 'best', 'possible', 'mp']",rahul gandhi campaigns for priyanka in wayanad says confident you now have the best possible mp
"['through', 'collective', 'spirit', 'well', 'keep', 'working', 'towards', 'tb', 'free', 'india', 'pm', 'modi']",through collective spirit well keep working towards tb free india pm modi
"['are', 'amcs', 'better', 'placed', 'than', 'others', 'in', 'the', 'capital', 'market', 'ecosystem', '4', 'amc', 'stocks', 'with', 'upside', 'potential', 'of', 'up', 'to', '27']",are amcs better placed than others in the capital market ecosystem 4 amc stocks with upside potential of up to 27
"['surprise', 'your', 'brother', 'with', 'the', 'best', 'bhai', 'dooj', 'gifts', 'this', 'festive', 'season']",surprise your brother with the best bhai dooj gifts this festive season
"['pat', 'cummins', 'denies', 'australia', 'a', 'series', 'will', 'be', 'a', 'bat', 'off', 'for', 'vacant', 'opening', 'spot', 'in', 'series', 'against', 'india']",pat cummins denies australia a series will be a bat off for vacant opening spot in series against india
"['naxalites', 'attack', '2', 'cops', 'flee', 'with', 'their', 'weapons', 'in', 'chhattisgarhs', 'sukma']",naxalites attack 2 cops flee with their weapons in chhattisgarhs sukma
"['justin', 'trudeau', 'extends', 'wishes', 'to', 'hindus', 'on', 'diwali', 'shares', 'a', 'bracelet', 'anecdote', 'amidst', 'india', 'canada', 'tensions']",justin trudeau extends wishes to hindus on diwali shares a bracelet anecdote amidst india canada tensions
"['delhi', 'two', 'traffic', 'personnel', 'injured', 'in', 'hit', 'and', 'run', 'case', 'near', 'ber', 'sarai']",delhi two traffic personnel injured in hit and run case near ber sarai
"['us', 'election', 'gaza', 'emerges', 'as', 'top', 'issue', 'for', 'many', 'new', 'york', 'muslims']",us election gaza emerges as top issue for many new york muslims
"['bjp', 'promises', 'money', 'to', 'jharkhand', 'women', 'lpg', 'gas', 'at', 'discounts', 'stipends', 'to', 'unemployed', 'graduates']",bjp promises money to jharkhand women lpg gas at discounts stipends to unemployed graduates
"['tamil', 'nadu', 'advances', 'towards', 'vision', 'of', 'distributed', 'growth', 'with', 'slew', 'of', 'projects']",tamil nadu advances towards vision of distributed growth with slew of projects
"['canada', 'row', 'some', 'of', 'our', 'consular', 'officials', 'under', 'audio', 'and', 'video', 'surveillance', 'says', 'india']",canada row some of our consular officials under audio and video surveillance says india
"['nora', 'fatehi', 'admits', 'she', 'needed', 'therapy', 'after', 'trusting', 'wrong', 'people', 'in', 'bollywood', 'i', 'was', 'new', 'to', 'india']",nora fatehi admits she needed therapy after trusting wrong people in bollywood i was new to india
