headlines,headline_text
"['trans', 'teen', 'expelled', 'from', 'assam', 'school', 'over', 'bikini', 'pics', 'principal', 'claims', 'photos', 'brought', 'bad', 'name', 'to', 'institution']",trans teen expelled from assam school over bikini pics principal claims photos brought bad name to institution
"['from', 'mirzapur', '3', 'to', 'garudan', 'latest', 'ott', 'releases', 'to', 'watch', 'this', 'week', 'on', 'prime', 'video', 'netflix', 'disney', 'hotstar']",from mirzapur 3 to garudan latest ott releases to watch this week on prime video netflix disney hotstar
"['women', 'outpacing', 'men', 'with', 'higher', 'aum', 'long', 'term', 'outlook', 'in', 'mutual', 'funds']",women outpacing men with higher aum long term outlook in mutual funds
"['rs', '2000', 'notes', '97', '87', 'returned', 'rs', '7581', 'crore', 'worth', 'notes', 'still', 'with', 'public']",rs 2000 notes 97 87 returned rs 7581 crore worth notes still with public
"['visual', 'telematics', 'startup', 'cautio', 'raises', 'rs', '6', '5', 'crore', 'from', 'antler', '8i', 'ventures', 'others']",visual telematics startup cautio raises rs 6 5 crore from antler 8i ventures others
"['emcure', 'pharmaceuticals', 'ipo', '10', 'things', 'to', 'know', 'before', 'subscribing', 'to', 'the', 'issue']",emcure pharmaceuticals ipo 10 things to know before subscribing to the issue
"['best', 'selling', 'symphony', 'air', 'coolers', 'top', 'choices', 'for', 'efficient', 'home', 'cooling', 'comfort']",best selling symphony air coolers top choices for efficient home cooling comfort
"['jungle', 'raj', 'kaisa', 'hota', 'hai', 'mamata', 'raj', 'jaisa', 'hota', 'hai', 'bjps', 'gaurav', 'bhatia', 'attacks', 'tmc', 'over', 'chopra', 'incident']",jungle raj kaisa hota hai mamata raj jaisa hota hai bjps gaurav bhatia attacks tmc over chopra incident
"['niit', 'appoints', 'pankaj', 'jathar', 'as', 'ceo']",niit appoints pankaj jathar as ceo
"['mha', 'framed', 'three', 'criminal', 'laws', 'discreetly', 'in', 'force', 'from', 'today']",mha framed three criminal laws discreetly in force from today
"['standard', 'deduction']",standard deduction
"['fiscal', 'deficit', 'of', 'india', '2023', '24', 'all', 'you', 'need', 'to', 'know', 'union', 'budget', '2024', 'nirmala', 'sitharaman', 'revenue', 'economy', 'deficit']",fiscal deficit of india 2023 24 all you need to know union budget 2024 nirmala sitharaman revenue economy deficit
"['nasa', 'warns', 'of', 'potential', 'planet', 'sized', 'asteroid', 'impact', '72', 'chance', 'of', 'earth', 'collision']",nasa warns of potential planet sized asteroid impact 72 chance of earth collision
"['crypto', 'price', 'today', 'bitcoin', 'gains', 'over', '4', 'altcoins', 'solana', 'dogecoin', 'cardano', 'jump', 'up', 'to', '7']",crypto price today bitcoin gains over 4 altcoins solana dogecoin cardano jump up to 7
"['canon', 'india', 'appoints', 'toshiaki', 'nomura', 'as', 'president', 'and', 'ceo']",canon india appoints toshiaki nomura as president and ceo
"['stanley', 'lifestyles', 'shares', 'surge', '9', 'after', 'morgan', 'stanley', 'picks', 'up', 'over', 'rs', '16', 'crore', 'stake']",stanley lifestyles shares surge 9 after morgan stanley picks up over rs 16 crore stake
"['wipro', 'shares', 'jump', 'over', '3', 'after', 'double', 'upgrade', 'from', 'clsa']",wipro shares jump over 3 after double upgrade from clsa
"['mahindra', 'sales', 'rise', '11', 'pc', 'to', '69397', 'units', 'in', 'june']",mahindra sales rise 11 pc to 69397 units in june
"['2', 'top', 'stock', 'recommendations', 'from', 'aditya', 'arora']",2 top stock recommendations from aditya arora
"['find', 'solutions', 'to', 'address', 'drain', 'overflow', 'issue', 'in', 'central', 'delhi', 'atishi', 'to', 'officials']",find solutions to address drain overflow issue in central delhi atishi to officials
"['nia', 'agrees', 'to', 'let', 'engineer', 'rashid', 'take', 'oath', 'as', 'mp', 'court', 'to', 'give', 'order', 'tomorrow']",nia agrees to let engineer rashid take oath as mp court to give order tomorrow
"['niva', 'bupa', 'health', 'insurance', 'files', 'papers', 'for', '3000', 'cr', 'ipo']",niva bupa health insurance files papers for 3000 cr ipo
"['union', 'budget', '2024', 'india', 'manufacturing', 'pmi', 'numbers', 'in', '2023', '24', 'sitharaman', 'decision', 'aatmanirbhar', 'bharat', 'pmi']",union budget 2024 india manufacturing pmi numbers in 2023 24 sitharaman decision aatmanirbhar bharat pmi
"['shut', 'after', 'june', '28', 'rainfall', 'delhis', 'pragati', 'maidan', 'tunnel', 'reopens']",shut after june 28 rainfall delhis pragati maidan tunnel reopens
"['crocodile', 'in', 'ratnagiri', 'viral', 'video', 'watch', 'an', '8', 'foot', 'long', 'crocodile', 'roaming', 'on', 'road', 'in', 'maharashtra']",crocodile in ratnagiri viral video watch an 8 foot long crocodile roaming on road in maharashtra
"['y', 'combinator', 'backed', 'ai', 'robotics', 'startup', 'pivot', 'robots', 'raises', 'funding', 'from', 'nuventures']",y combinator backed ai robotics startup pivot robots raises funding from nuventures
"['rec', 'loan', 'sanctions', 'grow', '24', 'pc', 'to', 'rs', '1', '12', 'lakh', 'crore', 'in', 'q1', 'rs', '40k', 'cr', 'for', 'renewables']",rec loan sanctions grow 24 pc to rs 1 12 lakh crore in q1 rs 40k cr for renewables
"['west', 'bengal', 'guv', 'seeks', 'report', 'from', 'mamata', 'banerjee', 'on', 'public', 'flogging', 'of', 'couple']",west bengal guv seeks report from mamata banerjee on public flogging of couple
"['union', 'budget', '2024', 'look', 'at', 'india', 'gdp', 'growth', 'rate', '2023', '24', 'indian', 'economy', 'gdp', 'growth', 'what', 'is', 'gdp']",union budget 2024 look at india gdp growth rate 2023 24 indian economy gdp growth what is gdp
"['ipc', 'crpc', 'replaced', 'by', 'swadesh', 'criminal', 'laws', 'now', 'you', 'will', 'find', 'it', 'easier', 'to', 'approach', 'police', 'file', 'fir', 'heres', 'how']",ipc crpc replaced by swadesh criminal laws now you will find it easier to approach police file fir heres how
"['lok', 'sabha', 'congratulates', 'indian', 'cricket', 'team', 'on', 't20', 'world', 'cup', 'win']",lok sabha congratulates indian cricket team on t20 world cup win
"['hdfc', 'bank', 'shares', 'up', '11', 'in', '1', 'month', 'msci', 'review', 'could', 'be', 'the', 'next', 'trigger']",hdfc bank shares up 11 in 1 month msci review could be the next trigger
"['kalki', '2898', 'ad', 'box', 'office', 'day', '4', 'prabhas', 'deepika', 'padukone', 'starrer', 'surpasses', 'rs', '500', 'crore', 'worldwide', 'in', 'debut', 'weekend']",kalki 2898 ad box office day 4 prabhas deepika padukone starrer surpasses rs 500 crore worldwide in debut weekend
"['neet', 'paper', 'leak', 'issue', 'causes', 'opposition', 'walk', 'out', 'in', 'lok', 'sabha', 'congress', 'rahul', 'gandhi', 'seeks', 'a', 'discussion']",neet paper leak issue causes opposition walk out in lok sabha congress rahul gandhi seeks a discussion
"['india', 'general', 'budget', 'gst', 'collection', 'in', '2023', 'a', 'look', 'at', 'the', 'goods', 'and', 'services', 'tax', 'news', 'rate', 'cut']",india general budget gst collection in 2023 a look at the goods and services tax news rate cut
"['kkr', 'set', 'to', 'acquire', 'keralas', 'baby', 'memorial', 'hospitals', 'make', 'a', 'comeback', 'in', 'hospital', 'segment']",kkr set to acquire keralas baby memorial hospitals make a comeback in hospital segment
"['jsw', 'energy', 'sjvn', 'sign', 'ppa', 'for', '700', 'mw', 'solar', 'project', 'in', 'rajasthan']",jsw energy sjvn sign ppa for 700 mw solar project in rajasthan
"['darshans', 'murder', 'trial', 'to', 'be', 'turned', 'into', 'a', 'feature', 'film', 'directors', 'rush', 'to', 'register', 'movie', 'titles']",darshans murder trial to be turned into a feature film directors rush to register movie titles
"['telangana', 'hc', 'dismisses', 'kcrs', 'plea', 'against', 'inquiry', 'panel', 'to', 'probe', 'irregularities', 'in', 'power', 'sector']",telangana hc dismisses kcrs plea against inquiry panel to probe irregularities in power sector
"['bajaj', 'consumers', 'rs', '166', 'cr', 'buyback', 'last', 'day', 'to', 'buy', 'shares', 'today']",bajaj consumers rs 166 cr buyback last day to buy shares today
"['fiscal', 'deficit']",fiscal deficit
"['ravindra', 'jadeja', 'a', 'thoroughbred', 'who', 'found', 'his', 'own', 'course']",ravindra jadeja a thoroughbred who found his own course
"['vraj', 'iron', 'and', 'steel', 'ipo', 'share', 'allotment', 'likely', 'today', 'heres', 'how', 'you', 'can', 'check', 'status']",vraj iron and steel ipo share allotment likely today heres how you can check status
"['rupee', 'falls', '9', 'paise', 'to', '83', '43', 'against', 'us', 'dollar', 'in', 'early', 'trade']",rupee falls 9 paise to 83 43 against us dollar in early trade
"['should', 'you', 'prefer', 'rr', 'kabel', 'over', 'polycab', 'amnish', 'aggarwal', 'explains', 'why']",should you prefer rr kabel over polycab amnish aggarwal explains why
"['hemant', 'soren', 'got', 'bail', 'because', 'of', 'the', 'strength', 'of', 'opposition', 'sanjay', 'raut']",hemant soren got bail because of the strength of opposition sanjay raut
"['india', 'best', 'emerging', 'market', 'story', 'havent', 'ever', 'seen', 'valuations', 'and', 'fundamentals', 'so', 'attractive', 'mihir', 'vora']",india best emerging market story havent ever seen valuations and fundamentals so attractive mihir vora
"['national', 'doctors', 'day', 'why', 'it', 'is', 'celebrated', 'history', 'significance', 'and', 'all', 'uou', 'need', 'to', 'know']",national doctors day why it is celebrated history significance and all uou need to know
"['vhp', 'holds', 'protest', 'against', 'owaisis', 'jai', 'palestine', 'slogan', 'at', 'delhis', 'jantar', 'mantar']",vhp holds protest against owaisis jai palestine slogan at delhis jantar mantar
"['dinesh', 'karthik', 'appointed', 'batting', 'coach', 'mentor', 'for', 'royal', 'challengers', 'bangalore']",dinesh karthik appointed batting coach mentor for royal challengers bangalore
"['stars', 'are', 'aligning', 'vodafone', 'idea', 'share', 'price', 'targets', 'increase', 'after', 'tariff', 'hike']",stars are aligning vodafone idea share price targets increase after tariff hike
"['civic', 'bodies', 'ramp', 'up', 'preparations', 'to', 'deal', 'with', 'waterlogging', 'as', 'imd', 'predicts', 'heavy', 'rain', 'in', 'delhi']",civic bodies ramp up preparations to deal with waterlogging as imd predicts heavy rain in delhi
"['nta', 'announces', 're', 'test', 'results', 'revised', 'rank', 'list', 'of', '1563', 'candidates', 'of', 'neet', 'exam']",nta announces re test results revised rank list of 1563 candidates of neet exam
"['us', 'fintech', 'platform', 'tifin', 'debuts', 'in', 'indian', 'market', 'with', 'conversational', 'ai', 'assistant', 'myfi']",us fintech platform tifin debuts in indian market with conversational ai assistant myfi
"['after', 'a', 'robust', 'debut', 'morgan', 'stanley', 'picks', 'up', '3', '7', 'lakh', 'shares', 'in', 'stanley', 'lifestyles', 'for', 'rs', '16', '7', 'crore']",after a robust debut morgan stanley picks up 3 7 lakh shares in stanley lifestyles for rs 16 7 crore
"['govt', 'fully', 'committed', 'to', 'improving', 'health', 'infrastructure', 'pm', 'modi', 'on', 'doctors', 'day']",govt fully committed to improving health infrastructure pm modi on doctors day
"['hotel', 'stocks', 'in', 'focus', 'lemon', 'tree', 'india', 'hotels', 'could', 'give', '9', '20', 'return', 'in', 'next', '1', 'year']",hotel stocks in focus lemon tree india hotels could give 9 20 return in next 1 year
"['didis', 'west', 'bengal', 'unsafe', 'for', 'women', 'bjps', 'jp', 'nadda', 'slams', 'mamata', 'banerjee', 'led', 'government']",didis west bengal unsafe for women bjps jp nadda slams mamata banerjee led government
"['pvr', 'inox', 'shares', 'rally', '6', 'after', 'addition', 'of', 'new', 'screens', 'in', 'hyderabad']",pvr inox shares rally 6 after addition of new screens in hyderabad
"['jio', 'airtel', 'tariff', 'hikes', 'users', 'can', 'still', 'avoid', 'increased', 'prices', 'heres', 'how']",jio airtel tariff hikes users can still avoid increased prices heres how
"['rohit', 'sharma', 'virat', 'kohli', 'retire', 'six', 'players', 'who', 'can', 'fill', 'the', 'void']",rohit sharma virat kohli retire six players who can fill the void
"['psbs', 'clock', 'higher', 'failure', 'rates', 'for', 'upi', 'payments']",psbs clock higher failure rates for upi payments
"['warehouse', 'operators', 'take', 'shine', 'to', 'solar', 'power', 'rework', 'logistics']",warehouse operators take shine to solar power rework logistics
"['bjp', 'will', 'be', 'wiped', 'out', 'from', 'jharkhand', 'after', 'assembly', 'elections', 'hemant', 'soren']",bjp will be wiped out from jharkhand after assembly elections hemant soren
"['womans', 'dad', 'snubs', 'marriage', 'proposal', 'of', 'bengaluru', 'techie', 'with', 'rs', '70', 'lpa', 'salary', 'the', 'reason', 'is', 'unbelievable']",womans dad snubs marriage proposal of bengaluru techie with rs 70 lpa salary the reason is unbelievable
"['posters', 'put', 'up', 'at', 'various', 'police', 'stations', 'in', 'delhi', 'to', 'create', 'awareness', 'on', 'new', 'criminal', 'laws']",posters put up at various police stations in delhi to create awareness on new criminal laws
"['grse', 'shares', 'jump', '8', 'after', 'signing', 'construction', 'contract', 'with', 'bangladesh', 'government']",grse shares jump 8 after signing construction contract with bangladesh government
"['anant', 'ambani', 'seeks', 'divine', 'blessings', 'at', 'krishna', 'kali', 'temple', 'ahead', 'of', 'wedding', 'wears', 'rs', '6', '9', 'crore', 'watch']",anant ambani seeks divine blessings at krishna kali temple ahead of wedding wears rs 6 9 crore watch
['subvention'],subvention
"['eps', 'withdrawal', 'rules', 'changed', 'lakhs', 'of', 'epf', 'subscribes', 'to', 'benefit', 'check', 'if', 'you', 'stand', 'to', 'benefit']",eps withdrawal rules changed lakhs of epf subscribes to benefit check if you stand to benefit
"['these', '6', 'mid', 'cap', 'mutual', 'funds', 'turn', 'rs', '5', 'lakh', 'lumpsum', 'investment', 'into', 'rs', '1', 'crore', 'in', '20', 'years']",these 6 mid cap mutual funds turn rs 5 lakh lumpsum investment into rs 1 crore in 20 years
"['stop', 'misusing', 'agencies', 'to', 'silence', 'opposition', 'india', 'bloc', 'mps', 'stage', 'protest', 'against', 'govt']",stop misusing agencies to silence opposition india bloc mps stage protest against govt
"['got', 'form', '16', 'from', 'your', 'employer', 'check', 'these', 'points', 'before', 'filing', 'itr']",got form 16 from your employer check these points before filing itr
"['imd', 'predicts', 'extremely', 'heavy', 'rainfall', 'during', 'the', 'next', '2', 'days', 'issues', 'red', 'alerts', 'for', 'northeastern', 'states']",imd predicts extremely heavy rainfall during the next 2 days issues red alerts for northeastern states
"['jsw', 'mg', 'motor', 'india', 'retail', 'sales', 'dip', '9', 'pc', 'in', 'june', 'to', '4644', 'units']",jsw mg motor india retail sales dip 9 pc in june to 4644 units
"['rohit', 'sharma', 'and', 'co', 'stuck', 'in', 'barbados', 'as', 'hurricane', 'beryl', 'disrupts', 'travel', 'plans', 'for', 'team', 'india']",rohit sharma and co stuck in barbados as hurricane beryl disrupts travel plans for team india
"['bcci', 'awards', 'rs', '125', 'crore', 'to', 'team', 'india', 'heres', 'how', 'much', 'each', 'player', 'will', 'get']",bcci awards rs 125 crore to team india heres how much each player will get
"['delhi', 'police', 'lodges', 'first', 'fir', 'under', 'new', 'criminal', 'law']",delhi police lodges first fir under new criminal law
"['ex', 'jharkhand', 'cm', 'hemant', 'soren', 'declares', 'rebellion', 'to', 'drive', 'out', 'feudal', 'forces']",ex jharkhand cm hemant soren declares rebellion to drive out feudal forces
"['falsely', 'implicated', 'i', 'was', 'forced', 'to', 'spend', '5', 'months', 'in', 'jail', 'hemant', 'soren']",falsely implicated i was forced to spend 5 months in jail hemant soren
"['virat', 'kohli', 'retirememt', 'kohli', 'announces', 'retirement', 'from', 't20', 'international', 'cricket', 'says', 'its', 'time', 'for', 'next', 'generation']",virat kohli retirememt kohli announces retirement from t20 international cricket says its time for next generation
"['airtel', 'jio', 'announce', 'mobile', 'tariff', 'hike', 'here', 'is', 'the', 'full', 'list', 'of', 'new', 'prepaid', 'and', 'postpaid', 'plans', 'and', 'prices']",airtel jio announce mobile tariff hike here is the full list of new prepaid and postpaid plans and prices
"['axis', 'bank', 'and', 'piramal', 'finance', 'join', 'hands', 'under', 'co', 'lending', 'business']",axis bank and piramal finance join hands under co lending business
"['recent', 'tariff', 'hikes', 'may', 'drive', 'more', 'users', 'away', 'from', 'vodafone', 'idea']",recent tariff hikes may drive more users away from vodafone idea
"['high', 'turnout', 'as', 'france', 'votes', 'in', 'election', 'that', 'could', 'usher', 'in', 'far', 'right']",high turnout as france votes in election that could usher in far right
"['australias', 'new', 'visa', 'rules', 'kick', 'in', 'heres', 'how', 'they', 'will', 'affect', 'indians']",australias new visa rules kick in heres how they will affect indians
"['next', 't20', 'captain', 'to', 'be', 'decided', 'by', 'selectors', 'says', 'jay', 'shah', 'confirms', 'seniors', 'role', 'in', 'future', 'icc', 'tournaments']",next t20 captain to be decided by selectors says jay shah confirms seniors role in future icc tournaments
"['irdai', 'bars', 'insurers', 'from', 'advertising', 'unit', 'linked', 'policies', 'as', 'investment', 'products', 'issues', 'advertising', 'rules']",irdai bars insurers from advertising unit linked policies as investment products issues advertising rules
"['how', 'one', 'of', 'the', 'worlds', 'strongest', 'car', 'unions', 'is', 'dealing', 'with', 'ev', 'job', 'losses']",how one of the worlds strongest car unions is dealing with ev job losses
"['et', 'make', 'in', 'india', 'sme', 'summit', 'in', 'lucknow', 'micro', 'industries', 'must', 'be', 'given', 'adequate', 'support', 'in', 'the', 'msme', 'ecosystem']",et make in india sme summit in lucknow micro industries must be given adequate support in the msme ecosystem
"['toyota', 'records', 'highest', 'ever', 'monthly', 'sales', 'in', 'june', 'at', '27474', 'units']",toyota records highest ever monthly sales in june at 27474 units
"['asias', 'factory', 'activity', 'expands', 'in', 'june', 'on', 'solid', 'global', 'demand']",asias factory activity expands in june on solid global demand
"['india', 'develops', 'new', 'explosive', '2', '01', 'times', 'more', 'lethal', 'than', 'tnt']",india develops new explosive 2 01 times more lethal than tnt
"['visaman', 'global', 'sales', 'shares', 'list', 'at', 'a', '5', 'premium', 'over', 'ipo', 'price']",visaman global sales shares list at a 5 premium over ipo price
"['icc', 't20', 'world', 'cup', 'team', 'of', 'the', 'tournament', 'six', 'indians', 'feature', 'in', 'the', 'list', 'finals', 'motm', 'kohli', 'misses', 'out']",icc t20 world cup team of the tournament six indians feature in the list finals motm kohli misses out
"['vraj', 'iron', 'and', 'steel', 'ipo', 'allotment', 'how', 'to', 'check', 'allotment', 'ipo', 'gmp', 'listing', 'date', 'and', 'more']",vraj iron and steel ipo allotment how to check allotment ipo gmp listing date and more
"['neet', 'ug', '2024', 'toppers', 'list', 'check', 'full', 'list', 'of', 'neet', 'ug', 'retest', 'toppers']",neet ug 2024 toppers list check full list of neet ug retest toppers
"['buy', 'coforge', 'target', 'price', 'rs', '5570', 'jm', 'financial']",buy coforge target price rs 5570 jm financial
"['sylvan', 'plyboard', 'stock', 'debuts', 'with', '20', 'premium', 'on', 'nse', 'sme', 'platform']",sylvan plyboard stock debuts with 20 premium on nse sme platform
['ddt'],ddt
"['buy', 'kpit', 'technologies', 'target', 'price', 'rs', '2030', 'jm', 'financial']",buy kpit technologies target price rs 2030 jm financial
"['mp', 'govt', 'abolishes', 'transport', 'check', 'posts', 'at', 'interstate', 'borders', 'road', 'safety', 'and', 'enforcement', 'checking', 'points', 'to', 'be', 'arranged']",mp govt abolishes transport check posts at interstate borders road safety and enforcement checking points to be arranged
"['indias', 'manufacturing', 'pmi', 'rises', 'to', '58', '3', 'in', 'june', 'from', '57', '5', 'in', 'may', 'record', 'upturn', 'in', 'job', 'creation']",indias manufacturing pmi rises to 58 3 in june from 57 5 in may record upturn in job creation
"['stock', 'market', 'opening', 'nifty', 'sensex', 'trade', 'in', 'green', 'hero', 'moto', 'and', 'bajaj', 'auto', 'take', 'lead', 'in', 'early', 'trade']",stock market opening nifty sensex trade in green hero moto and bajaj auto take lead in early trade
"['viral', 'video', 'of', 'couple', 'brutally', 'beaten', 'in', 'bengal', 'what', 'happened', 'and', 'why', 'is', 'the', 'tmc', 'under', 'scrutiny']",viral video of couple brutally beaten in bengal what happened and why is the tmc under scrutiny
"['bajaj', 'auto', 'sales', 'rise', '5', 'pc', 'to', '3', '58', 'lakh', 'units', 'in', 'june']",bajaj auto sales rise 5 pc to 3 58 lakh units in june
"['gold', 'price', 'today', 'gold', 'prices', 'trade', 'flat', 'in', 'june', 'month', 'silver', 'down', 'by', 'rs', '4400']",gold price today gold prices trade flat in june month silver down by rs 4400
"['multibagger', 'debut', 'shivalic', 'power', 'control', 'shares', 'list', 'at', '211', 'premium', 'over', 'ipo', 'price']",multibagger debut shivalic power control shares list at 211 premium over ipo price
"['buy', 'kalpataru', 'projects', 'international', 'target', 'price', 'rs', '1385', 'motilal', 'oswal']",buy kalpataru projects international target price rs 1385 motilal oswal
"['amnish', 'aggarwal', 'on', '2', 'top', 'cement', 'large', 'cap', 'stocks', 'to', 'bet', 'on', 'best', 'buy', 'in', 'auto']",amnish aggarwal on 2 top cement large cap stocks to bet on best buy in auto
"['porsche', 'case', 'pune', 'cops', 'plan', 'to', 'move', 'sc', 'against', 'release', 'of', 'juvenile', 'accused']",porsche case pune cops plan to move sc against release of juvenile accused
"['a', 'slice', 'of', 'ai', 'how', 'much', 'is', 'it', 'worth']",a slice of ai how much is it worth
"['jairam', 'ramesh', 'greets', 'naidu', 'on', 'b', 'day', 'reminds', 'him', 'of', 'andhra', 'special', 'category', 'status', 'promise']",jairam ramesh greets naidu on b day reminds him of andhra special category status promise
"['commercial', 'lpg', 'cylinder', 'prices', 'slashed', 'yet', 'again', 'this', 'time', 'by', 'rs', '30']",commercial lpg cylinder prices slashed yet again this time by rs 30
"['stock', 'radar', 'icici', 'bank', 'hits', 'fresh', 'record', 'high', 'in', 'june', 'should', 'traders', 'buy', 'sell', 'or', 'hold', 'at', 'current', 'levels']",stock radar icici bank hits fresh record high in june should traders buy sell or hold at current levels
"['cannot', 'avoid', 'market', 'momentum', 'but', 'be', 'a', 'little', 'more', 'selective', 'mayuresh', 'joshi']",cannot avoid market momentum but be a little more selective mayuresh joshi
"['canopy', 'collapse', 'moca', 'naidu', 'reviews', 'operations', 'at', 'delhi', 'airport']",canopy collapse moca naidu reviews operations at delhi airport
"['neet', 'retest', 'results', 'declared', 'by', 'nta', 'neet', '2024']",neet retest results declared by nta neet 2024
"['buy', 'jk', 'tyre', 'amp', 'industries', 'target', 'price', 'rs', '485', 'axis', 'securities']",buy jk tyre amp industries target price rs 485 axis securities
"['hina', 'khan', 'health', 'update', 'actress', 'says', 'shes', 'scarred', 'not', 'scared', 'amid', 'cancer', 'battle', 'shares', 'inspiring', 'message', 'for', 'fellow', 'fighters']",hina khan health update actress says shes scarred not scared amid cancer battle shares inspiring message for fellow fighters
"['neet', 'ug', '2024', 're', 'test', 'result', 'declared', 'today', 'heres', 'how', 'to', 'check', 'it']",neet ug 2024 re test result declared today heres how to check it
"['nifty', 'logs', 'positive', 'returns', '9', 'times', 'in', '10', 'years', 'in', 'july', 'fiis', 'net', 'buyers', 'on', '8', 'occasions']",nifty logs positive returns 9 times in 10 years in july fiis net buyers on 8 occasions
"['euro', 'cup', '2024', 'portugal', 'vs', 'slovenia', 'prediction', 'live', 'streaming', 'of', 'cristiano', 'ronaldos', 'knock', 'out', 'match']",euro cup 2024 portugal vs slovenia prediction live streaming of cristiano ronaldos knock out match
"['buy', 'dr', 'reddys', 'laboratories', 'target', 'price', 'rs', '6500', 'prabhudas', 'lilladher']",buy dr reddys laboratories target price rs 6500 prabhudas lilladher
"['buy', 'adani', 'ports', 'amp', 'special', 'economic', 'zone', 'target', 'price', 'rs', '1700', 'motilal', 'oswal']",buy adani ports amp special economic zone target price rs 1700 motilal oswal
"['araku', 'coffee', 'why', 'did', 'pm', 'modi', 'mention', 'it', 'in', 'mann', 'ki', 'baat', 'and', 'what', 'makes', 'it', 'so', 'special']",araku coffee why did pm modi mention it in mann ki baat and what makes it so special
"['oil', 'marketing', 'companies', 'reduce', 'prices', 'of', 'lpg', 'commercial', 'cylinders', '30']",oil marketing companies reduce prices of lpg commercial cylinders 30
"['australia', 'doubles', 'foreign', 'student', 'visa', 'fee', 'in', 'effort', 'to', 'curb', 'migration']",australia doubles foreign student visa fee in effort to curb migration
"['nifty', 'bulls', 'await', 'directional', 'move', 'auto', 'stocks', 'in', 'focus']",nifty bulls await directional move auto stocks in focus
"['like', 'auto', 'pharma', 'themes', 'these', '2', 'stocks', 'are', 'your', 'best', 'bet', 'rahul', 'shah']",like auto pharma themes these 2 stocks are your best bet rahul shah
"['hardik', 'pandya', 'natasa', 'stankovic', 'marriage', 'no', 'congratulatory', 'post', 'after', 't20', 'wc', 'victory', 'reignites', 'separation', 'rumours']",hardik pandya natasa stankovic marriage no congratulatory post after t20 wc victory reignites separation rumours
