headlines,headline_text
"['microlending', 'portfolio', 'grows', '31', 'pc', 'in', 'dec', 'quarter', 'report']",microlending portfolio grows 31 pc in dec quarter report
"['k', 'raheja', 'inks', 'pact', 'to', 'jointly', 'develop', '2', '5', 'acre', 'land', 'parcel', 'in', 'mumbais', 'worli']",k raheja inks pact to jointly develop 2 5 acre land parcel in mumbais worli
"['technical', 'stock', 'pick', 'jsw', 'steel', 'finds', 'support', 'above', 'neckline', 'of', '2', 'year', 'consolidation', 'should', 'you', 'buy']",technical stock pick jsw steel finds support above neckline of 2 year consolidation should you buy
"['left', 'has', 'been', 'at', 'forefront', 'of', 'setting', 'agenda', 'to', 'take', 'on', 'bjp', 'will', 'improve', 'tally', 'in', '2024', 'polls', 'yechury']",left has been at forefront of setting agenda to take on bjp will improve tally in 2024 polls yechury
"['remarks', 'offensive', 'in', 'bad', 'taste', 'ec', 'to', 'dilip', 'ghosh', 'supriya', 'shrinate']",remarks offensive in bad taste ec to dilip ghosh supriya shrinate
"['lok', 'sabha', 'polls', '2024', 'congress', 'names', '14', 'candidates', 'no', 'word', 'on', 'amethi', 'rae', 'bareli']",lok sabha polls 2024 congress names 14 candidates no word on amethi rae bareli
"['amethi', 'is', 'the', '2nd', 'choice', 'for', 'rahul', 'gandhi', 'smriti', 'irani']",amethi is the 2nd choice for rahul gandhi smriti irani
"['k2', 'infragen', 'ipo', 'check', 'issue', 'size', 'price', 'band', 'gmp', 'and', 'other', 'details']",k2 infragen ipo check issue size price band gmp and other details
"['arunachal', 'cm', 'pema', 'khandu', '4', 'other', 'bjp', 'nominees', 'may', 'be', 'elected', 'unopposed']",arunachal cm pema khandu 4 other bjp nominees may be elected unopposed
"['irdai', 'seeks', 'more', 'details', 'from', 'iihl', 'to', 'approve', 'deal', 'for', 'reliance', 'capitals', 'insurance', 'business']",irdai seeks more details from iihl to approve deal for reliance capitals insurance business
"['for', 'elections', 'people', 'support', 'needed', 'not', 'money', 'dmk', 'reacts', 'to', 'nirmala', 'sitharamans', 'statement']",for elections people support needed not money dmk reacts to nirmala sitharamans statement
"['bjp', 'appoints', 'lok', 'sabha', 'in', 'charges', 'for', 'states', 'uts']",bjp appoints lok sabha in charges for states uts
"['us', 'weather', 'forecast', 'rains', 'likely', 'to', 'pound', 'baltimore', 'i', '95', 'new', 'york', 'other', 'cities', 'check', 'full', 'list']",us weather forecast rains likely to pound baltimore i 95 new york other cities check full list
"['meta', 'limits', 'on', 'sharing', 'ai', 'could', 'dim', 'us', 'influence']",meta limits on sharing ai could dim us influence
"['how', 'much', 'to', 'invest', 'monthly', 'to', 'create', 'a', 'corpus', 'of', 'rs', '2', 'crore', 'in', '10', 'years']",how much to invest monthly to create a corpus of rs 2 crore in 10 years
"['attacks', 'on', 'chinese', 'infrastructure', 'in', 'pakistan', 'disrupt', 'cpec', 'raise', 'security', 'concerns']",attacks on chinese infrastructure in pakistan disrupt cpec raise security concerns
"['congresss', 'plea', 'against', 'tax', 're', 'assessment', 'by', 'it', 'authorities', 'dismissed', 'by', 'hc']",congresss plea against tax re assessment by it authorities dismissed by hc
"['footprints', 'gears', 'up', 'for', 'expansion', 'in', 'tier', '1', 'cities', 'of', 'gurgaon', 'bengaluru', 'and', 'delhi']",footprints gears up for expansion in tier 1 cities of gurgaon bengaluru and delhi
"['45', '50', 'growth', 'in', 'amuls', 'summer', 'product', 'categories', 'likely', 'this', 'year', 'md']",45 50 growth in amuls summer product categories likely this year md
"['lok', 'sabha', 'election', 'preneet', 'kaur', 'taranjit', 'singh', 'sandhu', 'ravneet', 'singh', 'bittu', 'provide', 'bjp', 'familiar', 'jat', 'sikh', 'faces', 'political', 'space', 'in', 'punjab']",lok sabha election preneet kaur taranjit singh sandhu ravneet singh bittu provide bjp familiar jat sikh faces political space in punjab
"['move', 'over', 'k', 'beauty', 'japanese', 'brands', 'are', 'here', 'to', 'take', 'over', 'indias', 'clean', 'b', 'trend']",move over k beauty japanese brands are here to take over indias clean b trend
"['didnt', 'declare', 'indias', 'involvement', 'in', 'nijjar', 'killing', 'lightly', 'canada', 'pm', 'trudeau', 'says', 'allegations', 'were', 'credible']",didnt declare indias involvement in nijjar killing lightly canada pm trudeau says allegations were credible
"['ipl', '2024', 'hardik', 'pandya', 'loses', 'cool', 'with', 'umpire', 'as', 'his', 'captaincy', 'comes', 'under', 'scrutiny', 'after', 'mis', 'back', 'to', 'back', 'losses']",ipl 2024 hardik pandya loses cool with umpire as his captaincy comes under scrutiny after mis back to back losses
"['akhilesh', 'yadav', 'has', 'final', 'say', 'in', 'rampur', 'azam', 'khan', 'in', 'moradabad']",akhilesh yadav has final say in rampur azam khan in moradabad
"['govt', 'revises', 'mnregs', 'wages', 'for', 'fy25', 'jairam', 'ramesh', 'says', 'congress', 'will', 'give', 'higher']",govt revises mnregs wages for fy25 jairam ramesh says congress will give higher
"['at', 'wto', 'australia', 'seeks', 'details', 'on', 'indias', 'fisheries', 'plan']",at wto australia seeks details on indias fisheries plan
"['adani', 'power', 'consolidates', 'rs', '19700', 'crore', 'loans', 'availed', 'by', 'six', 'arms', 'into', 'single', 'long', 'term', 'debt']",adani power consolidates rs 19700 crore loans availed by six arms into single long term debt
"['being', 'in', 'opposition', 'doesnt', 'give', 'immunity', 'against', 'corruption', 'says', 'nirmala', 'sitharaman']",being in opposition doesnt give immunity against corruption says nirmala sitharaman
"['residential', 'sale', 'in', 'fy24', 'reached', 'a', 'decadal', 'high', 'with', 'almost', '5', 'lakh', 'unit', 'sold']",residential sale in fy24 reached a decadal high with almost 5 lakh unit sold
"['jk', 'parties', 'hope', 'amit', 'shahs', 'afspa', 'pledge', 'is', 'not', 'false']",jk parties hope amit shahs afspa pledge is not false
"['go', 'first', 'lenders', 'yet', 'to', 'decide', 'on', 'bids', 'airlines', 'revival', 'likely', 'to', 'be', 'delayed']",go first lenders yet to decide on bids airlines revival likely to be delayed
"['2', 'engineering', 'stocks', 'build', 'case', 'for', '6', 'run', 'up']",2 engineering stocks build case for 6 run up
"['india', 'can', 'grow', 'at', 'close', 'to', '9', 'by', 'undertaking', 'pending', 'reforms', 'arvind', 'panagariya']",india can grow at close to 9 by undertaking pending reforms arvind panagariya
"['hero', 'no', '1', 'govinda', 'may', 'be', 'fielded', 'by', 'shinde', 'shiv', 'sena', 'from', 'mumbai', 'north', 'west', 'seat']",hero no 1 govinda may be fielded by shinde shiv sena from mumbai north west seat
"['delhi', 'high', 'court', 'warns', 'aap', 'legal', 'cell', 'of', 'severe', 'consequences']",delhi high court warns aap legal cell of severe consequences
