headlines,headline_text
"['nbcc', 'shares', 'in', 'focus', 'after', 'signing', 'mou', 'with', 'hudco', 'securing', 'rs', '316', 'crore', 'work', 'order']",nbcc shares in focus after signing mou with hudco securing rs 316 crore work order
"['transformed', 'the', 'theme', 'of', 'terrorism', 'to', 'tourism', 'in', 'j', 'k', 'coas', 'general', 'upendra', 'dwivedi']",transformed the theme of terrorism to tourism in j k coas general upendra dwivedi
"['vedanta', 'shares', 'in', 'focus', 'after', 'moodys', 'upgrades', 'vedanta', 'resources', 'corporate', 'family', 'rating', 'to', 'b2']",vedanta shares in focus after moodys upgrades vedanta resources corporate family rating to b2
"['indian', 'retail', 'sector', 'staring', 'at', 'these', '6', 'risks', 'but', '2', 'smallcaps', 'hold', 'edge', 'nuvama']",indian retail sector staring at these 6 risks but 2 smallcaps hold edge nuvama
"['sudarshan', 'chemical', 'shares', 'in', 'focus', 'after', 'promoters', 'sell', 'stake', 'via', 'block', 'deals']",sudarshan chemical shares in focus after promoters sell stake via block deals
"['proptech', 'startup', 'reloy', 'sees', '40', 'revenue', 'growth', 'to', 'rs', '25', 'crore', 'this', 'fiscal', 'on', 'strong', 'housing', 'demand']",proptech startup reloy sees 40 revenue growth to rs 25 crore this fiscal on strong housing demand
"['waaree', 'renewable', 'technologies', 'shares', 'in', 'focus', 'after', 'securing', 'rs', '1233', '5', 'crore', 'solar', 'project', 'order']",waaree renewable technologies shares in focus after securing rs 1233 5 crore solar project order
"['uber', 'faces', 'ftc', 'consumer', 'protection', 'probe', 'over', 'subscriptions']",uber faces ftc consumer protection probe over subscriptions
"['how', 'a', 'rebellion', 'and', 'a', 'meeting', 'with', 'narayana', 'murthy', 'shaped', 'indias', 'it', 'landscape', 'reveals', 'infosys', 'co', 'founder', 'nandan', 'nilekani']",how a rebellion and a meeting with narayana murthy shaped indias it landscape reveals infosys co founder nandan nilekani
"['aircastle', 'withdraws', 'insolvency', 'case', 'against', 'spicejet', 'after', 'settlement']",aircastle withdraws insolvency case against spicejet after settlement
"['hold', 'moil', 'target', 'price', 'rs', '330', 'sharekhan', 'by', 'bnp', 'paribas']",hold moil target price rs 330 sharekhan by bnp paribas
"['nifty', 'sensex', 'open', 'flat', 'on', 'thursday', 'experts', 'say', 'foreign', 'investors', 'return', 'to', 'indian', 'markets']",nifty sensex open flat on thursday experts say foreign investors return to indian markets
"['stock', 'radar', 'ltimindtree', 'forms', 'cup', 'handle', 'pattern', 'on', 'weekly', 'charts', 'buy', 'now', 'or', 'wait', 'for', 'breakout']",stock radar ltimindtree forms cup handle pattern on weekly charts buy now or wait for breakout
"['viral', 'video', 'man', 'thrashed', 'in', 'panipat', 'haryana', 'for', 'filming', 'reel', 'in', 'public', 'wearing', 'a', 'bra']",viral video man thrashed in panipat haryana for filming reel in public wearing a bra
"['is', 'delhi', 'bengaluru', 'outpacing', 'others', 'in', 'investment', 'risk', 'heres', 'what', 'a', 'report', 'says']",is delhi bengaluru outpacing others in investment risk heres what a report says
['kg'],kg
"['november', '2024', 'bank', 'holidays', 'banks', 'will', 'be', 'closed', 'for', '13', 'days', 'in', 'november', 'state', 'wise', 'bank', 'holiday', 'list']",november 2024 bank holidays banks will be closed for 13 days in november state wise bank holiday list
"['best', 'gilt', 'mutual', 'funds', 'to', 'invest', 'in', 'november2024']",best gilt mutual funds to invest in november2024
"['malls', 'may', 'cut', 'multiplex', 'space', 'as', 'cinema', 'led', 'revenues', 'shrink']",malls may cut multiplex space as cinema led revenues shrink
"['worried', 'about', 'the', 'harmful', 'microplastics', 'in', 'your', 'water', 'you', 'just', 'need', 'to', 'boil', 'and', 'strain', 'it', 'before', 'consumption']",worried about the harmful microplastics in your water you just need to boil and strain it before consumption
"['bank', 'holiday', 'in', 'september', '2024', 'banks', 'are', 'closed', 'for', '15', 'days', 'in', 'september', 'check', 'complete', 'state', 'wise', 'holiday', 'list']",bank holiday in september 2024 banks are closed for 15 days in september check complete state wise holiday list
"['godrej', 'properties', 'shares', 'in', 'focus', 'as', 'co', 'launches', 'qip', 'to', 'raise', 'rs', '6000', 'crore']",godrej properties shares in focus as co launches qip to raise rs 6000 crore
"['kec', 'international', 'shares', 'in', 'focus', 'after', 'securing', 'rs', '1704', 'crore', 'turnkey', 'orders', 'from', 'power', 'grid', 'corporation']",kec international shares in focus after securing rs 1704 crore turnkey orders from power grid corporation
"['trump', '2', '0', 'to', 'see', 'reduction', 'in', 'global', 'wars', 'lesser', 'geo', 'political', 'uncertainty', 'stable', 'crude', 'report']",trump 2 0 to see reduction in global wars lesser geo political uncertainty stable crude report
"['trumps', 'trade', 'chief', 'advocates', 'strategic', 'decoupling', 'from', 'china']",trumps trade chief advocates strategic decoupling from china
"['tamil', 'nadu', 'wont', 'implement', 'pm', 'vishwakarma', 'scheme', 'cm', 'stalin', 'informs', 'union', 'minister', 'jitan', 'ram', 'manjhi']",tamil nadu wont implement pm vishwakarma scheme cm stalin informs union minister jitan ram manjhi
"['its', 'not', 'possible', 'for', 'pakistan', 'to', 'play', 'in', 'india', 'as', 'theyre', 'not', 'sending', 'team', 'here', 'naqvi']",its not possible for pakistan to play in india as theyre not sending team here naqvi
"['hot', 'stocks', 'global', 'brokerages', 'see', 'up', 'to', '10', '18', 'upside', 'in', 'these', '2', 'fmcg', 'stocks']",hot stocks global brokerages see up to 10 18 upside in these 2 fmcg stocks
"['sonata', 'software', 'shares', 'in', 'focus', 'on', 'winning', 'multi', 'million', 'dollar', 'modernisation', 'deal', 'in', 'australia']",sonata software shares in focus on winning multi million dollar modernisation deal in australia
"['august', '2024', 'bank', 'holidays', 'banks', 'are', 'closed', 'for', '13', 'days', 'in', 'august', '2024', 'check', 'state', 'wise', 'bank', 'holiday', 'list']",august 2024 bank holidays banks are closed for 13 days in august 2024 check state wise bank holiday list
"['fo', 'radar', 'deploy', 'short', 'iron', 'butterfly', 'in', 'nifty', 'to', 'gain', 'from', 'sideways', 'market']",fo radar deploy short iron butterfly in nifty to gain from sideways market
"['world', 'war', 'iii', 'why', 'putins', 'nuclear', 'threat', 'is', 'real', 'russias', 'former', 'officer', 'reveals', 'alarming', 'secrets']",world war iii why putins nuclear threat is real russias former officer reveals alarming secrets
"['delhi', 'nursery', 'admissions', 'process', 'starts', 'november', '28', 'check', 'selection', 'criteria', 'by', 'schools', 'key', 'dates', 'and', 'more']",delhi nursery admissions process starts november 28 check selection criteria by schools key dates and more
"['stocks', 'to', 'buy', 'today', 'bel', 'indigo', 'among', 'top', '9', 'trading', 'ideas', 'for', '28', 'november', '2024']",stocks to buy today bel indigo among top 9 trading ideas for 28 november 2024
"['lucky', 'bashkar', 'makes', 'a', 'splashing', 'debut', 'on', 'ott', 'netizens', 'hail', 'dulquer', 'salmans', 'period', 'drama', 'for', 'story', 'performances']",lucky bashkar makes a splashing debut on ott netizens hail dulquer salmans period drama for story performances
"['did', 'aishwarya', 'rai', 'ditch', 'the', 'bachchan', 'surname', 'viral', 'video', 'triggers', 'fresh', 'divorce', 'buzz']",did aishwarya rai ditch the bachchan surname viral video triggers fresh divorce buzz
"['jharkhand', 'butcher', 'strangles', 'live', 'in', 'partner', 'chops', 'body', 'into', '40', 'pieces']",jharkhand butcher strangles live in partner chops body into 40 pieces
"['gold', 'funds', 'vs', 'etfs', 'which', 'one', 'should', 'investors', 'choose', 'now']",gold funds vs etfs which one should investors choose now
"['red', 'alert', '72', 'companies', 'flip', 'to', 'loss', 'in', 'q2', 'are', 'your', 'stocks', 'also', 'on', 'this', 'list']",red alert 72 companies flip to loss in q2 are your stocks also on this list
"['youtube', 'releases', 'late', 'ceo', 'susan', 'wojcickis', 'last', 'words', 'life', 'is', 'unpredictable', 'enjoy', 'the', 'present']",youtube releases late ceo susan wojcickis last words life is unpredictable enjoy the present
"['buy', 'state', 'bank', 'of', 'india', 'target', 'price', 'rs', '1030', 'axis', 'securities']",buy state bank of india target price rs 1030 axis securities
"['buy', 'lampt', 'finance', 'target', 'price', 'rs', '180', 'motilal', 'oswal', 'financial', 'services']",buy lampt finance target price rs 180 motilal oswal financial services
"['buy', 'siemens', 'target', 'price', 'rs', '8114', 'hdfc', 'securities']",buy siemens target price rs 8114 hdfc securities
"['is', 'this', 'the', 'right', 'time', 'to', 'buy', 'stocks', 'anupam', 'singhi', 'of', 'oneil', 'capital', 'decodes']",is this the right time to buy stocks anupam singhi of oneil capital decodes
"['etmarkets', 'smart', 'talk', 'equities', 'poised', 'for', '16', 'returns', 'in', '2024', 'gold', 'looks', 'toppish', 'naveen', 'kulkarni', 'axis', 'securities', 'pms']",etmarkets smart talk equities poised for 16 returns in 2024 gold looks toppish naveen kulkarni axis securities pms
"['eknath', 'shinde', 'wants', 'his', 'son', 'shrikant', 'to', 'be', 'maha', 'deputy', 'cm', 'heres', 'whats', 'buzzing']",eknath shinde wants his son shrikant to be maha deputy cm heres whats buzzing
"['mohammed', 'zubair', 'charged', 'of', 'endangering', 'the', 'sovereignty', 'unity', 'and', 'integrity', 'of', 'india']",mohammed zubair charged of endangering the sovereignty unity and integrity of india
"['earthquake', 'of', 'magnitude', '3', '8', 'strikes', 'nagalands', 'kiphire']",earthquake of magnitude 3 8 strikes nagalands kiphire
"['dot', 'plans', 'to', 'refarm', '1100', 'mhz', 'spectrum', 'from', 'various', 'ministries', 'departments']",dot plans to refarm 1100 mhz spectrum from various ministries departments
"['cement', 'industry', 'to', 'add', '70', '75', 'million', 'mt', 'capacity', 'in', 'two', 'years', 'amid', 'slowdown', 'in', 'construction']",cement industry to add 70 75 million mt capacity in two years amid slowdown in construction
"['best', 'refrigerators', 'under', '10000', 'affordable', 'cooling', 'solutions', 'for', 'every', 'budget']",best refrigerators under 10000 affordable cooling solutions for every budget
"['satcom', 'providers', 'divided', 'over', 'licensing', 'norms', 'for', 'satellite', 'earth', 'station', 'gateways']",satcom providers divided over licensing norms for satellite earth station gateways
"['redmi', 'note', '14', 'series', 'to', 'launch', 'this', 'december', 'check', 'prices', 'features']",redmi note 14 series to launch this december check prices features
"['agarwal', 'toughened', 'glass', 'ipo', 'opens', 'today', 'check', 'key', 'dates', 'gmp', 'price', 'band', 'and', 'other', 'details']",agarwal toughened glass ipo opens today check key dates gmp price band and other details
"['jiostar', 'has', 'the', 'scale', 'to', 'lead', 'impactful', 'change', 'in', 'me', 'sector', 'uday', 'shankar']",jiostar has the scale to lead impactful change in me sector uday shankar
"['c2c', 'advanced', 'systems', 'gmp', 'climbs', 'post', 'subscription', 'close', 'check', 'allotment', 'date', 'and', 'listing', 'date']",c2c advanced systems gmp climbs post subscription close check allotment date and listing date
"['buy', 'jsw', 'energy', 'target', 'price', 'rs', '810', 'motilal', 'oswal', 'financial', 'services']",buy jsw energy target price rs 810 motilal oswal financial services
"['are', 'auto', 'stocks', 'value', 'buys', 'now', 'how', 'will', 'maharashtra', 'election', 'results', 'impact', 'realty', 'stocks', 'chakri', 'lokapriya', 'answers']",are auto stocks value buys now how will maharashtra election results impact realty stocks chakri lokapriya answers
"['dont', 'make', 'fresh', 'investment', 'in', 'abb', 'hitachi', 'or', 'siemens', 'now', 'buy', 'psu', 'stocks', 'dipan', 'mehta']",dont make fresh investment in abb hitachi or siemens now buy psu stocks dipan mehta
"['jammu', 'and', 'kashmir', 'anantnag', 'police', 'attach', 'property', 'worth', 'rs', '2', 'cr', 'under', 'ndps', 'act', 'in', 'srigufwara']",jammu and kashmir anantnag police attach property worth rs 2 cr under ndps act in srigufwara
"['stock', 'radar', 'itc', 'takes', 'support', 'above', '200', 'dma', 'after', 'falling', 'by', 'about', '10', 'from', 'highs', 'time', 'to', 'buy']",stock radar itc takes support above 200 dma after falling by about 10 from highs time to buy
"['crisil', 'downgrades', 'fusion', 'finances', 'debt']",crisil downgrades fusion finances debt
"['big', 'movers', 'on', 'd', 'street', 'what', 'should', 'investors', 'do', 'with', 'adani', 'ports', 'nalco', 'and', 'ntpc']",big movers on d street what should investors do with adani ports nalco and ntpc
"['earthquake', 'of', 'magnitude', '4', '6', 'jolts', 'tajikistan']",earthquake of magnitude 4 6 jolts tajikistan
"['not', 'shah', 'rukh', 'khan', 'but', 'this', 'south', 'star', 'commands', 'over', 'rs', '300', 'crore', 'per', 'film', 'check', 'forbes', 'list', 'of', '10', 'highest', 'paid', 'indian', 'actors']",not shah rukh khan but this south star commands over rs 300 crore per film check forbes list of 10 highest paid indian actors
"['manipur', 'npp', 'condemns', 'all', 'forms', 'of', 'violence', 'in', 'state']",manipur npp condemns all forms of violence in state
"['pakistan', 'clashes', 'deaths', 'indian', 'american', 'congressman', 'calls', 'for', 'sanctions', 'against', 'pakistan', 'officials']",pakistan clashes deaths indian american congressman calls for sanctions against pakistan officials
"['easy', 'trip', 'planners', '2', 'other', 'stocks', 'to', 'trade', 'ex', 'bonus', 'tomorrow', 'last', 'chance', 'to', 'buy']",easy trip planners 2 other stocks to trade ex bonus tomorrow last chance to buy
"['masayoshi', 'sons', 'vision', 'for', 'india', 'stellaris', '300', 'million', 'fund']",masayoshi sons vision for india stellaris 300 million fund
"['nalco', 'among', '11', 'stocks', 'to', 'trade', 'ex', 'dividend', 'tomorrow', 'last', 'chance', 'to', 'buy', 'for', 'eligibility']",nalco among 11 stocks to trade ex dividend tomorrow last chance to buy for eligibility
"['bob', 'raises', 'rs', '3500', 'cr', 'through', 'tier', '2', 'bonds']",bob raises rs 3500 cr through tier 2 bonds
"['kashmiri', 'touch', 'in', 'central', 'asian', 'handiwork', 'seen', 'at', 'world', 'crafts', 'councils', 'programme']",kashmiri touch in central asian handiwork seen at world crafts councils programme
"['gen', 'z', 'work', 'life', 'expectations', 'reshaping', 'hr', 'job', 'profile']",gen z work life expectations reshaping hr job profile
"['asian', 'stocks', 'fluctuate', 'bond', 'yields', 'slip']",asian stocks fluctuate bond yields slip
"['israel', 'denies', 'authority', 'legitimacy', 'of', 'international', 'criminal', 'court', 'arrest', 'warrants', 'against', 'pm', 'netanyahu', 'former', 'defence', 'minister', 'gallant']",israel denies authority legitimacy of international criminal court arrest warrants against pm netanyahu former defence minister gallant
"['indigo', 'travel', 'advisory', 'flight', 'disruptions', 'to', 'continue', 'due', 'to', 'adverse', 'weather', 'conditions', 'in', 'tamil', 'nadu']",indigo travel advisory flight disruptions to continue due to adverse weather conditions in tamil nadu
"['pre', 'market', 'action', 'heres', 'the', 'trade', 'setup', 'for', 'todays', 'session']",pre market action heres the trade setup for todays session
"['stocks', 'in', 'news', 'waaree', 'renewable', 'godrej', 'properties', 'vedanta', 'pcbl', 'natco', 'pharma']",stocks in news waaree renewable godrej properties vedanta pcbl natco pharma
"['regulator', 'asks', 'fund', 'houses', 'pms', 'cos', 'to', 'disclose', 'more', 'about', 'dodgy', 'investors']",regulator asks fund houses pms cos to disclose more about dodgy investors
"['as', 'indian', 'markets', 'remain', 'expensive', 'investors', 'can', 'allocate', '15', 'to', 'us', 'equities']",as indian markets remain expensive investors can allocate 15 to us equities
"['interoperability', 'in', 'netbanking', 'payments', 'soon', 'icici', 'and', 'hdfc', 'bank', 'in', 'advanced', 'stages', 'of', 'integration']",interoperability in netbanking payments soon icici and hdfc bank in advanced stages of integration
"['peak', 'xv', 'ex', 'md', 'piyush', 'gupta', 'launches', 'secondaries', 'focused', 'investment', 'firm']",peak xv ex md piyush gupta launches secondaries focused investment firm
"['mood', 'at', 'core', 'sector', 'companies', 'positive', 'discretionary', 'outlook', 'cautious']",mood at core sector companies positive discretionary outlook cautious
"['no', 'bribery', 'charges', '55', 'billion', 'hit', 'on', 'm', 'cap', 'adani', 'group']",no bribery charges 55 billion hit on m cap adani group
"['hdfc', 'securities', 'to', 'shut', 'franchisee', 'business']",hdfc securities to shut franchisee business
"['order', 'book', 'momentum', 'margin', 'improvement', 'augur', 'well', 'for', 'afcons']",order book momentum margin improvement augur well for afcons
"['your', 'bets', 'on', 'multi', 'asset', 'allocation', 'funds', 'must', 'factor', 'in', 'equity', 'play']",your bets on multi asset allocation funds must factor in equity play
"['daily', 'trading', 'desk', '2', 'trades', 'for', 'short', 'term', 'gains', 'a', 'large', 'cap', 'defence', 'psu', 'and', 'a', 'mid', 'cap', 'it', 'solutions', 'stock', 'both', 'for', '7', 'upmove']",daily trading desk 2 trades for short term gains a large cap defence psu and a mid cap it solutions stock both for 7 upmove
"['these', 'mid', 'cap', 'stocks', 'with', 'strong', 'buy', 'buy', 'recos', 'can', 'rally', 'over', '25', 'according', 'to', 'analysts']",these mid cap stocks with strong buy buy recos can rally over 25 according to analysts
"['food', 'items', 'may', 'shed', 'weight', 'in', 'cpi', 'basket']",food items may shed weight in cpi basket
"['best', 'havells', 'geysers', 'for', 'this', 'winter', 'season']",best havells geysers for this winter season
"['best', 'blueair', 'air', 'purifiers', 'to', 'fight', 'off', 'pollution', 'woes']",best blueair air purifiers to fight off pollution woes
"['half', 'man', 'hbo', 'and', 'bbc', 'drama', 'shows', 'cast', 'storyline', 'and', 'production', 'team']",half man hbo and bbc drama shows cast storyline and production team
"['squid', 'game', 'season', '2', 'all', 'we', 'know', 'about', 'release', 'date', 'trailer', 'and', 'cast']",squid game season 2 all we know about release date trailer and cast
"['biggest', 'question', 'as', 'trump', 'takes', 'over', 'as', 'the', '47th', 'u', 's', 'president', 'what', 'will', 'his', 'salary', 'be', 'here', 'is', 'a', 'breakdown']",biggest question as trump takes over as the 47th u s president what will his salary be here is a breakdown
"['did', 'prince', 'harry', 'use', 'american', 'slang', 'in', 'a', 'video', 'with', 'singer', 'jelly', 'roll', 'whats', 'the', 'truth', 'as', 'fans', 'call', 'out', 'his', 'accent']",did prince harry use american slang in a video with singer jelly roll whats the truth as fans call out his accent
"['fortnite', 'remix', 'the', 'finale', 'live', 'event', 'all', 'you', 'may', 'want', 'to', 'know']",fortnite remix the finale live event all you may want to know
"['vanderpump', 'rules', 'season', '12', 'everything', 'we', 'know', 'so', 'far']",vanderpump rules season 12 everything we know so far
"['jake', 'pauls', 'next', 'opponent', 'is', 'ryan', 'garcia', 'what', 'we', 'know', 'so', 'far']",jake pauls next opponent is ryan garcia what we know so far
"['dexter', 'original', 'sin', 'heres', 'premiere', 'date', 'time', 'storyline', 'cast', 'trailer', 'and', 'where', 'to', 'watch']",dexter original sin heres premiere date time storyline cast trailer and where to watch
"['henry', 'danger', 'the', 'movie', 'see', 'premiere', 'date', 'time', 'plot', 'cast', 'and', 'where', 'to', 'watch']",henry danger the movie see premiere date time plot cast and where to watch
"['one', 'piece', 'chapter', '1132', 'see', 'release', 'date', 'time', 'where', 'to', 'read', 'and', 'spoilers']",one piece chapter 1132 see release date time where to read and spoilers
"['black', 'ops', '6', 'season', '1', 'reloaded', 'heres', 'release', 'date', 'weapons', 'and', 'maps']",black ops 6 season 1 reloaded heres release date weapons and maps
"['do', 'queen', 'camilla', 'and', 'kate', 'middleton', 'have', 'a', 'tense', 'relationship', 'her', 'role', 'in', 'the', 'monarchy', 'may', 'be', 're', 'evaluated', 'when', 'william', 'becomes', 'the', 'king']",do queen camilla and kate middleton have a tense relationship her role in the monarchy may be re evaluated when william becomes the king
"['macys', 'thanksgiving', 'day', 'parade', '2024', 'date', 'time', 'and', 'how', 'to', 'watch', 'live']",macys thanksgiving day parade 2024 date time and how to watch live
"['mm', 'targets', 'lifestyle', 'buyers', 'for', 'ev', 'growth']",mm targets lifestyle buyers for ev growth
['arpegeparis'],arpegeparis
"['saying', 'thanks', 'is', 'healthy']",saying thanks is healthy
"['disneys', 'moana', 'live', 'action', 'movie', 'release', 'date', 'when', 'will', 'dwayne', 'johnsons', 'movie', 'premiere']",disneys moana live action movie release date when will dwayne johnsons movie premiere
"['did', 'trumps', 'aide', 'natalie', 'harp', 'send', 'out', 'a', 'series', 'of', 'passionate', 'letters', 'to', 'the', 'president', 'elect', 'heres', 'what', 'reports', 'are', 'saying']",did trumps aide natalie harp send out a series of passionate letters to the president elect heres what reports are saying
"['as', 'onion', 'prices', 'near', 'rs', '100', 'delhi', 'mans', 'tearful', 'request', 'for', 'extra', 'onions', 'from', 'swiggy', 'restaurant', 'goes', 'viral']",as onion prices near rs 100 delhi mans tearful request for extra onions from swiggy restaurant goes viral
"['godrej', 'enterprises', 'group', 'unveils', 'new', 'brand', 'identity']",godrej enterprises group unveils new brand identity
"['hdfc', 'banks', 'm', 'cap', 'surpasses', 'rs', '14', 'lakh', 'crore', 'for', 'the', 'first', 'time', 'after', 'stock', 'hits', 'record', 'high']",hdfc banks m cap surpasses rs 14 lakh crore for the first time after stock hits record high
"['tgit', 'thank', 'god', 'its', 'thanksgiving', 'mitron']",tgit thank god its thanksgiving mitron
"['how', 'to', 'win', 'election', 'in', 'red', 'states', 'the', 'democrats', 'can', 'learn', 'from', 'this', 'fiery', 'american', 'evangelical', 'pastor']",how to win election in red states the democrats can learn from this fiery american evangelical pastor
"['knives', 'out', '3', 'will', 'the', 'sequel', 'be', 'released', 'in', 'theatres', 'or', 'streaming']",knives out 3 will the sequel be released in theatres or streaming
"['us', 'tariff', 'impact', 'on', 'india', 'economy', 'rupee', 'and', 'trade', 'donald', 'trumps', 'trump', 'card', 'can', 'actually', 'aid', 'indias', 'growth']",us tariff impact on india economy rupee and trade donald trumps trump card can actually aid indias growth
"['in', 'mahayuti', 'there', 'was', 'never', 'difference', 'of', 'opinions', 'devendra', 'fadnavis', 'after', 'eknath', 'shindes', 'remarks', 'on', 'cm', 'post']",in mahayuti there was never difference of opinions devendra fadnavis after eknath shindes remarks on cm post
"['suraksha', 'diagnostic', 'ipo', 'opens', 'friday', 'gmp', 'price', 'band', 'key', 'dates', 'among', 'top', '10', 'things', 'to', 'know']",suraksha diagnostic ipo opens friday gmp price band key dates among top 10 things to know
"['ed', 'team', 'attacked', 'in', 'delhi', 'during', 'raids', 'in', 'cyber', 'crime', 'case']",ed team attacked in delhi during raids in cyber crime case
"['adanis', 'time', 'wasted', 'in', 'court', 'norway', 'diplomat', 'calls', 'for', 'end', 'to', 'american', 'overreach']",adanis time wasted in court norway diplomat calls for end to american overreach
"['is', 'the', 'war', 'over', 'and', 'will', 'ukraine', 'surrender', 'russia', 'is', 'advancing', 'in', 'the', 'country', 'at', 'the', 'fastest', 'rate', 'since', '2022']",is the war over and will ukraine surrender russia is advancing in the country at the fastest rate since 2022
"['rcb', 'faces', 'backlash', 'from', 'pro', 'kannada', 'outfits', 'for', 'hindi', 'social', 'media', 'account']",rcb faces backlash from pro kannada outfits for hindi social media account
"['akasa', 'air', 'gets', 'notice', 'over', 'pilot', 'retraining', 'lapse']",akasa air gets notice over pilot retraining lapse
"['japans', 'third', 'largest', 'bank', 'mizuho', 'financialweighs', 'new', 'push', 'to', 'target', 'private', 'equity', 'boom', 'in', 'india']",japans third largest bank mizuho financialweighs new push to target private equity boom in india
"['coal', 'mines', 'nlc', 'acc', 'among', 'eight', 'top', 'bidders']",coal mines nlc acc among eight top bidders
"['billionaire', 'son', 'turned', 'monk', 'ven', 'ajahn', 'siripanyos', 'father', 'malaysias', 'richest', 'man', 'ananda', 'krishnan', 'passes', 'away']",billionaire son turned monk ven ajahn siripanyos father malaysias richest man ananda krishnan passes away
"['ind', 'vs', 'aus', 'shubman', 'gill', 'to', 'likely', 'miss', '2nd', 'test']",ind vs aus shubman gill to likely miss 2nd test
"['beml', 'shares', 'jump', '4', 'on', 'rs', '3658', 'crore', 'order', 'win', 'from', 'chennai', 'metro', 'rail']",beml shares jump 4 on rs 3658 crore order win from chennai metro rail
"['cyclone', 'fengal', 'how', 'it', 'got', 'its', 'name', 'landfall', 'weather', 'warnings', 'and', 'impact', 'on', 'tamil', 'nadu']",cyclone fengal how it got its name landfall weather warnings and impact on tamil nadu
