headlines,headline_text
"['indian', 'market', 'unlikely', 'to', 'fall', 'as', 'every', 'dip', 'gets', 'bought', 'into', 'tech', 'pharma', 'making', 'a', 'comeback', 'manish', 'sonthalia']",indian market unlikely to fall as every dip gets bought into tech pharma making a comeback manish sonthalia
"['apple', 'india', 'business', 'value', 'exceeds', '2', 'lakh', 'cr', 'how', 'did', 'it', 'reach', 'there']",apple india business value exceeds 2 lakh cr how did it reach there
"['demonstrators', 'hit', 'kolkata', 'streets', 'with', 'want', 'justice', 'slogan']",demonstrators hit kolkata streets with want justice slogan
"['new', 'video', 'game', 'release', 'date', 'on', 'playstation', '5', 'pc', 'how', 'to', 'play', 'key', 'features']",new video game release date on playstation 5 pc how to play key features
"['one', 'arrested', 'for', 'sharing', 'photo', 'of', 'rg', 'kar', 'hospital', 'victim', 'issuing', 'threat', 'to', 'mamata', 'banerjee']",one arrested for sharing photo of rg kar hospital victim issuing threat to mamata banerjee
"['candidates', 'names', 'will', 'be', 'finalised', 'soon', 'union', 'minister', 'g', 'kishan', 'reddy', 'ahead', 'of', 'j', 'k', 'assembly', 'polls']",candidates names will be finalised soon union minister g kishan reddy ahead of j k assembly polls
"['fund', 'manager', 'talk', 'invested', '75', 'in', 'equity', 'krishna', 'sanghavi', 'says', 'defer', 'fresh', 'allocation']",fund manager talk invested 75 in equity krishna sanghavi says defer fresh allocation
