headlines,headline_text
"['big', 'twist', 'in', 'allu', 'arjun', 'case', 'stampede', 'victims', 'husband', 'ready', 'to', 'withdraw', 'complaint']",big twist in allu arjun case stampede victims husband ready to withdraw complaint
"['ccpa', 'issues', 'notices', 'to', '17', 'direct', 'selling', 'firms', 'over', 'unfair', 'practices']",ccpa issues notices to 17 direct selling firms over unfair practices
"['allu', 'arjun', 'arrest', 'pushpa', '2', 'star', 'granted', 'interim', 'bail', 'in', 'stampede', 'death', 'case', 'by', 'telangana', 'hc']",allu arjun arrest pushpa 2 star granted interim bail in stampede death case by telangana hc
"['gold', 'silver', 'prices', 'slump', 'amid', 'heavy', 'selling', 'by', 'jewellers', 'stockists']",gold silver prices slump amid heavy selling by jewellers stockists
"['amazon', 'tv', 'sale', 'shop', 'best', 'rated', 'tvs', 'from', 'top', 'brands', 'as', 'per', 'your', 'budget']",amazon tv sale shop best rated tvs from top brands as per your budget
"['vivo', 'increases', 'presence', 'in', 'premium', 'segment', 'with', '16', 'market', 'share']",vivo increases presence in premium segment with 16 market share
"['did', 'donald', 'trump', 'pursue', 'princess', 'diana', 'and', 'want', 'her', 'as', 'the', 'ultimate', 'trophy', 'wife', 'heres', 'what', 'a', 'friend', 'of', 'the', 'royal', 'has', 'said']",did donald trump pursue princess diana and want her as the ultimate trophy wife heres what a friend of the royal has said
"['assam', 'police', 'arrest', 'eight', 'persons', 'for', 'their', 'involvement', 'in', 'the', 'gangrape', 'of', 'a', 'girl']",assam police arrest eight persons for their involvement in the gangrape of a girl
"['tech', 'view', 'nifty', 'forms', 'long', 'bull', 'candle', 'eyes', '25200', 'level', 'next', 'week', 'how', 'to', 'trade', 'on', 'monday']",tech view nifty forms long bull candle eyes 25200 level next week how to trade on monday
"['brookfield', 'india', 'reit', 'raises', 'rs', '3500', 'cr', 'through', 'qip', 'ifc', 'lic', 'among', 'key', 'investors']",brookfield india reit raises rs 3500 cr through qip ifc lic among key investors
"['scheme', 'to', 'give', 'rs', '1000', 'to', 'delhi', 'women', 'to', 'be', 'rolled', 'out', 'in', '10', '15', 'days', 'cm', 'atishi']",scheme to give rs 1000 to delhi women to be rolled out in 10 15 days cm atishi
"['no', 'staff', 'fired', 'it', 'was', 'campaign', 'to', 'highlight', 'workplace', 'stress', 'yesmadam', 'cofounder', 'clarifies']",no staff fired it was campaign to highlight workplace stress yesmadam cofounder clarifies
"['telangana', 'cm', 'revanth', 'reddy', 'under', 'fire', 'after', 'police', 'lift', 'allu', 'arjun', 'straight', 'from', 'his', 'bedroom']",telangana cm revanth reddy under fire after police lift allu arjun straight from his bedroom
"['isro', 'achieves', 'significant', 'milestone', 'for', 'gaganyaan', 'programme']",isro achieves significant milestone for gaganyaan programme
"['jennifer', 'lopez', 'caught', 'in', 'jay', 'z', 'rape', 'scandal', 'photos', 'of', 'her', 'sean', 'diddy', 'emerge', 'from', 'same', 'night', 'when', 'assault', 'happened']",jennifer lopez caught in jay z rape scandal photos of her sean diddy emerge from same night when assault happened
"['drdo', 'iaf', 'discuss', 'key', 'aerospace', 'projects', 'in', 'high', 'level', 'meeting']",drdo iaf discuss key aerospace projects in high level meeting
"['bengaluru', 'developers', 'face', 'allegations', 'of', 'rs', '3300', 'crore', 'fraud']",bengaluru developers face allegations of rs 3300 crore fraud
"['riding', 'new', 'waves', 'of', 'tech', 'essential', 'for', 'survival', 'say', 'indian', 'entrepreneurs']",riding new waves of tech essential for survival say indian entrepreneurs
"['allu', 'arjun', 'sent', 'to', 'jail', 'for', '14', 'days', 'what', 'are', 'the', 'charges', 'against', 'pushpa', '2', 'star']",allu arjun sent to jail for 14 days what are the charges against pushpa 2 star
"['former', 'rg', 'kar', 'principal', 'sandip', 'ghosh', 'gets', 'bail', 'in', 'kolkata', 'doctor', 'rape', 'murder', 'case']",former rg kar principal sandip ghosh gets bail in kolkata doctor rape murder case
"['agrochemicals', 'sector', 'revenue', 'expected', 'to', 'grow', 'at', '7', '9', 'pc', 'in', 'fy26', 'crisil']",agrochemicals sector revenue expected to grow at 7 9 pc in fy26 crisil
"['kotak', 'equities', 'downgrades', 'lt', 'to', 'reduce', 'gives', 'rs', '3650', 'target', 'price']",kotak equities downgrades lt to reduce gives rs 3650 target price
"['income', 'tax', 'dont', 'want', 'to', 'miss', 'important', 'income', 'tax', 'updates', 'on', 'mobile', 'email', 'follow', 'these', 'steps']",income tax dont want to miss important income tax updates on mobile email follow these steps
"['allu', 'arjun', 'arrest', 'court', 'sends', 'pushpa', '2', 'actor', 'to', '14', 'day', 'custody']",allu arjun arrest court sends pushpa 2 actor to 14 day custody
"['firstclub', 'of', 'former', 'cleartrip', 'ceo', 'ayyappan', 'raises', '8', 'million', 'in', 'round', 'led', 'by', 'accel', 'rtp', 'global']",firstclub of former cleartrip ceo ayyappan raises 8 million in round led by accel rtp global
"['french', 'president', 'macron', 'appoints', 'centrist', 'leader', 'franois', 'bayrou', 'as', 'the', 'new', 'prime', 'minister', 'of', 'the', 'nation']",french president macron appoints centrist leader franois bayrou as the new prime minister of the nation
"['international', 'gemmological', 'institute', 'ipo', 'opens', 'today', 'check', 'key', 'dates', 'gmp', 'price', 'band', 'subscription', 'and', 'review']",international gemmological institute ipo opens today check key dates gmp price band subscription and review
"['ktr', 'condemns', 'arrest', 'of', 'pushpa', '2', 'star', 'allu', 'arjun', 'calls', 'it', 'pinnacle', 'of', 'insecurity']",ktr condemns arrest of pushpa 2 star allu arjun calls it pinnacle of insecurity
"['sai', 'life', 'sciences', 'ipo', 'day', '3', 'check', 'key', 'dates', 'price', 'band', 'gmp', 'and', 'review']",sai life sciences ipo day 3 check key dates price band gmp and review
"['isha', 'ambani', 'led', 'reliance', 'retail', 'unveils', 'a', 'new', 'range', 'of', 'home', 'theatre', 'tvs']",isha ambani led reliance retail unveils a new range of home theatre tvs
"['us', 'makes', 'h', '1b', 'visa', 'green', 'card', 'pathways', 'easier', 'for', 'international', 'students', 'on', 'j', '1', 'visa']",us makes h 1b visa green card pathways easier for international students on j 1 visa
"['mobikwik', 'ipo', 'day', '3', 'check', 'key', 'dates', 'subscription', 'gmp', 'and', 'review']",mobikwik ipo day 3 check key dates subscription gmp and review
"['before', 'arrest', 'pushpa', '2', 'star', 'allu', 'arjun', 'had', 'clarified', 'numbers', 'are', 'temporary', 'but']",before arrest pushpa 2 star allu arjun had clarified numbers are temporary but
"['priyanka', 'gandhi', 'vadras', 'maiden', 'speech', 'in', 'parliament', 'top', '10', 'statements', 'by', 'the', 'congress', 'mp']",priyanka gandhi vadras maiden speech in parliament top 10 statements by the congress mp
"['onoe', 'a', 'ploy', 'to', 'finish', 'off', 'smaller', 'regional', 'parties', 'says', 'karnataka', 'dy', 'cm', 'shivakumar']",onoe a ploy to finish off smaller regional parties says karnataka dy cm shivakumar
"['alkem', 'lab', 'promoter', 'buys', 'sea', 'facing', 'luxury', 'apartment', 'in', 'mumbais', 'worli', 'for', 'rs', '185', 'cr']",alkem lab promoter buys sea facing luxury apartment in mumbais worli for rs 185 cr
"['delhi', 'dehradun', 'expressway', 'to', 'be', 'completed', 'within', 'three', 'months', 'nitin', 'gadkari']",delhi dehradun expressway to be completed within three months nitin gadkari
"['one', 'of', 'the', 'largest', 'strikes', 'on', 'energy', 'infrastructure', 'zelenskyy', 'says', 'russia', 'targeted', 'ukraine', 'with', '93', 'missiles', '200', 'drones']",one of the largest strikes on energy infrastructure zelenskyy says russia targeted ukraine with 93 missiles 200 drones
"['switzerland', 'scraps', 'mfn', 'status', 'to', 'india', 'dividend', 'income', 'to', 'face', 'higher', 'tax']",switzerland scraps mfn status to india dividend income to face higher tax
"['japan', 'plans', 'to', 'give', 'three', 'weekly', 'offs', 'to', 'everybody', 'from', 'next', 'year', 'to', 'grow', 'younger']",japan plans to give three weekly offs to everybody from next year to grow younger
"['digital', 'arrest', 'frauds', 'on', 'rise', 'npci', 'cautions', 'people', 'on', 'how', 'to', 'identify', 'and', 'protect', 'themselves', 'from', 'frauds']",digital arrest frauds on rise npci cautions people on how to identify and protect themselves from frauds
"['indias', 'forex', 'reserves', 'fall', 'by', '3', '23', 'bn', 'at', '654', '86', 'bn', 'as', 'on', 'dec', '6']",indias forex reserves fall by 3 23 bn at 654 86 bn as on dec 6
"['disinformation', 'campaign', 'to', 'malign', 'india', 'mea', 'on', 'canadian', 'media', 'report', 'on', 'visa', 'halt', 'for', 'khalistanis']",disinformation campaign to malign india mea on canadian media report on visa halt for khalistanis
"['japan', 'in', 'dire', 'straits', 'tokyo', 'to', 'introduce', '4', 'day', 'workweek', 'from', 'april', '2025', 'as', 'country', 'faces', 'big', 'problem', 'heres', 'how', 'it', 'is', 'trying', 'to', 'solve', 'it']",japan in dire straits tokyo to introduce 4 day workweek from april 2025 as country faces big problem heres how it is trying to solve it
"['competition', 'comm', 'directs', 'table', 'tennis', 'federation', 'of', 'india', 'to', 'cease', 'desist', 'from', 'unfair', 'practices']",competition comm directs table tennis federation of india to cease desist from unfair practices
"['allu', 'arjun', 'arrest', 'from', 'sandhya', 'theatre', 'stampede', 'to', '14', 'day', 'prison', 'sentence', 'a', 'complete', 'timeline', 'of', 'events']",allu arjun arrest from sandhya theatre stampede to 14 day prison sentence a complete timeline of events
"['noida', 'building', 'projects', 'without', 'clearances', 'not', 'to', 'proceed', 'with', 'construction', 'ngt']",noida building projects without clearances not to proceed with construction ngt
"['plans', 'afoot', 'to', 'bring', 'epfo', 'service', 'at', 'par', 'with', 'banking', 'says', 'top', 'official']",plans afoot to bring epfo service at par with banking says top official
"['indus', 'towers', 'to', 'acquire', '26', 'in', 'jsw', 'green', 'energy', 'eight']",indus towers to acquire 26 in jsw green energy eight
"['3', 'indian', 'students', 'killed', 'in', 'canada', 'india', 'takes', 'up', 'issue', 'of', 'safety', 'with', 'ottawa']",3 indian students killed in canada india takes up issue of safety with ottawa
"['delhi', 'court', 'sends', 'aap', 'mla', 'naresh', 'balyan', 'to', 'judicial', 'custody', 'in', 'mcoca', 'case']",delhi court sends aap mla naresh balyan to judicial custody in mcoca case
"['sake', 'made', 'in', 'space', 'heres', 'what', 'japanese', 'sake', 'brand', 'dassai', 'is', 'planning', 'on', 'sending', 'to', 'the', 'international', 'space', 'station']",sake made in space heres what japanese sake brand dassai is planning on sending to the international space station
"['vishal', 'mega', 'mart', 'ipo', 'day', '3', 'check', 'key', 'dates', 'gmp', 'price', 'band', 'subscription', 'and', 'review']",vishal mega mart ipo day 3 check key dates gmp price band subscription and review
"['karnataka', 'public', 'holidays', '2025', 'check', 'karnataka', 'state', 'govt', 'holiday', 'list', 'for', '2025']",karnataka public holidays 2025 check karnataka state govt holiday list for 2025
"['apple', 'to', 'assemble', 'airpods', 'in', 'india', 'for', 'the', 'first', 'time', 'starting', '2025']",apple to assemble airpods in india for the first time starting 2025
"['market', 'is', 'not', 'linear', 'stay', 'invested', 'and', 'reap', 'the', 'benefit', 'of', 'indias', 'growth', 'prospects', 'navneet', 'munot']",market is not linear stay invested and reap the benefit of indias growth prospects navneet munot
"['nestles', 'added', 'sugar', 'per', 'serving', 'for', 'baby', 'products', 'complies', 'regulations', 'health', 'minister', 'j', 'p', 'nadda']",nestles added sugar per serving for baby products complies regulations health minister j p nadda
"['karnataka', 'private', 'schools', 'overcharged', 'students', 'by', 'nearly', 'rs', '350', 'crore', 'during', 'covid', 'cag', 'pulls', 'up', 'state', 'government']",karnataka private schools overcharged students by nearly rs 350 crore during covid cag pulls up state government
"['un', 'team', 'to', 'study', 'aadhaar', 'card', 'based', 'services', 'in', 'andhra', 'pradesh']",un team to study aadhaar card based services in andhra pradesh
"['apple', 'ipo', 'anniversary', 'apple', 'stock', 'price', 'surge', 'a', '1000', 'investment', '44', 'years', 'ago', 'would', 'have', 'made', 'your', 'richer', 'by', '249900', 'by', 'now']",apple ipo anniversary apple stock price surge a 1000 investment 44 years ago would have made your richer by 249900 by now
"['sensex', 'up', '4487', 'points', 'since', 'november', 'lows', 'what', 'should', 'mutual', 'fund', 'investors', 'do']",sensex up 4487 points since november lows what should mutual fund investors do
"['toll', 'for', 'airport', 'highway', 'kiran', 'mazumdar', 'shaw', 'joins', 'critics', 'says', 'bengaluru', 'must', 'be', 'at', 'par', 'with', 'other', 'cities']",toll for airport highway kiran mazumdar shaw joins critics says bengaluru must be at par with other cities
"['keerthy', 'suresh', 'wedding', 'guests', 'were', 'treated', 'to', 'a', 'simple', 'satvik', 'meal', 'a', 'look', 'at', 'the', 'dishes']",keerthy suresh wedding guests were treated to a simple satvik meal a look at the dishes
"['peta', 'india', 'offers', 'rs', '50000', 'reward', 'for', 'information', 'on', 'stabbing', 'of', 'stray', 'dogs', 'in', 'delhi']",peta india offers rs 50000 reward for information on stabbing of stray dogs in delhi
"['rs', '35', 'lakh', 'gone', 'in', 'a', 'scam', 'grandfathers', 'life', 'savings', 'lost', 'in', 'fraudulent', 'schengen', 'visa', 'scheme']",rs 35 lakh gone in a scam grandfathers life savings lost in fraudulent schengen visa scheme
"['in', 'house', 'victory', 'heres', 'how', 'sony', 'playstation', '5', 'helped', 'astrobot', 'win', 'game', 'of', 'the', 'year', 'award']",in house victory heres how sony playstation 5 helped astrobot win game of the year award
"['fire', 'atul', 'subhashs', 'wife', 'netizens', 'call', 'on', 'accenture', 'to', 'act', 'after', 'bengaluru', 'engineers', 'tragic', 'death']",fire atul subhashs wife netizens call on accenture to act after bengaluru engineers tragic death
"['indian', 'forces', 'going', 'to', 'all', 'patrolling', 'points', 'in', 'depsang', 'in', 'ladakh', 'eastward', 'limit', 's', 'jaishankar']",indian forces going to all patrolling points in depsang in ladakh eastward limit s jaishankar
"['flying', 'from', 'delhi', 'indigo', 'announces', 'terminal', 'changes', 'for', 'some', 'flights', 'check', 'details']",flying from delhi indigo announces terminal changes for some flights check details
"['bengaluru', 'techie', 'suidice', 'case', 'estranged', 'wife', 'nikita', 'claims', 'rs', '10', 'lakh', 'dowry', 'demand', 'led', 'to', 'fathers', 'death']",bengaluru techie suidice case estranged wife nikita claims rs 10 lakh dowry demand led to fathers death
"['market', 'wrap', 'sensex', 'soars', '843', 'pts', 'after', 'wild', 'ride', 'nifty', 'ends', 'well', 'above', '24700', 'mark']",market wrap sensex soars 843 pts after wild ride nifty ends well above 24700 mark
"['why', 'did', 'bengaluru', 'techie', 'atul', 'subhash', 'ask', 'for', 'help', 'from', 'elon', 'musk', 'and', 'trump', 'his', 'last', 'post', 'discusses', 'indias', 'legal', 'system']",why did bengaluru techie atul subhash ask for help from elon musk and trump his last post discusses indias legal system
"['these', 'hdfc', 'bank', 'services', 'will', 'not', 'be', 'available', 'on', 'december', '14', '15', 'know', 'when', 'you', 'cannot', 'use', 'upi', 'imps', 'neft', 'credit', 'card']",these hdfc bank services will not be available on december 14 15 know when you cannot use upi imps neft credit card
"['nri', 'talk', 'indias', 'promising', 'sectors', 'top', '4', 'long', 'term', 'investment', 'opportunities', 'for', 'nris', 'himanshu', 'kohli', 'decodes']",nri talk indias promising sectors top 4 long term investment opportunities for nris himanshu kohli decodes
"['parliamentary', 'panel', 'recommends', 'increasing', 'assistance', 'under', 'pmay', 'g']",parliamentary panel recommends increasing assistance under pmay g
"['mainboard', 'ipos', 'set', 'to', 'hit', 'the', 'street', 'what', 'does', 'gmp', 'indicate', 'ahead', 'of', 'debut']",mainboard ipos set to hit the street what does gmp indicate ahead of debut
"['himachal', 'making', 'laws', 'to', 'favor', 'businessmen', 'bjp', 'shares', 'priyanka', 'gandhis', 'video', 'says', 'she', 'is', 'unaware', 'congress', 'is', 'in', 'power', 'there']",himachal making laws to favor businessmen bjp shares priyanka gandhis video says she is unaware congress is in power there
"['mark', 'zuckerbergs', 'gold', 'plated', 'chain', 'sold', 'at', 'auction', 'for', 'nearly', '100', 'times', 'its', 'market', 'value', '40500']",mark zuckerbergs gold plated chain sold at auction for nearly 100 times its market value 40500
"['kannada', 'actor', 'darshan', 'thoogudeepa', 'others', 'granted', 'bail', 'in', 'renukaswamy', 'murder', 'case']",kannada actor darshan thoogudeepa others granted bail in renukaswamy murder case
"['mujiburs', 'joy', 'bangla', 'no', 'longer', 'national', 'slogan', 'in', 'bangladesh']",mujiburs joy bangla no longer national slogan in bangladesh
"['planning', 'a', 'uk', 'trip', 'the', 'govt', 'just', 'made', 'your', 'london', 'stop', 'costlier']",planning a uk trip the govt just made your london stop costlier
"['government', 'blocks', 'scam', 'job', 'sites', 'rescues', '1600', 'indians', 'duped', 'abroad']",government blocks scam job sites rescues 1600 indians duped abroad
"['is', 'donald', 'trump', 'resorting', 'to', 'back', 'channeling', 'heres', 'what', 'he', 'is', 'planning', 'to', 'do', 'during', 'the', 'presidential', 'inauguration']",is donald trump resorting to back channeling heres what he is planning to do during the presidential inauguration
"['get', 'ready', 'to', 'show', 'physical', 'id', 'cards', 'as', 'delhi', 'bans', 'digital', 'ids', 'for', 'alcohol', 'service', 'in', 'hotels', 'and', 'restaurants']",get ready to show physical id cards as delhi bans digital ids for alcohol service in hotels and restaurants
"['kumbh', 'mela', 'is', 'grand', 'yajna', 'of', 'unity', 'where', 'distinction', 'of', 'castes', 'disappears', 'pm', 'modi']",kumbh mela is grand yajna of unity where distinction of castes disappears pm modi
"['fitch', 'slashes', 'indias', 'gdp', 'forecast', 'to', '6', '4', 'for', 'fy25', 'but', 'it', 'has', 'few', 'good', 'things', 'to', 'say']",fitch slashes indias gdp forecast to 6 4 for fy25 but it has few good things to say
"['railways', 'must', 'focus', 'on', 'raising', 'passenger', 'earnings', 'parliamentary', 'committee']",railways must focus on raising passenger earnings parliamentary committee
"['bpsc', '70th', 'prelim', 'exam', '2024', 'protests', 'break', 'out', 'at', 'patna', 'center', 'after', 'paper', 'leak', 'rumors']",bpsc 70th prelim exam 2024 protests break out at patna center after paper leak rumors
"['atul', 'subhash', 'suicide', 'after', 'asking', 'man', 'to', 'pay', 'rs', '5', 'crore', 'in', 'an', 'old', 'divorce', 'case', 'sc', 'lists', '8', 'factors', 'to', 'decide', 'alimony']",atul subhash suicide after asking man to pay rs 5 crore in an old divorce case sc lists 8 factors to decide alimony
"['better', 'than', 'my', 'maiden', 'speech', 'rahul', 'gandhi', 'hails', 'priyankas', 'lok', 'sabha', 'speech']",better than my maiden speech rahul gandhi hails priyankas lok sabha speech
"['passenger', 'vehicle', 'dispatches', 'to', 'dealers', 'rise', '4', 'pc', 'in', 'nov', 'at', '347522', 'units', 'siam']",passenger vehicle dispatches to dealers rise 4 pc in nov at 347522 units siam
"['identical', 'brains', 'studios', 'fixes', 'rs', '51', '54', 'price', 'band', 'for', 'rs', '20', 'crore', 'ipo', 'check', 'key', 'details']",identical brains studios fixes rs 51 54 price band for rs 20 crore ipo check key details
"['did', 'allu', 'arjun', 'object', 'to', 'how', 'he', 'was', 'arrested', 'viral', 'video', 'shows', 'pushpa', 'star', 'asking', 'police', 'to', 'let', 'him', 'finish', 'breakfast']",did allu arjun object to how he was arrested viral video shows pushpa star asking police to let him finish breakfast
"['nfo', 'update', 'motilal', 'oswal', 'mutual', 'fund', 'launches', 'arbitrage', 'fund']",nfo update motilal oswal mutual fund launches arbitrage fund
"['akasa', 'air', 'stake', 'buy', 'why', 'premji', 'ranjan', 'pai', 'are', 'betting', 'millions', 'on', 'akasa', 'air']",akasa air stake buy why premji ranjan pai are betting millions on akasa air
"['fmcg', 'telecom', 'and', 'cement', 'may', 'draw', 'investor', 'interest', 'anshul', 'saigal', 'explains', 'why']",fmcg telecom and cement may draw investor interest anshul saigal explains why
"['isg', 'gets', 'rbi', 'nod', 'to', 'operate', 'as', 'payment', 'aggregator']",isg gets rbi nod to operate as payment aggregator
"['mutual', 'fund', 'aum', 'reach', 'an', 'all', 'time', 'high', 'of', 'rs', '67', '90', 'lakh', 'crore', 'in', 'november', 'amfi']",mutual fund aum reach an all time high of rs 67 90 lakh crore in november amfi
"['it', 'was', 'a', 'moment', 'for', 'us', 'to', 'remember', 'all', 'the', 'sacrifices', 'we', 'made', 'gukeshs', 'mother']",it was a moment for us to remember all the sacrifices we made gukeshs mother
"['pm', 'should', 'tell', 'parliament', 'what', 'steps', 'india', 'is', 'taking', 'to', 'protect', 'hindus', 'in', 'bangladesh', 'uddhav', 'thackeray']",pm should tell parliament what steps india is taking to protect hindus in bangladesh uddhav thackeray
"['modi', 'govt', 'consistently', 'hiked', 'capex', 'mos', 'finance']",modi govt consistently hiked capex mos finance
"['spicejet', 'clears', 'rs', '160', '07', 'cr', 'provident', 'fund', 'dues']",spicejet clears rs 160 07 cr provident fund dues
"['pm', 'modi', 'launches', 'major', 'development', 'projects', 'in', 'prayagraj', 'ahead', 'of', 'mahakumbh', '2025']",pm modi launches major development projects in prayagraj ahead of mahakumbh 2025
"['meesho', 'sees', '35', 'order', 'growth', 'in', '2024', 'number', 'of', 'users', 'up', '25']",meesho sees 35 order growth in 2024 number of users up 25
"['how', 'to', 'position', 'yourself', 'in', 'this', 'volatile', 'market', 'varun', 'goel', 'answers']",how to position yourself in this volatile market varun goel answers
"['jai', 'shri', 'ram', 'slogan', 'inside', 'mosque', 'all', 'eyes', 'on', 'key', 'supreme', 'court', 'hearing']",jai shri ram slogan inside mosque all eyes on key supreme court hearing
"['budget', '2025', 'what', 'is', 'buyback', 'tax', 'union', 'budget']",budget 2025 what is buyback tax union budget
"['bjp', 'accuses', 'aap', 'govt', 'of', 'sitting', 'on', '14', 'cag', 'reports', 'demands', 'delhi', 'assembly', 'session']",bjp accuses aap govt of sitting on 14 cag reports demands delhi assembly session
"['russia', 'has', 'invented', 'a', 'missile', 'that', 'may', 'change', 'the', 'way', 'wars', 'are', 'fought']",russia has invented a missile that may change the way wars are fought
"['video', 'raises', 'questions', 'about', 'jay', 'z', 'and', 'sean', 'diddy', 'combs', 'friendship', 'amid', 'child', 'rape', 'allegations']",video raises questions about jay z and sean diddy combs friendship amid child rape allegations
"['fancode', 'inks', 'broadcast', 'deal', 'with', 'mssa']",fancode inks broadcast deal with mssa
"['allu', 'arjun', 'arrest', 'furious', 'fans', 'ask', 'if', 'virat', 'kohli', 'would', 'have', 'been', 'behind', 'bars', 'if', 'a', 'stampede', 'occurred', 'during', 'a', 'cricket', 'match']",allu arjun arrest furious fans ask if virat kohli would have been behind bars if a stampede occurred during a cricket match
"['yes', 'bank', 'launches', 'yes', 'business', 'empower', 'msmes']",yes bank launches yes business empower msmes
"['can', 'friday', 'the', '13th', 'really', 'spook', 'nifty', 'bulls', 'lets', 'study', 'history']",can friday the 13th really spook nifty bulls lets study history
"['fmcg', 'companies', 'concerns', 'demand', 'slowdown', 'in', 'indian', 'economy', 'the', 'coming', 'year', 'could', 'be', 'another', 'hurdle', 'for', 'indias', 'consumer', 'market']",fmcg companies concerns demand slowdown in indian economy the coming year could be another hurdle for indias consumer market
"['allu', 'arjun', 'taken', 'taken', 'for', 'medical', 'examination', 'after', 'arrest']",allu arjun taken taken for medical examination after arrest
"['h', '1b', 'visa', 'approvals', 'for', 'indian', 'it', 'firms', 'fall', 'by', 'half', 'since', '2015']",h 1b visa approvals for indian it firms fall by half since 2015
"['govt', 'cant', 'turn', 'blind', 'eye', 'to', 'public', 'inconvenience', 'siddaramaiah', 'on', 'lathi', 'charge', 'on', 'panchamasalis']",govt cant turn blind eye to public inconvenience siddaramaiah on lathi charge on panchamasalis
"['irctc', 'scam', 'delhi', 'hc', 'issues', 'notice', 'in', 'disproportionate', 'assets', 'case', 'directs', 'trial', 'court', 'to', 'reschedule']",irctc scam delhi hc issues notice in disproportionate assets case directs trial court to reschedule
"['parliamentary', 'panel', 'raises', 'concern', 'over', 'low', 'mgnregs', 'wages']",parliamentary panel raises concern over low mgnregs wages
"['no', 'problem', 'with', 'adani', 'funding', 'colombo', 'port', 'project', 'with', 'own', 'resources', 'sri', 'lankan', 'minister']",no problem with adani funding colombo port project with own resources sri lankan minister
