headlines,headline_text
"['sean', 'diddy', 'combs', 'denied', 'bail', 'third', 'time', 'faces', 'another', 'setback', 'federal', 'judge', 'rejects', '50', 'million', 'package', 'whats', 'next', 'for', 'us', 'music', 'mogul']",sean diddy combs denied bail third time faces another setback federal judge rejects 50 million package whats next for us music mogul
"['delhis', 'ev', 'policy', 'extended', 'till', 'march', '2025']",delhis ev policy extended till march 2025
"['visa', 'scam', 'how', 'an', 'mba', 'graduate', 'a', 'diploma', 'holder', 'and', 'a', 'clinic', 'owner', 'duped', 'over', '100', 'seeking', 'foreign', 'jobs']",visa scam how an mba graduate a diploma holder and a clinic owner duped over 100 seeking foreign jobs
"['india', 'is', 'a', 'leader', 'in', 'ai', 'driven', 'sustainability', 'initiatives', 'report']",india is a leader in ai driven sustainability initiatives report
"['sunita', 'williams', 'to', 'celebrate', 'thanksgiving', 'in', 'space', 'whats', 'on', 'the', 'menu', 'for', 'nasas', 'stranded', 'crew']",sunita williams to celebrate thanksgiving in space whats on the menu for nasas stranded crew
"['monitoring', 'inflation', 'in', 'us', 'indian', 'market', 'going', 'for', 'largecaps', 'in', 'india', 'hartmut', 'issel']",monitoring inflation in us indian market going for largecaps in india hartmut issel
"['sbi', 'life', 'other', 'insurance', 'stocks', 'tumble', 'up', 'to', '8', 'heres', 'why']",sbi life other insurance stocks tumble up to 8 heres why
"['indian', 'maritime', 'body', 'meet', 'urges', 'stakeholders', 'to', 'work', 'together']",indian maritime body meet urges stakeholders to work together
"['amazon', 'backed', 'anthropic', 'introduces', 'google', 'gemini', 'and', 'apple', 'intelligence', 'style', 'features', 'to', 'claude', 'ai']",amazon backed anthropic introduces google gemini and apple intelligence style features to claude ai
"['need', 'holistic', 'new', 'tax', 'code', 'for', 'vikshit', 'bharat', 'experts']",need holistic new tax code for vikshit bharat experts
"['60', 'fmcg', 'companies', 'say', 'e', 'commerce', 'is', 'critical', 'platform', 'for', 'sales']",60 fmcg companies say e commerce is critical platform for sales
"['sbi', 'tata', 'motors', 'among', 'motilal', 'oswals', 'top', 'winners', 'losers', 'post', 'a', 'dull', 'q2', 'earnings', 'season']",sbi tata motors among motilal oswals top winners losers post a dull q2 earnings season
"['sa', 'dhan', 'joins', 'hands', 'with', 'iibf', 'to', 'develop', 'a', 'certification', 'course', 'in', 'microfinance', 'sector']",sa dhan joins hands with iibf to develop a certification course in microfinance sector
"['mahindra', 'tata', 'prepare', 'a', 'warm', 'welcome', 'for', 'elon', 'musk']",mahindra tata prepare a warm welcome for elon musk
"['mirae', 'asset', 'financial', 'group', 'completes', 'acquisition', 'of', 'sharekhan']",mirae asset financial group completes acquisition of sharekhan
"['mahindra', 'be', '6e', 'vs', 'tata', 'curvv', 'ev', 'the', 'battle', 'of', 'coupe', 'suvs']",mahindra be 6e vs tata curvv ev the battle of coupe suvs
"['coop', 'sugar', 'mills', 'body', 'nfcsf', 'refutes', 'cane', 'worker', 'exploitation', 'calls', 'us', 'media', 'report', 'conspiracy']",coop sugar mills body nfcsf refutes cane worker exploitation calls us media report conspiracy
"['cooperatives', 'can', 'create', 'up', 'to', '5', '5', 'crore', 'direct', 'jobs', '5', '6', 'crore', 'self', 'employment', 'opportunities', 'by', '2030', 'report']",cooperatives can create up to 5 5 crore direct jobs 5 6 crore self employment opportunities by 2030 report
"['why', 'you', 'should', 'be', 'extra', 'careful', 'while', 'taking', 'vitamin', 'd', 'doctors', 'warn', 'of', 'severe', 'complications', 'like', 'kidney', 'disease']",why you should be extra careful while taking vitamin d doctors warn of severe complications like kidney disease
"['mahindra', 'xuv', '9e', 'be', '6e', 'heres', 'everything', 'you', 'need', 'to', 'know', 'about', 'the', 'new', 'electric', 'cars']",mahindra xuv 9e be 6e heres everything you need to know about the new electric cars
"['delhi', 'hc', 'reserves', 'order', 'on', 'puja', 'khedkars', 'pre', 'arrest', 'bail', 'plea']",delhi hc reserves order on puja khedkars pre arrest bail plea
"['india', 'proactively', 'combating', 'money', 'laundering', 'terrorism', 'financing', 'union', 'minister', 'chaudhary']",india proactively combating money laundering terrorism financing union minister chaudhary
"['most', 'cfos', 'in', 'india', 'believe', 'generative', 'ai', 'will', 'enhance', 'effectiveness', 'of', 'tax', 'functions', 'report']",most cfos in india believe generative ai will enhance effectiveness of tax functions report
"['china', 'plus', 'one', 'opportunity', 'opening', 'up', 'for', 'india', 'tamil', 'nadu', 'doing', 'its', 'best', 'to', 'attract', 'fdi', 'arvind', 'subramanian']",china plus one opportunity opening up for india tamil nadu doing its best to attract fdi arvind subramanian
"['earnings', 'growth', 'pace', 'doubling', 'in', 'fy26', 'post', 'corrections', 'ubs', 'asks', 'investors', 'to', 'position', 'early', 'on', 'india', 'hartmut', 'issel']",earnings growth pace doubling in fy26 post corrections ubs asks investors to position early on india hartmut issel
"['knight', 'frank', 'appoints', 'shishir', 'baijal', 'as', 'asia', 'pacific', 'non', 'executive', 'chair']",knight frank appoints shishir baijal as asia pacific non executive chair
"['prince', 'william', 'and', 'kate', 'middletons', 'marriage', 'in', 'trouble', 'royal', 'couple', 'to', 'spend', 'a', 'quiet', 'christmas']",prince william and kate middletons marriage in trouble royal couple to spend a quiet christmas
"['dra', 'aims', 'for', 'rs', '1000', 'crore', 'revenue', 'by', 'fy26', '27']",dra aims for rs 1000 crore revenue by fy26 27
"['private', 'banks', 'it', 'poised', 'for', 'revival', 'cement', 'to', 'emerge', 'as', 'a', 'dark', 'horse', 'rupen', 'rajguru']",private banks it poised for revival cement to emerge as a dark horse rupen rajguru
"['indian', 'cricket', 'team', 'meets', 'australian', 'pm', 'anthony', 'albanese', 'ahead', 'of', 'practice', 'game', 'in', 'canberra']",indian cricket team meets australian pm anthony albanese ahead of practice game in canberra
"['nz', 'vs', 'pak', 'test', 'kane', 'williamson', 'puts', 'new', 'zealand', 'ahead', 'even', 'as', 'shoaib', 'bashir', 'picks', 'four', 'wickets', 'for', 'england']",nz vs pak test kane williamson puts new zealand ahead even as shoaib bashir picks four wickets for england
"['is', 'the', 'bias', 'changing', 'still', 'stay', 'with', 'only', 'a', 'few', '6', 'large', 'cap', 'stocks', 'from', 'different', 'sectors', 'with', 'upside', 'potential', 'of', 'up', 'to', '38']",is the bias changing still stay with only a few 6 large cap stocks from different sectors with upside potential of up to 38
"['long', 'term', 'consensual', 'affairs', 'cannot', 'be', 'criminalised', 'as', 'rape', 'over', 'false', 'marriage', 'promises', 'sc']",long term consensual affairs cannot be criminalised as rape over false marriage promises sc
"['gail', 're', 'engages', 'process', 'licensor', 'for', 'revival', 'of', 'mangalore', 'pta', 'plant']",gail re engages process licensor for revival of mangalore pta plant
"['piyush', 'goyal', 'underlines', 'indias', 'emergence', 'as', 'a', 'quality', 'conscious', 'nation', 'notes', 'its', 'rising', 'impact', 'on', 'emerging', 'sectors']",piyush goyal underlines indias emergence as a quality conscious nation notes its rising impact on emerging sectors
"['sensitive', 'issue', 'matter', 'of', 'investigation', 'bjp', 'mp', 'ravi', 'kishan', 'on', 'ajmer', 'dargah', 'row']",sensitive issue matter of investigation bjp mp ravi kishan on ajmer dargah row
"['higher', 'interest', 'rate', 'regime', 'to', 'benefit', 'banking', 'stocks', 'says', 'santosh', 'pandey', 'of', 'nuvama']",higher interest rate regime to benefit banking stocks says santosh pandey of nuvama
"['nfo', 'tracker', 'kotak', 'mutual', 'fund', 'launches', 'two', 'index', 'funds']",nfo tracker kotak mutual fund launches two index funds
"['best', 'philips', 'air', 'purifiers', 'in', 'india', 'cleaner', 'healthier', 'air']",best philips air purifiers in india cleaner healthier air
"['a', '30', 'year', 'journey', 'of', 'hope', 'and', 'despair', 'bhim', 'singhs', 'miraculous', 'return', 'after', 'being', 'kidnapped', 'in', '1993']",a 30 year journey of hope and despair bhim singhs miraculous return after being kidnapped in 1993
"['prabhudas', 'lilladher', 'cuts', 'nifty', 'target', 'to', '27381', 'suggests', 'buying', 'on', 'dips', 'for', 'long', 'term', 'gains']",prabhudas lilladher cuts nifty target to 27381 suggests buying on dips for long term gains
"['delhis', 'winter', 'peak', 'power', 'demand', 'also', 'expected', 'to', 'break', 'record', 'likely', 'to', 'surpass', '6300', 'mw']",delhis winter peak power demand also expected to break record likely to surpass 6300 mw
"['what', 'rfk', 'jr', 'wrote', 'in', 'secret', 'diary', 'about', 'celebs', 'like', 'tom', 'hanks', 'bruce', 'willis', 'bill', 'clinton', 'and', 'his', 'sex', 'life']",what rfk jr wrote in secret diary about celebs like tom hanks bruce willis bill clinton and his sex life
"['lifelong', 'geysers', 'in', 'india', 'to', 'hot', 'water', 'solution', 'this', 'winter']",lifelong geysers in india to hot water solution this winter
"['sean', 'diddy', 'scandal', 'why', 'ashton', 'kutcher', 'might', 'be', 'feeling', 'the', 'heat']",sean diddy scandal why ashton kutcher might be feeling the heat
"['spam', 'calls', 'coai', 'calls', 'on', 'doca', 'to', 'notify', 'rules', 'to', 'rein', 'in', 'ubc', 'menace']",spam calls coai calls on doca to notify rules to rein in ubc menace
"['bee', 'yond', 'justice', 'man', 'jailed', 'for', 'over', '4', 'years', 'for', 'stealing', 'beehives', 'in', 'bulandshahr']",bee yond justice man jailed for over 4 years for stealing beehives in bulandshahr
"['angel', 'one', 'shares', 'may', 'rally', '24', 'rs', '300', 'crore', 'addition', 'in', 'revenue', 'seen', 'in', 'fy27', 'motilal', 'oswal']",angel one shares may rally 24 rs 300 crore addition in revenue seen in fy27 motilal oswal
"['ben', 'affleck', 'jennifer', 'lopez', 'divorce', 'actor', 'seen', 'with', 'new', 'look', 'ahead', 'of', 'thanksgiving', 'pic', 'goes', 'viral']",ben affleck jennifer lopez divorce actor seen with new look ahead of thanksgiving pic goes viral
"['honasa', 'consumer', 'elevates', 'vipul', 'maheshwari', 'to', 'senior', 'vice', 'president', 'product', 'and', 'data', 'analytics']",honasa consumer elevates vipul maheshwari to senior vice president product and data analytics
"['ease', 'compliance', 'for', 'msmes', 'with', 'simplified', 'gst', 'and', 'reduced', 'tds', 'assocham', 'egrow', 'study']",ease compliance for msmes with simplified gst and reduced tds assocham egrow study
"['2', 'top', 'stock', 'recommendations', 'from', 'shivangi', 'sarda']",2 top stock recommendations from shivangi sarda
"['bangladesh', 'high', 'court', 'refuses', 'to', 'ban', 'iskcon']",bangladesh high court refuses to ban iskcon
"['r', 'madhavan', 'always', 'aimed', 'to', 'be', 'a', 'rich', 'and', 'famous', 'actor', '3', 'idiots', 'stars', '28', 'yr', 'old', 'graduation', 'yearbook', 'goes', 'viral']",r madhavan always aimed to be a rich and famous actor 3 idiots stars 28 yr old graduation yearbook goes viral
"['yamuna', 'expressway', 'and', 'noida', 'greater', 'noida', 'e', 'way', 'speed', 'limits', 'to', 'be', 'reduced', 'till', 'feb', '15', 'check', 'new', 'limits', 'and', 'penalties']",yamuna expressway and noida greater noida e way speed limits to be reduced till feb 15 check new limits and penalties
"['best', 'electric', 'blankets', 'stay', 'warm', 'cosy', 'and', 'comfortable', 'all', 'winter', 'long']",best electric blankets stay warm cosy and comfortable all winter long
"['govt', 'moves', 'to', 'fill', '59', 'vacant', 'independent', 'director', 'posts', 'at', 'cpses']",govt moves to fill 59 vacant independent director posts at cpses
"['cannot', 'interfere', 'in', 'another', 'countrys', 'affair', 'will', 'follow', 'centres', 'stand', 'mamata', 'banerjee', 'on', 'bdesh', 'situation']",cannot interfere in another countrys affair will follow centres stand mamata banerjee on bdesh situation
"['jaipur', 'techie', 'builds', 'basic', 'ai', 'photo', 'app', 'hits', 'rs', '8', '4', 'lakh', 'monthly', 'revenue', 'in', '3', 'months', 'tutorial', 'available', 'on', 'youtube']",jaipur techie builds basic ai photo app hits rs 8 4 lakh monthly revenue in 3 months tutorial available on youtube
"['a', '4', 'day', 'drive', 'from', 'delhi', 'to', 'mars', 'why', 'ladakh', 'is', 'emerging', 'as', 'indias', 'training', 'ground', 'for', 'martian', 'life', 'experiments']",a 4 day drive from delhi to mars why ladakh is emerging as indias training ground for martian life experiments
"['cyclone', 'fengal', 'alert', 'holiday', 'declared', 'for', 'schools', 'and', 'colleges', 'in', 'puducherry', 'and', 'karaikal']",cyclone fengal alert holiday declared for schools and colleges in puducherry and karaikal
"['retirement', 'planning', 'want', 'to', 'retire', 'with', 'rs', '10', 'crore', 'corpus', 'in', 'your', 'early', '50', 'how', 'to', 'plan']",retirement planning want to retire with rs 10 crore corpus in your early 50 how to plan
"['for', 'sale', '50', 'million', 'mercedes', '30', 'million', 'ferrari', 'race', 'cars']",for sale 50 million mercedes 30 million ferrari race cars
"['ind', 'vs', 'aus', 'india', 'are', 'better', 'team', 'away', 'from', 'home', 'than', 'they', 'are', 'at', 'home', 'says', 'ricky', 'ponting']",ind vs aus india are better team away from home than they are at home says ricky ponting
"['everything', 'lalit', 'modi', 'said', 'on', 'ipl', 'dawood', 'ibrahim', 'and', 'shah', 'rukh', 'khan']",everything lalit modi said on ipl dawood ibrahim and shah rukh khan
"['bitcoin', 'price', 'rebounds', 'above', '95k', 'will', 'the', '100000', 'milestone', 'be', 'reached', 'soon']",bitcoin price rebounds above 95k will the 100000 milestone be reached soon
"['why', 'are', 'bjp', 'rss', 'spreading', 'hatred', 'over', 'mosques', 'and', 'dargahs', 'asaduddin', 'owaisi', 'amid', 'ajmer', 'dargah', 'row']",why are bjp rss spreading hatred over mosques and dargahs asaduddin owaisi amid ajmer dargah row
"['best', 'gym', 'bras', 'for', 'women', 'stylish', 'supportive', 'comfortable', 'and', 'perfect', 'for', 'workouts']",best gym bras for women stylish supportive comfortable and perfect for workouts
"['icc', 'champions', 'trophy', '2025', 'discussion', 'on', 'hybrid', 'model', 'set', 'to', 'dominate', 'icc', 'meeting']",icc champions trophy 2025 discussion on hybrid model set to dominate icc meeting
"['ed', 'attaches', 'assets', 'valued', 'rs', '106', '20', 'cr', 'in', 'hpz', 'token', 'investment', 'scam', 'linked', 'to', 'chinese', 'shell', 'entities']",ed attaches assets valued rs 106 20 cr in hpz token investment scam linked to chinese shell entities
"['eknath', 'shinde', 'set', 'example', 'of', 'following', 'alliance', 'dharma', 'son', 'shrikant']",eknath shinde set example of following alliance dharma son shrikant
"['supervity', 'partners', 'with', 'evolutia', 'to', 'transform', 'autonomous', 'enterprises', 'with', 'multi', 'agent', 'ai', 'architecture']",supervity partners with evolutia to transform autonomous enterprises with multi agent ai architecture
"['there', 'are', 'talks', 'regarding', 'changing', 'karnataka', 'cong', 'president', 'says', 'minister', 'parameshwara']",there are talks regarding changing karnataka cong president says minister parameshwara
"['how', 'to', 'see', 'dazzling', 'northern', 'lights', 'on', 'thanksgiving', 'and', 'black', 'friday', 'follow', 'these', 'tips']",how to see dazzling northern lights on thanksgiving and black friday follow these tips
"['tamil', 'nadu', 'battles', 'unrelenting', 'rain', 'imd', 'warns', 'of', 'more', 'disruption', 'crop', 'damage', 'and', 'flight', 'delays']",tamil nadu battles unrelenting rain imd warns of more disruption crop damage and flight delays
"['indian', 'alco', 'bev', 'industry', 'one', 'of', 'the', 'worlds', 'most', 'dynamic', 'markets', 'piccadily', 'agros', 'siddhartha', 'sharma']",indian alco bev industry one of the worlds most dynamic markets piccadily agros siddhartha sharma
"['successful', 'but', 'burnt', 'out', 'founder', 'quits', 'start', 'up', 'life', 'advises', 'no', 'shame', 'in', '9', 'to', '5', 'jobs', 'if', 'you', 'are', 'happy']",successful but burnt out founder quits start up life advises no shame in 9 to 5 jobs if you are happy
"['vodafone', 'idfc', 'first', 'among', '14', 'biggest', 'midcap', 'laggards', 'in', 'past', '1', 'year', 'should', 'you', 'buy', 'sell', 'or', 'hold']",vodafone idfc first among 14 biggest midcap laggards in past 1 year should you buy sell or hold
"['biju', 'patnaik', 'airport', 'in', 'odisha', 'announces', 'flights', 'to', '5', 'new', 'destinations', 'from', '2025']",biju patnaik airport in odisha announces flights to 5 new destinations from 2025
"['satish', 'gupta', 'appointed', 'liquidator', 'for', 'jet', 'airways']",satish gupta appointed liquidator for jet airways
"['healthy', 'ambitions', 'lic', 'eyeing', 'manipalcigna']",healthy ambitions lic eyeing manipalcigna
"['adani', 'energy', 'solutions', 'adani', 'total', 'gas', 'shares', 'soar', 'up', 'to', '19', 'heres', 'the', 'reason', 'behind', 'the', 'rally']",adani energy solutions adani total gas shares soar up to 19 heres the reason behind the rally
"['what', 'happens', 'with', 'the', 'new', 'trump', 'sarkar', 'in', 'place']",what happens with the new trump sarkar in place
"['did', 'elon', 'musk', 'pay', 'kim', 'kardashian', 'for', 'a', 'photo', 'op', 'of', 'her', 'sitting', 'on', 'tesla', 'robots', 'lap']",did elon musk pay kim kardashian for a photo op of her sitting on tesla robots lap
"['maharashtra', 'extends', 'deadline', 'for', 'submission', 'of', 'audited', 'accounts', 'by', 'charitable', 'trusts']",maharashtra extends deadline for submission of audited accounts by charitable trusts
"['export', 'demand', 'rainfall', 'delay', 'damage', 'keep', 'onion', 'prices', 'firm']",export demand rainfall delay damage keep onion prices firm
"['delhi', 'reports', 'isolated', 'case', 'of', 'japanese', 'encephalitis']",delhi reports isolated case of japanese encephalitis
"['massive', 'crackdown', 'on', 'terror', 'networks', 'in', 'j', 'ks', 'kathua', 'several', 'suspects', 'ogws', 'arrested']",massive crackdown on terror networks in j ks kathua several suspects ogws arrested
"['digital', 'infrastructure', 'interconnected', 'grid', 'affordable', 'data', 'made', 'india', 'most', 'attractive', 'investment', 'destination', 'piyush', 'goyal']",digital infrastructure interconnected grid affordable data made india most attractive investment destination piyush goyal
"['joe', 'biden', 'donald', 'trump', 'asked', 'to', 'intervene', 'as', 'indian', 'american', 'body', 'warns', 'of', 'bangladesh', 'becoming', 'islamic', 'state']",joe biden donald trump asked to intervene as indian american body warns of bangladesh becoming islamic state
"['nifty', 'to', 'stay', 'range', 'bound', 'focus', 'on', 'sector', 'rotation', 'and', 'stock', 'specific', 'plays', 'vikas', 'khemani']",nifty to stay range bound focus on sector rotation and stock specific plays vikas khemani
"['aishwarya', 'rai', 'bachchans', 'mother', 'brinda', 'battled', 'cancer', 'actresss', 'sister', 'in', 'law', 'shares', 'first', 'picture']",aishwarya rai bachchans mother brinda battled cancer actresss sister in law shares first picture
"['pan', '2', '0', 'project', 'do', 'you', 'have', 'extra', 'pan', 'steps', 'to', 'surrender', 'additional', 'pan', 'card', 'to', 'avoid', 'penalty']",pan 2 0 project do you have extra pan steps to surrender additional pan card to avoid penalty
"['december', 'releases', 'may', 'do', 'the', 'trick', 'for', 'hindi', 'film', 'industry']",december releases may do the trick for hindi film industry
"['russian', 'man', 'dies', 'after', 'pet', 'cat', 'scratch', 'caused', 'severe', 'blood', 'loss', 'from', 'torn', 'vein']",russian man dies after pet cat scratch caused severe blood loss from torn vein
"['special', 'fd', 'offering', '8', '05', 'interest', 'to', 'end', 'on', 'november', '30', '2024', 'last', 'chance', 'to', 'book', 'fixed', 'deposit', 'at', 'high', 'rate']",special fd offering 8 05 interest to end on november 30 2024 last chance to book fixed deposit at high rate
"['sectors', 'dependent', 'on', 'domestic', 'growth', 'should', 'do', 'well', 'in', 'h2', 'hold', 'on', 'to', 'adani', 'ports', 'neeraj', 'dewan']",sectors dependent on domestic growth should do well in h2 hold on to adani ports neeraj dewan
"['adani', 'stocks', 'in', 'focus', 'after', 'group', 'clarifies', 'on', 'bribery', 'charges', 'against', 'gautam', 'adani', 'nephew', 'in', 'us', 'indictment']",adani stocks in focus after group clarifies on bribery charges against gautam adani nephew in us indictment
"['is', 'hdfc', 'bank', 'signalling', 'more', 'than', 'what', 'is', 'visible', '6', 'private', 'sector', 'bank', 'stocks', '4', 'of', 'which', 'may', 'give', 'returns', 'above', '26', 'in', '1', 'year']",is hdfc bank signalling more than what is visible 6 private sector bank stocks 4 of which may give returns above 26 in 1 year
"['bts', 'suga', 'left', 'his', 'former', 'home', 'due', 'to', 'repeated', 'fights', 'with', 'neighbours']",bts suga left his former home due to repeated fights with neighbours
"['eknath', 'shinde', 'should', 'have', 'been', 'natural', 'choice', 'shiv', 'senas', 'shaina', 'nc', 'on', 'maharashtra', 'cm', 'pick']",eknath shinde should have been natural choice shiv senas shaina nc on maharashtra cm pick
"['rcb', 'gives', '5500', 'hike', 'to', 'this', 'player', 'it', 'is', 'not', 'virat', 'kohli']",rcb gives 5500 hike to this player it is not virat kohli
"['nine', 'adani', 'group', 'firms', 'trade', 'higher', 'adani', 'total', 'soars', 'nearly', '19']",nine adani group firms trade higher adani total soars nearly 19
"['beml', 'gets', 'contract', 'worth', 'rs', '2501', 'crore', 'from', 'chennai', 'metro']",beml gets contract worth rs 2501 crore from chennai metro
"['citi', 'initiates', 'coverage', 'on', 'ola', 'electric', 'with', 'rs', '90', 'target', 'price', 'heres', 'what', 'it', 'said']",citi initiates coverage on ola electric with rs 90 target price heres what it said
"['madhavan', 'salutes', 'ajith', 'kumar', 'as', 'thala', 'returns', 'to', 'racing', 'tracks', 'he', 'just', 'goes', 'after', 'his', 'dreams', 'no', 'matter', 'what']",madhavan salutes ajith kumar as thala returns to racing tracks he just goes after his dreams no matter what
"['marico', 'ceo', 'makes', 'light', 'of', 'gloom', 'over', 'urban', 'consumption', 'calls', 'it', 'a', 'temporary', 'blip']",marico ceo makes light of gloom over urban consumption calls it a temporary blip
"['we', 'aim', 'to', 'be', 'global', 'leader', 'in', 'regenerative', 'packaging', 'at', 'scale', 'by', '2030', 'says', 'pranay', 'pasricha', 'pakka']",we aim to be global leader in regenerative packaging at scale by 2030 says pranay pasricha pakka
"['dr', 'reddys', 'launches', 'immuno', 'oncology', 'drug', 'toripalimab', 'in', 'india', 'for', 'treating', 'nasopharyngeal', 'carcinoma']",dr reddys launches immuno oncology drug toripalimab in india for treating nasopharyngeal carcinoma
"['lic', 'shares', 'surge', 'over', '2', 'on', 'discussions', 'to', 'acquire', '50', 'stake', 'in', 'manipalcigna', 'health']",lic shares surge over 2 on discussions to acquire 50 stake in manipalcigna health
"['india', 'successfully', 'tests', 'k', '4', 'submarine', 'launched', 'nuclear', 'missile', 'from', 'ins', 'arighaat']",india successfully tests k 4 submarine launched nuclear missile from ins arighaat
"['black', 'gold', 'hustle', 'nikhil', 'kamath', 'on', 'how', 'indias', '138', 'million', 'wig', 'empire', 'makes', 'the', 'world', 'wigs', 'out']",black gold hustle nikhil kamath on how indias 138 million wig empire makes the world wigs out
"['karyakartas', 'felt', 'party', 'should', 'have', 'fought', 'polls', 'independent', 'says', 'ubt', 'senas', 'sanjay', 'raut', 'assures', 'alliance', 'intact']",karyakartas felt party should have fought polls independent says ubt senas sanjay raut assures alliance intact
"['honasa', 'consumer', 'shares', 'hit', '10', 'upper', 'circuit', 'amid', 'high', 'volume']",honasa consumer shares hit 10 upper circuit amid high volume
"['hdfc', 'securities', 'addresses', 'franchisee', 'business', 'rumours', 'denies', 'compliance', 'issues']",hdfc securities addresses franchisee business rumours denies compliance issues
"['pakistan', 'china', 'hold', 'military', 'level', 'talks', 'on', 'counter', 'terrorism']",pakistan china hold military level talks on counter terrorism
"['paytm', 'shares', 'in', 'focus', 'after', 'ubs', 'hikes', 'target', 'price', 'to', 'rs', '1000']",paytm shares in focus after ubs hikes target price to rs 1000
"['kalyani', 'developers', 'redefining', 'modern', 'urban', 'living', 'with', 'unmatched', 'amenities', 'and', 'sustainability']",kalyani developers redefining modern urban living with unmatched amenities and sustainability
"['is', 'trump', 'going', 'to', 'kick', 'prince', 'harry', 'meghan', 'markle', 'out', 'of', 'the', 'us', 'heres', 'what', 'the', 'royals', 'can', 'do']",is trump going to kick prince harry meghan markle out of the us heres what the royals can do
"['stellaris', 'venture', 'partners', 'closes', 'third', 'fund', 'at', '300', 'million']",stellaris venture partners closes third fund at 300 million
"['masters', 'union', 'mba', 'cohort', '2024', 'reports', 'rs', '28', '52', 'lakh', 'average', 'salary', 'top', 'offers', 'reach', 'rs', '61', '8', 'lakh']",masters union mba cohort 2024 reports rs 28 52 lakh average salary top offers reach rs 61 8 lakh
"['bengaluru', 'techie', 'groom', 'forgets', 'his', 'haldi', 'ceremony', 'kurta', 'swiggy', 'saves', 'his', 'day', 'just', 'in', 'time']",bengaluru techie groom forgets his haldi ceremony kurta swiggy saves his day just in time
