headlines,headline_text
"['maharashtra', 'government', 'reinstates', 'rashmi', 'shukla', 'as', 'state', 'police', 'chief']",maharashtra government reinstates rashmi shukla as state police chief
"['stocks', 'to', 'buy', 'today', 'infosys', 'sbi', 'among', 'top', '10', 'trading', 'ideas', 'for', '26', 'november', '2024']",stocks to buy today infosys sbi among top 10 trading ideas for 26 november 2024
"['it', 'hardware', 'firms', 'find', 'scaling', 'up', 'in', 'india', 'tough']",it hardware firms find scaling up in india tough
"['buy', 'apollo', 'hospitals', 'target', 'price', 'rs', '8020', 'motilal', 'oswal', 'financial', 'services']",buy apollo hospitals target price rs 8020 motilal oswal financial services
"['continue', 'to', 'like', 'bank', 'it', 'stocks', 'not', 'worried', 'about', 'short', 'term', 'volatility', 'roshi', 'jain']",continue to like bank it stocks not worried about short term volatility roshi jain
"['capital', 'markets', 'to', 'continue', 'to', 'surprise', 'on', 'upside', '3', 'big', 'trends', 'to', 'bet', 'on', 'navneet', 'munot']",capital markets to continue to surprise on upside 3 big trends to bet on navneet munot
"['pre', 'budget', 'hype', 'drives', 'psu', 'sectors', 'but', 'challenges', 'persist', 'ajay', 'bagga']",pre budget hype drives psu sectors but challenges persist ajay bagga
"['is', 'market', 'recovery', 'sustainable', 'it', 'is', 'back', 'to', 'fundamentals', 'now', 'says', 'daljeet', 'kohli']",is market recovery sustainable it is back to fundamentals now says daljeet kohli
"['adani', 'shares', 'drew', 'retail', 'investors', 'just', 'before', 'us', 'probe', 'pullback']",adani shares drew retail investors just before us probe pullback
"['upgrads', 'president', 'gaurav', 'kumar', 'exits', 'amid', 'leadership', 'exodus', 'and', 'ipo', 'plans']",upgrads president gaurav kumar exits amid leadership exodus and ipo plans
"['happiest', 'minds', 'among', '8', 'stocks', 'to', 'trade', 'ex', 'dividend', 'tomorrow', 'do', 'you', 'own']",happiest minds among 8 stocks to trade ex dividend tomorrow do you own
"['russia', 'fulfilling', 'all', 'contractual', 'obligations', 'on', 's', '400', 'missile', 'defence', 'system', 'deputy', 'fm']",russia fulfilling all contractual obligations on s 400 missile defence system deputy fm
"['jimmy', 'patronis', 'secures', 'trumps', 'backing', 'for', 'congressional', 'run', 'set', 'to', 'replace', 'matt', 'gaetz']",jimmy patronis secures trumps backing for congressional run set to replace matt gaetz
"['senior', 'executives', 'of', 'jsw', 'mg', 'motor', 'likely', 'to', 'exit']",senior executives of jsw mg motor likely to exit
"['big', 'movers', 'on', 'd', 'street', 'what', 'should', 'investors', 'do', 'with', 'hpcl', 'pfc', 'and', 'irfc']",big movers on d street what should investors do with hpcl pfc and irfc
"['rajputana', 'biodiesel', 'ipo', 'opens', 'today', 'check', 'issue', 'size', 'gmp', 'price', 'band', 'and', 'other', 'details']",rajputana biodiesel ipo opens today check issue size gmp price band and other details
"['bharatnet', 'phase', 'iii', 'to', 'create', 'nearly', '25k', 'jobs', 'teamlease']",bharatnet phase iii to create nearly 25k jobs teamlease
"['use', 'market', 'rebound', 'to', 'prune', 'exposure', 'to', 'thematic', 'funds']",use market rebound to prune exposure to thematic funds
"['pre', 'market', 'action', 'heres', 'the', 'trade', 'setup', 'for', 'todays', 'session']",pre market action heres the trade setup for todays session
"['cummins', 'indias', 'growth', 'hinges', 'on', 'pricing', 'trend', 'competitive', 'intensity']",cummins indias growth hinges on pricing trend competitive intensity
"['stocks', 'in', 'news', 'hul', 'zomato', 'adani', 'enterprises', 'wipro', 'lt', 'foods', 'power', 'grid']",stocks in news hul zomato adani enterprises wipro lt foods power grid
"['hindujas', 'in', 'talks', 'to', 'raise', '2nd', 'tranche', 'of', 'rs', '4300', 'crore']",hindujas in talks to raise 2nd tranche of rs 4300 crore
"['ai', 'the', 'access', 'key', 'to', 'inclusion']",ai the access key to inclusion
"['fake', 'wedding', 'cards', 'emptying', 'bank', 'accounts']",fake wedding cards emptying bank accounts
"['rupee', 'logs', 'best', 'single', 'day', 'gain', 'since', 'june', 'on', 'account', 'of', 'msci', 'rebalancing']",rupee logs best single day gain since june on account of msci rebalancing
"['delayed', 'government', 'payments', 'hit', 'cos', 'operating', 'cash', 'flows', 'in', 'h1']",delayed government payments hit cos operating cash flows in h1
"['indices', 'continue', 'climb', 'on', 'ballot', 'of', 'sentiment']",indices continue climb on ballot of sentiment
"['edelweiss', 'financial', 'appoints', 'nomura', 'for', 'mf', 'stake', 'sale']",edelweiss financial appoints nomura for mf stake sale
"['buy', 'the', 'dip', 'in', 'large', 'cap', 'stocks', 'fii', 'flows', 'unlikely', 'to', 'return', 'soon']",buy the dip in large cap stocks fii flows unlikely to return soon
"['vedanta', 'seeks', 'up', 'to', '1', '2', 'billion', 'via', 'bonds', 'to', 'refinance', 'debt']",vedanta seeks up to 1 2 billion via bonds to refinance debt
"['citi', 'upgrades', 'ril', 'sees', '18', '5', 'upside']",citi upgrades ril sees 18 5 upside
"['after', 'mega', 'bids', 'at', 'ipl', 'auction', 'big', 'brandobast', 'for', 'pant', 'iyers', 'on', 'endorsement', 'street']",after mega bids at ipl auction big brandobast for pant iyers on endorsement street
"['govt', 'may', 'not', 'sharply', 'hike', 'fy26', 'capex', 'outlay', 'to', 'keep', 'fiscal', 'deficit', 'in', 'check']",govt may not sharply hike fy26 capex outlay to keep fiscal deficit in check
"['stock', 'radar', 'grasim', 'industries', 'stock', 'takes', 'support', 'above', '200', 'ema', 'time', 'to', 'buy']",stock radar grasim industries stock takes support above 200 ema time to buy
"['weekly', 'top', 'mid', 'and', 'small', 'cap', 'picks', 'these', 'stocks', 'scored', '10', 'on', '10', 'on', 'stock', 'reports', 'plus']",weekly top mid and small cap picks these stocks scored 10 on 10 on stock reports plus
"['these', 'large', 'caps', 'have', 'strong', 'buy', 'buy', 'recos', 'and', 'upside', 'potential', 'of', 'more', 'than', '32']",these large caps have strong buy buy recos and upside potential of more than 32
"['daily', 'trading', 'desk', '2', 'trades', 'for', 'short', 'term', 'gains', 'an', 'infra', 'major', 'for', 'over', '6', 'gain', 'large', 'cap', 'it', 'stock', 'for', 'almost', '6', 'upmove']",daily trading desk 2 trades for short term gains an infra major for over 6 gain large cap it stock for almost 6 upmove
"['the', 'agency', 'check', 'out', 'plot', 'trailer', 'cast', 'and', 'release', 'date']",the agency check out plot trailer cast and release date
"['what', 'will', 'kamala', 'harris', 'next', 'move', 'be', 'after', 'she', 'vacates', 'the', 'white', 'house', 'here', 'are', 'some', 'options', 'she', 'may', 'be', 'pondering']",what will kamala harris next move be after she vacates the white house here are some options she may be pondering
"['beetlejuice', 'beetlejuice', 'when', 'and', 'where', 'to', 'stream']",beetlejuice beetlejuice when and where to stream
"['victoria', 'and', 'david', 'beckham', 'have', 'distanced', 'themselves', 'from', 'prince', 'harry', 'and', 'meghan', 'markle', 'and', 'no', 'longer', 'on', 'speaking', 'terms', 'what', 'went', 'wrong', 'here', 'are', 'some', 'clues']",victoria and david beckham have distanced themselves from prince harry and meghan markle and no longer on speaking terms what went wrong here are some clues
"['the', 'traitors', 'season', '3', 'what', 'we', 'know', 'about', 'celebrity', 'contestants', 'game', 'structure', 'and', 'release', 'date']",the traitors season 3 what we know about celebrity contestants game structure and release date
"['diddys', 'lawyer', 'makes', 'big', 'admission', 'will', 'the', 'rapper', 'pay', 'for', 'breaking', 'rules']",diddys lawyer makes big admission will the rapper pay for breaking rules
"['the', 'pitt', 'new', 'hospital', 'dramas', 'plot', 'cast', 'and', 'production', 'team']",the pitt new hospital dramas plot cast and production team
"['the', 'boroughs', 'what', 'we', 'know', 'about', 'cast', 'storyline', 'and', 'production', 'team']",the boroughs what we know about cast storyline and production team
"['leonardo', 'di', 'caprio', 'doesnt', 'acknowledge', 'traditional', 'song', 'and', 'dance', 'at', 'fiji', 'hotel', 'dubbed', 'as', 'snobbish', 'and', 'disrespectful', 'video', 'goes', 'viral', 'on', 'tiktok']",leonardo di caprio doesnt acknowledge traditional song and dance at fiji hotel dubbed as snobbish and disrespectful video goes viral on tiktok
"['honkai', 'star', 'rail', '2', '7', 'update', 'everything', 'we', 'know', 'so', 'far']",honkai star rail 2 7 update everything we know so far
"['musk', 'wont', 'stick', 'long', 'enough', 'it', 'will', 'be', 'easier', 'for', 'him', 'to', 'go', 'to', 'mars', 'than', 'making', 'cuts', 'in', 'the', 'government', 'says', 'trumps', 'former', 'chief', 'of', 'staff']",musk wont stick long enough it will be easier for him to go to mars than making cuts in the government says trumps former chief of staff
"['gautam', 'adani', 'us', 'indictment', 'sebi', 'probe', 'bank', 'loans', 'bribery', 'charges', 'frauds', 'us', 'sec', 'summons', 'a', 'new', 'twist', 'in', 'india', 'supreme', 'court', 'intensify', 'billionaires', 'troubles']",gautam adani us indictment sebi probe bank loans bribery charges frauds us sec summons a new twist in india supreme court intensify billionaires troubles
"['we', 'call', 'on', 'the', 'pakistani', 'authorities', 'to', 'respect', 'human', 'rights', 'and', 'fundamental', 'freedom', 'us', 'on', 'pakistan']",we call on the pakistani authorities to respect human rights and fundamental freedom us on pakistan
"['tata', 'teleservices', 'among', 'other', 'telecom', 'stocks', 'rally', 'up', 'to', '19', 'on', 'bank', 'guarantee', 'waiver']",tata teleservices among other telecom stocks rally up to 19 on bank guarantee waiver
"['hul', 'to', 'demerge', 'ice', 'cream', 'business', 'into', 'independent', 'entity']",hul to demerge ice cream business into independent entity
"['india', 'to', 'go', 'natural', 'for', 'farming', 'cost', '2481', 'crore']",india to go natural for farming cost 2481 crore
"['us', 'agency', 'conducting', 'due', 'diligence', 'on', 'adanis', 'sri', 'lanka', 'project']",us agency conducting due diligence on adanis sri lanka project
"['shweta', 'bachchan', 'sends', 'flower', 'bouquet', 'to', 'aishwarya', 'rais', 'sister', 'in', 'law', 'netizens', 'wonder', 'whats', 'behind', 'the', 'gesture']",shweta bachchan sends flower bouquet to aishwarya rais sister in law netizens wonder whats behind the gesture
"['kenya', 'cancels', 'power', 'transmission', 'deal', 'with', 'adani', 'following', 'us', 'bribery', 'charges']",kenya cancels power transmission deal with adani following us bribery charges
"['can', 'india', 'overcome', 'its', 'massive', 'trade', 'deficit', 'with', 'strategic', 'manufacturing', 'policies']",can india overcome its massive trade deficit with strategic manufacturing policies
"['cabinet', 'approves', 'continuation', 'of', 'atal', 'innovation', 'mission']",cabinet approves continuation of atal innovation mission
"['3', 'sectors', 'ca', 'rudramurthy', 'bv', 'is', 'betting', 'on', 'for', 'near', 'term']",3 sectors ca rudramurthy bv is betting on for near term
"['aadhaar', 'card', 'free', 'update', 'deadline', 'ends', 'on', 'december', '14', '2024', 'a', 'step', 'by', 'step', 'guide', 'on', 'how', 'to', 'update', 'your', 'aadhaar', 'for', 'free']",aadhaar card free update deadline ends on december 14 2024 a step by step guide on how to update your aadhaar for free
"['it', 'really', 'hurt', 'samantha', 'ruth', 'prabhu', 'opens', 'up', 'about', 'shaming', 'after', 'her', 'divorce', 'from', 'naga', 'chaitanya']",it really hurt samantha ruth prabhu opens up about shaming after her divorce from naga chaitanya
"['india', 'bloc', 'not', 'to', 'escalate', 'protest', 'stall', 'entire', 'winter', 'session', 'of', 'parliament']",india bloc not to escalate protest stall entire winter session of parliament
"['indian', 'woman', 'in', 'dubai', 'seeks', 'advice', 'on', 'genz', 'maid', 'using', 'phone', 'sitting', 'on', 'sofa', 'watch', 'viral', 'video']",indian woman in dubai seeks advice on genz maid using phone sitting on sofa watch viral video
"['yashasvi', 'jaiswal', 'poised', 'to', 'inherit', 'batting', 'excellence', 'of', 'sachin', 'tendulkar', 'and', 'kohli', 'greg', 'chappell']",yashasvi jaiswal poised to inherit batting excellence of sachin tendulkar and kohli greg chappell
"['fortnite', 'chapter', '6', 'all', 'we', 'know', 'about', 'release', 'date', 'themes', 'map', 'and', 'weapons']",fortnite chapter 6 all we know about release date themes map and weapons
"['sp', 'ratings', 'says', 'us', 'allegations', 'may', 'renew', 'questions', 'on', 'governance', 'practices', 'at', 'adani']",sp ratings says us allegations may renew questions on governance practices at adani
"['entrepreneur', 'leaves', 'bengaluru', 'after', '14', 'years', 'for', 'pune', 'sparks', 'bengaluru', 'vs', 'pune', 'debate']",entrepreneur leaves bengaluru after 14 years for pune sparks bengaluru vs pune debate
"['french', 'energy', 'giant', 'total', 'says', 'no', 'new', 'investment', 'in', 'adani', 'till', 'bribe', 'charges', 'cleared']",french energy giant total says no new investment in adani till bribe charges cleared
"['govt', 'approves', 'tb', 'supplement', 'ahead', 'of', 'pending', 'trial', 'results', 'experts', 'raise', 'concerns']",govt approves tb supplement ahead of pending trial results experts raise concerns
"['no', 'direct', 'agreement', 'with', 'adani', 'says', 'ysrcp', 'on', 'allegation', 'of', 'bribe', 'for', 'power', 'purchase']",no direct agreement with adani says ysrcp on allegation of bribe for power purchase
"['pan', '2', '0', 'explained', 'key', 'changes', 'who', 'should', 'apply', 'and', 'more', 'all', 'you', 'need', 'to', 'know']",pan 2 0 explained key changes who should apply and more all you need to know
"['centre', 'bans', 'ulfa', 'for', 'five', 'more', 'years', 'under', 'uapa']",centre bans ulfa for five more years under uapa
"['difficult', 'to', 'function', 'like', 'this', 'delhi', 'schools', 'not', 'in', 'favour', 'of', 'hybrid', 'models']",difficult to function like this delhi schools not in favour of hybrid models
"['do', 'you', 'hate', 'trump', 'so', 'much', 'youd', 'quit', 'the', 'us', 'like', 'ellen', 'degeneres']",do you hate trump so much youd quit the us like ellen degeneres
"['cabinet', 'approves', 'rs', '7927', 'cr', 'for', 'multitracking', 'railway', 'projects']",cabinet approves rs 7927 cr for multitracking railway projects
"['piyush', 'goyal', 'urges', 'credai', 'to', 'assess', 'constructions', 'impact', 'on', 'air', 'quality', 'prioritise', 'affordable', 'rental', 'housing']",piyush goyal urges credai to assess constructions impact on air quality prioritise affordable rental housing
"['et', 'graphics', 'record', 'spend', 'at', 'ipl', '2025', 'mega', 'auction', 'rs', '635', '30', 'crore', '173', 'players', 'sold']",et graphics record spend at ipl 2025 mega auction rs 635 30 crore 173 players sold
"['kim', 'kardashian', 'stirs', 'controversy', 'for', 'pairing', 'lingerie', 'with', 'holy', 'rosary', 'skims', 'brand', 'dolce', 'gabbana', 'netizens', 'call', 'it', 'blatant', 'disrespect', 'see', 'pics']",kim kardashian stirs controversy for pairing lingerie with holy rosary skims brand dolce gabbana netizens call it blatant disrespect see pics
"['must', 'take', 'ipr', 'pacts', 'seriously', 'sanjeev', 'sanyal']",must take ipr pacts seriously sanjeev sanyal
"['eknath', 'shinde', 'resigns', 'asked', 'to', 'act', 'as', 'caretaker', 'cm']",eknath shinde resigns asked to act as caretaker cm
"['never', 'entered', 'into', 'pact', 'to', 'operate', 'airport', 'in', 'kenya', 'adani']",never entered into pact to operate airport in kenya adani
"['cabinet', 'approves', 'pan', '2', '0', 'will', 'you', 'have', 'to', 'apply', 'for', 'a', 'new', 'one']",cabinet approves pan 2 0 will you have to apply for a new one
"['centre', 'approves', '2', 'hydro', 'projects', 'worth', 'rs', '3689', 'cr', 'in', 'arunachal', 'pradesh']",centre approves 2 hydro projects worth rs 3689 cr in arunachal pradesh
"['in', 'blood', 'they', 'trust', 'japanese', 'bank', 'employees', 'sign', 'pledge', 'to', 'commit', 'suicide', 'if', 'they', 'steal']",in blood they trust japanese bank employees sign pledge to commit suicide if they steal
"['tata', 'cliq', 'fy24', 'revenue', 'falls', 'on', 'exiting', 'electronics', 'category', 'loss', 'narrows']",tata cliq fy24 revenue falls on exiting electronics category loss narrows
"['cabinet', 'meeting', 'highlights', 'union', 'cabinet', 'okays', 'several', 'projects', 'for', 'farmers', 'young', 'citizens']",cabinet meeting highlights union cabinet okays several projects for farmers young citizens
"['adani', 'cfo', 'says', 'us', 'indictment', 'linked', 'to', 'one', 'adani', 'green', 'contract']",adani cfo says us indictment linked to one adani green contract
"['gautam', 'adanis', 'biggest', 'trial', 'us', 'indictment', 'fraud', 'sagar', 'adani', 'whatsapp', 'messages', 'how', 'it', 'all', 'started', 'in', 'june', '2020']",gautam adanis biggest trial us indictment fraud sagar adani whatsapp messages how it all started in june 2020
"['nfo', 'alert', 'tata', 'mutual', 'fund', 'launches', 'tata', 'bse', 'select', 'business', 'groups', 'index', 'fund']",nfo alert tata mutual fund launches tata bse select business groups index fund
"['adani', 'touts', 'financial', 'muscle', 'shows', 'can', 'grow', 'without', 'external', 'debt']",adani touts financial muscle shows can grow without external debt
"['competition', 'regulator', 'unlikely', 'to', 'take', 'cognizance', 'of', 'media', 'reports', 'on', 'adani', 'bribery', 'issue']",competition regulator unlikely to take cognizance of media reports on adani bribery issue
"['bengalurus', 'reva', 'university', 'aeronautical', 'students', 'get', 'private', 'airfield', 'to', 'test', 'their', 'products']",bengalurus reva university aeronautical students get private airfield to test their products
"['ahead', 'of', 'market', '10', 'things', 'that', 'will', 'decide', 'stock', 'market', 'action', 'on', 'tuesday']",ahead of market 10 things that will decide stock market action on tuesday
"['fitch', 'takes', 'negative', 'rating', 'actions', 'on', 'adani', 'group', 'entities', 'amid', 'us', 'bribery', 'scandal']",fitch takes negative rating actions on adani group entities amid us bribery scandal
"['gen', 'ai', 'and', 'cybersecurity', 'are', 'top', 'investment', 'priorities', 'for', 'executives', 'pwc', 'report']",gen ai and cybersecurity are top investment priorities for executives pwc report
"['mumbai', 'woman', 'duped', 'of', 'rs', '3', '8', 'cr', 'by', 'online', 'fraudsters', 'held', 'in', 'digital', 'custody', 'for', 'a', 'month']",mumbai woman duped of rs 3 8 cr by online fraudsters held in digital custody for a month
"['adani', 'us', 'indictment', 'theres', 'enough', 'cash', 'to', 'cover', '30', 'months', 'of', 'debt', 'payments']",adani us indictment theres enough cash to cover 30 months of debt payments
"['constitution', 'powerful', 'tool', 'to', 'protect', 'poorest', 'section', 'of', 'society', 'rahul', 'gandhi']",constitution powerful tool to protect poorest section of society rahul gandhi
"['manipur', 'mp', 'takes', 'on', 'mizo', 'mp', 'for', 'autonomy', 'comment']",manipur mp takes on mizo mp for autonomy comment
"['elon', 'musks', 'vision', 'for', 'space', 'travel', 'to', 'mars', 'is', 'not', 'realistic', 'says', 'this', 'famous', 'astrophysicist']",elon musks vision for space travel to mars is not realistic says this famous astrophysicist
"['azure', 'power', 'who', 'are', 'the', 'key', 'people', 'now', 'in', 'the', 'company', 'central', 'to', '250', 'mn', 'bribery', 'case', 'against', 'adani']",azure power who are the key people now in the company central to 250 mn bribery case against adani
"['adani', 'case', 'raises', 'issue', 'of', 'extraterritorial', 'application', 'of', 'american', 'laws', 'attorney']",adani case raises issue of extraterritorial application of american laws attorney
"['isros', 'shukrayaan', 'takes', 'offon', 'paper', 'govt', 'greenlights', 'venus', 'mission', 'to', 'study', 'planets', 'weather', 'atmosphere']",isros shukrayaan takes offon paper govt greenlights venus mission to study planets weather atmosphere
"['big', 'compromise', 'by', 'jennifer', 'lopez', 'amid', 'divorce', 'she', 'had', 'to', 'let', 'go', 'of', 'this', 'to', 'work', 'with', 'ex', 'husband', 'ben', 'affleck']",big compromise by jennifer lopez amid divorce she had to let go of this to work with ex husband ben affleck
"['has', 'trump', 'started', 'his', 'retaliation', 'gop', 'senator', 'blocks', 'promotion', 'of', 'general', 'who', 'oversaw', 'pullout', 'of', 'troops', 'in', 'afghanistan']",has trump started his retaliation gop senator blocks promotion of general who oversaw pullout of troops in afghanistan
"['cabinet', 'gives', 'nod', 'to', 'one', 'nation', 'one', 'subscription', 'heres', 'all', 'you', 'need', 'to', 'know', 'about', 'it']",cabinet gives nod to one nation one subscription heres all you need to know about it
"['charges', 'against', 'adani', 'in', 'bribery', 'case', 'can', 'be', 'withdrawn', 'if', 'deemed', 'unworthy', 'after', 'trump', 'takes', 'over', 'as', 'president']",charges against adani in bribery case can be withdrawn if deemed unworthy after trump takes over as president
"['thied', 'eye', 'washed', 'away', 'by', 'rain', 'forecast', 'caught', 'up', 'in', 'procedures', 'time', 'to', 'take', 'independent', 'view']",thied eye washed away by rain forecast caught up in procedures time to take independent view
"['meghan', 'markle', 'prince', 'harry', 'missing', 'from', 'recent', 'events', 'details', 'here']",meghan markle prince harry missing from recent events details here
"['indias', 'gen', 'z', 'not', 'fascinated', 'with', 'fair', 'skin']",indias gen z not fascinated with fair skin
"['best', 'selling', 'laptops', 'under', '40000', 'in', 'india']",best selling laptops under 40000 in india
"['indian', 'market', 'to', 'blindly', 'follow', 'global', 'trend', 'for', 'a', 'month', 'or', 'more', '5', 'sectors', 'to', 'bet', 'on', 'aman', 'chowhan']",indian market to blindly follow global trend for a month or more 5 sectors to bet on aman chowhan
"['railways', 'recruited', '5', 'lakh', 'employees', 'since', '2014', 'minister', 'ashwini', 'vaishnaw']",railways recruited 5 lakh employees since 2014 minister ashwini vaishnaw
"['sebi', 'investigating', 'whether', 'adani', 'group', 'flouted', 'disclosure', 'rules', 'report']",sebi investigating whether adani group flouted disclosure rules report
"['viktors', 'rework', 'in', 'league', 'of', 'legends', 'all', 'you', 'may', 'want', 'to', 'know']",viktors rework in league of legends all you may want to know
"['aviom', 'india', 'housing', 'hit', 'by', 'fraud', 'to', 'delay', 'lender', 'payments']",aviom india housing hit by fraud to delay lender payments
"['uttar', 'pradesh', 'robots', 'to', 'boost', 'fire', 'safety', 'at', 'mahakumbh', '2025']",uttar pradesh robots to boost fire safety at mahakumbh 2025
"['what', 'could', 'be', 'kim', 'kardashians', 'next', 'profession', 'she', 'shares', 'life', 'update', 'with', 'major', 'post', 'heres', 'how', 'she', 'is', 'preparing', 'for', 'it']",what could be kim kardashians next profession she shares life update with major post heres how she is preparing for it
