headlines,headline_text
"['finance', 'ministry', 'rethinks', 'windfall', 'tax', 'oil', 'ministry', 'for', 'natural', 'gas', 'under', 'gst']",finance ministry rethinks windfall tax oil ministry for natural gas under gst
"['amazon', 'sale', '2024', 'discover', 'the', 'best', 'deals', 'on', 'chimneys', 'from', 'top', 'brands', 'like', 'faber', 'elica', 'and', 'glen']",amazon sale 2024 discover the best deals on chimneys from top brands like faber elica and glen
"['dr', 'reddys', 'launches', 'drug', 'for', 'neck', 'head', 'cancer']",dr reddys launches drug for neck head cancer
"['taylor', 'swift', 'fans', 'enraged', 'as', 'billboard', 'uses', 'kanyes', 'famous', 'naked', 'clip', 'in', 'her', 'tribute', 'video', 'apology', 'issued']",taylor swift fans enraged as billboard uses kanyes famous naked clip in her tribute video apology issued
"['cop29', 'is', 'the', 'developed', 'world', 'failing', 'the', 'global', 'south', 'on', 'climate', 'finance']",cop29 is the developed world failing the global south on climate finance
"['climate', 'summit', 'hypocrisy', 'the', 'disconnect', 'between', 'promises', 'and', 'reality', 'in', 'global', 'emissions']",climate summit hypocrisy the disconnect between promises and reality in global emissions
"['age', 'defying', 'makeover', 'did', 'lindsay', 'lohan', 'spend', '300000', 'on', 'plastic', 'surgery', 'fans', 'gush', 'about', 'her', 'new', 'youthful', 'look', 'heres', 'how', 'she', 'looks', 'now', 'and', 'what', 'doctors', 'are', 'saying']",age defying makeover did lindsay lohan spend 300000 on plastic surgery fans gush about her new youthful look heres how she looks now and what doctors are saying
"['this', 'is', 'what', 'king', 'charles', 'is', 'gifting', 'queen', 'camilla', 'for', 'christmas', 'it', 'will', 'surprise', 'you']",this is what king charles is gifting queen camilla for christmas it will surprise you
"['prince', 'harry', 'and', 'meghan', 'markles', 'new', 'house', 'in', 'portugal', 'still', 'not', 'ready', 'heres', 'how', 'much', 'it', 'cost', 'them', 'and', 'when', 'they', 'will', 'move', 'in']",prince harry and meghan markles new house in portugal still not ready heres how much it cost them and when they will move in
"['we', 'follow', 'policies', 'set', 'by', 'centre', 'mamata', 'banerjee', 'on', 'bangladesh']",we follow policies set by centre mamata banerjee on bangladesh
"['irdai', 'seeks', 'road', 'maps', 'to', 'dalal', 'street', 'from', 'large', 'insurers']",irdai seeks road maps to dalal street from large insurers
"['mufasa', 'the', 'lion', 'king', 'director', 'reveals', 'if', 'the', 'movie', 'is', 'animated', 'or', 'not']",mufasa the lion king director reveals if the movie is animated or not
"['minority', 'protection', 'is', 'no', 'minor', 'matter']",minority protection is no minor matter
"['west', 'bengal', 'chief', 'minister', 'mamata', 'banerjee', 'says', 'this', 'bill', 'has', 'been', 'brought', 'in', 'for', 'political', 'reasons']",west bengal chief minister mamata banerjee says this bill has been brought in for political reasons
"['cbi', 'urges', 'supreme', 'court', 'to', 'shift', 'yasin', 'malik', 'trial', 'from', 'jammu', 'to', 'tihar', 'jail', 'court']",cbi urges supreme court to shift yasin malik trial from jammu to tihar jail court
"['rajasthan', 'courts', 'notice', 'on', 'ajmer', 'shrine', 'sparks', 'political', 'outrage', 'in', 'kashmir']",rajasthan courts notice on ajmer shrine sparks political outrage in kashmir
"['health', 'dept', 'told', 'to', 'include', 'ab', 'pmjay', 'benefits', 'with', 'delhi', 'govts', 'free', 'healthcare', 'service', 'cm', 'atishi']",health dept told to include ab pmjay benefits with delhi govts free healthcare service cm atishi
"['tgibf', 'thank', 'god', 'its', 'black', 'friday', 'here']",tgibf thank god its black friday here
"['india', 'plans', 'global', 'pacts', 'for', 'processing', 'offshore', 'minerals']",india plans global pacts for processing offshore minerals
"['cyber', 'fraud', 'case', 'ed', 'search', 'party', 'attacked', 'in', 'delhi', 'officer', 'injured']",cyber fraud case ed search party attacked in delhi officer injured
"['dhaka', 'high', 'court', 'refuses', 'to', 'ban', 'iskcon']",dhaka high court refuses to ban iskcon
"['jharkhand', 'likely', 'to', 'experience', 'cloudy', 'weather', 'under', 'influence', 'of', 'cyclone', 'fengal']",jharkhand likely to experience cloudy weather under influence of cyclone fengal
"['cci', 'probe', 'against', 'google', 'nazaras', 'fundraise']",cci probe against google nazaras fundraise
"['cow', 'vigilantes', 'booked', 'under', 'new', 'lynching', 'law', 'of', 'bharatiya', 'nyaya', 'sanhita']",cow vigilantes booked under new lynching law of bharatiya nyaya sanhita
"['parliament', 'logjam', 'continues', 'jpc', 'probe', 'demand', 'into', 'adani', 'issue', 'rejected', 'by', 'chair']",parliament logjam continues jpc probe demand into adani issue rejected by chair
"['staying', 'under', 'covers']",staying under covers
"['best', '25', 'litre', 'geysers', 'in', 'india']",best 25 litre geysers in india
"['this', 'harry', 'potter', 'book', 'with', 'tea', 'stains', 'and', 'folded', 'corner', 'auctioned', 'for', 'rs', '38', 'lakh', 'what', 'makes', 'it', 'special']",this harry potter book with tea stains and folded corner auctioned for rs 38 lakh what makes it special
"['trumps', 'tariffs', 'will', 'mexico', 'use', 'its', 'secret', 'weapon', 'bmw', 'to', 'hit', 'back', 'at', 'us', 'heres', 'how', 'that', 'can', 'happen']",trumps tariffs will mexico use its secret weapon bmw to hit back at us heres how that can happen
"['charitable', 'hospitals', 'to', 'cover', 'esic', 'beneficiaries']",charitable hospitals to cover esic beneficiaries
"['go', 'first', 'proposes', 'new', 'liquidator', 'after', 'objections', 'from', 'tribunal']",go first proposes new liquidator after objections from tribunal
"['draft', 'ready', 'skill', 'indias', 'new', 'avatar', 'awaits', 'cabinet', 'nod']",draft ready skill indias new avatar awaits cabinet nod
"['private', 'sector', 'banks', 'securitise', '40000', 'cr', 'of', 'loans', 'this', 'fiscal']",private sector banks securitise 40000 cr of loans this fiscal
"['no', 'no', 'business', 'like', 'parliament', 'business']",no no business like parliament business
"['how', 'elon', 'musk', 'plans', 'to', 'change', 'gaming', 'world', 'worlds', 'richest', 'man', 'announces', 'ai', 'game', 'studio', 'after', 'complaining', 'to', 'satya', 'nadella']",how elon musk plans to change gaming world worlds richest man announces ai game studio after complaining to satya nadella
"['uks', 'smiths', 'group', 'to', 'relocate', 'wet', 'seal', 'assembly', 'ops', 'from', 'thailand', 'to', 'bengaluru']",uks smiths group to relocate wet seal assembly ops from thailand to bengaluru
"['west', 'bengal', 'has', 'become', 'haven', 'for', 'criminals', 'sukanta', 'majumdar', 'slams', 'cm', 'mamata', 'banerjee']",west bengal has become haven for criminals sukanta majumdar slams cm mamata banerjee
"['best', 'geysers', 'under', '10000', 'for', 'every', 'home']",best geysers under 10000 for every home
"['edible', 'oil', 'prices', 'likely', 'to', 'drop', '9', 'by', 'mid', 'december']",edible oil prices likely to drop 9 by mid december
"['sharon', 'stone', 'faces', 'backlash', 'for', 'calling', 'americans', 'ignorant', 'and', 'uneducated', 'for', 'voting', 'trump', 'people', 'vent', 'ire', 'on', 'social', 'media', 'share', 'old', 'photos', 'of', 'her', 'and', 'trump']",sharon stone faces backlash for calling americans ignorant and uneducated for voting trump people vent ire on social media share old photos of her and trump
"['how', 'musk', 'trump', 'will', 'take', 'on', 'tech']",how musk trump will take on tech
"['eknath', 'shinde', 'meets', 'amit', 'shah', 'in', 'delhi', 'ahead', 'of', 'mahayuti', 'meeting']",eknath shinde meets amit shah in delhi ahead of mahayuti meeting
"['is', 'justin', 'bieber', 'being', 'forced', 'to', 'tour', 'amid', 'health', 'challenges', 'and', 'financial', 'woes']",is justin bieber being forced to tour amid health challenges and financial woes
"['happy', 'thanksgiving', '2024', 'images', 'quotes', 'messages', 'greetings', 'blessings', 'to', 'share', 'with', 'friends', 'and', 'family']",happy thanksgiving 2024 images quotes messages greetings blessings to share with friends and family
"['india', 'has', 'taken', 'up', 'matter', 'of', 'rise', 'in', 'visa', 'fees', 'for', 'students', 'by', 'australia', 'mos', 'singh', 'informs', 'parliament']",india has taken up matter of rise in visa fees for students by australia mos singh informs parliament
"['ar', 'rahman', 'saira', 'banu', 'divorce', 'their', 'lawyer', 'opens', 'up', 'about', 'possible', 'reconciliation', 'kids', 'custody', 'and', 'alimony']",ar rahman saira banu divorce their lawyer opens up about possible reconciliation kids custody and alimony
"['recession', 'to', 'hit', 'usa', 'soon', 'heres', 'what', 'americans', 'expect']",recession to hit usa soon heres what americans expect
"['in', 'first', 'cabinet', 'meeting', 'jkhand', 'cm', 'decides', 'to', 'form', 'panel', 'to', 'study', 'plight', 'of', 'tea', 'tribes', 'in', 'assam']",in first cabinet meeting jkhand cm decides to form panel to study plight of tea tribes in assam
"['mamata', 'banerjee', 'says', 'waqf', 'bill', 'is', 'attack', 'on', 'indias', 'federal', 'structure', 'claims', 'rights', 'of', 'muslims', 'would', 'be', 'taken', 'away']",mamata banerjee says waqf bill is attack on indias federal structure claims rights of muslims would be taken away
"['manipur', 'government', 'condemns', 'mizo', 'national', 'fronts', 'interference', 'in', 'state', 'affairs']",manipur government condemns mizo national fronts interference in state affairs
"['embrace', 'values']",embrace values
"['c2c', 'advanced', 'systems', 'ipo', 'sees', 'withdrawal', 'of', '3', '72', 'lakh', 'applications']",c2c advanced systems ipo sees withdrawal of 3 72 lakh applications
"['going', 'against', 'campaign', 'promise', 'will', 'trump', 'do', 'a', 'u', 'turn', 'and', 'arm', 'ukraine', 'to', 'take', 'on', 'russia', 'biden', 'may', 'have', 'quietly', 'said', 'something', 'to', 'him', 'behind', 'closed', 'doors']",going against campaign promise will trump do a u turn and arm ukraine to take on russia biden may have quietly said something to him behind closed doors
"['sambhal', 'gyanvapi', 'all', 'are', 'being', 'done', 'to', 'divert', 'public', 'from', 'key', 'issues', 'chandrashekhar', 'azad', 'on', 'ajmer', 'dargah', 'row']",sambhal gyanvapi all are being done to divert public from key issues chandrashekhar azad on ajmer dargah row
"['ahead', 'of', 'market', '10', 'things', 'that', 'will', 'decide', 'stock', 'market', 'action', 'on', 'friday']",ahead of market 10 things that will decide stock market action on friday
"['cardekho', 'group', 'reports', '11', 'fall', 'in', 'fy24', 'net', 'revenue', 'net', 'loss', 'narrows']",cardekho group reports 11 fall in fy24 net revenue net loss narrows
"['pm', 'modi', 'to', 'inaugurate', 'rising', 'rajasthan', 'global', 'summit', 'in', 'jaipur', 'on', 'dec', '9']",pm modi to inaugurate rising rajasthan global summit in jaipur on dec 9
"['shopping', 'experts', 'say', 'these', 'are', 'the', 'best', 'black', 'friday', 'deals', 'this', 'year', 'go', 'grab', 'them', 'now']",shopping experts say these are the best black friday deals this year go grab them now
"['after', 'diddy', 'now', 'his', 'son', 'justin', 'combs', 'struggling', 'to', 'do', 'this', 'heres', 'what', 'the', 'problem', 'is']",after diddy now his son justin combs struggling to do this heres what the problem is
"['was', 'kim', 'kardashian', 'paid', 'by', 'elon', 'musk', 'to', 'pose', 'with', 'a', 'gold', 'tesla', 'optimus', 'robot', 'heres', 'what', 'the', 'reality', 'star', 'has', 'to', 'say']",was kim kardashian paid by elon musk to pose with a gold tesla optimus robot heres what the reality star has to say
"['this', 'musician', 'made', 'a', 'guitar', 'out', 'of', 'his', 'uncles', 'skeleton', 'and', 'he', 'has', 'a', 'reason']",this musician made a guitar out of his uncles skeleton and he has a reason
"['up', 'govt', 'launches', 'hi', 'tech', 'township', 'close', 'to', 'jewar', 'international', 'airport']",up govt launches hi tech township close to jewar international airport
"['cigarette', 'butt', 'found', 'in', 'biryani', 'of', 'famous', 'hyderabad', 'resturant', 'video', 'goes', 'viral']",cigarette butt found in biryani of famous hyderabad resturant video goes viral
"['in', 'indias', 'two', 'horse', 'telecom', 'race', 'a', 'laggard', 'picks', 'up', 'pace']",in indias two horse telecom race a laggard picks up pace
"['four', 'times', 'f1', 'champion', 'sebastian', 'vettel', 'has', 'taken', 'up', 'a', 'new', 'career', 'you', 'will', 'be', 'surprised', 'what', 'he', 'is', 'doing', 'now']",four times f1 champion sebastian vettel has taken up a new career you will be surprised what he is doing now
"['mizoram', 'opposition', 'mnf', 'calls', 'for', 'manipur', 'cm', 'n', 'biren', 'singhs', 'resignation', 'over', 'ongoing', 'crisis']",mizoram opposition mnf calls for manipur cm n biren singhs resignation over ongoing crisis
"['many', 'incidents', 'of', 'desecration', 'damage', 'to', 'hindu', 'temples', 'reported', 'from', 'bangladesh', 'govt']",many incidents of desecration damage to hindu temples reported from bangladesh govt
"['delhi', 'cabinet', 'approves', 'rs', '17', 'crore', 'grant', 'to', 'clear', 'pending', 'salaries', 'of', 'dsfdc', 'employees']",delhi cabinet approves rs 17 crore grant to clear pending salaries of dsfdc employees
"['is', 'iconic', 'japanese', 'automaker', 'nissan', 'in', 'dire', 'situation', 'reports', 'say', 'it', 'is', 'existing', 'on', 'borrowed', 'time', 'and', 'can', 'only', 'survive', 'for', '12', '14', 'months']",is iconic japanese automaker nissan in dire situation reports say it is existing on borrowed time and can only survive for 12 14 months
"['centre', 'approves', 'coal', 'allocation', 'for', 'mp', 'to', 'set', 'up', 'power', 'plants', 'with', 'capacity', 'of', '4100', 'mw']",centre approves coal allocation for mp to set up power plants with capacity of 4100 mw
"['elon', 'musk', 'gives', 'donald', 'trump', 'a', 'reality', 'check', 'after', 'his', 'strange', 'question', 'about', 'rockets']",elon musk gives donald trump a reality check after his strange question about rockets
"['karnataka', 'government', 'to', 'spend', 'rs', '2500', 'crore', 'to', 'upgrade', '500', 'government', 'schools']",karnataka government to spend rs 2500 crore to upgrade 500 government schools
"['indias', 'lessons', 'in', 'energy', 'security', 'applicable', 'to', 'africa', 'power', 'minister', 'khattar']",indias lessons in energy security applicable to africa power minister khattar
"['jim', 'rogers', 'has', 'this', 'golden', 'advice', 'for', 'global', 'investors', 'details', 'here']",jim rogers has this golden advice for global investors details here
"['back', 'to', 'square', 'one', 'fiis', 'sell', 'indian', 'equities', 'worth', 'over', 'rs11000', 'crore', 'after', '3', 'days', 'of', 'buying']",back to square one fiis sell indian equities worth over rs11000 crore after 3 days of buying
"['this', 'democratic', 'donor', 'claims', 'obama', 'and', 'pelosi', 'opposed', 'kamala', 'harris', 'nomination']",this democratic donor claims obama and pelosi opposed kamala harris nomination
"['indian', 'pacer', 'siddharth', 'kaul', 'announces', 'retirement']",indian pacer siddharth kaul announces retirement
"['dgp', 'conference', 'begins', 'friday', 'internal', 'security', 'j', 'k', 'khalistan', 'issue', 'to', 'be', 'discussed']",dgp conference begins friday internal security j k khalistan issue to be discussed
"['in', 'karnatakas', 'bpl', 'card', 'revamp', 'not', 'just', 'i', 't', 'payers', 'i', 't', 'filers', 'too', 'faced', 'heat']",in karnatakas bpl card revamp not just i t payers i t filers too faced heat
"['us', 'tariffs', 'on', 'china', 'india', 'could', 'get', 'hurt', 'most', 'says', 'crisil']",us tariffs on china india could get hurt most says crisil
"['141', 'indian', 'fishermen', 'are', 'in', 'sri', 'lankan', 'custody', 'govt']",141 indian fishermen are in sri lankan custody govt
"['bse', 'revises', 'expiry', 'day', 'for', 'sensex', 'bankex', 'sensex', '50', 'to', 'tuesday', 'effective', 'from', 'jan', '1', '2025']",bse revises expiry day for sensex bankex sensex 50 to tuesday effective from jan 1 2025
"['testing', 'facilities', 'for', 'energy', 'storage', 'systems', 'needed', 'for', 'indias', 'energy', 'transition', 'niti', 'aayog', 'member']",testing facilities for energy storage systems needed for indias energy transition niti aayog member
"['this', 'entire', 'federal', 'agency', 'may', 'be', 'slashed', 'by', 'elon', 'musks', 'doge', 'which', 'department', 'is', 'it', 'and', 'what', 'does', 'it', 'do']",this entire federal agency may be slashed by elon musks doge which department is it and what does it do
"['the', 'great', 'british', 'baking', 'show', 'season', '12', 'finale', 'in', 'the', 'us', 'check', 'release', 'date', 'and', 'how', 'to', 'watch', 'it', 'for', 'free']",the great british baking show season 12 finale in the us check release date and how to watch it for free
"['war', 'on', 'spam', 'mandate', 'on', 'message', 'traceability', 'will', 'not', 'delay', 'message', 'delivery', 'says', 'trai']",war on spam mandate on message traceability will not delay message delivery says trai
"['lucky', 'baskhar', 'bloody', 'beggar', 'vikkatakavi', 'watch', 'latest', 'malayalam', 'telugu', 'tamil', 'ott', 'releases', 'on', 'netflix', 'prime', 'video', 'disney', 'hotstar']",lucky baskhar bloody beggar vikkatakavi watch latest malayalam telugu tamil ott releases on netflix prime video disney hotstar
"['my', 'name', 'not', 'mentioned', 'anywhere', 'says', 'former', 'andhra', 'cm', 'jagan', 'on', 'adani', 'bribe', 'controversy']",my name not mentioned anywhere says former andhra cm jagan on adani bribe controversy
"['sebi', 'allows', 'nse', 'bse', 'to', 'act', 'as', 'alternative', 'trading', 'venue', 'on', 'outage', 'on', 'one']",sebi allows nse bse to act as alternative trading venue on outage on one
"['gold', 'rate', 'today', 'gold', 'prices', 'jump', 'big', 'will', 'this', 'trend', 'continue']",gold rate today gold prices jump big will this trend continue
"['will', 'ben', 'affleck', 'spend', 'thanksgiving', 'with', 'jennifer', 'lopez', 'the', 'actor', 'is', 'taking', 'a', 'break', 'from', 'filming', 'and', 'heres', 'what', 'he', 'plans', 'to', 'do']",will ben affleck spend thanksgiving with jennifer lopez the actor is taking a break from filming and heres what he plans to do
"['regulations', 'business', 'registrations', 'credit', 'and', 'market', 'access', 'still', 'a', 'challenge', 'for', 'msme']",regulations business registrations credit and market access still a challenge for msme
"['cyclone', 'fengal', 'alert', 'schools', 'and', 'colleges', 'to', 'stay', 'closed', 'for', 'more', 'days', 'in', 'puducherry', 'and', 'other', 'areas', 'check', 'details', 'here']",cyclone fengal alert schools and colleges to stay closed for more days in puducherry and other areas check details here
"['which', 'stealth', 'jet', 'is', 'better', 'usas', 'f', '35', 'or', 'chinas', 'j', '35a', 'heres', 'a', 'breakdown']",which stealth jet is better usas f 35 or chinas j 35a heres a breakdown
"['delhi', 'blast', 'investigative', 'agencies', 'looking', 'for', 'motive', 'white', 'powder', 'recovered', 'from', 'spot']",delhi blast investigative agencies looking for motive white powder recovered from spot
"['happy', 'thanksgiving', '2024', 'heartfelt', 'wishes', 'quotes', 'and', 'messages', 'to', 'share', 'with', 'your', 'family', 'and', 'friends']",happy thanksgiving 2024 heartfelt wishes quotes and messages to share with your family and friends
"['pollution', 'complaints', 'in', 'delhi', 'ncr', 'surged', 'by', '33', 'per', 'cent', 'in', '2024', 'cpcb']",pollution complaints in delhi ncr surged by 33 per cent in 2024 cpcb
"['isro', 'to', 'launch', 'esas', 'proba', '3', 'mission', 'to', 'study', 'suns', 'corona']",isro to launch esas proba 3 mission to study suns corona
"['russias', 'satan', '2', 'missiles', 'dubbed', 'as', 'most', 'destructive', 'weapon', 'on', 'earth', 'heres', 'all', 'about', 'it']",russias satan 2 missiles dubbed as most destructive weapon on earth heres all about it
"['looking', 'forward', 'to', 'working', 'closely', 'with', 'incoming', 'us', 'administration', 'india']",looking forward to working closely with incoming us administration india
"['k', 'raheja', 'investment', 'pays', 'rs', '68', '73', 'lakh', 'to', 'settle', 'reit', 'norms', 'violation', 'case', 'with', 'sebi']",k raheja investment pays rs 68 73 lakh to settle reit norms violation case with sebi
"['air', 'india', 'has', 'more', 'than', 'half', 'of', 'market', 'share', 'on', 'top', 'metro', 'routes', 'ceo', 'campbell', 'wilson']",air india has more than half of market share on top metro routes ceo campbell wilson
"['old', 'video', 'of', 'protest', 'against', 'evms', 'in', 'delhi', 'linked', 'to', 'maharashtra', 'polls']",old video of protest against evms in delhi linked to maharashtra polls
"['thanksgiving', 'in', 'the', 'us', 'from', 'liquor', 'stores', 'to', 'restaurants', 'heres', 'whats', 'open', 'and', 'whats', 'closed']",thanksgiving in the us from liquor stores to restaurants heres whats open and whats closed
"['nia', 'court', 'sentences', 'three', 'bangladeshis', 'for', 'harbouring', 'al', 'qaida', 'linked', 'terrorists', 'in', 'pune']",nia court sentences three bangladeshis for harbouring al qaida linked terrorists in pune
"['oxyzo', 'financial', 'services', 'q2', 'operational', 'revenue', 'up', '8', 'net', 'profit', 'at', 'rs', '82', 'crore']",oxyzo financial services q2 operational revenue up 8 net profit at rs 82 crore
"['bse', 'revises', 'circuit', 'limit', 'for', '55', 'stocks', 'including', 'paytm', 'dmart', 'adani', 'total', 'gas']",bse revises circuit limit for 55 stocks including paytm dmart adani total gas
"['fci', 'to', 'offer', '25', 'lmt', 'of', 'wheat', 'in', 'the', 'open', 'market', 'sale', 'till', 'march', '25']",fci to offer 25 lmt of wheat in the open market sale till march 25
"['bengaluru', 'woman', 'rejected', 'for', 'her', 'age', 'during', 'house', 'hunt', 'what', 'she', 'did', 'next', 'was', 'unexpected', 'viral', 'video']",bengaluru woman rejected for her age during house hunt what she did next was unexpected viral video
"['govt', 'may', 'shut', 'single', 'window', 'system', 'as', 'industry', 'seems', 'uninterested', 'piyush', 'goyal']",govt may shut single window system as industry seems uninterested piyush goyal
"['awhad', 'calls', 'maharashtra', 'results', 'conspiracy', 'to', 'politically', 'harm', 'pawar', 'and', 'thackeray']",awhad calls maharashtra results conspiracy to politically harm pawar and thackeray
"['silver', 'prices', 'crash', 'yet', 'again', 'slip', 'back', 'to', 'rs', '90000', 'mark']",silver prices crash yet again slip back to rs 90000 mark
"['this', 'telugu', 'actress', 'wants', 'to', 'date', 'shubhman', 'gill', 'she', 'was', 'once', 'rejected', 'for', 'her', 'beauty']",this telugu actress wants to date shubhman gill she was once rejected for her beauty
"['after', 'banning', 'donald', 'trump', 'from', 'facebook', 'post', 'jan', '6', 'riots', 'mark', 'zuckerberg', 'now', 'dines', 'with', 'the', 'president', 'elect', 'at', 'mar', 'a', 'lago', 'heres', 'what', 'they', 'discussed']",after banning donald trump from facebook post jan 6 riots mark zuckerberg now dines with the president elect at mar a lago heres what they discussed
"['will', 'donald', 'trump', 'lead', 'the', 'us', 'economy', 'towards', 'bankruptcy', 'latest', 'national', 'debt', 'projections', 'cause', 'massive', 'alarm']",will donald trump lead the us economy towards bankruptcy latest national debt projections cause massive alarm
"['five', 'member', 'panel', 'set', 'up', 'to', 'examine', 'safety', 'concerns', 'about', 'new', 'pamban', 'bridge', 'ashwini', 'vaishnaw']",five member panel set up to examine safety concerns about new pamban bridge ashwini vaishnaw
"['rupee', 'weakens', 'to', '84', '485', 'per', 'dollar', 'amid', 'fpi', 'outflows', 'and', 'month', 'end', 'dollar', 'demand']",rupee weakens to 84 485 per dollar amid fpi outflows and month end dollar demand
"['mines', 'ministry', 'launches', 'first', 'ever', 'tranche', 'of', '13', 'offshore', 'mineral', 'blocks', 'for', 'auction']",mines ministry launches first ever tranche of 13 offshore mineral blocks for auction
"['cci', 'orders', 'probe', 'against', 'google', 'on', 'winzos', 'complaint']",cci orders probe against google on winzos complaint
"['warewitt', 'investment', 'trust', 'to', 'raise', 'rs', '500', 'crore', 'warehousing', 'fund']",warewitt investment trust to raise rs 500 crore warehousing fund
"['diddy', 'doesnt', 'get', 'bail', 'for', 'the', 'fourth', 'time', 'heres', 'what', 'the', 'judge', 'said', 'while', 'rejecting', 'his', '50', 'million', 'bail']",diddy doesnt get bail for the fourth time heres what the judge said while rejecting his 50 million bail
"['infosys', 'nandan', 'nilekani', 'recalls', 'first', 'meeting', 'with', 'narayana', 'murthy', 'says', 'would', 'have', 'jumped', 'off', 'the', 'clip', 'for', 'him']",infosys nandan nilekani recalls first meeting with narayana murthy says would have jumped off the clip for him
"['delhi', 'government', 'extends', 'electric', 'vehicle', 'incentives', 'until', 'march', '2025', 'amid', 'poor', 'air', 'quality']",delhi government extends electric vehicle incentives until march 2025 amid poor air quality
"['ug', 'students', 'to', 'soon', 'get', 'option', 'to', 'shorten', 'extend', 'duration', 'of', 'degree', 'courses', 'ugc', 'chief', 'jagadesh', 'kumar']",ug students to soon get option to shorten extend duration of degree courses ugc chief jagadesh kumar
