headlines,headline_text
"['new', 'criminal', 'laws', 'will', 'replace', 'ipc', 'crpc', 'indian', 'evidence', 'act', 'from', 'today']",new criminal laws will replace ipc crpc indian evidence act from today
"['fo', 'stocks', 'to', 'buy', 'today', 'apollo', 'tyre', 'ongc', 'among', 'top', '9', 'trading', 'ideas', 'for', 'july', '1', '2024']",fo stocks to buy today apollo tyre ongc among top 9 trading ideas for july 1 2024
"['india', 'issued', 'one', 'lakh', 'patents', 'in', '2024', 'ten', 'years', 'back', 'it', 'was', 'just', '6000', 'piyush', 'goyal']",india issued one lakh patents in 2024 ten years back it was just 6000 piyush goyal
"['hot', 'stocks', 'brokerages', 'on', 'amara', 'raja', 'united', 'spirits', 'dixon', 'technologies', 'and', 'grasim']",hot stocks brokerages on amara raja united spirits dixon technologies and grasim
"['nifty', 'rides', 'with', 'bulls', 'can', 'hit', '24600', 'analysts']",nifty rides with bulls can hit 24600 analysts
"['buy', 'satia', 'industries', 'target', 'price', 'rs', '153', 'hem', 'securities']",buy satia industries target price rs 153 hem securities
"['corporate', 'watch', 'mm', 'tata', 'comm', 'among', '36', 'stocks', 'in', 'spotlight', 'this', 'week']",corporate watch mm tata comm among 36 stocks in spotlight this week
"['kg', 'in', 'june', 'is', 'it', 'setback', 'to', 'rs', '1', 'lakh', 'target', 'in', '2024']",kg in june is it setback to rs 1 lakh target in 2024
"['tour', 'de', 'france', '2024', 'how', 'to', 'watch', 'in', 'us', 'live', 'streaming', 'options', 'a', 'complete', 'guide']",tour de france 2024 how to watch in us live streaming options a complete guide
"['india', 'catching', 'up', 'with', 'china', 'vietnam', 'on', 'phone', 'exports']",india catching up with china vietnam on phone exports
"['as', 'new', 'criminal', 'laws', 'come', 'into', 'effect', 'heres', 'what', 'experts', 'think', 'of', 'their', 'impact', 'on', 'legal', 'system']",as new criminal laws come into effect heres what experts think of their impact on legal system
"['godrej', 'properties', 'buys', 'tdr', 'certificates', 'for', 'gurugram', 'project']",godrej properties buys tdr certificates for gurugram project
"['fintechs', 'secure', 'credit', 'play', 'new', 'jersey', 'turns', 'it', 'hub']",fintechs secure credit play new jersey turns it hub
"['fo', 'radar', 'deploy', 'short', 'strangle', 'in', 'nifty', 'to', 'trade', 'range', 'bound', 'oscillation']",fo radar deploy short strangle in nifty to trade range bound oscillation
"['stocks', 'in', 'news', 'jsw', 'infra', 'stanley', 'lifestyles', 'samhi', 'hotels', 'bank', 'of', 'baroda', 'ireda']",stocks in news jsw infra stanley lifestyles samhi hotels bank of baroda ireda
"['stock', 'radar', 'multibagger', 'alert', 'this', 'power', 'stock', 'doubles', 'in', '1', 'year', 'should', 'investors', 'buy', 'or', 'book', 'profits']",stock radar multibagger alert this power stock doubles in 1 year should investors buy or book profits
"['indiafirst', 'lifes', 'ipo', 'deferred', 'not', 'shelved', 'rushabh', 'gandhi']",indiafirst lifes ipo deferred not shelved rushabh gandhi
"['redevelopment', 'projects', '8', 'common', 'mistakes', 'housing', 'societies', 'make', 'when', 'embarking', 'on', 'redevelopment', 'how', 'to', 'avoid', 'it']",redevelopment projects 8 common mistakes housing societies make when embarking on redevelopment how to avoid it
"['spot', 'financial', 'trends', 'using', 'this', 'ms', 'excel', 'tool', 'and', 'make', 'advanced', 'predictions', 'for', 'investing']",spot financial trends using this ms excel tool and make advanced predictions for investing
"['are', 'diamonds', 'a', 'good', 'investment', 'option']",are diamonds a good investment option
"['bima', 'bharosa', 'portal', 'for', 'insurance', 'grievances', 'step', 'by', 'step', 'process', 'to', 'register', 'an', 'insurance', 'related', 'grievance']",bima bharosa portal for insurance grievances step by step process to register an insurance related grievance
"['retirement', 'income', 'why', 'we', 'need', 'both', 'an', 'income', 'stream', 'and', 'a', 'corpus']",retirement income why we need both an income stream and a corpus
"['change', 'your', 'job', 'search', 'strategy', 'to', 'deal', 'with', 'age', 'bias', 'how', 'to', 'search', 'jobs', 'aligned', 'with', 'age']",change your job search strategy to deal with age bias how to search jobs aligned with age
"['nifty', 'india', 'defence', 'index', '5', 'things', 'to', 'know']",nifty india defence index 5 things to know
"['is', 'your', 'childs', 'foreign', 'education', 'a', 'crucial', 'goal']",is your childs foreign education a crucial goal
"['should', 'you', 'invest', 'or', 'exit', 'the', 'stock', 'market', 'now']",should you invest or exit the stock market now
"['how', 'to', 'save', 'rs', '91000', 'in', 'tax', 'using', 'nps', 'salary', 'perks']",how to save rs 91000 in tax using nps salary perks
"['best', 'approach', 'for', 'self', 'redevelopment', 'of', 'a', 'real', 'estate', 'project', '7', 'things', 'to', 'know']",best approach for self redevelopment of a real estate project 7 things to know
"['what', 'is', 'the', 'difference', 'between', 'deductible', 'co', 'payment', 'in', 'a', 'health', 'insurance', 'policy']",what is the difference between deductible co payment in a health insurance policy
"['i', 'am', 'legally', 'separated', 'from', 'my', 'husband', 'do', 'i', 'have', 'right', 'to', 'wedding', 'jewellery', 'and', 'gifts', 'received', 'as', 'streedhan']",i am legally separated from my husband do i have right to wedding jewellery and gifts received as streedhan
"['jyothy', 'labs', 'stock', 'has', 'earned', '91', 'return', 'in', 'last', 'one', 'year', 'why', 'analysts', 'are', 'bullish']",jyothy labs stock has earned 91 return in last one year why analysts are bullish
"['women', 'better', 'at', 'handling', 'market', 'volatility', 'survey']",women better at handling market volatility survey
"['quant', 'mutual', 'fund', 'probe', 'should', 'you', 'stay', 'invested', 'or', 'exit', 'your', 'investment']",quant mutual fund probe should you stay invested or exit your investment
"['mirae', 'asset', 'large', 'cap', 'mutual', 'fund', 'has', 'underperformed', 'peers', 'benchmark', 'since', '2022', 'what', 'should', 'investors', 'do']",mirae asset large cap mutual fund has underperformed peers benchmark since 2022 what should investors do
"['pre', 'market', 'action', 'heres', 'the', 'trade', 'setup', 'for', 'todays', 'session']",pre market action heres the trade setup for todays session
"['despite', 'ntrs', 'cajoling', 'venkaiah', 'naidu', 'garu', 'stayed', 'with', 'bjp', 'helped', 'it', 'grow', 'in', 'andhra', 'pradesh']",despite ntrs cajoling venkaiah naidu garu stayed with bjp helped it grow in andhra pradesh
"['vcs', 'chase', 'auto', 'parts', 'makers', 'to', 'hitch', 'a', 'ride', 'on', 'ev', 'journey']",vcs chase auto parts makers to hitch a ride on ev journey
"['top', 'fintechs', 'dial', 'nbfcs', 'for', 'secured', 'credit', 'partnerships']",top fintechs dial nbfcs for secured credit partnerships
"['why', 'indian', 'it', 'companies', 'are', 'moving', 'into', 'new', 'jersey']",why indian it companies are moving into new jersey
"['fb', 'quick', 'commerce', 'log', '40', '50', 'sales', 'jump', 'on', 't20', 'final', 'night']",fb quick commerce log 40 50 sales jump on t20 final night
"['its', 'taxing', 'times', 'for', 'electoral', 'bond', 'buyers', 'after', 'supreme', 'courts', 'feb', 'verdict']",its taxing times for electoral bond buyers after supreme courts feb verdict
"['fpi', 'gross', 'buys', 'aum', 'hit', 'all', 'time', 'records', 'in', 'june']",fpi gross buys aum hit all time records in june
"['valuations', 'of', 'some', 'infra', 'stocks', 'at', '2006', '2008', 'high', 'levels']",valuations of some infra stocks at 2006 2008 high levels
"['fresh', 'capital', 'raised', 'via', 'ipos', 'surges', 'to', 'a', '9', 'year', 'high', 'hints', 'at', 'private', 'capex', 'revival']",fresh capital raised via ipos surges to a 9 year high hints at private capex revival
"['us', 'fund', 'platinum', 'acquires', 'inventia', 'health', 'in', 'india', 'foray']",us fund platinum acquires inventia health in india foray
"['the', 'bear', 'season', '4', 'when', 'will', 'the', 'next', 'season', 'release', 'and', 'will', 'camy', 'and', 'sydney', 'get', 'together']",the bear season 4 when will the next season release and will camy and sydney get together
"['in', 'a', 'violent', 'nature', 'when', 'will', 'the', 'horror', 'movie', 'release', 'on', 'netflix']",in a violent nature when will the horror movie release on netflix
"['usmnt', 'vs', 'uruguay', 'copa', 'america', '2024', 'live', 'where', 'and', 'how', 'to', 'watch', 'usas', 'must', 'win', 'match']",usmnt vs uruguay copa america 2024 live where and how to watch usas must win match
"['the', 'bet', 'awards', '2024', 'when', 'and', 'where', 'to', 'watch', 'the', 'cultural', 'extravaganza', 'for', 'free']",the bet awards 2024 when and where to watch the cultural extravaganza for free
"['t20', 'world', 'cup', 'triumph', 'sends', 'indian', 'players', 'valuation', 'soaring']",t20 world cup triumph sends indian players valuation soaring
"['neet', 'ug', 'exam', 'irregularities', 'cbi', 'arrests', 'private', 'school', 'owner', 'from', 'godhra']",neet ug exam irregularities cbi arrests private school owner from godhra
"['corporate', 'tax']",corporate tax
"['budget', '2024', 'gdp', 'gst', 'fiscal', 'deficit', 'forex', 'reserve', 'all', 'about', 'indian', 'union', 'budget', 'rupee', 'value', 'economy', 'news']",budget 2024 gdp gst fiscal deficit forex reserve all about indian union budget rupee value economy news
"['pm', 'modi', 'addresses', 'mann', 'ki', 'baat', 'for', 'the', 'first', 'time', 'in', 'new', 'term', 'here', 'are', 'the', 'key', 'highlights']",pm modi addresses mann ki baat for the first time in new term here are the key highlights
"['india', 'vs', 'sa', 'final', '2024', 'rohit', 'sharma', 'becomes', 'the', 'third', 'captain', 'after', 'kapil', 'dev', 'and', 'ms', 'dhoni', 'to', 'lift', 'icc', 'world', 'cup']",india vs sa final 2024 rohit sharma becomes the third captain after kapil dev and ms dhoni to lift icc world cup
"['fund', 'manager', 'talk', 'higher', 'for', 'longer', 'interest', 'rates', 'can', 'upset', 'bull', 'market', 'mihir', 'vora']",fund manager talk higher for longer interest rates can upset bull market mihir vora
"['majority', 'of', 'us', 'media', 'expect', 'president', 'biden', 'to', 'withdraw', 'from', 'race', 'to', 'save', 'american', 'democracy', 'from', 'trump']",majority of us media expect president biden to withdraw from race to save american democracy from trump
"['rs', 'lop', 'mallikarjun', 'kharge', 'leads', 'oppn', 'mps', 'into', 'well', 'to', 'protest', 'paper', 'leak']",rs lop mallikarjun kharge leads oppn mps into well to protest paper leak
"['neet', 'ug', '2024', 'result', 'ug', 'revised', 'rank', 'out', 'how', 'to', 'check', 'online', 'step', 'by', 'step', 'procedure', 'on', 'exams', 'nta', 'ac', 'in']",neet ug 2024 result ug revised rank out how to check online step by step procedure on exams nta ac in
"['pm', 'modi', 'praises', 'ravindra', 'jadeja', 'thanks', 'him', 'for', 'enthralling', 't20', 'performances']",pm modi praises ravindra jadeja thanks him for enthralling t20 performances
"['cricket', 'legends', 'congratulate', 'champions', 'team', 'india', 'for', 't20', 'world', 'cup', 'glory']",cricket legends congratulate champions team india for t20 world cup glory
"['soon', 'cosmetics', 'will', 'be', 'more', 'transparent', 'to', 'all']",soon cosmetics will be more transparent to all
"['soon', 'cosmetics', 'will', 'be', 'more', 'transparent', 'to', 'all']",soon cosmetics will be more transparent to all
"['go', 'back', 'to', 'schools', 'to', 'root', 'out', 'neet', 'type', 'malaise']",go back to schools to root out neet type malaise
"['these', 'us', 'states', 'make', 'the', 'most', 'from', 'sports', 'betting', 'a', 'complete', 'list']",these us states make the most from sports betting a complete list
"['cji', 'chandrachud', 'underlines', 'constitutional', 'morality', 'as', 'means', 'to', 'preserve', 'indias', 'diversity']",cji chandrachud underlines constitutional morality as means to preserve indias diversity
"['it', 'was', 'a', 'great', 'journey', 'says', 'rahul', 'dravid', 'as', 'he', 'signs', 'off', 'as', 'india', 'coach']",it was a great journey says rahul dravid as he signs off as india coach
"['nothing', 'better', 'than', 'winning', 'the', 'cup', 'and', 'saying', 'goodbye', 'rohit', 'sharma']",nothing better than winning the cup and saying goodbye rohit sharma
"['the', 'stage', 'for', 'indias', 't20', 'triumph', 'was', 'not', 'set', 'in', 'one', 'day', 'rohit', 'co', 'made', 'the', 'blueprint', 'post', '2023', 'world', 'cup', 'setback']",the stage for indias t20 triumph was not set in one day rohit co made the blueprint post 2023 world cup setback
"['personalised', 'learning', 'a', 'way', 'out', 'to', 'fix', 'the', 'problem', 'of', 'unemployable', 'graduates']",personalised learning a way out to fix the problem of unemployable graduates
"['kalki', '2898', 'ad', 'creates', 'box', 'office', 'history', 'prabhas', 'starrer', 'is', 'set', 'to', 'cross', 'rs', '500', 'cr', 'worldwide']",kalki 2898 ad creates box office history prabhas starrer is set to cross rs 500 cr worldwide
"['skys', 'lagaan', 'moment', 'suryakumar', 'yadavs', 'boundary', 'catch', 'swung', 'the', 't20', 'finale', 'in', 'spectacular', 'way']",skys lagaan moment suryakumar yadavs boundary catch swung the t20 finale in spectacular way
"['new', 'head', 'coach', 'to', 'take', 'charge', 'from', 'sri', 'lanka', 'series', 'jay', 'shah']",new head coach to take charge from sri lanka series jay shah
"['t20', 'world', 'cup', 'final', 'sets', 'peak', 'concurrency', 'at', '53', 'million', 'just', 'shy', 'of', 'record', 'high']",t20 world cup final sets peak concurrency at 53 million just shy of record high
"['female', 'worker', 'assaulted', 'alleges', 'bjp', 'ncw', 'team', 'reaches', 'west', 'bengal']",female worker assaulted alleges bjp ncw team reaches west bengal
"['lonavala', 'waterfall', 'tragedy', 'body', 'of', '1', 'of', '2', 'missing', 'children', 'found']",lonavala waterfall tragedy body of 1 of 2 missing children found
"['dmk', 'says', 'tamil', 'nadu', 'first', 'state', 'to', 'unmask', 'neet', 'nation', 'now', 'realises', 'test', 'fraudulent']",dmk says tamil nadu first state to unmask neet nation now realises test fraudulent
"['cs', 'to', 'spot', 'money', 'mules']",cs to spot money mules
"['first', 'time', 'in', 'history', 'says', 'anguished', 'dhankhar', 'on', 'kharge', 'entering', 'rajya', 'sabha', 'well']",first time in history says anguished dhankhar on kharge entering rajya sabha well
"['ril', 'shares', 'can', 'create', 'up', 'to', '100', 'billion', 'wealth', 'predicts', 'morgan', 'stanley']",ril shares can create up to 100 billion wealth predicts morgan stanley
"['deg', 'ifc', 'adb', 'trio', 'eyes', 'renewable', 'energy', 'firm', 'fourth', 'partner']",deg ifc adb trio eyes renewable energy firm fourth partner
"['tight', 'liquidity', 'forces', 'banks', 'to', 'tap', 'debt', 'markets', 'shell', 'out', 'more']",tight liquidity forces banks to tap debt markets shell out more
"['koi', 'ro', 'ko', 'na', 'in', 'triumph', 'and', 'retirement', 'rohit', 'and', 'kohli', 'stick', 'together']",koi ro ko na in triumph and retirement rohit and kohli stick together
"['despair', 'in', 'the', 'air', 'for', 'many', 'voters', 'the', 'biden', 'trump', 'debate', 'means', 'a', 'tough', 'choice', 'just', 'got', 'tougher']",despair in the air for many voters the biden trump debate means a tough choice just got tougher
"['budget', '2024', 'india', 'inflation', 'fy', '2023', '24', 'data', 'check', 'a', 'year', 'before', 'nirmala', 'sitharaman', 'budget', 'key', 'announcements']",budget 2024 india inflation fy 2023 24 data check a year before nirmala sitharaman budget key announcements
"['rise', 'in', 'cyber', 'threats', 'make', 'companies', 'go', 'for', 'unified', 'security', 'command']",rise in cyber threats make companies go for unified security command
"['after', 'quitting', 'alcohol', 'and', 'cigarettes', 'australias', 'former', 'deputy', 'pm', 'barnaby', 'joyce', 'finds', 'life', 'boring']",after quitting alcohol and cigarettes australias former deputy pm barnaby joyce finds life boring
"['rainy', 'days', 'ahead', 'delhi', 'under', 'three', 'day', 'orange', 'alert', 'imd', 'warns']",rainy days ahead delhi under three day orange alert imd warns
"['mobile', 'phone', 'exports', 'india', 'captures', '50', 'share', 'of', 'fall', 'in', 'shipment', 'from', 'china', 'vietnam']",mobile phone exports india captures 50 share of fall in shipment from china vietnam
"['expect', '8', '10', 'industry', 'volume', 'growth', 'for', 'fy', '25', 'mohan', 'bangur', 'shree', 'cement']",expect 8 10 industry volume growth for fy 25 mohan bangur shree cement
"['did', 'a', 'lot', 'of', 'work', 'says', 'maharashtra', 'cm', 'shinde', 'on', 'completion', 'of', '2', 'years', 'of', 'mahayuti', 'government']",did a lot of work says maharashtra cm shinde on completion of 2 years of mahayuti government
"['job', 'applicant', 'asked', 'to', 'dance', 'during', 'interview', 'after', 'listing', 'it', 'as', 'hobby', 'viral', 'video']",job applicant asked to dance during interview after listing it as hobby viral video
"['its', 'not', 'today', 'but', 'hard', 'work', 'of', '3', '4', 'years', 'says', 'emotional', 'rohit', 'sharma', 'after', 't20', 'world', 'cup', 'win', 'against', 'south', 'africa']",its not today but hard work of 3 4 years says emotional rohit sharma after t20 world cup win against south africa
"['from', 'first', 'world', 'cup', 'in', '1983', 'to', '2024', 'here', 'is', 'indias', 'glorious', 'cricketing', 'journey']",from first world cup in 1983 to 2024 here is indias glorious cricketing journey
"['rahul', 'dravid', 'after', 'double', 'dissappintment', 'how', 'the', 'wall', 'helped', 'india', 'scale', 'the', 'world', 'cup', 'summit']",rahul dravid after double dissappintment how the wall helped india scale the world cup summit
"['mann', 'ki', 'baat', 'pm', 'modi', 'thanks', 'voters', 'ec', 'for', 'lok', 'sabha', 'polls']",mann ki baat pm modi thanks voters ec for lok sabha polls
"['godrej', 'properties', 'to', 'develop', '11', 'acre', 'project', 'at', 'pune', 'with', 'revenue', 'potential', 'of', 'rs', '1800', 'cr']",godrej properties to develop 11 acre project at pune with revenue potential of rs 1800 cr
"['nia', 'conducts', 'searches', 'in', 'jks', 'rajouri']",nia conducts searches in jks rajouri
"['first', 'presidential', 'debate', 'verdict', 'did', 'trumps', 'performance', 'earn', 'him', 'a', '1', '0', 'lead', 'over', 'biden']",first presidential debate verdict did trumps performance earn him a 1 0 lead over biden
"['ireda', 'shares', 'surge', 'nearly', '6', 'after', 'sanctioned', 'loans', 'amount', 'jumped', 'nearly', '5', 'times']",ireda shares surge nearly 6 after sanctioned loans amount jumped nearly 5 times
"['tour', 'de', 'france', '2024', 'stage', '2', 'winners', 'yellow', 'jersey', 'leader', 'board', 'who', 'is', 'winning']",tour de france 2024 stage 2 winners yellow jersey leader board who is winning
"['us', 'lawmakers', 'assure', 'hindus', 'against', 'discrimination', 'hinduphobia']",us lawmakers assure hindus against discrimination hinduphobia
"['rahul', 'dravids', 'incredible', 'coaching', 'journey', 'has', 'shaped', 'indian', 'crickets', 'success', 'pm', 'modi', 'as', 'he', 'congratulates', 'team', 'india', 'on', 't20', 'wc', 'win']",rahul dravids incredible coaching journey has shaped indian crickets success pm modi as he congratulates team india on t20 wc win
"['growing', 'clamour', 'for', 'biden', 'to', 'step', 'down', 'he', 'says', 'here', 'to', 'stay', 'to', 'defeat', 'trump']",growing clamour for biden to step down he says here to stay to defeat trump
"['bank', 'holidays', 'in', 'july', '2024', 'banks', 'will', 'be', 'closed', 'for', '12', 'days', 'in', 'july', 'heres', 'the', 'full', 'state', 'wise', 'bank', 'holiday', 'list']",bank holidays in july 2024 banks will be closed for 12 days in july heres the full state wise bank holiday list
"['third', 'eye', 'smoking', 'out', 'the', 'plot', 'difficult', 'to', 'fathom', 'and', 'bamboo', 'business']",third eye smoking out the plot difficult to fathom and bamboo business
"['proactive', 'measures', 'against', 'cyber', 'vulnerabilities', 'are', 'vital', 'heres', 'how', 'companies', 'can', 'get', 'started']",proactive measures against cyber vulnerabilities are vital heres how companies can get started
"['how', 'lifting', 'weights', 'thrice', 'a', 'week', 'can', 'help', 'prevent', 'knee', 'pain', 'as', 'you', 'age']",how lifting weights thrice a week can help prevent knee pain as you age
"['fd', 'interest', 'rate', 'up', 'to', '7', '95', 'punjab', 'and', 'sind', 'bank', 'extends', 'last', 'date', 'of', 'this', 'special', 'fd', 'with', 'higher', 'interest', 'rate']",fd interest rate up to 7 95 punjab and sind bank extends last date of this special fd with higher interest rate
"['couldnt', 'have', 'dreamt', 'of', 'a', 'better', 'day', 'virat', 'kohli', 'on', 'retirement']",couldnt have dreamt of a better day virat kohli on retirement
"['wockhardt', 'shares', 'skyrocket', '18', 'to', 'fresh', '52', 'week', 'high', 'heres', 'why']",wockhardt shares skyrocket 18 to fresh 52 week high heres why
"['india', 'vs', 'south', 'africa', 't20', 'world', 'cup', 'final', 'india', 'held', 'their', 'line', 'breath']",india vs south africa t20 world cup final india held their line breath
"['best', 'shorts', 'for', 'men', 'for', 'style', 'and', 'comfort', 'in', 'budget']",best shorts for men for style and comfort in budget
"['mallikarjun', 'kharge', 'says', 'he', 'was', 'forced', 'to', 'go', 'to', 'the', 'well', 'to', 'get', 'chairman', 'dhankhars', 'attention']",mallikarjun kharge says he was forced to go to the well to get chairman dhankhars attention
"['sjvn', 'to', 'supply', '4500', 'mw', 'green', 'energy', 'to', 'am', 'greens', 'green', 'ammonia', 'facilities']",sjvn to supply 4500 mw green energy to am greens green ammonia facilities
"['delhi', 'police', 'register', 'case', 'after', 'aimim', 'chief', 'owaisi', 'files', 'complaint', 'about', 'vandalism', 'at', 'his', 'residence']",delhi police register case after aimim chief owaisi files complaint about vandalism at his residence
"['hardik', 'pandya', 'scripts', 'a', 'redemption', 'story', 'like', 'no', 'other', 'comes', 'in', 'clutch', 'to', 'help', 'india', 'win', 'second', 't20', 'world', 'cup']",hardik pandya scripts a redemption story like no other comes in clutch to help india win second t20 world cup
"['oil', 'india', '12', 'bonus', 'issue', 'last', 'day', 'today', 'to', 'buy', 'shares', 'to', 'qualify', 'before', 'record', 'date']",oil india 12 bonus issue last day today to buy shares to qualify before record date
"['heatwaves', 'burn', 'a', 'hole', 'in', 'hotels', 'revenue', 'growth']",heatwaves burn a hole in hotels revenue growth
"['for', 'peoples', 'man', 'challa', 'sreenivasulu', 'setty', 'the', 'challenge', 'is', 'to', 'take', 'high', 'flying', 'sbi', 'to', 'newer', 'heights']",for peoples man challa sreenivasulu setty the challenge is to take high flying sbi to newer heights
"['caught', 'on', 'camera', 'rahul', 'dravids', 'heartfelt', 'moment', 'with', 'virat', 'kohli', 'steals', 't20', 'world', 'cup', 'show']",caught on camera rahul dravids heartfelt moment with virat kohli steals t20 world cup show
"['awfis', 'plans', 'to', 'raise', 'seats', 'by', '50', 'in', 'fy25']",awfis plans to raise seats by 50 in fy25
"['delhi', 'police', 'ready', 'to', 'implement', 'new', 'criminal', 'laws', 'which', 'come', 'into', 'effect', 'on', 'july', '1']",delhi police ready to implement new criminal laws which come into effect on july 1
"['incomplete', 'transmission', 'could', 'delay', 'rate', 'reversal']",incomplete transmission could delay rate reversal
"['skoda', 'eyeing', 'local', 'equity', 'partnership', 'amid', 'electric', 'shift']",skoda eyeing local equity partnership amid electric shift
"['cm', 'naidu', 'to', 'raise', 'budget', 'specific', 'demands', 'in', 'meeting', 'with', 'pm', 'fm']",cm naidu to raise budget specific demands in meeting with pm fm
"['us', 'military', 'bases', 'in', 'europe', 'on', 'high', 'alert', 'amid', 'terror', 'threat', 'concerns']",us military bases in europe on high alert amid terror threat concerns
"['centre', 'extends', 'validity', 'of', 'fcra', 'registration', 'of', 'ngos', 'till', 'september', '30']",centre extends validity of fcra registration of ngos till september 30
"['delhi', 'faces', 'rain', 'fury', 'records', 'highest', 'rainfall', 'in', '88', 'years']",delhi faces rain fury records highest rainfall in 88 years
"['excise', 'policy', 'case', 'arvind', 'kejriwal', 'moves', 'delhi', 'hc', 'challenging', 'arrest', 'by', 'cbi']",excise policy case arvind kejriwal moves delhi hc challenging arrest by cbi
