headlines,headline_text
"['shark', 'tank', 'india', 'judge', 'anupam', 'mittal', 'criticises', 'indigo', 'for', 'inhumane', 'treatment', 'of', 'passengers', 'heres', 'how', 'the', 'airline', 'rensponded']",shark tank india judge anupam mittal criticises indigo for inhumane treatment of passengers heres how the airline rensponded
"['dartmouth', 'college', 'becomes', 'first', 'ivy', 'league', 'university', 'to', 'reinstate', 'sat', 'requirement', 'for', 'applicants']",dartmouth college becomes first ivy league university to reinstate sat requirement for applicants
"['mallika', 'srinivasan', 'steps', 'down', 'as', 'swiggys', 'independent', 'director']",mallika srinivasan steps down as swiggys independent director
"['valentines', 'day', 'want', 'to', 'chat', 'up', 'your', 'tinder', 'crush', 'follow', 'this', 'guide', 'of', 'in', 'app', 'behaviour']",valentines day want to chat up your tinder crush follow this guide of in app behaviour
"['window', 'to', 'book', 'fds', 'at', 'current', 'higher', 'interest', 'rates', 'shrinks', 'as', 'rbi', 'holds', 'repo', 'rate', 'what', 'fd', 'investors', 'should', 'do', 'now']",window to book fds at current higher interest rates shrinks as rbi holds repo rate what fd investors should do now
"['rbi', 'mpc', 'meeting', 'at', 'a', 'glance', 'repo', 'rate', 'policy', 'stance', 'what', 'monetary', 'policy', 'means', 'for', 'you', 'key', 'points', 'from', 'rbi', 'policy']",rbi mpc meeting at a glance repo rate policy stance what monetary policy means for you key points from rbi policy
"['rashi', 'peripherals', 'ipo', 'issue', 'subscribed', '1', '17', 'times', 'so', 'far', 'on', 'day', '2', 'check', 'gmp', 'other', 'details']",rashi peripherals ipo issue subscribed 1 17 times so far on day 2 check gmp other details
"['rbi', 'mpc', 'meeting', 'rbi', 'paytm', 'notice', 'reserve', 'bank', 'of', 'india', 'gives', 'a', 'must', 'do', 'list', 'for', 'financial', 'institutions', 'amid', 'paytm', 'crisis']",rbi mpc meeting rbi paytm notice reserve bank of india gives a must do list for financial institutions amid paytm crisis
"['sidbi', 'et', 'msme', 'conclave', 'fifth', 'session', 'in', 'rajkot', 'to', 'focus', 'on', 'the', 'states', 'technology', 'integration', 'and', 'innovation']",sidbi et msme conclave fifth session in rajkot to focus on the states technology integration and innovation
"['hope', 'congress', 'gets', 'at', 'least', '40', 'seats', 'even', 'though', 'some', 'in', 'west', 'bengal', 'claim', 'they', 'cannot', 'pm', 'modi', 'in', 'rajya', 'sabha']",hope congress gets at least 40 seats even though some in west bengal claim they cannot pm modi in rajya sabha
"['q3', 'results', 'today', 'zomato', 'lic', 'grasim', 'among', '270', 'companies', 'to', 'announce', 'earnings']",q3 results today zomato lic grasim among 270 companies to announce earnings
"['rbi', 'holds', 'rates', 'monetary', 'stance', 'change', 'rate', 'cuts', 'must', 'wait']",rbi holds rates monetary stance change rate cuts must wait
"['valentines', 'day', 'combo', 'gifts', 'for', 'your', 'special', 'someone']",valentines day combo gifts for your special someone
"['amazon', 'laptop', 'days', 'up', 'to', 'rs', '35000', 'off', 'on', 'best', 'selling', 'laptops', 'of', 'all', 'time']",amazon laptop days up to rs 35000 off on best selling laptops of all time
"['itc', 'stock', 'slumps', '4', 'after', 'bat', 'reiterates', 'intention', 'to', 'sell', 'partial', 'stake']",itc stock slumps 4 after bat reiterates intention to sell partial stake
"['park', 'hotels', 'ipo', 'check', 'status', 'gmp', 'listing', 'date', 'and', 'other', 'details']",park hotels ipo check status gmp listing date and other details
"['reducing', 'debt', 'burden', 'necessary', 'to', 'create', 'fiscal', 'space', 'for', 'investment', 'in', 'priority', 'areas', 'rbi', 'guv', 'das']",reducing debt burden necessary to create fiscal space for investment in priority areas rbi guv das
"['tata', 'tiago', 'tigor', 'cng', 'automatic', 'variants', 'starting', 'rs', '7', '9', 'lakh', 'launched', 'here', 'are', 'price', 'specification', 'booking', 'details']",tata tiago tigor cng automatic variants starting rs 7 9 lakh launched here are price specification booking details
"['amazon', 'sale', 'get', 'up', 'to', '55', 'off', 'on', 'smart', 'tvs', 'from', 'leading', 'brands']",amazon sale get up to 55 off on smart tvs from leading brands
"['aponyx', 'electric', 'vehicles', 'to', 'launch', 'electric', 'scooters', 'and', 'bikes', 'in', 'india']",aponyx electric vehicles to launch electric scooters and bikes in india
"['pm', 'modi', 'lauds', 'manmohan', 'singhs', 'contribution', 'to', 'rajya', 'sabha', 'likens', 'congress', 'black', 'paper', 'to', 'kaala', 'teeka']",pm modi lauds manmohan singhs contribution to rajya sabha likens congress black paper to kaala teeka
"['anand', 'mahindra', 'meets', 'real', 'life', 'inspirations', 'behind', 'vikrant', 'masseys', '12th', 'fail', 'heres', 'what', 'the', 'billionaire', 'did', 'next']",anand mahindra meets real life inspirations behind vikrant masseys 12th fail heres what the billionaire did next
"['jasprit', 'bumrah', 'bowls', 'a', 'yorker', 'at', 'critics', 'after', 'becoming', 'no', '1', 'ranked', 'test', 'bowler']",jasprit bumrah bowls a yorker at critics after becoming no 1 ranked test bowler
"['busting', 'myths', 'and', 'shattering', 'stereotypes', 'steering', 'stigma', 'free', 'diabetes', 'care']",busting myths and shattering stereotypes steering stigma free diabetes care
"['mandatory', 'quality', 'control', 'norms', 'for', '70', 'sizes', 'types', 'of', 'tyres', 'from', 'next', 'year']",mandatory quality control norms for 70 sizes types of tyres from next year
"['lic', 'q3', 'results', 'today', 'what', 'to', 'expect', 'from', 'the', 'state', 'owned', 'insurance', 'behemoth']",lic q3 results today what to expect from the state owned insurance behemoth
"['groww', 'mutual', 'fund', 'launches', 'groww', 'nifty', 'smallcap', '250', 'index', 'fund']",groww mutual fund launches groww nifty smallcap 250 index fund
"['india', 'consumption', 'story', 'driving', 'mall', 'operators', 'warehousing', 'players', 'growth', 'icra']",india consumption story driving mall operators warehousing players growth icra
"['for', 'volatile', 'market', 'conditions', '5', 'largecap', 'stocks', 'from', 'different', 'sectors', 'with', 'upside', 'potential', 'of', 'up', 'to', '25']",for volatile market conditions 5 largecap stocks from different sectors with upside potential of up to 25
"['rbi', 'mpc', 'meet', 'highlights', '8', 'february', '2024', 'reserve', 'bank', 'of', 'india', 'governor', 'shaktikanta', 'das', 'speech', 'pointers', 'das', 'and', 'cos', 'status', 'quo', 'to', 'a', 'likely', 'alternate', 'for', 'otps']",rbi mpc meet highlights 8 february 2024 reserve bank of india governor shaktikanta das speech pointers das and cos status quo to a likely alternate for otps
"['mpc', 'meet', 'rbis', 'repo', 'rate', 'pause', 'growth', 'outlook', 'likely', 'to', 'help', 'sustain', 'housing', 'momentum']",mpc meet rbis repo rate pause growth outlook likely to help sustain housing momentum
"['orient', 'growth', 'ventures', 'closes', 'india', 'and', 'south', 'east', 'asia', 'fund', 'at', '90', 'million']",orient growth ventures closes india and south east asia fund at 90 million
"['paytm', 'mat', 'karo', 'say', '3', 'of', '5', 'kiranas', 'boarding', 'its', 'rivals', 'study']",paytm mat karo say 3 of 5 kiranas boarding its rivals study
"['rbi', 'governor', 'not', 'creating', 'any', 'space', 'for', 'a', 'rate', 'cut', 'soon', 'abheek', 'barua']",rbi governor not creating any space for a rate cut soon abheek barua
"['amazon', 'blockbuster', 'value', 'days', 'up', 'to', '70', 'off', 'on', 'laptops', 'smartwatches', 'headphones', 'and', 'more']",amazon blockbuster value days up to 70 off on laptops smartwatches headphones and more
"['ceo', 'philippe', 'schaus', 'talks', 'about', 'mot', 'hennessys', 'success', 'in', 'indias', 'wine', 'and', 'spirits', 'market']",ceo philippe schaus talks about mot hennessys success in indias wine and spirits market
"['fo', 'stocks', 'tata', 'consumer', 'can', 'fin', 'home', 'among', '5', 'stocks', 'with', 'short', 'buildup']",fo stocks tata consumer can fin home among 5 stocks with short buildup
"['fo', 'stocks', 'trent', 'canara', 'bank', 'among', '5', 'stocks', 'with', 'long', 'buildup']",fo stocks trent canara bank among 5 stocks with long buildup
"['amazon', 'sale', 'last', 'day', 'today', 'shop', 'now', 'your', 'favourites']",amazon sale last day today shop now your favourites
"['rbi', 'mpc', 'gold', 'price', 'hedging', 'on', 'ifsc', 'to', 'augur', 'well', 'for', 'industry', 'traders', 'say', 'experts']",rbi mpc gold price hedging on ifsc to augur well for industry traders say experts
"['trent', 'shares', 'surge', '23', 'in', 'two', 'sessions', 'on', 'strong', 'q3', 'results', 'should', 'you', 'but', 'at', 'current', 'levels']",trent shares surge 23 in two sessions on strong q3 results should you but at current levels
"['rbi', 'mpc', 'meet', 'j', 'r', 'varma', 'dissents', 'on', 'both', 'rate', 'and', 'stance', 'decision', 'this', 'time']",rbi mpc meet j r varma dissents on both rate and stance decision this time
"['yes', 'bank', 'shares', 'rally', 'for', '3rd', 'straight', 'session', 'extend', 'gains', 'to', '43']",yes bank shares rally for 3rd straight session extend gains to 43
"['zomato', 'q3', 'results', 'today', 'will', 'profits', 'improve', 'further', 'heres', 'what', 'to', 'expect']",zomato q3 results today will profits improve further heres what to expect
"['business', 'firing', 'on', 'all', 'cylinders', 'adding', 'new', 'engines', 'of', 'growth', 'sunil', 'dsouza', 'tcpl']",business firing on all cylinders adding new engines of growth sunil dsouza tcpl
"['demand', 'for', 'warehouse', 'space', 'in', 'tier', 'ii', 'cities', 'on', 'the', 'rise', 'report']",demand for warehouse space in tier ii cities on the rise report
"['dpiit', 'stand', 'may', 'pave', 'way', 'for', 'starlinks', 'india', 'satcom', 'entry']",dpiit stand may pave way for starlinks india satcom entry
"['veteran', 'industry', 'executives', 'launch', 'all', 'things', 'people', 'to', 'facilitate', 'organisational', 'transformation']",veteran industry executives launch all things people to facilitate organisational transformation
"['shiba', 'inu', 'shib', 'millionaire', 'reveals', 'three', '100x', 'microcaps']",shiba inu shib millionaire reveals three 100x microcaps
"['can', 'better', 'data', 'protect', 'fashion', 'workers', 'from', 'climate', 'risks']",can better data protect fashion workers from climate risks
"['ucc', 'panel', 'studied', 'reforms', 'in', 'muslim', 'majority', 'nations']",ucc panel studied reforms in muslim majority nations
"['these', 'midcap', 'stocks', 'with', 'strong', 'buy', 'buy', 'recos', 'can', 'rally', 'over', '20', 'according', 'to', 'analysts']",these midcap stocks with strong buy buy recos can rally over 20 according to analysts
"['indias', 'clean', 'energy', 'boom', 'slows', 'as', 'new', 'solar', 'projects', 'get', 'delayed', 'experts', 'say', 'it', 'can', 'pick', 'back', 'up']",indias clean energy boom slows as new solar projects get delayed experts say it can pick back up
"['rbi', 'hikes', 'gdp', 'growth', 'projection', 'for', 'fy24', 'to', '7', '3', 'keeps', 'rates', 'stance', 'unchanged']",rbi hikes gdp growth projection for fy24 to 7 3 keeps rates stance unchanged
"['ratan', 'tatas', 'new', '24x7', 'animal', 'hospital', 'opening', 'soon', 'when', 'and', 'where']",ratan tatas new 24x7 animal hospital opening soon when and where
"['power', 'grid', 'shares', 'jump', '7', 'break', 'two', 'session', 'losing', 'streak', 'heres', 'why']",power grid shares jump 7 break two session losing streak heres why
"['nifty', 'sensex', 'sees', 'sharp', 'slide', 'after', 'rbi', 'credit', 'policy']",nifty sensex sees sharp slide after rbi credit policy
"['quite', 'bullish', 'and', 'overweight', 'on', 'pharma', 'stocks', 'vikas', 'khemani']",quite bullish and overweight on pharma stocks vikas khemani
"['suvita', 'real', 'estates', 'plans', 'ncd', 'issue', 'to', 'raise', 'rs', '105', 'cr']",suvita real estates plans ncd issue to raise rs 105 cr
"['voda', 'idea', 'opposes', 'reliance', 'jios', 'suggestion', 'to', 'phase', 'out', '2g', '3g', 'networks']",voda idea opposes reliance jios suggestion to phase out 2g 3g networks
"['despite', 'turbulence', 'now', 'global', 'growth', 'to', 'remain', 'steady', 'in', '2024', 'das', 'at', 'mpc']",despite turbulence now global growth to remain steady in 2024 das at mpc
"['hyderabad', 'bengaluru', 'are', 'hotter', 'than', 'usual', 'and', 'there', 'is', 'a', 'weather', 'warning', 'for', 'both', 'the', 'it', 'cities']",hyderabad bengaluru are hotter than usual and there is a weather warning for both the it cities
"['ongc', 'oil', 'india', 'shine', 'among', 'omcs', 'wont', 'make', 'money', 'by', 'blindly', 'buying', 'psu', 'stocks', 'at', 'this', 'level', 'chakri', 'lokapriya']",ongc oil india shine among omcs wont make money by blindly buying psu stocks at this level chakri lokapriya
"['unleash', 'culinary', 'excellence', 'elevate', 'your', 'kitchen', 'with', 'the', 'best', 'cooktops', '2023']",unleash culinary excellence elevate your kitchen with the best cooktops 2023
"['depository', 'services', 'player', 'and', 'a', 'pharma', 'stock', 'offer', '6', '7', 'gains']",depository services player and a pharma stock offer 6 7 gains
"['these', 'auto', 'sector', 'stocks', 'can', 'deliver', 'more', 'than', '17', 'return', 'in', 'next', 'one', 'year']",these auto sector stocks can deliver more than 17 return in next one year
"['retail', 'investors', 'sold', 'stocks', 'worth', 'rs', '12000', 'crore', 'in', 'q3', 'hdfc', 'bank', 'among', 'top', '10', 'sells']",retail investors sold stocks worth rs 12000 crore in q3 hdfc bank among top 10 sells
"['johnny', 'depp', 'replaced', 'by', 'ayo', 'edebiri', 'in', 'pirates', 'of', 'the', 'caribbean', '6', 'outraged', 'fans', 'threaten', 'boycott']",johnny depp replaced by ayo edebiri in pirates of the caribbean 6 outraged fans threaten boycott
"['punjab', 'govt', 'pays', 'banks', '1426', 'crore', 'to', 'complete', 'takeover', 'of', 'gvk', 'powers', 'facility']",punjab govt pays banks 1426 crore to complete takeover of gvk powers facility
"['supply', 'chain', 'finance', 'market', 'set', 'to', 'see', 'explosive', 'growth', 'as', 'use', 'of', 'data', 'becomes', 'common', 'veefin', 'solutions']",supply chain finance market set to see explosive growth as use of data becomes common veefin solutions
"['best', 'large', 'mid', 'cap', 'funds', 'to', 'invest', 'in', '2024']",best large mid cap funds to invest in 2024
"['buy', 'birla', 'corporation', 'target', 'price', 'rs', '1800', 'motilal', 'oswalnbsp']",buy birla corporation target price rs 1800 motilal oswalnbsp
"['grams', 'in', 'opening', 'trade', 'buy', 'sell', 'or', 'hold']",grams in opening trade buy sell or hold
"['sanjiv', 'bhasin', 'says', 'add', 'trent', 'on', 'dips', 'points', 'to', 'a', 'dark', 'horse', 'which', 'is', 'a', 'must', 'have', 'in', 'portfolio']",sanjiv bhasin says add trent on dips points to a dark horse which is a must have in portfolio
"['fundamental', 'radar', 'why', 'is', 'yatra', 'online', 'placed', 'well', 'to', 'see', 'a', 'reversal', 'in', 'fortunes']",fundamental radar why is yatra online placed well to see a reversal in fortunes
"['sensex', 'climbs', '200', 'points', 'ahead', 'of', 'rbi', 'mpc', 'outcome', 'nifty', 'holds', '22k']",sensex climbs 200 points ahead of rbi mpc outcome nifty holds 22k
"['how', 'many', 'times', 'can', 'you', 'do', 'partial', 'withdrawal', 'from', 'nps', 'what', 'are', 'the', 'rules', 'arnav', 'pandya', 'explains']",how many times can you do partial withdrawal from nps what are the rules arnav pandya explains
"['controls', 'in', 'place', 'to', 'avoid', 'loans', 'to', 'npa', 'customers', 'jana', 'sfb', 'ceo', 'ajay', 'kanwal']",controls in place to avoid loans to npa customers jana sfb ceo ajay kanwal
"['fo', 'ban', 'list', 'delta', 'corp', 'upl', 'among', '10', 'stocks', 'under', 'trade', 'ban', 'on', 'thursday']",fo ban list delta corp upl among 10 stocks under trade ban on thursday
"['buy', 'manappuram', 'finance', 'target', 'price', 'rs', '230', 'motilal', 'oswal']",buy manappuram finance target price rs 230 motilal oswal
"['vinit', 'bolinjkar', 'on', '3', 'sectors', 'that', 'will', 'create', 'momentum', 'going', 'ahead']",vinit bolinjkar on 3 sectors that will create momentum going ahead
"['target', 'hm', 'hyosung', 'corp', 'among', '3000', 'cos', 'to', 'participate', 'in', 'bharat', 'tex']",target hm hyosung corp among 3000 cos to participate in bharat tex
"['fo', 'stocks', 'to', 'buy', 'today', 'maruti', 'sbi', 'among', 'top', '9', 'trading', 'ideas', 'for', '8', 'february', '2024']",fo stocks to buy today maruti sbi among top 9 trading ideas for 8 february 2024
"['gujjar', 'bakerwal', 'community', 'in', 'jk', 'slams', 'bjp', 'govt', 'for', 'inclusion', 'of', 'paharis', 'in', 'schedule', 'tribe', 'term', 'it', 'as', 'murder', 'of', 'idea', 'of', 'social', 'justice']",gujjar bakerwal community in jk slams bjp govt for inclusion of paharis in schedule tribe term it as murder of idea of social justice
"['buy', 'trent', 'target', 'price', 'rs', '4200', 'motilal', 'oswal']",buy trent target price rs 4200 motilal oswal
"['hot', 'stocks', 'brokerages', 'view', 'on', 'trent', 'nazara', 'technologies', 'nestle', 'and', 'jb', 'pharma']",hot stocks brokerages view on trent nazara technologies nestle and jb pharma
"['india', 'is', 'scorning', 'the', 'energy', 'bounty', 'that', 'transformed', 'china']",india is scorning the energy bounty that transformed china
"['buy', 'brigade', 'enterprises', 'target', 'price', 'rs', '1250', 'motilal', 'oswal']",buy brigade enterprises target price rs 1250 motilal oswal
"['indias', 'true', 'manufacturing', 'rival', 'is', 'vietnam', 'not', 'china']",indias true manufacturing rival is vietnam not china
"['buy', 'computer', 'age', 'management', 'services', 'target', 'price', 'rs', '3450', 'motilal', 'oswal']",buy computer age management services target price rs 3450 motilal oswal
"['buy', 'endurance', 'technologies', 'target', 'price', 'rs', '2275', 'motilal', 'oswal']",buy endurance technologies target price rs 2275 motilal oswal
"['10', 'budget', 'from', 'modi', 'govt', 'renewable', 'good', 'theme', 'for', 'next', '10', 'years', 'naveen', 'kulkarni']",10 budget from modi govt renewable good theme for next 10 years naveen kulkarni
"['one', 'year', 'later', 'gautam', 'adanis', 'fortune', 'hits', '100', 'billion', 'again']",one year later gautam adanis fortune hits 100 billion again
"['kapil', 'sharma', 'cheating', 'case', 'comedian', 'claims', 'car', 'designer', 'dilip', 'chhabria', 'tried', 'to', 'extract', 'money', 'illegally']",kapil sharma cheating case comedian claims car designer dilip chhabria tried to extract money illegally
"['big', 'movers', 'on', 'd', 'street', 'what', 'should', 'investors', 'do', 'with', 'eih', 'gensol', 'engineering', 'and', 'trent']",big movers on d street what should investors do with eih gensol engineering and trent
"['this', '16th', 'century', 'soothsayer', 'predicted', 'that', 'king', 'charless', 'reign', 'would', 'be', 'cut', 'short', 'by', 'a', 'grim', 'cancer', 'diagnosis']",this 16th century soothsayer predicted that king charless reign would be cut short by a grim cancer diagnosis
"['paytm', 'money', 'kyc', 'process', 'under', 'review', 'satya', 'nadella', 'on', 'indias', 'ai', 'potential']",paytm money kyc process under review satya nadella on indias ai potential
"['stocks', 'in', 'news', 'zomato', 'lic', 'tata', 'consumer', 'piramal', 'pharma', 'bpcl']",stocks in news zomato lic tata consumer piramal pharma bpcl
"['microsoft', 'to', 'train', '2', 'million', 'in', 'india', 'for', 'ai', 'jobs']",microsoft to train 2 million in india for ai jobs
"['pre', 'market', 'action', 'heres', 'the', 'trade', 'setup', 'for', 'todays', 'session']",pre market action heres the trade setup for todays session
"['fm', 'nirmala', 'sitharaman', 'says', 'reassuring', 'measures', 'being', 'taken', 'to', 'lower', 'debt', 'to', 'gdp', 'ratio']",fm nirmala sitharaman says reassuring measures being taken to lower debt to gdp ratio
"['ather', 'cfo', 'deepak', 'jain', 'steps', 'down', 'sohil', 'parekh', 'named', 'successor']",ather cfo deepak jain steps down sohil parekh named successor
"['propose', 'day', '2024', 'history', 'significance', 'and', 'how', 'you', 'can', 'make', 'the', 'day', 'special']",propose day 2024 history significance and how you can make the day special
"['congress', 'aap', 'of', 'india', 'bloc', 'hit', 'new', 'hurdle', 'on', 'seat', 'sharing']",congress aap of india bloc hit new hurdle on seat sharing
"['from', 'rajasthans', 'small', 'village', 'to', 'bollywood', 'barmer', 'girls', 'aakhir', 'palayan', 'kab', 'tak', 'to', 'debut', 'next', 'week']",from rajasthans small village to bollywood barmer girls aakhir palayan kab tak to debut next week
"['rbi', 'steps', 'up', 'auctions', 'to', 'drain', 'liquidity']",rbi steps up auctions to drain liquidity
"['analysts', 'pare', 'navin', 'fluorines', 'price', 'targets', 'on', 'weak', 'q3', 'show']",analysts pare navin fluorines price targets on weak q3 show
"['happy', 'propose', 'day', '2024', 'best', 'wishes', 'images', 'messages', 'quotes', 'facebook', 'post', 'instagram', 'story', 'to', 'purpose', 'your', 'love']",happy propose day 2024 best wishes images messages quotes facebook post instagram story to purpose your love
"['borrow', 'more', 'buy', 'more', 'credit', 'still', 'king', 'of', 'shopper', 'street']",borrow more buy more credit still king of shopper street
"['stock', 'radar', 'long', 'term', 'pick', 'dcw', 'breaks', 'out', 'of', '16', 'year', 'channel', 'pattern', 'may', 'double', 'in', '2', 'years']",stock radar long term pick dcw breaks out of 16 year channel pattern may double in 2 years
"['life', 'insurers', 'see', '27', 'rise', 'in', 'new', 'policy', 'premiums']",life insurers see 27 rise in new policy premiums
"['irb', 'infra', 'in', 'talks', 'to', 'tap', 'overseas', 'bond', 'market']",irb infra in talks to tap overseas bond market
"['likely', 'buyers', 'eye', 'fresh', 'kyc', 'of', 'paytm', 'merchants']",likely buyers eye fresh kyc of paytm merchants
"['government', 'launches', 'pilot', 'in', 'himachal', 'pradesh', 'to', 'onboard', 'fair', 'price', 'shops', 'on', 'ondc']",government launches pilot in himachal pradesh to onboard fair price shops on ondc
"['consumer', 'awareness', 'social', 'media', 'put', 'healthy', 'snack', 'brands', 'on', 'growth', 'path']",consumer awareness social media put healthy snack brands on growth path
"['cdsl', 'reviews', 'paytm', 'money', 'kyc', 'process']",cdsl reviews paytm money kyc process
"['top', 'broker', 'bodies', 'differ', 'over', 'plan', 'to', 'extend', 'trading', 'hours']",top broker bodies differ over plan to extend trading hours
"['gross', 'equity', 'investments', 'by', 'domestic', 'funds', 'at', 'record', 'high', 'in', 'january']",gross equity investments by domestic funds at record high in january
"['sbi', 'energys', 'nfo', 'suited', 'for', 'aggressive', 'investors']",sbi energys nfo suited for aggressive investors
"['fpis', 'sell', 'over', 'rs', '31000', 'crore', 'shares', 'of', 'financial', 'services', 'buy', 'it', 'again']",fpis sell over rs 31000 crore shares of financial services buy it again
"['tiger', 'woods', 'announces', 'comeback', 'to', 'pga', 'tour', 'event', 'check', 'date', 'schedule']",tiger woods announces comeback to pga tour event check date schedule
"['barbie', 'star', 'margot', 'robbies', 'next', 'movie', 'announced', 'details', 'here']",barbie star margot robbies next movie announced details here
"['uttarakhand', 'gets', 'a', 'uniform', 'civil', 'law']",uttarakhand gets a uniform civil law
"['hazbin', 'hotel', 'season', '2', 'this', 'is', 'what', 'creator', 'vivienne', 'medrano', 'has', 'to', 'say', 'about', 'release', 'date']",hazbin hotel season 2 this is what creator vivienne medrano has to say about release date
"['meesho', 'launches', 'logistics', 'vertical', 'valmo', 'to', 'charge', 'under', 'a', 'rupee', 'per', 'order', 'for', 'services']",meesho launches logistics vertical valmo to charge under a rupee per order for services
"['ghosts', 'season', '3', 'cbs', 'set', 'to', 'haunt', 'screens', 'with', 'release', 'date', 'and', 'plot', 'intrigues', 'when', 'and', 'where', 'to', 'watch']",ghosts season 3 cbs set to haunt screens with release date and plot intrigues when and where to watch
"['bihar', 'cm', 'nitish', 'calls', 'on', 'pm', 'modi', 'amit', 'shah', 'nadda', 'before', 'trust', 'vote']",bihar cm nitish calls on pm modi amit shah nadda before trust vote
"['special', 'ops', 'lioness', 'season', '2', 'check', 'out', 'what', 'we', 'know', 'about', 'taylor', 'sheridans', 'action', 'packed', 'series']",special ops lioness season 2 check out what we know about taylor sheridans action packed series
"['erika', 'jaynes', 'bet', 'it', 'all', 'on', 'blonde', 'the', 'spin', 'off', 'documentary', 'series', 'of', 'real', 'housewives', 'release', 'date', 'and', 'trailer', 'everything', 'you', 'need', 'to', 'know']",erika jaynes bet it all on blonde the spin off documentary series of real housewives release date and trailer everything you need to know
"['netflixs', 'berlin', 'season', '2', 'this', 'is', 'what', 'we', 'know', 'so', 'far']",netflixs berlin season 2 this is what we know so far
"['time', 'to', 'start', 'buying', 'into', 'v', 'mart', 'hold', 'on', 'to', 'mankind', 'pharma', 'chakri', 'lokapriya']",time to start buying into v mart hold on to mankind pharma chakri lokapriya
"['crypto', 'price', 'on', 'february', '8', 'bitcoin', 'jumps', 'above', '44400', 'solana', 'cardano', 'gain', 'up', 'to', '6']",crypto price on february 8 bitcoin jumps above 44400 solana cardano gain up to 6
"['did', 'prince', 'harry', 'visit', 'king', 'charles', 'after', 'his', 'cancer', 'diagnosis', 'without', 'meghan', 'markle']",did prince harry visit king charles after his cancer diagnosis without meghan markle
