headlines,headline_text
"['relationship', 'with', 'us', 'very', 'critical', 'for', 'india', 'to', 'grow', 'into', 'a', 'fully', 'developed', 'economy', 'by', '2047', 'amitabh', 'kant']",relationship with us very critical for india to grow into a fully developed economy by 2047 amitabh kant
"['financial', 'services', 'and', 'pharma', 'to', 'drive', 'piramal', 'groups', 'next', 'growth', 'phase', 'ajay', 'piramal']",financial services and pharma to drive piramal groups next growth phase ajay piramal
"['oversupply', 'and', 'unsustainable', 'pricing', 'weighing', 'on', 'cement', 'sector', 'outlook', 'sandip', 'sabharwal']",oversupply and unsustainable pricing weighing on cement sector outlook sandip sabharwal
"['israeli', 'airstrikes', 'disrupt', 'hamas', 'plot', 'to', 'hijack', 'humanitarian', 'convoys']",israeli airstrikes disrupt hamas plot to hijack humanitarian convoys
"['malls', 'feel', 'the', 'chill', 'as', 'brands', 'start', 'winter', 'sale', 'early']",malls feel the chill as brands start winter sale early
"['insurance', 'sale', 'at', 'parent', 'banks', 'worries', 'regulator']",insurance sale at parent banks worries regulator
"['mi', 'signs', '120', 'crore', 'jersey', 'deal', 'with', 'lauritz', 'knudsen']",mi signs 120 crore jersey deal with lauritz knudsen
"['pc', 'jeweller', 'shares', 'to', 'trade', 'ex', 'split', 'on', 'monday', 'last', 'day', 'to', 'buy', 'for', 'eligibility']",pc jeweller shares to trade ex split on monday last day to buy for eligibility
"['abolish', 'devanhalli', 'toll', 'why', 'this', 'discrimination', 'against', 'bengaluru', 'says', 'mohandas', 'pai']",abolish devanhalli toll why this discrimination against bengaluru says mohandas pai
"['french', 'president', 'emmanuel', 'macron', 'to', 'announce', 'new', 'prime', 'minister', 'today']",french president emmanuel macron to announce new prime minister today
"['karthigai', 'deepam', '2024', 'date', 'auspicious', 'timings', 'puja', 'rituals', 'and', 'spiritual', 'importance']",karthigai deepam 2024 date auspicious timings puja rituals and spiritual importance
"['stocks', 'to', 'buy', 'today', 'ultratech', 'dmart', 'and', 'bajaj', 'auto', 'on', 'investors', 'radar']",stocks to buy today ultratech dmart and bajaj auto on investors radar
"['paraguayan', 'president', 'santiago', 'pena', 'inaugurates', 'jerusalem', 'embassy']",paraguayan president santiago pena inaugurates jerusalem embassy
"['stock', 'radar', 'bse', 'nearly', 'doubles', 'investors', 'wealth', 'in', '3', 'months', 'time', 'to', 'buy', 'or', 'book', 'profits']",stock radar bse nearly doubles investors wealth in 3 months time to buy or book profits
"['zomatos', 'tax', 'trouble', 'bluestones', 'ipo', 'valuation']",zomatos tax trouble bluestones ipo valuation
"['zomato', 'gets', 'tax', 'demand', 'of', 'rs', '803', '4', 'crore', 'from', 'maharashtra', 'gst', 'authorities']",zomato gets tax demand of rs 803 4 crore from maharashtra gst authorities
"['6', 'storey', 'building', 'partially', 'collapses', 'in', 'mumbais', 'bhendi', 'bazar', 'search', 'ops', 'on']",6 storey building partially collapses in mumbais bhendi bazar search ops on
"['india', 'middle', 'east', 'europe', 'corridor', 'discussed', 'between', 'pm', 'modi', 'and', 'uae', 'deputy', 'pm', 'mea']",india middle east europe corridor discussed between pm modi and uae deputy pm mea
"['fo', 'ban', 'list', 'pvr', 'inox', 'rbl', 'bank', 'among', '6', 'stocks', 'under', 'trade', 'ban', 'on', 'friday']",fo ban list pvr inox rbl bank among 6 stocks under trade ban on friday
"['pre', 'market', 'action', 'heres', 'the', 'trade', 'setup', 'for', 'todays', 'session']",pre market action heres the trade setup for todays session
"['hello', 'india', 'china', 'handset', 'companies', 'like', 'oneplus', 'xiaomi', 'vivo', 'and', 'oppo', 'rebuild', 'network']",hello india china handset companies like oneplus xiaomi vivo and oppo rebuild network
"['igi', 'offers', 'long', 'term', 'play', 'for', 'investors', 'keen', 'on', 'niche', 'biz']",igi offers long term play for investors keen on niche biz
"['india', 'needs', 'to', 'build', 'dense', 'cities', 'relook', 'at', 'standards', 'for', 'building', 'construction', 'sanjeev', 'sanyal']",india needs to build dense cities relook at standards for building construction sanjeev sanyal
"['joe', 'biden', 'grants', 'clemency', 'to', '1500', 'people']",joe biden grants clemency to 1500 people
"['premji', 'ranjan', 'pai', 'family', 'offices', 'to', 'board', 'akasa', 'with', 'big', 'stake', 'buy']",premji ranjan pai family offices to board akasa with big stake buy
"['et', 'ceo', 'roundtable', 'animal', 'spirits', 'need', 'a', 'release', 'says', 'bccl', 'ceo', 'sivakumar', 'sundaram']",et ceo roundtable animal spirits need a release says bccl ceo sivakumar sundaram
"['macquarie', 'asset', 'management', 'hits', 'the', 'road', 'to', 'sell', 'india', 'highway', 'portfolio']",macquarie asset management hits the road to sell india highway portfolio
"['indias', 'structural', 'reforms', 'need', 'acceleration', 'world', 'banks', 'chief', 'economist', 'indermit', 'gill']",indias structural reforms need acceleration world banks chief economist indermit gill
"['bajaj', 'finances', 'five', 'year', 'plan', 'has', 'a', 'deep', 'ai', 'focus']",bajaj finances five year plan has a deep ai focus
"['bangladesh', 'court', 'keeps', 'bail', 'petition', 'refuses', 'to', 'advance', 'hearing', 'of', 'arrested', 'hindu', 'monk', 'chinmoy', 'krishna', 'das']",bangladesh court keeps bail petition refuses to advance hearing of arrested hindu monk chinmoy krishna das
"['asian', 'stocks', 'drop', 'ahead', 'of', 'next', 'weeks', 'fed', 'meeting']",asian stocks drop ahead of next weeks fed meeting
"['stocks', 'in', 'news', 'tata', 'motors', 'ril', 'hal', 'zomato', 'jk', 'tyre', 'jsw', 'energy']",stocks in news tata motors ril hal zomato jk tyre jsw energy
"['sebi', 'issues', 'warning', 'letter', 'to', 'hdfc', 'bank']",sebi issues warning letter to hdfc bank
"['rbis', 'two', 'way', 'operations', 'to', 'manage', 'funds', 'to', 'sort', 'out', 'liquidity', 'stress']",rbis two way operations to manage funds to sort out liquidity stress
"['bank', 'deposits', 'went', 'up', 'in', 'line', 'with', 'credit', 'growth', 'in', 'year', 'to', 'nov']",bank deposits went up in line with credit growth in year to nov
"['rbi', 'wary', 'of', 'fintech', 'companies', 'vehicle', 'loan', 'drive']",rbi wary of fintech companies vehicle loan drive
"['et', 'ceo', 'roundtable', 'an', 'economy', 'in', 'slow', 'motion', 'needs', 'a', 'policy', 'on', 'fast', 'forward']",et ceo roundtable an economy in slow motion needs a policy on fast forward
"['amid', 'uncertainty', 'over', 'trumps', 'policies', 'us', 'companies', 'hold', 'india', 'investments']",amid uncertainty over trumps policies us companies hold india investments
"['isro', 'successfully', 'tests', 'ce20', 'cryogenic', 'engine', 'paves', 'way', 'for', 'gaganyaan', 'mission']",isro successfully tests ce20 cryogenic engine paves way for gaganyaan mission
"['gemini', 'gets', 'a', 'new', 'avatar', 'what', 'does', 'googles', 'latest', 'play', 'hold', 'for', 'you']",gemini gets a new avatar what does googles latest play hold for you
"['rupee', 'plunges', 'to', 'record', 'intraday', 'closing', 'lows']",rupee plunges to record intraday closing lows
"['nomura', 'ms', 'to', 'roll', 'out', 'india', 'forex', 'market', 'facility']",nomura ms to roll out india forex market facility
"['pharma', 'capital', 'goods', 'stocks', 'new', 'darlings', 'of', 'fund', 'houses']",pharma capital goods stocks new darlings of fund houses
"['bourses', 'raise', 'the', 'bar', 'for', 'sme', 'offers']",bourses raise the bar for sme offers
"['retail', 'inflation', 'falls', 'industrial', 'output', 'expands']",retail inflation falls industrial output expands
"['these', 'large', 'caps', 'have', 'buy', 'hold', 'recos', 'and', 'an', 'upside', 'potential', 'of', 'more', 'than', '23']",these large caps have buy hold recos and an upside potential of more than 23
"['weekly', 'top', 'picks', 'these', 'stocks', 'scored', '10', 'on', '10', 'on', 'stock', 'reports', 'plus']",weekly top picks these stocks scored 10 on 10 on stock reports plus
"['daily', 'trading', 'desk', '2', 'trades', 'for', 'short', 'term', 'gains', 'an', 'nbfc', 'stock', 'for', '8', 'rise', 'a', 'mid', 'cap', 'realty', 'firm', 'for', '7', 'upmove']",daily trading desk 2 trades for short term gains an nbfc stock for 8 rise a mid cap realty firm for 7 upmove
"['best', 'top', 'load', 'washing', 'machines', 'under', '30000']",best top load washing machines under 30000
"['going', 'for', 'greenland', 'again', 'will', 'trump', 'buy', 'land', 'to', 'expand', 'usa', 'amid', 'his', 'canada', 'taunts', 'a', 'fox', 'news', 'host', 'says', 'it', 'could', 'become', 'a', 'reality', 'in', 'the', 'next', '4', 'years']",going for greenland again will trump buy land to expand usa amid his canada taunts a fox news host says it could become a reality in the next 4 years
"['who', 'is', 'matthieu', 'blazy', 'heres', 'what', 'you', 'need', 'to', 'know', 'about', 'him']",who is matthieu blazy heres what you need to know about him
"['after', 'prison', 'threat', 'metas', 'mark', 'zuckerberg', 'trying', 'to', 'mend', 'bridges', 'with', 'donald', 'trump', 'donates', 'staggering', '1', 'million', 'for', 'the', 'president', 'elects', 'inauguration']",after prison threat metas mark zuckerberg trying to mend bridges with donald trump donates staggering 1 million for the president elects inauguration
"['us', 'supreme', 'court', 'allows', 'a', 'shareholder', 'lawsuit', 'to', 'continue', 'after', 'granting', 'bail', 'in', 'the', 'nvidia', 'case']",us supreme court allows a shareholder lawsuit to continue after granting bail in the nvidia case
"['sullivans', 'crossing', 'season', '3', 'what', 'we', 'know', 'about', 'renewal', 'at', 'the', 'cw']",sullivans crossing season 3 what we know about renewal at the cw
"['country', 'will', 'return', 'to', '7', 'plus', 'growth', 'in', 'coming', 'quarters', 'arvind', 'panagariya']",country will return to 7 plus growth in coming quarters arvind panagariya
"['trump', 'tariffs', 'could', 'prove', 'good', 'for', 'us', 'says', 'ficci', 'chief']",trump tariffs could prove good for us says ficci chief
"['narcl', 'has', 'acquired', '22', 'accounts', 'with', 'an', 'exposure', 'of', 'rs', '95711', 'cr']",narcl has acquired 22 accounts with an exposure of rs 95711 cr
"['our', 'growth', 'will', 'be', 'back', 'on', 'track', 'despite', 'global', 'uncertainties', 'piyush', 'goyal']",our growth will be back on track despite global uncertainties piyush goyal
"['disneys', 'tangled', 'live', 'action', 'remake', 'all', 'you', 'may', 'want', 'to', 'know']",disneys tangled live action remake all you may want to know
"['should', 'joe', 'biden', 'pre', 'emptively', 'pardon', 'hillary', 'clinton', 'ahead', 'of', 'trump', 'taking', 'office', 'heres', 'what', 'bill', 'clinton', 'says']",should joe biden pre emptively pardon hillary clinton ahead of trump taking office heres what bill clinton says
"['has', 'fifa', 'rigged', 'voting', 'system', 'to', 'award', 'saudi', 'arabia', 'with', '2034', 'world', 'cup', 'host']",has fifa rigged voting system to award saudi arabia with 2034 world cup host
"['centre', 'seeks', 'nod', 'for', 'extra', 'net', 'spending', 'of', '44143', 'cr']",centre seeks nod for extra net spending of 44143 cr
"['this', 'is', 'why', 'olivia', 'wilde', 'received', 'death', 'threats', 'while', 'portraying', 'a', 'character', 'in', 'medical', 'drama', 'series', 'house']",this is why olivia wilde received death threats while portraying a character in medical drama series house
"['trade', 'talks', 'with', 'eu', 'need', 'political', 'direction', 'for', 'meaningful', 'deal', 'govt']",trade talks with eu need political direction for meaningful deal govt
"['india', 'to', 'become', 'third', 'largest', 'economy', 'by', '2027', '28', 'ashwini', 'vaishnaw']",india to become third largest economy by 2027 28 ashwini vaishnaw
"['jimmy', 'kimmel', 'says', 'donald', 'trump', 'and', 'elon', 'musks', 'friendship', 'may', 'soon', 'blow', 'up', 'like', 'a', 'spacex', 'rocket']",jimmy kimmel says donald trump and elon musks friendship may soon blow up like a spacex rocket
"['teen', 'brothers', 'braved', 'cold', 'weather', 'to', 'sleep', 'on', 'porch', 'outside', 'home', 'for', 'months', 'in', 'detroit', 'details', 'here']",teen brothers braved cold weather to sleep on porch outside home for months in detroit details here
"['sbi', 'adds', 'to', 'record', 'samurai', 'loan', 'boom', 'with', '30', 'billion', 'debt', 'plan']",sbi adds to record samurai loan boom with 30 billion debt plan
"['india', 'uae', 'discuss', 'gaza', 'imeec', 'and', 'sudden', 'turn', 'of', 'events', 'in', 'syria']",india uae discuss gaza imeec and sudden turn of events in syria
"['putin', 'hints', 'at', 'forging', 'ai', 'partnership', 'with', 'india']",putin hints at forging ai partnership with india
"['stocks', 'to', 'buy', 'today', 'mirae', 'asset', 'sharekhan', 'sees', 'up', 'to', '40', 'upside', 'in', 'bajaj', 'finserv']",stocks to buy today mirae asset sharekhan sees up to 40 upside in bajaj finserv
"['ipef', 'discusses', 'ways', 'to', 'push', 'greater', 'chemicals', 'trade']",ipef discusses ways to push greater chemicals trade
"['youtube', 'tvs', 'monthly', 'price', 'rises', 'by', '10', 'starting', 'january']",youtube tvs monthly price rises by 10 starting january
"['vinod', 'kambli', 'acknowledges', 'tendulkars', 'financial', 'help', 'clarifies', 'on', 'his', 'infamous', 'remark', 'against', 'sachin']",vinod kambli acknowledges tendulkars financial help clarifies on his infamous remark against sachin
"['german', 'co', 'eyeing', 'p75i', 'contract', 'offers', 'to', 'make', 'submarines', 'in', 'india']",german co eyeing p75i contract offers to make submarines in india
"['rajya', 'sabha', 'adjourned', 'till', 'december', '16', 'amid', 'ruckus', 'over', 'no', 'trust', 'motion', 'against', 'chairman']",rajya sabha adjourned till december 16 amid ruckus over no trust motion against chairman
"['bombay', 'high', 'court', 'allows', 'criminal', 'proceedings', 'against', 'coca', 'cola', 'after', 'spider', 'webs', 'found', 'in', 'bottles']",bombay high court allows criminal proceedings against coca cola after spider webs found in bottles
"['singham', 'again', 'now', 'available', 'on', 'ott', 'when', 'and', 'how', 'to', 'watch', 'ajay', 'devgs', 'hit', 'cop', 'drama']",singham again now available on ott when and how to watch ajay devgs hit cop drama
"['india', 'backs', 'unga', 'resolutions', 'on', 'gaza', 'ceasefire', 'and', 'unrwa']",india backs unga resolutions on gaza ceasefire and unrwa
"['luigi', 'mangione', 'on', 'fire', 'ceo', 'brian', 'thompsons', 'alleged', 'killer', 'dubbed', 'the', 'hot', 'assassin', 'and', 'boy', 'of', 'the', 'month', 'by', 'fans']",luigi mangione on fire ceo brian thompsons alleged killer dubbed the hot assassin and boy of the month by fans
"['india', 'now', 'an', 'anchor', 'market', 'says', 'pepsico']",india now an anchor market says pepsico
"['onus', 'on', 'rohit', 'kohli', 'as', 'india', 'gear', 'up', 'for', 'potentially', 'make', 'or', 'break', 'test']",onus on rohit kohli as india gear up for potentially make or break test
"['ambuja', 'cements', 'commisions', '200', 'mw', 'solar', 'power', 'in', 'khavda', 'unlocking', '70', 'savings', 'in', 'power', 'cost']",ambuja cements commisions 200 mw solar power in khavda unlocking 70 savings in power cost
"['congress', 'doubts', 'govt', 'on', 'constitution', 'debate', 'issues', 'whip', 'to', 'lok', 'sabha', 'members']",congress doubts govt on constitution debate issues whip to lok sabha members
"['airports', 'may', 'hike', 'capex', 'to', 'rs', '60000', 'crore', 'in', '3', 'years']",airports may hike capex to rs 60000 crore in 3 years
"['will', 'sacrifice', 'my', 'life', 'for', 'country', 'rs', 'chairman', 'jagdeep', 'dhankar', 'questions', 'opposition', 'on', 'no', 'confidence', 'motion', 'against', 'him']",will sacrifice my life for country rs chairman jagdeep dhankar questions opposition on no confidence motion against him
"['astro', 'bot', 'tops', 'the', 'list', 'in', 'game', 'award', '2024', 'check', 'names', 'of', 'best', 'games', 'of', '2024']",astro bot tops the list in game award 2024 check names of best games of 2024
"['tata', 'motors', 'trent', '5', 'more', 'bluechip', 'stocks', 'from', 'tata', 'stable', 'fall', 'up', 'to', '23', 'in', '3', 'months', 'what', 'should', 'you', 'do']",tata motors trent 5 more bluechip stocks from tata stable fall up to 23 in 3 months what should you do
"['dont', 'see', 'relationship', 'between', 'govt', 'and', 'raj', 'bhavan', 'as', 'sensitive', 'up', 'governor', 'anandiben', 'patel']",dont see relationship between govt and raj bhavan as sensitive up governor anandiben patel
"['chicago', 'marathon', '2025', 'direct', 'link', 'how', 'to', 'check', '2025', 'bank', 'of', 'america', 'chicago', 'marathon', 'selection', 'status']",chicago marathon 2025 direct link how to check 2025 bank of america chicago marathon selection status
"['opposition', 'submits', 'notice', 'in', 'rajya', 'sabha', 'for', 'allahabad', 'hc', 'judges', 'impeachment', 'over', 'controversial', 'remarks', 'sources']",opposition submits notice in rajya sabha for allahabad hc judges impeachment over controversial remarks sources
"['best', 'ifb', 'top', 'load', 'washing', 'machines', 'for', 'effortless', 'laundry', 'care']",best ifb top load washing machines for effortless laundry care
"['selena', 'gomez', 'is', 'a', 'soon', 'to', 'be', 'bride', 'star', 'confirms', 'her', 'engagement', 'to', 'benny', 'blanco', 'heres', 'when', 'they', 'are', 'going', 'to', 'walk', 'down', 'the', 'aisle']",selena gomez is a soon to be bride star confirms her engagement to benny blanco heres when they are going to walk down the aisle
"['indias', '6g', 'technology', 'ambitions', 'run', 'into', 'funding', 'challenges']",indias 6g technology ambitions run into funding challenges
"['fundstrats', '2025', 'stock', 'market', 'outlook', 'is', 'out', 'and', 'its', 'projection', 'is', 'not', 'as', 'rosy', 'as', 'you', 'think', 'heres', 'what', 'you', 'should', 'take', 'note']",fundstrats 2025 stock market outlook is out and its projection is not as rosy as you think heres what you should take note
"['third', 'eye', 'booking', 'hours', 'babudom', 'inertia', 'and', 'top', 'secret', 'exams']",third eye booking hours babudom inertia and top secret exams
"['kejriwal', 'promises', 'to', 'more', 'than', 'double', 'aid', 'for', 'women', 'after', 'polls']",kejriwal promises to more than double aid for women after polls
"['oppn', 'gives', 'privilege', 'motion', 'notice', 'against', 'rijiju', '60', 'sign']",oppn gives privilege motion notice against rijiju 60 sign
"['evm', 'memory', 'checking', 'demand', 'picks', 'up', 'with', '100', 'petitions', 'in', 'maharashtra']",evm memory checking demand picks up with 100 petitions in maharashtra
"['bangladesh', 'delegation', 'likely', 'to', 'attend', 'vijay', 'diwas', 'celebrations', 'defence', 'sources']",bangladesh delegation likely to attend vijay diwas celebrations defence sources
"['pf', 'claim', 'settlement', 'rule', 'change', 'now', 'epf', 'members', 'will', 'get', 'more', 'interest', 'money', 'on', 'epf', 'withdrawal', 'faster', 'settlement']",pf claim settlement rule change now epf members will get more interest money on epf withdrawal faster settlement
"['govt', 'calls', 'out', 'oppn', 'for', 'holding', 'press', 'conference', 'against', 'rs', 'chairman']",govt calls out oppn for holding press conference against rs chairman
"['istanbul', 'indigo', 'flight', 'fiasco', 'airline', 'leaves', '400', 'flyers', 'grounded', 'without', 'food', 'accommodation', 'for', 'over', 'a', 'day']",istanbul indigo flight fiasco airline leaves 400 flyers grounded without food accommodation for over a day
"['new', 'world', 'chess', 'champion', 'd', 'gukesh', 'shares', 'two', 'connections', 'with', 'superstar', 'rajinikanth']",new world chess champion d gukesh shares two connections with superstar rajinikanth
"['sterlite', 'power', 'unit', 'raises', '725', 'crore']",sterlite power unit raises 725 crore
"['ex', 'ltte', 'men', 'trying', 'to', 'revive', 'terror', 'group', 'in', 'tn', 'probe', 'agencies']",ex ltte men trying to revive terror group in tn probe agencies
"['maha', 'cabinet', 'expansion', 'likely', 'on', 'saturday']",maha cabinet expansion likely on saturday
"['unbungle', 'up', 'bangladesh', 'delhi', 'has', 'reached', 'now', 'dhaka', 'needs', 'to', 'reciprocate']",unbungle up bangladesh delhi has reached now dhaka needs to reciprocate
"['sc', 'to', 'delhi', 'ncr', 'states', 'decide', 'on', 'blanket', 'ban', 'on', 'firecrackers']",sc to delhi ncr states decide on blanket ban on firecrackers
"['rajnath', 'singh', 'launches', 'direct', 'attack', 'on', 'congress', 'over', 'insults', 'to', 'constitution', 'attempts', 'to', 'hijack', 'it']",rajnath singh launches direct attack on congress over insults to constitution attempts to hijack it
"['india', 'has', 'an', 'inherent', 'expertise', 'to', 'increase', 'population', 'automobile', 'numbers', 'nitin', 'gadkari']",india has an inherent expertise to increase population automobile numbers nitin gadkari
"['opposition', 'to', 'move', 'impeachment', 'motion', 'against', 'hc', 'judge', 'in', 'rajya', 'sabha', 'today']",opposition to move impeachment motion against hc judge in rajya sabha today
"['ongc', 'oil', 'output', 'bucks', 'the', 'trend', 'after', '8', 'years', 'of', 'decline']",ongc oil output bucks the trend after 8 years of decline
"['bjps', 'nishikant', 'dubey', 'drags', 'rajiv', 'gandhi', 'foundation', 'sonia', 'gandhi', 'in', 'soros', 'row', 'ls', 'adjourned', 'again']",bjps nishikant dubey drags rajiv gandhi foundation sonia gandhi in soros row ls adjourned again
"['upi', 'new', 'feature', 'not', 'enough', 'balance', 'upi', 'lite', 'can', 'be', 'loaded', 'via', 'auto', 'top', 'up', 'soon', 'check', 'how', 'to', 'use', 'when', 'you', 'can', 'use']",upi new feature not enough balance upi lite can be loaded via auto top up soon check how to use when you can use
"['cabinet', 'nod', 'to', 'bills', 'for', 'simultaneous', 'elections', 'to', 'lok', 'sabha', 'and', 'state', 'assemblies']",cabinet nod to bills for simultaneous elections to lok sabha and state assemblies
"['aap', 'mp', 'sanjay', 'singh', 'moves', 'suspension', 'of', 'business', 'notice', 'in', 'rs', 'to', 'discuss', 'manipur', 'situation']",aap mp sanjay singh moves suspension of business notice in rs to discuss manipur situation
