headlines,headline_text
"['rbi', 'mpc', 'das', 'and', 'co', 'keeps', 'repo', 'rate', 'unchanged', 'at', '6', '5', 'yet', 'again']",rbi mpc das and co keeps repo rate unchanged at 6 5 yet again
"['us', 'nsa', 'jake', 'sullivan', 'set', 'to', 'visit', 'india', 'this', 'month']",us nsa jake sullivan set to visit india this month
"['kennedy', 'star', 'sunny', 'leone', 'reveals', 'she', 'fell', 'in', 'love', 'with', 'husband', 'daniel', 'weber', 'when', 'she', 'saw', 'him', 'playing', 'music']",kennedy star sunny leone reveals she fell in love with husband daniel weber when she saw him playing music
['km'],km
"['dont', 'expect', 'rate', 'cuts', 'before', 'august', 'monetary', 'policy', 'siddhartha', 'sanyal']",dont expect rate cuts before august monetary policy siddhartha sanyal
"['amid', 'red', 'sea', 'crisis', 'india', 'gets', 'a', 'specific', 'zone', 'in', 'duqm', 'port']",amid red sea crisis india gets a specific zone in duqm port
"['moet', 'hennessy', 'sees', 'the', 'right', 'spirit', 'in', 'india']",moet hennessy sees the right spirit in india
"['justin', 'timberlake', 'announces', 'new', 'concert', 'dates', 'for', 'us', 'cities']",justin timberlake announces new concert dates for us cities
"['sjvn', 'shares', 'rally', '10', 'on', 'winning', '200', 'mw', 'solar', 'project']",sjvn shares rally 10 on winning 200 mw solar project
"['60', 'equity', 'mutual', 'fund', 'schemes', 'fail', 'to', 'beat', 'benchmark', 'in', 'three', 'five', 'seven', 'and', '10', 'years']",60 equity mutual fund schemes fail to beat benchmark in three five seven and 10 years
"['election', 'commission', 'allots', 'ncp', 'sharadchandra', 'pawar', 'name', 'to', 'sharad', 'group']",election commission allots ncp sharadchandra pawar name to sharad group
"['best', 'gifts', 'for', 'hug', 'day', 'celebrate', 'hug', 'day', 'with', 'these', 'perfect', 'presents']",best gifts for hug day celebrate hug day with these perfect presents
"['rbi', 'mpc', 'meeting', 'indias', 'fy25', 'gdp', 'growth', 'pegged', 'at', '7']",rbi mpc meeting indias fy25 gdp growth pegged at 7
"['most', 'of', 'the', 'new', 'cars', 'to', 'hit', 'indian', 'roads', 'next', 'fiscal', 'may', 'be', 'electric']",most of the new cars to hit indian roads next fiscal may be electric
"['notifications', 'issued', 'for', 'polls', 'to', 'six', 'rajya', 'sabha', 'seats', 'in', 'bihar']",notifications issued for polls to six rajya sabha seats in bihar
"['verdict', 'on', 'sustainability', 'of', 'regional', 'business', 'models', 'will', 'be', 'out', 'soon', 'britannia', 'md', 'varun', 'berry']",verdict on sustainability of regional business models will be out soon britannia md varun berry
"['congress', 'likely', 'to', 'bring', 'black', 'paper', 'in', 'response', 'to', 'modi', 'govts', 'white', 'paper', 'on', 'economic', 'mismanagement']",congress likely to bring black paper in response to modi govts white paper on economic mismanagement
"['nestle', 'misses', 'street', 'estimates', 'in', 'december', 'quarter']",nestle misses street estimates in december quarter
"['tall', 'pay', 'wall', 'stops', 'rivals', 'from', 'fishing', 'in', 'paytms', 'talent', 'pool']",tall pay wall stops rivals from fishing in paytms talent pool
"['valentines', 'day', 'amazon', 'sale']",valentines day amazon sale
"['india', 'lanka', 'joint', 'panel', 'meet', 'to', 'take', 'grid', 'connectivity', 'further']",india lanka joint panel meet to take grid connectivity further
"['2', 'psu', 'insurance', 'stocks', 'zoom', '14', 'whats', 'the', 'good', 'news']",2 psu insurance stocks zoom 14 whats the good news
"['samajwadi', 'party', 'hopes', 'rld', 'wont', 'weaken', 'struggle', 'for', 'farmer', 'welfare']",samajwadi party hopes rld wont weaken struggle for farmer welfare
"['is', 'ai', 'coming', 'for', 'white', 'collar', 'jobs', 'coders', 'and', 'analysts', 'in', 'america', 'should', 'worry']",is ai coming for white collar jobs coders and analysts in america should worry
"['ariana', 'grandes', 'unique', 'album', 'rollout', 'no', 'pre', 'release', 'singles', 'for', 'eternal', 'sunshine']",ariana grandes unique album rollout no pre release singles for eternal sunshine
"['atal', 'pension', 'yojana', 'online', 'facility', 'to', 'ease', 'onboarding', 'and', 'seeding', 'of', 'aadhaar', 'for', 'apy', 'subscribers']",atal pension yojana online facility to ease onboarding and seeding of aadhaar for apy subscribers
"['bank', 'other', 'rate', 'sensitive', 'stocks', 'fall', 'up', 'to', '8', 'post', 'rbi', 'policy', 'decision']",bank other rate sensitive stocks fall up to 8 post rbi policy decision
"['technical', 'stock', 'pick', 'breakout', 'from', 'a', 'flag', 'pattern', 'could', 'take', 'gabriel', 'india', 'to', 'fresh', 'highs', 'time', 'to', 'buy']",technical stock pick breakout from a flag pattern could take gabriel india to fresh highs time to buy
"['momentum', 'around', 'developers', 'development', 'in', 'india', 'unbelievable', 'microsoft', 'ceo', 'satya', 'nadella']",momentum around developers development in india unbelievable microsoft ceo satya nadella
"['niti', 'aayog', 'moots', 'sops', 'extension', 'of', 'pli', 'to', 'lng', 'vehicles']",niti aayog moots sops extension of pli to lng vehicles
"['rbi', 'mpc', 'meet', 'incomplete', 'transmissions', 'inflationary', 'challenges', 'rbi', 'drops', 'hints', 'for', 'those', 'reading', 'into', 'mpcs', 'stance']",rbi mpc meet incomplete transmissions inflationary challenges rbi drops hints for those reading into mpcs stance
"['growth', 'of', 'caffeinated', 'energy', 'drinks', 'makes', 'govt', 'anxious']",growth of caffeinated energy drinks makes govt anxious
"['elevated', 'debt', 'raising', 'serious', 'concern', 'in', 'many', 'countries', 'will', 'impact', 'future', 'global', 'financial', 'system', 'rbi', 'guv', 'das']",elevated debt raising serious concern in many countries will impact future global financial system rbi guv das
"['amfi', 'data', 'equity', 'mutual', 'fund', 'inflows', 'surge', '28', 'in', 'january', 'to', 'near', 'rs', '22000', 'crore', 'mark']",amfi data equity mutual fund inflows surge 28 in january to near rs 22000 crore mark
"['siddaramaiah', 'dk', 'shivakumar', 'lead', 'karnataka', 'govts', 'delhi', 'protest', 'against', 'centre']",siddaramaiah dk shivakumar lead karnataka govts delhi protest against centre
"['banks', 'seek', 'incentives', 'for', 'sustainability', 'linked', 'loans', 'from', 'rbi', 'and', 'centre']",banks seek incentives for sustainability linked loans from rbi and centre
"['nhai', 'arm', 'lens', 'on', 'paytm', 'for', 'fastags']",nhai arm lens on paytm for fastags
"['housing', 'ministry', 'asks', 'state', 'reras', 'to', 'set', 'recovery', 'mechanism', 'for', 'homebuyers', 'refunds']",housing ministry asks state reras to set recovery mechanism for homebuyers refunds
"['uttarakhand', 'assembly', 'passes', 'uniform', 'civil', 'code', 'bill']",uttarakhand assembly passes uniform civil code bill
"['what', 'should', 'be', 'the', 'takeaways', 'from', 'todays', 'rbi', 'policy', 'commentary', 'ak', 'tewari', 'answers']",what should be the takeaways from todays rbi policy commentary ak tewari answers
"['punjab', 'trader', 'shot', 'dead', 'in', 'srinagar', 'another', 'injured']",punjab trader shot dead in srinagar another injured
"['my', 'name', 'is', 'loh', 'kiwan', 'heres', 'all', 'about', 'netflix', 'k', 'dramas', 'release', 'date', 'cast', 'plot', 'filming', 'and', 'more']",my name is loh kiwan heres all about netflix k dramas release date cast plot filming and more
"['bjp', 'shinde', 'sena', 'explore', 'possibility', 'of', 'alliance', 'with', 'mns']",bjp shinde sena explore possibility of alliance with mns
"['love', 'is', 'blind', 'season', '6', 'all', 'you', 'need', 'to', 'know', 'about', 'release', 'date', 'trailer', 'and', 'more']",love is blind season 6 all you need to know about release date trailer and more
"['nestle', 'falls', '2', 'post', 'q3', 'earnings', 'heres', 'how', 'brokerages', 'view', 'this', 'stock']",nestle falls 2 post q3 earnings heres how brokerages view this stock
"['this', 'is', 'status', 'quo', 'policy', 'shouldnt', 'have', 'any', 'material', 'impact', 'on', 'markets', 'nilesh', 'shah']",this is status quo policy shouldnt have any material impact on markets nilesh shah
"['election', 'years', 'have', 'typically', 'been', 'volatile', 'for', 'equity', 'investors', 'will', 'history', 'repeat', 'in', '2024']",election years have typically been volatile for equity investors will history repeat in 2024
"['lok', 'sabha', 'govt', 'oppn', 'lock', 'horns', 'over', 'data', 'quality', 'budget']",lok sabha govt oppn lock horns over data quality budget
"['kitchen', 'appliances', 'startup', 'upliance', 'ai', 'raises', 'rs', '34', 'crore', 'in', 'funding', 'led', 'by', 'khosla', 'ventures']",kitchen appliances startup upliance ai raises rs 34 crore in funding led by khosla ventures
