headlines,headline_text
"['time', 'to', 'shed', 'fear', 'skepticism', '5', 'mid', 'cap', 'stocks', 'where', 'managements', 'have', 'seen', 'many', 'cycles', 'with', 'an', 'upside', 'potential', 'of', 'up', 'to', '35']",time to shed fear skepticism 5 mid cap stocks where managements have seen many cycles with an upside potential of up to 35
"['cabinet', 'clears', 'bank', 'guarantee', 'waiver', 'for', 'spectrum', 'auctioned', 'since', '2012']",cabinet clears bank guarantee waiver for spectrum auctioned since 2012
"['schengen', 'visa', 'have', 'a', 'trip', 'to', 'paris', 'planned', 'now', 'you', 'can', 'add', 'another', 'stop', 'notre', 'dame']",schengen visa have a trip to paris planned now you can add another stop notre dame
['share'],share
"['elon', 'musks', 'ex', 'wife', 'grimes', 'opens', 'up', 'about', 'her', 'heartbreaking', 'struggles', 'over', 'bitter', 'custody', 'battle', 'for', 'kids']",elon musks ex wife grimes opens up about her heartbreaking struggles over bitter custody battle for kids
"['india', 'key', 'pillar', 'for', 'creating', 'multipolar', 'world', 'order']",india key pillar for creating multipolar world order
"['centre', 'approves', 'rs', '1115', 'crore', 'to', 'states', 'for', 'disaster', 'mitigation', 'capacity', 'building', 'projects']",centre approves rs 1115 crore to states for disaster mitigation capacity building projects
"['rate', 'cuts', 'likely', 'to', 'optimise', 'home', 'affordability', 'in', 'next', '12', 'months', 'kolkata', 'most', 'affordable', 'report']",rate cuts likely to optimise home affordability in next 12 months kolkata most affordable report
"['disheartening', 'to', 'see', 'countrys', 'largest', 'minority', 'facing', 'unprecedented', 'threats', 'says', 'mehbooba', 'mufti']",disheartening to see countrys largest minority facing unprecedented threats says mehbooba mufti
"['nasa', 'astronaut', 'sunita', 'williams', 'encounters', 'toxic', 'smell', 'on', 'international', 'space', 'station', 'triggers', 'panic', 'this', 'happened', 'next']",nasa astronaut sunita williams encounters toxic smell on international space station triggers panic this happened next
"['ed', 'searches', 'properties', 'linked', 'to', 'prayag', 'group', 'in', 'kolkata', 'in', 'chit', 'fund', 'scam']",ed searches properties linked to prayag group in kolkata in chit fund scam
"['candytoy', 'corporate', 'raises', 'rs', '110', 'cr', 'in', 'funding', 'round', 'to', 'expand', 'manufacturing', 'facilities']",candytoy corporate raises rs 110 cr in funding round to expand manufacturing facilities
"['asia', 'and', 'africas', 'climate', 'resilience', 'hindered', 'by', 'financial', 'and', 'developmental', 'inequities', 'climate', 'and', 'sustainability', 'initiative']",asia and africas climate resilience hindered by financial and developmental inequities climate and sustainability initiative
"['ai', 'in', 'tax', 'operations', 'seen', 'as', 'a', 'game', 'changer', 'by', '94', 'of', 'indian', 'cfos', 'tax', 'leaders']",ai in tax operations seen as a game changer by 94 of indian cfos tax leaders
"['tamil', 'film', 'maharaja', 'to', 'release', 'in', 'china', 'on', 'friday', 'first', 'indian', 'film', 'to', 'be', 'screened', 'after', 'normalisation', 'of', 'ties']",tamil film maharaja to release in china on friday first indian film to be screened after normalisation of ties
"['oscar', 'winner', 'charlize', 'theron', 'joins', 'christopher', 'nolans', 'next', 'film', 'alongside', 'tom', 'holland', 'anne', 'hathaway', 'check', 'release', 'date']",oscar winner charlize theron joins christopher nolans next film alongside tom holland anne hathaway check release date
"['why', 'a', 'bengaluru', 'techie', 'doesnt', 'mind', 'half', 'the', 'salary', 'in', 'canada', 'as', 'compared', 'to', 'the', 'us']",why a bengaluru techie doesnt mind half the salary in canada as compared to the us
"['bitcoin', 'dips', 'below', '93000', 'amid', 'rising', 'liquidations', 'and', 'profit', 'taking']",bitcoin dips below 93000 amid rising liquidations and profit taking
"['yes', 'securities', 'initiates', 'coverage', 'on', 'tips', 'music', 'sees', 'upside', 'potential', 'of', '18', 'with', 'target', 'price', 'of', 'rs', '1050']",yes securities initiates coverage on tips music sees upside potential of 18 with target price of rs 1050
"['nfo', 'monitor', 'groww', 'mutual', 'fund', 'introduces', 'multicap', 'fund']",nfo monitor groww mutual fund introduces multicap fund
"['stocks', 'to', 'buy', '10', 'equity', 'funds', 'that', 'have', 'outperformed', 'benchmarks', 'during', 'volatility']",stocks to buy 10 equity funds that have outperformed benchmarks during volatility
"['hyundai', 'motor', 'india', 'gets', 'rs', '5', 'cr', 'demand', 'from', 'maharashtra', 'tax', 'authority']",hyundai motor india gets rs 5 cr demand from maharashtra tax authority
"['regal', 'jewellers', 'keralas', 'premier', 'wholesale', 'manufacturing', 'jewellery', 'brand']",regal jewellers keralas premier wholesale manufacturing jewellery brand
"['these', '10', 'small', 'cap', 'mutual', 'funds', 'outperform', 'their', 'benchmarks', 'in', '5', 'years']",these 10 small cap mutual funds outperform their benchmarks in 5 years
"['adani', 'groups', 'debt', 'to', 'ebitda', 'hits', '2', '46x', 'in', 'h1', 'fy25', 'backed', 'by', 'rs', '53024', 'crore', 'reserves']",adani groups debt to ebitda hits 2 46x in h1 fy25 backed by rs 53024 crore reserves
"['local', 'lenders', 'exposure', 'to', 'adanis', 'expected', 'to', 'come', 'down', 'soon', 'group', 'executive']",local lenders exposure to adanis expected to come down soon group executive
"['tech', 'cos', 'q2fy25', 'results', 'ahead', 'of', 'estimates', 'infosys', 'coforge', 'among', '9', 'brokerage', 'buys']",tech cos q2fy25 results ahead of estimates infosys coforge among 9 brokerage buys
"['adani', 'green', 'share', 'price', 'clarifies', 'on', 'totalenergies', 'no', 'fresh', 'capital', 'statement', 'co', 'says', 'no', 'material', 'impact', 'on', 'its', 'growth']",adani green share price clarifies on totalenergies no fresh capital statement co says no material impact on its growth
"['dinner', 'after', '5', 'pm', 'heres', 'why', 'its', 'riskier', 'than', 'you', 'think', 'for', 'your', 'glucose', 'levels']",dinner after 5 pm heres why its riskier than you think for your glucose levels
"['enviro', 'infra', 'engineers', 'ipo', 'gmp', 'price', 'band', 'subscription', 'key', 'dates', 'review']",enviro infra engineers ipo gmp price band subscription key dates review
"['as', 'elon', 'musk', 'plans', 'human', 'colony', 'on', 'mars', 'heres', 'what', 'india', 'is', 'planning', 'for', 'our', 'neighbouring', 'red', 'planet', 'and', 'venus']",as elon musk plans human colony on mars heres what india is planning for our neighbouring red planet and venus
"['quick', 'commerce', 'firms', 'dangle', 'discounts', 'for', 'bulk', 'buys', 'above', 'rs', '1000', 'cart', 'size']",quick commerce firms dangle discounts for bulk buys above rs 1000 cart size
"['indian', 'government', 'will', 'maintain', 'its', 'support', 'for', 'gautam', 'adani', 'says', 'gqg', 'partners']",indian government will maintain its support for gautam adani says gqg partners
"['33', 'on', 'duty', 'police', 'officers', 'killed', 'in', 'delhi', 'in', '2', 'years']",33 on duty police officers killed in delhi in 2 years
"['battery', 'smart', 'appoints', 'amit', 'bhardwaj', 'as', 'cfo']",battery smart appoints amit bhardwaj as cfo
"['struggle', 'to', 'defend', 'indias', 'inherent', 'philosophy', 'must', 'be', 'reignited', 'kharge', 'on', 'constitution', 'day']",struggle to defend indias inherent philosophy must be reignited kharge on constitution day
"['gqg', 'partners', 'refuse', 'to', 'sell', 'adani', 'stocks', 'after', 'bribery', 'scandal']",gqg partners refuse to sell adani stocks after bribery scandal
"['after', 'late', 'night', 'royal', 'fight', 'at', 'udaipurs', 'city', 'palace', 'govt', 'appoints', 'receiver', 'for', 'disputed', 'site']",after late night royal fight at udaipurs city palace govt appoints receiver for disputed site
"['america', 'headed', 'for', 'bankruptcy', 'debt', 'to', 'gdp', 'ratio', 'crosses', '200', 'every', 'citizen', 'now', 'has', 'a', 'debt', 'of', 'over', '100000']",america headed for bankruptcy debt to gdp ratio crosses 200 every citizen now has a debt of over 100000
"['constitution', 'helped', 'in', 'countrys', 'transformation', 'cji', 'sanjiv', 'khanna']",constitution helped in countrys transformation cji sanjiv khanna
"['baby', 'mom', 'retail', 'eyes', 'rs', '100', 'crore', 'revenue', 'by', '2025', 'rs', '280', 'crore', 'ipo', 'by', '2026']",baby mom retail eyes rs 100 crore revenue by 2025 rs 280 crore ipo by 2026
"['pm', 'modi', 'should', 'keep', 'his', 'promise', 'and', 'restore', 'statehood', 'of', 'jk', 'with', 'constitutional', 'guarantees', 'jk', 'congress', 'chief']",pm modi should keep his promise and restore statehood of jk with constitutional guarantees jk congress chief
"['zomatos', 'qip', 'pricing', 'qcomms', 'bulk', 'orders']",zomatos qip pricing qcomms bulk orders
"['mf', 'query', 'is', 'it', 'possible', 'to', 'generate', 'rs', '1', 'lakh', 'monthly', 'income', 'with', 'rs', '2', '7', 'cr', 'corpus', 'girirajan', 'murugan', 'answers']",mf query is it possible to generate rs 1 lakh monthly income with rs 2 7 cr corpus girirajan murugan answers
"['cost', 'free', 'visa', 'false', 'job', 'vows', 'lure', 'women', 'to', 'gulf', 'countries']",cost free visa false job vows lure women to gulf countries
"['nifty', 'it', 'index', 'hits', 'fresh', 'record', 'high', 'infosys', 'ltimindtree', 'tech', 'mahindra', 'lead', 'the', 'gains']",nifty it index hits fresh record high infosys ltimindtree tech mahindra lead the gains
"['violence', 'erupts', 'in', 'sambhal', 'over', 'mosque', 'survey', 'seven', 'firs', 'filed', 'four', 'dead']",violence erupts in sambhal over mosque survey seven firs filed four dead
"['adanis', 'legal', 'troubles', 'may', 'worsen', 'with', 'risk', 'of', 'investor', 'lawsuits']",adanis legal troubles may worsen with risk of investor lawsuits
"['we', 'are', 'very', 'pleased', 'with', 'the', 'squad', 'akash', 'ambani', 'on', 'mi', 'squad', 'for', 'ipl', '2025', 'season']",we are very pleased with the squad akash ambani on mi squad for ipl 2025 season
"['10', 'best', 'drip', 'irrigation', 'kits', 'for', 'efficient', 'watering', 'grow', 'green']",10 best drip irrigation kits for efficient watering grow green
"['hitachi', 'energy', 'shares', 'rally', '10', 'on', 'winning', 'order', 'from', 'power', 'grid']",hitachi energy shares rally 10 on winning order from power grid
"['spintly', 'launches', 'employee', 'badge', 'in', 'apple', 'wallet', 'for', 'seamless', 'access', 'control', 'in', 'india']",spintly launches employee badge in apple wallet for seamless access control in india
"['telangana', 'declines', 'rs', '100', 'crore', 'donation', 'from', 'adani', 'group']",telangana declines rs 100 crore donation from adani group
"['adani', 'group', 'stocks', 'in', 'focus', 'as', 'gqg', 'partners', 'stands', 'firm', 'amid', 'bribery', 'scandal']",adani group stocks in focus as gqg partners stands firm amid bribery scandal
"['tamil', 'nadu', 'weather', 'chennai', 'to', 'receive', 'heavy', 'rains', 'till', 'weekend', 'as', 'imd', 'issues', 'yellow', 'alert']",tamil nadu weather chennai to receive heavy rains till weekend as imd issues yellow alert
"['adani', 'green', 'energy', 'shares', 'fall', '8', 'after', 'co', 'says', 'no', 'new', 'financial', 'commitment', 'under', 'discussion', 'with', 'totalenergies']",adani green energy shares fall 8 after co says no new financial commitment under discussion with totalenergies
"['adani', 'indictment', 'us', 'state', 'department', 'declines', 'comment', 'on', 'disruptions', 'in', 'indian', 'parliament']",adani indictment us state department declines comment on disruptions in indian parliament
"['for', 'credit', 'cardholders', 'restriction', 'on', 'free', 'airport', 'lounge', 'access', 'reward', 'point', 'usage', 'and', 'other', 'big', 'changes', 'by', 'four', 'banks']",for credit cardholders restriction on free airport lounge access reward point usage and other big changes by four banks
"['no', 'fresh', 'funds', 'into', 'adani', 'firms', 'till', 'clarity', 'on', 'accusations', 'totalenergies']",no fresh funds into adani firms till clarity on accusations totalenergies
"['when', 'a', 'wwe', 'employee', 'set', 'the', 'undertaker', 'on', 'fire', 'just', 'before', 'a', 'match']",when a wwe employee set the undertaker on fire just before a match
"['follow', 'traditions', 'of', 'dignified', 'constructive', 'debates', 'of', 'constituent', 'assembly', 'ls', 'speaker', 'birla']",follow traditions of dignified constructive debates of constituent assembly ls speaker birla
"['charges', 'against', 'adani', 'in', 'bribery', 'case', 'can', 'be', 'withdrawn', 'if', 'deemed', 'unworthy', 'after', 'trump', 'takes', 'over', 'as', 'president']",charges against adani in bribery case can be withdrawn if deemed unworthy after trump takes over as president
"['rajasthan', 'clash', 'erupts', 'between', 'two', 'groups', 'of', 'royal', 'family', 'for', 'entry', 'into', 'udaipur', 'palace']",rajasthan clash erupts between two groups of royal family for entry into udaipur palace
"['let', 'us', 'pledge', 'to', 'build', 'strong', 'india', 'on', 'constitution', 'day', 'amit', 'shah']",let us pledge to build strong india on constitution day amit shah
"['business', 'seeks', 'details', 'in', 'face', 'of', 'mixed', 'cop29', 'climate', 'messages']",business seeks details in face of mixed cop29 climate messages
"['sensex', 'rises', 'over', '250', 'pts', 'nifty', 'above', '24250', 'it', 'banks', 'lead', 'gains']",sensex rises over 250 pts nifty above 24250 it banks lead gains
"['global', 'airfares', 'set', 'to', 'rise', 'yet', 'again', 'in', '2025']",global airfares set to rise yet again in 2025
"['36', 'companies', 'doubled', 'their', 'sales', 'and', 'pat', 'in', 'a', 'disappointing', 'q2', 'earnings', 'season']",36 companies doubled their sales and pat in a disappointing q2 earnings season
"['11', 'mumbai', 'terror', 'attack', 'survivor', 'helped', 'the', 'justice', 'system', 'hang', 'ajmal', 'kasab']",11 mumbai terror attack survivor helped the justice system hang ajmal kasab
"['jpmorgan', 'bullish', 'on', 'defence', 'stocks', 'initiates', 'coverage', 'on', 'bel', 'hal', 'mazagon', 'dock', 'sees', 'up', 'to', '17', 'upside']",jpmorgan bullish on defence stocks initiates coverage on bel hal mazagon dock sees up to 17 upside
"['hc', 'stays', 'closure', 'of', 'nine', 'himachal', 'pradesh', 'tourism', 'corporation', 'hotels']",hc stays closure of nine himachal pradesh tourism corporation hotels
"['trip', 'of', 'chief', 'minister', 'is', 'of', 'extreme', 'importance', 'diaspora', 'members', 'laud', 'cm', 'yadavs', 'trip', 'to', 'uk']",trip of chief minister is of extreme importance diaspora members laud cm yadavs trip to uk
"['india', 'a', 'key', 'part', 'of', 'our', 'global', 'distribution', 'red', 'hat', 'ceo', 'chris', 'wright']",india a key part of our global distribution red hat ceo chris wright
"['vodafone', 'idea', 'shares', 'zoom', '18', 'on', 'cabinet', 'nod', 'for', 'bank', 'guarantee', 'waiver']",vodafone idea shares zoom 18 on cabinet nod for bank guarantee waiver
"['swiggy', 'shares', 'rally', '4', 'as', 'ubs', 'initiates', 'coverage', 'with', 'rs', '515', 'target', 'price']",swiggy shares rally 4 as ubs initiates coverage with rs 515 target price
"['ai', 'use', 'comes', 'of', 'age', 'in', 'hindi', 'film', 'production']",ai use comes of age in hindi film production
"['tirupurs', 'textile', 'industry', 'sees', 'resurgence', 'as', 'us', 'uk', 'orders', 'surge', 'amid', 'bangladesh', 'instability']",tirupurs textile industry sees resurgence as us uk orders surge amid bangladesh instability
"['want', 'to', 'ride', 'the', 'tide', 'over', '40', 'stock', 'ideas', 'as', 'nifty', 'bulls', 'attempt', 'to', 'regain', 'strength']",want to ride the tide over 40 stock ideas as nifty bulls attempt to regain strength
"['sbi', 'mm', 'and', 'hindalco', 'poised', 'for', 'double', 'digit', 'returns', 'in', '2025', 'rahul', 'shah']",sbi mm and hindalco poised for double digit returns in 2025 rahul shah
"['farmers', 'bets', 'more', 'heavily', 'on', 'cotton', 'in', 'brazils', 'newest', 'farming', 'region']",farmers bets more heavily on cotton in brazils newest farming region
"['ashoka', 'buildcon', 'shares', 'in', 'focus', 'after', 'winning', 'rs', '1391', 'crore', 'nhai', 'road', 'project']",ashoka buildcon shares in focus after winning rs 1391 crore nhai road project
"['sudip', 'bandyopadhyay', 'on', '2', 'triggers', 'that', 'may', 'take', 'market', 'higher']",sudip bandyopadhyay on 2 triggers that may take market higher
"['bitcoin', 'investor', 'who', 'hid', '2', 'million', 'treasure', 'across', 'us', 'drops', 'clues', 'in', 'new', 'book', 'for', 'treasure', 'hunters']",bitcoin investor who hid 2 million treasure across us drops clues in new book for treasure hunters
"['vedanta', 'shares', 'in', 'focus', 'as', 'co', 'seeks', 'up', 'to', '1', '2', 'billion', 'via', 'bonds', 'to', 'refinance', 'debt']",vedanta shares in focus as co seeks up to 1 2 billion via bonds to refinance debt
"['11', 'martyrs', 'reiterates', 'indias', 'commitment', 'to', 'fight', 'terrorism']",11 martyrs reiterates indias commitment to fight terrorism
"['vaibhav', 'suryavanshi', 'the', 'youngest', 'ipl', 'cricketer', 'started', 'playing', 'at', '8', 'years', 'father', 'sold', 'land']",vaibhav suryavanshi the youngest ipl cricketer started playing at 8 years father sold land
"['kec', 'international', 'stock', 'in', 'focus', 'on', 'securing', 'new', 'orders', 'worth', 'rs', '1114', 'crore']",kec international stock in focus on securing new orders worth rs 1114 crore
"['us', 'charges', 'may', 'slow', 'adani', 'groups', 'fundraising', 'plans']",us charges may slow adani groups fundraising plans
"['buy', 'kolte', 'patil', 'developers', 'target', 'price', 'rs', '480', 'hdfc', 'securities']",buy kolte patil developers target price rs 480 hdfc securities
"['pm', 'modi', 'amit', 'shah', 'and', 'several', 'leaders', 'extend', 'wishes', 'on', 'the', '75th', 'anniversary', 'of', 'samvidhan', 'diwas']",pm modi amit shah and several leaders extend wishes on the 75th anniversary of samvidhan diwas
"['assam', 'rifles', 'emerges', 'as', 'relief', 'to', 'people', 'in', 'violence', 'hit', 'manipur']",assam rifles emerges as relief to people in violence hit manipur
['kg'],kg
"['russia', 'alone', 'responsible', 'for', 's', 'korea', 'us', 'japans', 'security', 'concerns', 'on', 'n', 'koreas', 'troops', 'joining', 'russia', 'us']",russia alone responsible for s korea us japans security concerns on n koreas troops joining russia us
"['utpanna', 'ekadashi', '2024', 'date', 'time', 'significance', 'mantras', 'to', 'please', 'lord', 'vishnu']",utpanna ekadashi 2024 date time significance mantras to please lord vishnu
"['ev', 'battery', 'maker', 'calls', 'for', 'cheaper', 'eu', 'energy', 'to', 'counter', 'china']",ev battery maker calls for cheaper eu energy to counter china
"['keerthy', 'suresh', 'rocks', 'hyderabad', 'in', 'a', 'jaw', 'dropping', 'black', 'outfit', 'ahead', 'of', 'her', 'wedding']",keerthy suresh rocks hyderabad in a jaw dropping black outfit ahead of her wedding
"['tpg', 'is', 'said', 'in', 'advanced', 'talks', 'to', 'buy', 'siemens', 'gamesa', 'india', 'assets']",tpg is said in advanced talks to buy siemens gamesa india assets
"['better', 'infrastructure', 'is', 'about', 'connecting', 'dreams', 'accelerating', 'progress', 'pm', 'modi']",better infrastructure is about connecting dreams accelerating progress pm modi
"['best', 'banking', 'psu', 'mutual', 'funds', 'to', 'invest', 'in', 'november', '2024']",best banking psu mutual funds to invest in november 2024
"['aiudf', 'suspends', 'hailakandi', 'mla', 'zakir', 'hussain', 'laskar', 'from', 'party', 'for', 'six', 'years']",aiudf suspends hailakandi mla zakir hussain laskar from party for six years
"['no', 'celebration', 'would', 'be', 'complete', 'till', 'ls', 'rs', 'dont', 'discuss', 'debate', 'dissect', 'congress', 'manish', 'tewari', 'on', 'constitution', 'day']",no celebration would be complete till ls rs dont discuss debate dissect congress manish tewari on constitution day
"['zomato', 'shares', 'in', 'focus', 'as', 'qip', 'launches', 'with', 'floor', 'price', 'set', 'at', 'rs', '265', '91', 'per', 'share']",zomato shares in focus as qip launches with floor price set at rs 265 91 per share
"['international', 'emmy', 'awards', '2024', 'here', 'is', 'the', 'full', 'list', 'of', 'winners']",international emmy awards 2024 here is the full list of winners
"['coffee', 'prices', 'surge', 'to', 'highest', 'since', '1997', 'on', 'supply', 'fears']",coffee prices surge to highest since 1997 on supply fears
"['hul', 'shares', 'in', 'focus', 'as', 'board', 'approves', 'demerger', 'of', 'ice', 'cream', 'biz', 'into', 'separate', 'listed', 'entity']",hul shares in focus as board approves demerger of ice cream biz into separate listed entity
"['how', 'teenager', 'shashi', 'ruia', 'rejected', 'study', 'abroad', 'offer', 'built', 'an', 'empire', 'across', '35', 'nations', 'over', 'five', 'decades']",how teenager shashi ruia rejected study abroad offer built an empire across 35 nations over five decades
"['shashi', 'ruia', 'essar', 'group', 'co', 'founder', 'dies', 'at', '80']",shashi ruia essar group co founder dies at 80
"['nifty', 'sensex', 'continue', 'bullish', 'trend', 'experts', 'say', 'selling', 'pressure', 'remains']",nifty sensex continue bullish trend experts say selling pressure remains
"['constitution', 'day', 'what', 'is', 'samvidhan', 'divas', 'why', 'is', 'it', 'celebrated', 'on', 'november', '26', 'and', 'how', 'is', 'it', 'different', 'from', 'republic', 'day']",constitution day what is samvidhan divas why is it celebrated on november 26 and how is it different from republic day
"['ar', 'rahmans', 'former', 'band', 'member', 'mohini', 'dey', 'breaks', 'silence', 'on', 'their', 'relationship', 'after', 'his', 'ex', 'wife', 'speaks', 'out', 'on', 'their', 'separation']",ar rahmans former band member mohini dey breaks silence on their relationship after his ex wife speaks out on their separation
"['cabinet', 'approves', 'pan', '2', '0', 'project', 'worth', 'rs', '1435', 'cr', 'heres', 'how', 'it', 'will', 'help', 'indian', 'taxpayers']",cabinet approves pan 2 0 project worth rs 1435 cr heres how it will help indian taxpayers
"['china', 'intensifies', 'incursions', 'in', 'taiwan', 'strait']",china intensifies incursions in taiwan strait
"['11', 'mumbai', 'terror', 'attacks']",11 mumbai terror attacks
"['q2', 'earnings', 'shocker', '36', 'bse', '500', 'companies', 'report', 'over', '50', 'profit', 'plunge']",q2 earnings shocker 36 bse 500 companies report over 50 profit plunge
"['delhis', 'air', 'quality', 'deteriorates', 'again', 'as', 'it', 'dips', 'to', 'very', 'poor', 'category', 'aqi', 'now', 'almost', '400']",delhis air quality deteriorates again as it dips to very poor category aqi now almost 400
"['edelweiss', 'financial', 'shares', 'in', 'focus', 'on', 'plans', 'to', 'sell', 'minority', 'stake', 'in', 'mf', 'arm']",edelweiss financial shares in focus on plans to sell minority stake in mf arm
"['policy', 'decision', 'of', 'trump', 'administration', 'to', 'play', 'crucial', 'role', 'in', 'shaping', 'global', 'trade', 'dynamics', 'report']",policy decision of trump administration to play crucial role in shaping global trade dynamics report
"['fo', 'radar', 'deploy', 'bull', 'call', 'spread', 'in', 'divis', 'lab', 'from', 'potential', 'bullish', 'reversal']",fo radar deploy bull call spread in divis lab from potential bullish reversal
"['bhel', 'shares', 'in', 'focus', 'on', 'receiving', 'work', 'order', 'from', 'power', 'grid']",bhel shares in focus on receiving work order from power grid
"['crop', 'burning', 'inside', 'punjabs', 'broken', 'paddy', 'supply', 'chain', 'fuelled', 'by', 'politics', 'and', 'mismanagement']",crop burning inside punjabs broken paddy supply chain fuelled by politics and mismanagement
"['hot', 'stocks', 'jefferies', 'sees', 'over', '30', 'upside', 'in', 'ril', 'emcure', 'gets', 'an', 'upgrade', 'from', 'kotak']",hot stocks jefferies sees over 30 upside in ril emcure gets an upgrade from kotak
"['most', 'hated', 'stocks', 'fii', 'selling', 'in', 'financials', 'cross', 'rs', '70000', 'crore', 'in', '2024']",most hated stocks fii selling in financials cross rs 70000 crore in 2024
"['sc', 'to', 'resume', 'hearing', 'on', 'covid', '19', 'vaccine', 'adverse', 'effects', 'case']",sc to resume hearing on covid 19 vaccine adverse effects case
"['buy', 'icici', 'bank', 'target', 'price', 'rs', '1500', 'axis', 'securities']",buy icici bank target price rs 1500 axis securities
"['buy', 'dixon', 'technologies', 'target', 'price', 'rs', '17500', 'motilal', 'oswal', 'financial', 'services']",buy dixon technologies target price rs 17500 motilal oswal financial services
"['buy', 'beml', 'target', 'price', 'rs', '4155', 'hdfc', 'securities']",buy beml target price rs 4155 hdfc securities
"['etmarkets', 'smart', 'talk', 'why', 'indian', 'aifs', 'are', 'gaining', 'popularity', 'among', 'nris', 'seeking', 'diversified', 'returns', 'puneet', 'sharma', 'decodes']",etmarkets smart talk why indian aifs are gaining popularity among nris seeking diversified returns puneet sharma decodes
"['how', 'china', 'trump', 'and', 'the', 'russia', 'ukraine', 'war', 'are', 'shaping', 'gold', 'silver', 'investments']",how china trump and the russia ukraine war are shaping gold silver investments
"['who', 'is', 'jimmy', 'patronis', 'trumps', 'latest', 'pick', 'for', 'floridas', 'congressional', 'future']",who is jimmy patronis trumps latest pick for floridas congressional future
"['schools', 'in', 'delhi', 'ncr', 'to', 'now', 'operate', 'in', 'hybrid', 'mode', 'following', 'scs', 'nudge']",schools in delhi ncr to now operate in hybrid mode following scs nudge
