headlines,headline_text
"['got', 'rejected', 'because', 'i', 'am', 'woman', 'makes', 'presentation', 'to', 'prove', 'she', 'is', 'best', 'roommate', 'during', 'house', 'hunting', 'in', 'bengaluru', 'video', 'goes', 'viral']",got rejected because i am woman makes presentation to prove she is best roommate during house hunting in bengaluru video goes viral
"['viral', 'video', 'bangladeshi', 'womans', 'crazy', 'dance', 'on', 'moving', 'train', 'roof', 'leaves', 'internet', 'worried']",viral video bangladeshi womans crazy dance on moving train roof leaves internet worried
"['integrated', 'tax', 'technology', 'is', 'key', 'to', 'corporate', 'taxation', 'success']",integrated tax technology is key to corporate taxation success
"['travis', 'kelces', 'ex', 'girlfriend', 'kayla', 'nicole', 'breaks', 'down', 'in', 'tears', 'while', 'talking', 'about', 'her', 'breakup', 'heres', 'what', 'she', 'said']",travis kelces ex girlfriend kayla nicole breaks down in tears while talking about her breakup heres what she said
"['delhi', 'hc', 'asks', 'for', 'delhi', 'govts', 'response', 'on', 'pil', 'seeking', 'implementation', 'of', 'the', 'ab', 'pm', 'jay', 'in', 'the', 'national', 'capital']",delhi hc asks for delhi govts response on pil seeking implementation of the ab pm jay in the national capital
"['air', 'india', 'is', 'responsible', 'employer', 'says', 'wilson', 'amid', 'certain', 'hr', 'concerns']",air india is responsible employer says wilson amid certain hr concerns
"['dynastic', 'candidates', 'were', 'fielded', 'across', 'maharashtra', 'in', 'assembly', 'elections']",dynastic candidates were fielded across maharashtra in assembly elections
"['entry', 'level', 'workforce', 'across', 'key', 'sectors', 'to', 'earn', 'better', 'salaries', 'report']",entry level workforce across key sectors to earn better salaries report
"['india', 'us', 'china', 'trade', 'deficit', 'surplus', 'us', 'tariffs', 'the', 'lesser', 'known', 'tale', 'of', 'indias', 'trade', 'with', 'two', 'giants', 'us', 'and', 'china']",india us china trade deficit surplus us tariffs the lesser known tale of indias trade with two giants us and china
"['stranger', 'things', 'season', '5', 'on', 'netflix', 'big', 'development', 'ahead', 'of', 'release', 'date']",stranger things season 5 on netflix big development ahead of release date
"['k', '4', 'ballistic', 'missile', 'test', 'mad', 'message', 'rings', 'loud', 'and', 'clear']",k 4 ballistic missile test mad message rings loud and clear
"['superman', 'lois', 'season', '4', 'will', 'superman', 'die', 'in', 'the', 'last', 'episode']",superman lois season 4 will superman die in the last episode
"['new', 'guidelines', 'on', 'indias', 'laptop', 'import', 'policy', 'still', 'under', 'deliberation', 'piyush', 'goyal']",new guidelines on indias laptop import policy still under deliberation piyush goyal
"['ajmera', 'realty', 'infra', 'repays', 'debt', 'worth', 'rs', '100', 'crore']",ajmera realty infra repays debt worth rs 100 crore
"['sheikh', 'hasina', 'slams', 'bangladesh', 'govt', 'seeks', 'immediate', 'release', 'of', 'iskcon', 'priest', 'chinmoy', 'das']",sheikh hasina slams bangladesh govt seeks immediate release of iskcon priest chinmoy das
"['indias', 'iron', 'ore', 'production', 'rises', '4', 'pc', 'in', 'apr', 'oct']",indias iron ore production rises 4 pc in apr oct
"['dr', 'reddys', 'launches', 'novel', 'cancer', 'therapy', 'toripalimab', 'in', 'india']",dr reddys launches novel cancer therapy toripalimab in india
"['our', 'party', 'was', 'once', 'a', 'national', 'party', 'to', 'reclaim', 'that', 'status', 'we', 'need', 'to', 'work', 'harder', 'now', 'ajit', 'pawar', 'hints', 'at', 'spreading', 'ncps', 'footprints']",our party was once a national party to reclaim that status we need to work harder now ajit pawar hints at spreading ncps footprints
"['kerala', 'grants', 'two', 'days', 'of', 'menstrual', 'leave', 'monthly', 'for', 'female', 'iti', 'students']",kerala grants two days of menstrual leave monthly for female iti students
"['india', 'china', 'making', 'great', 'progress', 'in', 'implementing', 'border', 'disengagement', 'agreement', 'chinese', 'military']",india china making great progress in implementing border disengagement agreement chinese military
"['govt', 'slaps', 'fine', 'on', 'sun', 'pharma', 'officials', 'over', 'related', 'party', 'transactions']",govt slaps fine on sun pharma officials over related party transactions
"['hemant', 'soren', 'takes', 'oath', 'as', 'cm', 'of', 'jharkhand']",hemant soren takes oath as cm of jharkhand
"['silver', 'prices', 'crash', 'yet', 'again', 'slip', 'back', 'to', 'rs', '90000', 'mark']",silver prices crash yet again slip back to rs 90000 mark
"['modi', 'and', 'all', 'other', 'pms', 'have', 'offered', 'chadar', 'asaduddin', 'owaisi', 'blames', 'rss', 'bjp', 'for', 'ajmer', 'dargah', 'row']",modi and all other pms have offered chadar asaduddin owaisi blames rss bjp for ajmer dargah row
"['air', 'india', 'transformation', 'is', 'test', 'match', 'not', 't20', 'more', 'work', 'to', 'do', 'campbell', 'wilson']",air india transformation is test match not t20 more work to do campbell wilson
"['india', 'plans', 'local', 'supply', 'chains', 'for', 'bullet', 'trains']",india plans local supply chains for bullet trains
"['heartbreaks', 'bringing', 'ben', 'affleck', 'and', 'jennifer', 'garner', 'back', 'together', 'here', 'is', 'the', 'latest', 'update']",heartbreaks bringing ben affleck and jennifer garner back together here is the latest update
"['1248', 'people', 'died', 'cleaning', 'sewer', 'and', 'septic', 'tanks', 'since', '1993', 'government']",1248 people died cleaning sewer and septic tanks since 1993 government
"['ben', 'affleck', 'and', 'jennifer', 'lopez', 'to', 'celebrate', 'thanksgiving', '2024', 'together', 'after', 'their', 'divorce', 'all', 'you', 'need', 'to', 'know']",ben affleck and jennifer lopez to celebrate thanksgiving 2024 together after their divorce all you need to know
"['elon', 'musks', 'tesla', 'is', 'pushing', 'jensen', 'huang', 'led', 'nvidia', 'to', 'the', 'brink', 'heres', 'the', 'reason']",elon musks tesla is pushing jensen huang led nvidia to the brink heres the reason
"['odisha', 'govt', 'declares', 'the', 'sabarmati', 'report', 'tax', 'free', 'in', 'state']",odisha govt declares the sabarmati report tax free in state
"['hc', 'seeks', 'delhi', 'govts', 'stand', 'on', 'pil', 'to', 'implement', 'centre', 'backed', 'health', 'scheme']",hc seeks delhi govts stand on pil to implement centre backed health scheme
"['kidnapped', 'at', '7', 'up', 'man', 'reunites', 'with', 'family', 'after', 'three', 'decades']",kidnapped at 7 up man reunites with family after three decades
"['did', 'los', 'angeles', 'lakers', 'star', 'lebron', 'james', 'attend', 'diddys', 'freak', 'off', 'parties', 'a', 'fans', 'taunt', 'at', 'him', 'has', 'gone', 'viral']",did los angeles lakers star lebron james attend diddys freak off parties a fans taunt at him has gone viral
"['uttar', 'pradesh', 'police', 'hold', 'flag', 'march', 'near', 'shahi', 'jama', 'masjid', 'after', 'violence', 'in', 'sambhal', 'over', 'survey']",uttar pradesh police hold flag march near shahi jama masjid after violence in sambhal over survey
"['come', 'december', 'and', 'elon', 'musk', 'is', 'ready', 'to', 'take', 'on', 'the', 'mighty', 'silicon', 'valley', 'tech', 'giants', 'with', 'this', 'product', 'what', 'is', 'it', 'heres', 'all', 'you', 'need', 'to', 'know']",come december and elon musk is ready to take on the mighty silicon valley tech giants with this product what is it heres all you need to know
"['why', 'bengalureans', 'are', 'choosing', 'mysuru', 'a', 'real', 'estate', 'boom', 'driven', 'by', 'connectivity', 'and', 'quality', 'of', 'life']",why bengalureans are choosing mysuru a real estate boom driven by connectivity and quality of life
"['allu', 'arjun', 'breaks', 'silence', 'on', 'why', 'fahadh', 'faasil', 'is', 'absent', 'from', 'pushpa', '2', 'promotions', 'i', 'wish', 'we', 'were']",allu arjun breaks silence on why fahadh faasil is absent from pushpa 2 promotions i wish we were
"['from', 'first', 'impressions', 'to', 'long', 'term', 'growth', 'how', 'design', 'can', 'play', 'a', 'big', 'role', 'in', 'business', 'success']",from first impressions to long term growth how design can play a big role in business success
"['govt', 'says', 'no', 'plan', 'to', 'bring', 'law', 'mandating', 'sc', 'hc', 'judges', 'to', 'furnish', 'property', 'return', 'details']",govt says no plan to bring law mandating sc hc judges to furnish property return details
"['can', 'elon', 'musk', 'save', '2', 'trillion', 'for', 'donald', 'trump', 'department', 'of', 'government', 'efficiency', 'federal', 'budget', 'cuts']",can elon musk save 2 trillion for donald trump department of government efficiency federal budget cuts
"['new', 'audi', 'q7', 'launched', 'in', 'india', 'prices', 'starts', 'from', 'rs', '88', '66', 'lakh']",new audi q7 launched in india prices starts from rs 88 66 lakh
"['rexas', 'finance', 'rxs', 'sells', 'out', 'stage', 'seven', 'presale', 'months', 'ahead', 'of', 'expectations']",rexas finance rxs sells out stage seven presale months ahead of expectations
"['painful', 'whats', 'the', 'problem', 'intense', 'debate', 'over', 'court', 'notice', 'on', 'ajmer', 'dargah', 'plea']",painful whats the problem intense debate over court notice on ajmer dargah plea
"['shiv', 'sena', 'holds', 'anti', 'bangladesh', 'protests', 'in', 'jammu', 'urges', 'pm', 'to', 'ensure', 'safety', 'of', 'hindus']",shiv sena holds anti bangladesh protests in jammu urges pm to ensure safety of hindus
"['cbi', 'files', 'chargesheet', 'against', 'four', 'accused', 'in', 'dibrugarh', 'investment', 'scam', 'case']",cbi files chargesheet against four accused in dibrugarh investment scam case
"['indian', 'navy', 'prepares', 'disaster', 'response', 'plan', 'for', 'cyclone', 'fengal', 'relief', 'operations']",indian navy prepares disaster response plan for cyclone fengal relief operations
"['how', 'new', 'buyers', 'are', 'moving', 'towards', 'luxury', 'living', 'leaving', 'affordable', 'home']",how new buyers are moving towards luxury living leaving affordable home
"['west', 'bengal', 'jamiat', 'e', 'ulama', 'holds', 'protest', 'against', 'waqf', 'amendment', 'bill', 'calls', 'it', 'attack', 'on', 'constitution']",west bengal jamiat e ulama holds protest against waqf amendment bill calls it attack on constitution
"['from', 'beer', 'to', 'gasoline', 'heres', 'what', 'will', 'get', 'costly', 'in', 'the', 'us', 'if', 'donald', 'trump', 'imposes', 'new', 'tariffs']",from beer to gasoline heres what will get costly in the us if donald trump imposes new tariffs
"['pvr', 'inox', 'brings', 'back', 'cinema', 'lovers', 'day', 'on', 'nov', '29th', 'with', 'tickets', 'at', 'rs', '99', 'what', 'films', 'will', 'feature']",pvr inox brings back cinema lovers day on nov 29th with tickets at rs 99 what films will feature
"['adani', 'power', 'gets', '67', 'out', 'of', '100', 'ranks', 'in', 'top', '80', 'percentile', 'of', 'all', 'global', 'electric', 'utilities', 'in', 'sp', 'global', 'csa', 'score']",adani power gets 67 out of 100 ranks in top 80 percentile of all global electric utilities in sp global csa score
"['man', 'goes', 'on', 'a', 'casual', 'walk', 'and', 'comes', 'back', 'with', 'a', 'reptilian', 'bagpack', 'watch', 'viral', 'video']",man goes on a casual walk and comes back with a reptilian bagpack watch viral video
"['air', 'pollution', 'grap', 'iv', 'measures', 'except', 'relating', 'to', 'schools', 'will', 'continue', 'to', 'operate', 'till', 'december', '2', 'says', 'sc']",air pollution grap iv measures except relating to schools will continue to operate till december 2 says sc
"['ril', 'subsidiary', 'acquires', '21', 'stake', 'in', 'us', 'based', 'wavetech', 'helium', 'for', '12', 'million']",ril subsidiary acquires 21 stake in us based wavetech helium for 12 million
"['india', 'bloc', 'to', 'hold', 'protests', 'in', 'delhi', 'over', 'manipur', 'situation', 'congress', 'leader']",india bloc to hold protests in delhi over manipur situation congress leader
"['pm', 'kisan', 'samman', 'nidhi', '19th', 'instalment', 'heres', 'how', 'to', 'update', 'mobile', 'number', 'linked', 'to', 'pm', 'kisan']",pm kisan samman nidhi 19th instalment heres how to update mobile number linked to pm kisan
"['bangladesh', 'seeks', 'deposed', 'pm', 'hasinas', 'trial', 'in', 'icc', 'alongside', 'domestic', 'court']",bangladesh seeks deposed pm hasinas trial in icc alongside domestic court
"['centre', 'has', 'received', '28', 'proposals', 'from', '23', 'states', 'to', 'develop', 'new', 'cities', 'lok', 'sabha', 'informed']",centre has received 28 proposals from 23 states to develop new cities lok sabha informed
"['priyanka', 'gandhi', 'ravindra', 'vasantrao', 'chavan', 'to', 'take', 'oath', 'as', 'mps', 'in', 'lok', 'sabha', 'today']",priyanka gandhi ravindra vasantrao chavan to take oath as mps in lok sabha today
"['wheel', 'of', 'fortune', 'is', 'pat', 'sajaks', 'daughter', 'maggie', 'sajak', 'set', 'to', 'replace', 'vanna', 'white']",wheel of fortune is pat sajaks daughter maggie sajak set to replace vanna white
"['launch', 'movement', 'to', 'change', 'interim', 'govt', 'tripura', 'cpim', 'urges', 'people', 'in', 'bangladesh']",launch movement to change interim govt tripura cpim urges people in bangladesh
"['5182', 'faculty', 'positions', 'vacant', 'in', 'central', 'universities', 'moe', 'tells', 'rajya', 'sabha']",5182 faculty positions vacant in central universities moe tells rajya sabha
"['delhi', 'pollution', 'as', 'schools', 'reopen', 'here', 'are', 'some', 'strategies', 'for', 'parents', 'to', 'protect', 'kids', 'from', 'air', 'pollution']",delhi pollution as schools reopen here are some strategies for parents to protect kids from air pollution
"['top', '10', 'cryptocurrency', 'investments', 'in', 'november', '2024']",top 10 cryptocurrency investments in november 2024
"['plea', 'for', 'implementing', 'integrated', 'help', 'system', 'for', 'women', 'across', 'india', 'not', 'justiciable', 'sc']",plea for implementing integrated help system for women across india not justiciable sc
"['bsnl', 'installs', '50708', '4g', 'sites', '41957', 'sites', 'on', 'air', 'mos', 'communications']",bsnl installs 50708 4g sites 41957 sites on air mos communications
"['hcl', 'techbee', 'signs', 'up', 'with', 'skill', 'development', 'corp', 'for', 'training', 'ii', 'pu', 'passouts']",hcl techbee signs up with skill development corp for training ii pu passouts
"['best', 'wallet', 'limited', 'presale', 'window', 'is', 'now', 'open', 'smashes', '1', 'million', 'raised']",best wallet limited presale window is now open smashes 1 million raised
"['lok', 'sabha', 'grants', 'extension', 'to', 'joint', 'panel', 'on', 'waqf', 'bill', 'house', 'adjourned', 'for', 'the', 'day']",lok sabha grants extension to joint panel on waqf bill house adjourned for the day
"['enviro', 'infra', 'engineers', 'ipo', 'shares', 'to', 'debut', 'on', 'friday', 'what', 'gmp', 'signals', 'ahead', 'of', 'listing']",enviro infra engineers ipo shares to debut on friday what gmp signals ahead of listing
"['how', 'ai', 'drones', 'and', 'predictive', 'analytics', 'can', 'transform', 'real', 'estate', 'asset', 'management', 'in', 'india']",how ai drones and predictive analytics can transform real estate asset management in india
"['ntpc', 'signs', 'mou', 'with', 'chhattisgarh', 'state', 'power', 'generation', 'to', 'develop', '200', 'mw', 'renewable', 'projects']",ntpc signs mou with chhattisgarh state power generation to develop 200 mw renewable projects
"['champions', 'trophy', '2025', 'hybrid', 'model', 'unacceptable', 'says', 'pakistan', 'ahead', 'of', 'icc', 'meeting']",champions trophy 2025 hybrid model unacceptable says pakistan ahead of icc meeting
"['eknath', 'shinde', 'unlikely', 'to', 'be', 'deputy', 'cm', 'in', 'new', 'maharashtra', 'government', 'says', 'close', 'aide']",eknath shinde unlikely to be deputy cm in new maharashtra government says close aide
"['what', 'is', 'taylor', 'swift', 'travis', 'kelces', 'couple', 'song', 'death', 'by', 'a', 'thousand', 'cuts', 'blank', 'space', 'nfl', 'star', 'drops', 'a', 'hint']",what is taylor swift travis kelces couple song death by a thousand cuts blank space nfl star drops a hint
"['let', 'member', 'brought', 'from', 'rwanda', 'in', 'operation', 'coordinated', 'by', 'cbi', 'nia', 'interpol']",let member brought from rwanda in operation coordinated by cbi nia interpol
"['eci', 'must', 'clarify', 'how', 'voter', 'turnout', 'rose', 'by', 'over', '7', 'per', 'cent', 'after', 'polling', 'ended', 'nana', 'patole']",eci must clarify how voter turnout rose by over 7 per cent after polling ended nana patole
"['hindu', 'organisation', 'takes', 'out', 'protest', 'march', 'to', 'bangladesh', 'deputy', 'high', 'commission']",hindu organisation takes out protest march to bangladesh deputy high commission
"['pepe', 'unchained', 'smashes', 'the', '50', 'million', 'milestone', 'in', 'viral', 'crypto', 'presale']",pepe unchained smashes the 50 million milestone in viral crypto presale
"['incuspaze', 'plans', '25m', 'pre', 'ipo', 'round', 'as', 'flexible', 'workspace', 'ipos', 'gain', 'momentum']",incuspaze plans 25m pre ipo round as flexible workspace ipos gain momentum
"['expressed', 'deep', 'disappointment', 'at', 'eus', 'cbam', 'eudr', 'regulations', 'with', 'french', 'counterpart', 'piyush', 'goyal']",expressed deep disappointment at eus cbam eudr regulations with french counterpart piyush goyal
"['unwarranted', 'sc', 'should', 'intervene', 'cpim', 'slams', 'court', 'notice', 'on', 'ajmer', 'shrine']",unwarranted sc should intervene cpim slams court notice on ajmer shrine
"['govt', 'says', '136', 'vande', 'bharat', 'train', 'services', 'operational', 'across', 'railways', 'network']",govt says 136 vande bharat train services operational across railways network
"['bangladesh', 'government', 'polarising', 'entire', 'society', 'bjps', 'basavaraj', 'bommai', 'condemns', 'the', 'arrest', 'of', 'saint', 'chinmoy', 'das']",bangladesh government polarising entire society bjps basavaraj bommai condemns the arrest of saint chinmoy das
"['delhis', 'aqi', 'improves', 'from', 'severe', 'but', 'remains', 'in', 'very', 'poor', 'residents', 'battle', 'with', 'eye', 'irritation', 'breathing', 'difficulties']",delhis aqi improves from severe but remains in very poor residents battle with eye irritation breathing difficulties
"['delhi', 'explosion', 'blast', 'prashant', 'vihar', 'fire', 'tenders', 'on', 'spot']",delhi explosion blast prashant vihar fire tenders on spot
"['govt', 'collected', 'rs', '1', '44', 'lakh', 'crore', 'toll', 'at', 'highway', 'plazas', 'under', 'public', 'private', 'partnership', 'since', '2000']",govt collected rs 1 44 lakh crore toll at highway plazas under public private partnership since 2000
"['analysing', 'hundreds', 'of', 'stocks', 'for', 'strategy', 'phonepe', 'brings', 'a', 'new', 'tool', 'to', 'do', 'key', 'trading', 'tasks']",analysing hundreds of stocks for strategy phonepe brings a new tool to do key trading tasks
"['bollywood', 'actress', 'wishes', 'prabhas', 'were', 'her', 'son', 'admires', 'baahubali', 'stars', 'humble', 'nature']",bollywood actress wishes prabhas were her son admires baahubali stars humble nature
"['gold', 'silver', 'prices', 'poised', 'for', 'recovery', 'as', 'fundamentals', 'support', 'bullish', 'trend', 'tata', 'mf']",gold silver prices poised for recovery as fundamentals support bullish trend tata mf
"['nazara', 'completes', 'rs', '855', 'crore', 'fundraise', 'led', 'by', 'sbi', 'mutual', 'fund']",nazara completes rs 855 crore fundraise led by sbi mutual fund
"['pan', '2', '0', 'new', 'pan', 'card', 'to', 'have', 'a', 'qr', 'code', 'will', 'your', 'current', 'pan', 'card', 'become', 'inoperative']",pan 2 0 new pan card to have a qr code will your current pan card become inoperative
"['chinese', 'manufacturer', 'usi', 'opens', 'first', 'development', 'centre', 'in', 'india', 'with', 'techm']",chinese manufacturer usi opens first development centre in india with techm
"['ntpc', 'green', 'energy', 'shares', 'jump', '10', 'post', 'listing', 'should', 'you', 'buy', 'sell', 'or', 'hold']",ntpc green energy shares jump 10 post listing should you buy sell or hold
"['kolkata', 'metros', 'airport', 'line', 'likely', 'to', 'start', 'running', 'from', 'march', 'here', 'is', 'the', 'latest', 'update']",kolkata metros airport line likely to start running from march here is the latest update
"['rupee', 'falls', '9', 'paise', 'to', 'close', 'at', '84', '49', 'against', 'us', 'dollar']",rupee falls 9 paise to close at 84 49 against us dollar
"['eli', 'benefits', 'from', 'epfo', 'deadline', 'for', 'eligible', 'employees', 'to', 'activate', 'uan', 'is', 'november', '30', '2024', 'heres', 'how', 'to', 'do', 'it']",eli benefits from epfo deadline for eligible employees to activate uan is november 30 2024 heres how to do it
"['extension', 'to', 'waqf', 'panel', 'to', 'enable', 'more', 'stakeholders', 'to', 'place', 'their', 'views', 'tmcs', 'kalyan', 'banerjee']",extension to waqf panel to enable more stakeholders to place their views tmcs kalyan banerjee
"['air', 'india', 'sees', 'growth', 'from', 'domestic', 'short', 'international', 'flights', 'in', '2025', 'ceo', 'campbell', 'wilson']",air india sees growth from domestic short international flights in 2025 ceo campbell wilson
"['rajya', 'sabha', 'fails', 'to', 'transact', 'any', 'business', 'for', 'third', 'day', 'amid', 'opposition', 'uproar', 'over', 'adani', 'sambhal', 'issues']",rajya sabha fails to transact any business for third day amid opposition uproar over adani sambhal issues
"['enough', 'leadership', 'bandwidth', 'at', 'top', 'and', 'below', 'ltimindtree']",enough leadership bandwidth at top and below ltimindtree
"['simplifying', 'crypto', 'take', 'ownership', 'of', 'your', 'financial', 'future', 'with', 'crypto', 'ki', 'paathshala']",simplifying crypto take ownership of your financial future with crypto ki paathshala
"['kerala', 'completes', 'survey', 'of', 'unrecognised', 'schools', 'identifies', '827', 'institutions']",kerala completes survey of unrecognised schools identifies 827 institutions
"['terrified', 'elon', 'musk', 'warns', 'us', 'is', 'currently', 'headed', 'for', 'bankruptcy', 'super', 'fast', 'offers', 'solution', 'to', 'fix', 'it']",terrified elon musk warns us is currently headed for bankruptcy super fast offers solution to fix it
"['akasa', 'air', 'announces', 'daily', 'flights', 'between', 'abu', 'dhabi', 'bengaluru', 'ahmedabad', 'starting', 'march', '2025']",akasa air announces daily flights between abu dhabi bengaluru ahmedabad starting march 2025
"['pakistan', 'to', 'earn', 'usd', '30', 'billion', 'from', 'defence', 'exports', 'in', 'coming', 'years']",pakistan to earn usd 30 billion from defence exports in coming years
"['ongc', 'makes', 'four', 'oil', 'discoveries', 'in', 'ashokenagar', 'awaits', 'mining', 'lease', 'from', 'bengal', 'govt']",ongc makes four oil discoveries in ashokenagar awaits mining lease from bengal govt
"['abu', 'dhabi', 'offers', 'indian', 'startups', 'a', 'gateway', 'to', 'global', 'opportunities', 'through', 'abu', 'dhabi', 'investment', 'office', 'adios', 'massimo', 'falcioni']",abu dhabi offers indian startups a gateway to global opportunities through abu dhabi investment office adios massimo falcioni
"['tech', 'view', 'nifty', 'breaches', '20', 'dema', 'strong', 'resistance', 'near', '24360', 'how', 'to', 'trade', 'tomorrow']",tech view nifty breaches 20 dema strong resistance near 24360 how to trade tomorrow
"['nhb', 'probe', 'into', 'avioms', 'books', 'finds', 'inflated', 'investments']",nhb probe into avioms books finds inflated investments
"['ntpc', 'green', 'energys', 'm', 'cap', 'crosses', 'rs', '1', 'lakh', 'crore', 'mark', 'on', 'debut', 'stock', 'jumps', '10', 'post', 'listing']",ntpc green energys m cap crosses rs 1 lakh crore mark on debut stock jumps 10 post listing
"['alibaba', 'releases', 'qwq', '32b', 'preview', 'an', 'ai', 'rival', 'to', 'openais', 'o1']",alibaba releases qwq 32b preview an ai rival to openais o1
"['epfo', 'uan', 'do', 'you', 'need', 'to', 'activate', 'uan', 'every', 'time', 'you', 'change', 'jobs', 'check', 'details', 'here']",epfo uan do you need to activate uan every time you change jobs check details here
"['sensex', 'nifty', 'trade', 'flat', 'mirroring', 'asian', 'peers', 'as', 'concerns', 'over', 'us', 'rate', 'cut', 'timeline', 'weigh', 'on', 'markets']",sensex nifty trade flat mirroring asian peers as concerns over us rate cut timeline weigh on markets
"['streambox', 'looks', 'to', 'disrupt', 'entertainment', 'industry', 'through', 'subscription', 'based', 'tv', 'service']",streambox looks to disrupt entertainment industry through subscription based tv service
"['ayushman', 'bharat', 'pm', 'jays', '30000', 'empanelled', 'hospitals', 'to', 'become', 'available', 'to', 'esic', 'beneficiaries', 'to', 'benefit', '14', '43', 'crore']",ayushman bharat pm jays 30000 empanelled hospitals to become available to esic beneficiaries to benefit 14 43 crore
"['vizhinjam', 'port', 'set', 'for', 'december', 'commissioning', 'kerala', 'govt', 'extends', 'project', 'timeline']",vizhinjam port set for december commissioning kerala govt extends project timeline
"['mea', 'officials', 'to', 'brief', 'external', 'affairs', 'committee', 'on', 'bangladesh', 'situation', 'on', 'december', '11', 'shashi', 'tharoor']",mea officials to brief external affairs committee on bangladesh situation on december 11 shashi tharoor
"['over', '24', 'lakh', 'candidates', 'provisionally', 'shortlisted', 'during', 'job', 'fairs', 'jitendra', 'singh']",over 24 lakh candidates provisionally shortlisted during job fairs jitendra singh
