headlines,headline_text
"['elon', 'musk', 'spacex', 'headquarters', 'texas', 'wants', 'to', 'transform', 'spacexs', 'starbase', 'into', 'a', 'texas', 'city', 'but', 'theres', 'a', 'hurdle']",elon musk spacex headquarters texas wants to transform spacexs starbase into a texas city but theres a hurdle
"['put', 'under', 'house', 'arrest', 'prevented', 'from', 'offering', 'congregational', 'prayers', 'hurriyat', 'chief', 'umar', 'farooq']",put under house arrest prevented from offering congregational prayers hurriyat chief umar farooq
"['hyderabad', 'stampede', 'pushpa', '2', 'actor', 'allu', 'arjun', 'arrested']",hyderabad stampede pushpa 2 actor allu arjun arrested
"['lico', 'materials', 'opens', 'battery', 'recycling', 'facility', 'to', 'invest', 'rs', '250', 'crore', 'in', 'hydrometallurgy', 'biz']",lico materials opens battery recycling facility to invest rs 250 crore in hydrometallurgy biz
"['carlyle', 'eyeing', '1', 'billion', 'indian', 'ipo', 'for', 'quest', 'global', 'report']",carlyle eyeing 1 billion indian ipo for quest global report
"['indias', 'ambitious', '6', 'billion', 'submarine', 'building', 'plan', 'stalls', 'after', 'sea', 'tests']",indias ambitious 6 billion submarine building plan stalls after sea tests
"['dont', 'want', 'to', 'touch', 'it', 'just', 'yet', 'gukesh', 'after', 'seeing', 'world', 'championship', 'trophy']",dont want to touch it just yet gukesh after seeing world championship trophy
"['spg', 'moves', 'sc', 'for', 'extension', 'of', 'registration', 'period', 'of', '3', 'specialised', 'armoured', 'vehicles']",spg moves sc for extension of registration period of 3 specialised armoured vehicles
"['australian', 'immigration', 'falls', 'for', 'first', 'time', 'in', 'two', 'years', 'indians', 'top', 'source', 'country']",australian immigration falls for first time in two years indians top source country
"['infra', 'built', 'in', 'last', '10', 'years', 'more', 'than', 'work', 'done', 'in', '60', 'years', 'of', 'previous', 'govt', 'jyotiraditya', 'scindia']",infra built in last 10 years more than work done in 60 years of previous govt jyotiraditya scindia
"['time', 'to', 'shed', 'the', 'negative', 'bias', 'yes', 'selectively', '5', 'nbfc', 'stocks', 'with', 'an', 'upside', 'potential', 'of', 'up', 'to', '36']",time to shed the negative bias yes selectively 5 nbfc stocks with an upside potential of up to 36
"['modi', 'performs', 'puja', 'at', 'sangam', 'nose', 'to', 'inaugurate', 'projects', 'to', 'improve', 'pilgrims', 'kumbh', 'experience']",modi performs puja at sangam nose to inaugurate projects to improve pilgrims kumbh experience
"['mamata', 'machinery', 'fixes', 'rs', '230', '243', 'for', 'rs', '179', 'crore', 'ipo', 'check', 'details']",mamata machinery fixes rs 230 243 for rs 179 crore ipo check details
"['misleading', 'medicine', 'ads', 'case', 'next', 'date', 'of', 'hearing', 'on', 'january', '15']",misleading medicine ads case next date of hearing on january 15
"['dutee', 'chand', 'escapes', 'unhurt', 'in', 'road', 'accident']",dutee chand escapes unhurt in road accident
"['european', 'economy', 'europe', 'faces', 'dire', 'economic', 'prospects', 'amid', 'monumental', 'challenges']",european economy europe faces dire economic prospects amid monumental challenges
"['nri', 'father', 'flies', 'from', 'kuwait', 'to', 'andhra', 'to', 'murder', 'alleged', 'molester', 'of', 'his', 'daughter', 'after', 'police', 'inaction', 'shares', 'video']",nri father flies from kuwait to andhra to murder alleged molester of his daughter after police inaction shares video
"['union', 'budget', '2025', 'what', 'are', 'expenditure', 'and', 'revenue', 'budgets']",union budget 2025 what are expenditure and revenue budgets
"['supreme', 'court', 'steps', 'in', 'as', 'farmer', 'leader', 'dallewals', 'fast', 'unto', 'death', 'enters', 'day', '18']",supreme court steps in as farmer leader dallewals fast unto death enters day 18
"['eam', 's', 'jaishankar', 'highlights', 'neighbourhood', 'first', 'policy', 'in', 'parliament']",eam s jaishankar highlights neighbourhood first policy in parliament
"['add', 'bajaj', 'housing', 'on', 'dips', 'but', 'upside', 'negligible', 'in', '1', 'year', 'iifl', 'securities']",add bajaj housing on dips but upside negligible in 1 year iifl securities
"['air', 'india', 'bsuiness', 'class', 'premium', 'economy', 'new', 'air', 'india', 'experience', 'whats', 'inside', 'amenity', 'kits', 'for', 'passengers']",air india bsuiness class premium economy new air india experience whats inside amenity kits for passengers
"['india', 'need', 'not', 'spend', 'resources', 'on', 'large', 'language', 'model', 'says', 'nandan', 'nilekani']",india need not spend resources on large language model says nandan nilekani
"['scientists', 'find', 'alien', 'like', 'predator', 'in', 'the', 'depths', 'of', 'the', 'ocean', 'call', 'it', 'darkness']",scientists find alien like predator in the depths of the ocean call it darkness
"['mazagon', 'dock', 'grse', 'shares', 'fall', 'up', 'to', '4', 'on', '6', 'billion', 'setback', 'details', 'here']",mazagon dock grse shares fall up to 4 on 6 billion setback details here
"['advance', 'tax', 'payment', 'deadline', 'december', '15', 'is', 'sunday', 'can', 'you', 'pay', 'this', 'third', 'installment', 'of', 'advance', 'tax', 'on', 'december', '16']",advance tax payment deadline december 15 is sunday can you pay this third installment of advance tax on december 16
"['bitcoin', 'holds', 'above', '100k', 'mark', 'avalanche', 'chainlink', 'surge', 'over', '4']",bitcoin holds above 100k mark avalanche chainlink surge over 4
"['evm', 'verification', 'plea', 'should', 'go', 'before', 'bench', 'that', 'gave', 'verdict', 'in', 'april', 'supreme', 'court']",evm verification plea should go before bench that gave verdict in april supreme court
"['russian', 'ruble', 'money', 'piles', 'up', 'abroad', 'amid', 'us', 'pressure', 'on', 'trade', 'payments', 'export', 'import', 'settlementsrade', 'p']",russian ruble money piles up abroad amid us pressure on trade payments export import settlementsrade p
"['food', 'inflation', 'in', 'richer', 'states', 'cooling', 'down', 'faster', 'due', 'to', 'migration', 'state', 'bank', 'of', 'india', 'sbi', 'report', 'fod', 'prices', 'india', 'inflation', 'economy']",food inflation in richer states cooling down faster due to migration state bank of india sbi report fod prices india inflation economy
"['defence', 'story', 'still', 'strong', 'in', 'india', 'pick', 'the', 'entry', 'points', 'zomato', 'fairly', 'valued', 'sandip', 'sabharwal']",defence story still strong in india pick the entry points zomato fairly valued sandip sabharwal
"['karnataka', 'hc', 'quashes', 'fir', 'against', 'bjp', 'mp', 'tejasvi', 'surya', 'over', 'farmer', 'suicide', 'post']",karnataka hc quashes fir against bjp mp tejasvi surya over farmer suicide post
"['indian', 'army', 'hosts', 'tata', 'steel', 'kolkata', '25', 'km', 'vijay', 'diwas', 'cup', 'to', 'honor', '1971', 'war', 'heroes']",indian army hosts tata steel kolkata 25 km vijay diwas cup to honor 1971 war heroes
"['several', 'delhi', 'schools', 'receive', 'bomb', 'threats', 'while', 'a', 'few', 'others', 'report', 'fire', 'incidents']",several delhi schools receive bomb threats while a few others report fire incidents
"['fo', 'stock', 'strategy', 'how', 'to', 'trade', 'infosys', 'and', 'bhel']",fo stock strategy how to trade infosys and bhel
"['attacker', 'afzal', 'guru', 'honoured', 'by', 'tukde', 'tukde', 'gang', 'union', 'minister', 'giriraj', 'singh', 'on', '23rd', 'anniversary', 'of', 'parliament', 'attack']",attacker afzal guru honoured by tukde tukde gang union minister giriraj singh on 23rd anniversary of parliament attack
"['gukesh', 'the', '18', 'year', 'old', 'friends', 'superfan', 'is', 'now', 'worlds', 'youngest', 'chess', 'champion']",gukesh the 18 year old friends superfan is now worlds youngest chess champion
"['keerthy', 'suresh', 'wedding', 'did', 'thalapathy', 'vijay', 'and', 'trisha', 'travel', 'to', 'goa', 'together']",keerthy suresh wedding did thalapathy vijay and trisha travel to goa together
"['friday', 'fever', 'sensex', 'cracks', 'over', '500', 'points', 'nifty', 'below', '24400', 'all', 'sectors', 'under', 'pressure']",friday fever sensex cracks over 500 points nifty below 24400 all sectors under pressure
"['assembly', 'polls', 'a', 'fight', 'to', 'bring', 'back', 'spirit', 'of', 'development', 'in', 'delhi', 'says', 'congress', 'sandeep', 'dikshit']",assembly polls a fight to bring back spirit of development in delhi says congress sandeep dikshit
"['how', 'coach', 'behind', 'dhonis', '2011', 'world', 'cup', 'win', 'helped', 'gukesh', 'dommaraju', 'become', 'the', 'worlds', 'youngest', 'chess', 'champion']",how coach behind dhonis 2011 world cup win helped gukesh dommaraju become the worlds youngest chess champion
"['current', 'valuations', 'signal', 'limited', 'near', 'term', 'growth', 'potential', 'vetri', 'subramaniam']",current valuations signal limited near term growth potential vetri subramaniam
"['ultratech', 'ambuja', 'cement', 'among', 'top', 'stock', 'picks', 'as', 'cement', 'demand', 'rebounds', 'motilal', 'oswal']",ultratech ambuja cement among top stock picks as cement demand rebounds motilal oswal
"['indian', 'oil', 'shares', 'rise', 'over', '2', 'after', 'jefferies', 'upgrades', 'rating', 'to', 'buy', 'from', 'hold']",indian oil shares rise over 2 after jefferies upgrades rating to buy from hold
"['biden', 'issues', 'clemency', 'to', 'four', 'indian', 'americans']",biden issues clemency to four indian americans
"['jailed', 'west', 'bengal', 'minister', 'partha', 'chatterjee', 'given', 'future', 'bail', 'by', 'supreme', 'court', 'in', 'money', 'laundering', 'case']",jailed west bengal minister partha chatterjee given future bail by supreme court in money laundering case
"['reserve', 'bank', 'of', 'india', 'receives', 'bomb', 'threat', 'in', 'russian', 'language']",reserve bank of india receives bomb threat in russian language
"['great', 'job', 'kochi', 'anand', 'mahindra', 'explains', 'why', 'keralas', 'iconic', 'city', 'is', 'a', 'must', 'see']",great job kochi anand mahindra explains why keralas iconic city is a must see
"['tasteatlas', 'six', 'indian', 'cities', 'feature', 'in', 'worlds', 'top', '100', 'best', 'food', 'cities', 'check', 'which', 'city', 'tops', 'the', 'list']",tasteatlas six indian cities feature in worlds top 100 best food cities check which city tops the list
"['krishna', 'mehra', 'joins', 'elevation', 'capital', 'to', 'lead', 'ai', 'investments']",krishna mehra joins elevation capital to lead ai investments
"['before', 'trump', 'takes', 'charge', 'biden', 'administration', 'announces', 'strategy', 'to', 'counter', 'anti', 'muslim', 'islamophobia']",before trump takes charge biden administration announces strategy to counter anti muslim islamophobia
"['inventurus', 'knowledge', 'solutions', 'ipo', 'day', '2', 'issue', 'subscribed', '1', '55', 'times', 'check', 'gmp', 'key', 'dates', 'price', 'band', 'reviews']",inventurus knowledge solutions ipo day 2 issue subscribed 1 55 times check gmp key dates price band reviews
"['upi', 'transaction', 'limit', 'set', 'to', 'change', 'check', 'limits', 'for', 'different', 'upi', 'transactions']",upi transaction limit set to change check limits for different upi transactions
"['nifty', 'can', 'deliver', 'up', 'to', '10', 'return', 'in', '2025', 'sbi', 'bharti', 'airtel', 'among', 'top', 'stock', 'picks']",nifty can deliver up to 10 return in 2025 sbi bharti airtel among top stock picks
"['china', 'jeopardised', 'peace', 'with', 'its', 'military', 'threat', 'taiwan', 'defence', 'ministry']",china jeopardised peace with its military threat taiwan defence ministry
"['one', 'nation', 'one', 'election', 'india', 'will', 'have', 'to', 'spend', 'rs', '7951', 'crore', 'for', 'simaltaneous', 'polls', 'in', '2029']",one nation one election india will have to spend rs 7951 crore for simaltaneous polls in 2029
"['food', 'inflation', 'easing', 'could', 'be', 'a', 'temporary', 'relief', 'inflation', 'remains', 'key', 'risk', 'for', 'any', 'economy', 'devendra', 'pant']",food inflation easing could be a temporary relief inflation remains key risk for any economy devendra pant
"['fed', 'on', 'track', 'for', 'december', 'rate', 'cut', 'as', 'inflation', 'concerns', 'cloud', '2025', 'outlook', 'cameron', 'brandt']",fed on track for december rate cut as inflation concerns cloud 2025 outlook cameron brandt
"['world', 'competition', 'day', '2024', 'trade', 'competition', 'and', 'inequality']",world competition day 2024 trade competition and inequality
"['us', 'markets', 'staring', 'at', 'a', 'dotcom', 'bubble', 'like', 'burst', 'ruchir', 'sharma', 'paints', 'a', 'scary', 'picture', 'of', 'worlds', 'largest', 'economy']",us markets staring at a dotcom bubble like burst ruchir sharma paints a scary picture of worlds largest economy
"['weaving', 'prosperity', 'how', 'handicrafts', 'can', 'shape', 'indias', 'economic', 'renaissance']",weaving prosperity how handicrafts can shape indias economic renaissance
"['pan', '2', '0', 'a', 'master', 'key', 'to', 'access', 'digital', 'system', 'and', 'govt', 'services', 'know', 'how', 'it', 'will', 'help', 'you']",pan 2 0 a master key to access digital system and govt services know how it will help you
"['indias', 'msmes', 'offer', 'huge', 'opportunities', 'need', 'to', 'further', 'leverage', 'this', 'sector', 'oliver', 'prill', 'tide']",indias msmes offer huge opportunities need to further leverage this sector oliver prill tide
"['hazlewood', 'replaces', 'boland', 'in', 'australia', 'xi', 'for', 'third', 'test', 'against', 'india', 'confirms', 'cummins']",hazlewood replaces boland in australia xi for third test against india confirms cummins
"['ola', 'group', 'chief', 'people', 'officer', 'n', 'balachandar', 'quits']",ola group chief people officer n balachandar quits
"['keerthy', 'suresh', 'ties', 'the', 'knot', 'with', 'fiance', 'antony', 'thattil', 'in', 'colourful', 'iyengar', 'ceremony', 'in', 'goa', 'check', 'out', 'pics']",keerthy suresh ties the knot with fiance antony thattil in colourful iyengar ceremony in goa check out pics
"['nayanthara', 'reveals', 'how', 'ex', 'boyfriend', 'prabhudeva', 'taught', 'her', 'value', 'of', 'compromise', 'made', 'her', 'a', 'different', 'person']",nayanthara reveals how ex boyfriend prabhudeva taught her value of compromise made her a different person
"['decoding', 'keerthy', 'sureshs', 'bridal', 'dress', 'and', 'jewellery', 'from', 'madisar', 'saree', 'to', 'netti', 'chutti', 'how', 'she', 'embraced', 'her', 'tamil', 'iyengar', 'roots']",decoding keerthy sureshs bridal dress and jewellery from madisar saree to netti chutti how she embraced her tamil iyengar roots
"['pm', 'modi', 'rahul', 'gandhi', 'others', 'pay', 'tributes', 'to', 'fallen', 'jawans', 'on', '23', 'years', 'of', 'parliament', 'attack']",pm modi rahul gandhi others pay tributes to fallen jawans on 23 years of parliament attack
"['extremely', 'serious', 'and', 'worrying', 'former', 'delhi', 'cm', 'arvind', 'kejriwal', 'on', 'bomb', 'threats', 'to', 'schools']",extremely serious and worrying former delhi cm arvind kejriwal on bomb threats to schools
"['manickam', 'tagore', 'urges', 'lok', 'sabha', 'speaker', 'to', 'expunge', 'derogatory', 'remarks', 'by', 'nishikant', 'dubey', 'on', 'congress', 'leaders']",manickam tagore urges lok sabha speaker to expunge derogatory remarks by nishikant dubey on congress leaders
"['indias', 'indo', 'pacific', 'strategy', 'a', 'vision', 'for', 'peace', 'prosperity', 'and', 'partnership']",indias indo pacific strategy a vision for peace prosperity and partnership
"['buy', 'maruti', 'suzuki', 'target', 'price', 'rs', '15250', 'jm', 'financial']",buy maruti suzuki target price rs 15250 jm financial
"['evolution', 'of', 'diabetes', 'management', 'a', 'holistic', 'approach']",evolution of diabetes management a holistic approach
"['stock', 'radar', 'what', 'makes', 'maharashtra', 'seamless', 'a', 'buy', 'after', '28', 'fall', 'from', 'highs']",stock radar what makes maharashtra seamless a buy after 28 fall from highs
"['legacy', 'in', 'action', 'continuity', 'storytelling', 'and', 'archiving', 'at', 'the', 'tatas']",legacy in action continuity storytelling and archiving at the tatas
"['taiwan', 'reports', '12', 'chinese', 'aircrafts', '14', 'naval', 'vessels', '9', 'official', 'ships', 'near', 'its', 'territory']",taiwan reports 12 chinese aircrafts 14 naval vessels 9 official ships near its territory
"['best', 'value', 'funds', 'to', 'invest', 'in', 'december', '2024']",best value funds to invest in december 2024
"['hal', 'shares', 'in', 'focus', 'after', 'defence', 'ministry', 'signs', 'rs', '13500', 'crore', 'deal', 'for', '12', 'su', '30mki', 'aircraft']",hal shares in focus after defence ministry signs rs 13500 crore deal for 12 su 30mki aircraft
"['bluestone', 'likely', 'to', 'launch', 'ipo', 'at', 'rs', '12000', '13000', 'crore', 'valuation', 'up', '50', 'from', 'last', 'funding']",bluestone likely to launch ipo at rs 12000 13000 crore valuation up 50 from last funding
"['chennai', 'rains', 'imd', 'warns', 'of', 'heavy', 'rain', 'in', 'tamil', 'nadu', 'full', 'list', 'of', 'affected', 'districts', 'and', 'school', 'closure', 'updates']",chennai rains imd warns of heavy rain in tamil nadu full list of affected districts and school closure updates
"['fire', 'breaks', 'out', 'at', 'tamil', 'nadu', 'hospital', 'seven', 'people', 'reportedly', 'dead', '20', 'injured']",fire breaks out at tamil nadu hospital seven people reportedly dead 20 injured
"['indias', 'fdi', 'hits', '1', 'trillion', 'and', 'the', 'biggest', 'investor', 'is', 'a', 'small', 'island', 'nation', 'whose', 'gdp', 'is', 'smaller', 'than', 'himachal']",indias fdi hits 1 trillion and the biggest investor is a small island nation whose gdp is smaller than himachal
"['rupee', 'recovers', 'from', 'all', 'time', 'low', 'gains', '5', 'paise', 'to', '84', '83', 'against', 'us', 'dollar', 'in', 'early', 'trade']",rupee recovers from all time low gains 5 paise to 84 83 against us dollar in early trade
"['over', 'half', 'of', 'sme', 'debutants', 'in', '2024', 'in', 'red', '19', 'multibaggers', 'only', 'saving', 'grace']",over half of sme debutants in 2024 in red 19 multibaggers only saving grace
"['shakti', 'pumps', 'shares', 'in', 'focus', 'on', 'bagging', 'rs', '754', 'crore', 'order', 'from', 'maharashtra', 'government']",shakti pumps shares in focus on bagging rs 754 crore order from maharashtra government
"['rvnl', 'shares', 'in', 'focus', 'on', 'securing', 'project', 'worth', 'rs', '111', 'crore', 'from', 'southern', 'railway']",rvnl shares in focus on securing project worth rs 111 crore from southern railway
"['pms', 'tracker', 'top', '10', 'schemes', 'that', 'helped', 'hni', 'investors', 'beat', 'the', 'street', 'in', 'november']",pms tracker top 10 schemes that helped hni investors beat the street in november
"['court', 'refuses', 'registration', 'of', 'fir', 'against', 'congress', 'chief', 'mallikarjun', 'kharge']",court refuses registration of fir against congress chief mallikarjun kharge
"['ril', 'shares', 'in', 'focus', 'on', '12', 'billion', 'oil', 'deal', 'with', 'russias', 'rosneft']",ril shares in focus on 12 billion oil deal with russias rosneft
"['bjp', 'announces', 'ram', 'temple', 'project', 'in', 'bengal', 'after', 'tmc', 'mlas', 'proposal', 'for', 'babri', 'masjid', 'like', 'mosque']",bjp announces ram temple project in bengal after tmc mlas proposal for babri masjid like mosque
"['zomato', 'shares', 'in', 'focus', 'after', 'company', 'get', 'rs', '803', 'crore', 'gst', 'notice']",zomato shares in focus after company get rs 803 crore gst notice
"['indus', 'towers', 'shares', 'in', 'focus', 'on', 'entering', 'into', 'ppa', 'with', 'jsw', 'green', 'energy', '38', 'cr', 'investment']",indus towers shares in focus on entering into ppa with jsw green energy 38 cr investment
"['ashok', 'leyland', 'shares', 'in', 'focus', 'after', 'securing', 'order', 'worth', 'rs', '346', 'crore', 'from', 'tamil', 'nadu', 'state', 'transport', 'corporation']",ashok leyland shares in focus after securing order worth rs 346 crore from tamil nadu state transport corporation
"['debate', 'on', 'constitution', 'to', 'commence', 'in', 'lok', 'sabha', 'today', 'priyanka', 'gandhi', 'vadra', 'likely', 'to', 'make', 'her', 'maiden', 'speech']",debate on constitution to commence in lok sabha today priyanka gandhi vadra likely to make her maiden speech
"['delhi', 'colder', 'than', 'shimla', 'temperature', 'in', 'national', 'capital', 'drops', 'to', 'three', 'year', 'low', 'of', '4', '5c']",delhi colder than shimla temperature in national capital drops to three year low of 4 5c
"['jk', 'tyre', 'shares', 'in', 'focus', 'as', 'co', 'gets', 'loan', 'of', 'eur', '30', 'million', 'for', 'expansion', 'of', 'production', 'capacities']",jk tyre shares in focus as co gets loan of eur 30 million for expansion of production capacities
"['stocks', 'to', 'buy', 'today', 'hdfc', 'bank', 'infosys', 'among', 'top', '6', 'trading', 'ideas', 'for', '13', 'december', '2024']",stocks to buy today hdfc bank infosys among top 6 trading ideas for 13 december 2024
"['lt', 'stock', 'in', 'focus', 'after', 'ccs', 'clears', '100', 'k', '9', 'vajra', 'howitzers', 'for', 'indian', 'army']",lt stock in focus after ccs clears 100 k 9 vajra howitzers for indian army
['kg'],kg
"['neutral', 'bajaj', 'finance', 'target', 'price', 'rs', '7500', 'motilal', 'oswal', 'financial', 'services']",neutral bajaj finance target price rs 7500 motilal oswal financial services
"['buy', 'axis', 'bank', 'target', 'price', 'rs', '1425', 'jm', 'financial']",buy axis bank target price rs 1425 jm financial
"['buy', 'zen', 'technologies', 'target', 'price', 'rs', '2400', 'motilal', 'oswal', 'financial', 'services']",buy zen technologies target price rs 2400 motilal oswal financial services
"['etmarkets', 'aif', 'talk', 'vikaas', 'm', 'sachdeva', 'predicts', 'quality', 'focused', 'equity', 'markets', 'for', '2025']",etmarkets aif talk vikaas m sachdeva predicts quality focused equity markets for 2025
"['delhi', 'aqi', 'remains', 'in', 'the', 'poor', 'category', 'a', 'thin', 'layer', 'of', 'fog', 'covers', 'the', 'city']",delhi aqi remains in the poor category a thin layer of fog covers the city
"['eam', 'jaishankar', 'meets', 'uae', 'counterpart', 'at', '4th', 'india', 'uae', 'strategic', 'dialogue']",eam jaishankar meets uae counterpart at 4th india uae strategic dialogue
"['will', 'do', 'a', 'lot', 'of', 'development', 'in', 'greater', 'kailash', 'says', 'congress', 'assembly', 'polls', 'candidate', 'garvit', 'singhvi']",will do a lot of development in greater kailash says congress assembly polls candidate garvit singhvi
"['russian', 'embassy', 'hosts', 'solemn', 'reception', 'for', 'baselios', 'marthoma', 'mathews', 'iii']",russian embassy hosts solemn reception for baselios marthoma mathews iii
"['pm', 'modi', 'to', 'visit', 'prayagraj', 'today', 'to', 'launch', 'development', 'projects', 'worth', 'around', 'rs', '5500', 'cr']",pm modi to visit prayagraj today to launch development projects worth around rs 5500 cr
"['india', 'iran', 'armenia', 'hold', '2nd', 'trilateral', 'consultations', 'in', 'new', 'delhi', 'discusses', 'connectivity', 'regional', 'cooperation']",india iran armenia hold 2nd trilateral consultations in new delhi discusses connectivity regional cooperation
"['aap', 'betrays', 'delhi', 'sandeep', 'dikshit', 'congress', 'candidate', 'from', 'new', 'delhi']",aap betrays delhi sandeep dikshit congress candidate from new delhi
"['powergrid', 'shares', 'in', 'focus', 'after', 'getting', 'declared', 'as', 'successful', 'bidder', 'under', 'tbcb']",powergrid shares in focus after getting declared as successful bidder under tbcb
"['3', 'men', 'accuse', 'sean', 'diddy', 'combs', 'of', 'rape', 'claim', 'he', 'drugged', 'them', 'before', 'assault']",3 men accuse sean diddy combs of rape claim he drugged them before assault
"['govt', 'cant', 'make', 'farmers', 'protest', 'fail', 'says', 'sarwan', 'singh', 'pandher', 'as', 'farmers', 'mark', '10', 'months', 'of', 'protest']",govt cant make farmers protest fail says sarwan singh pandher as farmers mark 10 months of protest
"['feel', 'this', 'will', 'bring', 'more', 'people', 'into', 'this', 'game', 'vidit', 'gujrathi', 'after', 'd', 'gukeshs', 'chess', 'world', 'championship', 'title', 'win']",feel this will bring more people into this game vidit gujrathi after d gukeshs chess world championship title win
"['hamps', 'bio', 'ipo', 'opens', 'today', 'check', 'key', 'dates', 'gmp', 'price', 'band', 'and', 'other', 'details']",hamps bio ipo opens today check key dates gmp price band and other details
"['bajaj', 'finance', 'shares', 'in', 'focus', 'as', 'co', 'bets', 'big', 'on', 'ai', 'to', 'drive', 'growth', 'and', 'cut', 'costs']",bajaj finance shares in focus as co bets big on ai to drive growth and cut costs
"['crypto', 'bull', 'run', 'drives', 'demand', 'for', 'courses', 'in', 'blockchain', 'tech']",crypto bull run drives demand for courses in blockchain tech
"['tata', 'motors', 'shares', 'in', 'focus', 'as', 'co', 'hikes', 'prices', 'of', 'commercial', 'vehicles', 'by', '2', 'effective', 'from', 'jan', '1']",tata motors shares in focus as co hikes prices of commercial vehicles by 2 effective from jan 1
"['jason', 'gillespie', 'steps', 'down', 'as', 'pakistan', 'head', 'coach', 'ahead', 'of', 'test', 'series', 'against', 'south', 'africa']",jason gillespie steps down as pakistan head coach ahead of test series against south africa
"['add', 'metropolis', 'healthcare', 'target', 'price', 'rs', '2335', 'icici', 'securities']",add metropolis healthcare target price rs 2335 icici securities
"['iks', 'health', 'management', 'on', 'aquity', 'acquisition', 'falling', 'margins', 'future', 'plans']",iks health management on aquity acquisition falling margins future plans
